,topic,category,content
9,Reasons Of Why Bangladeshi Businesses Need To Redesign Their Websites,computers-technology," Websites are digital representations of businesses, and if they are properly presented, they can bring you extra business and build your reputation. Isn't it worthwhile to invest in a website that leaves a great first impression? Every Bangladeshi business owner will at some point realize that they need a professional website for their business, a website designed by an experienced team of professionals. You Reflect Your Company's Identity Through Your Website Stanford University researchers found that 75% of people judge a business's credibility by its website alone. As a result, your website should be mobile-friendly, easy-to-use, up-to-date, visually pleasing, and represent you and your brand well. Optimize It For The Search Engines Is your website having trouble ranking on Google's first two pages? This may be due to outdated SEO on your website. The SEO landscape is constantly evolving since Google's algorithms are updated daily. In that case, it may be hurting instead of helping you if you haven't updated your SEO for quite some time. You can remedy this by redesigning your website. You will be more likely to rank in the first two pages of Google if you redesign your website and improve its SEO. Being one of Bangladeshi top SEO agencies, Online Solutions has the know-how and expertise to improve your SEO. Mobile Responsive Website Over 82 percent of internet users in Bangladeshi and the world own and regularly use smartphones. Having a mobile-friendly website is, therefore, more important now than ever before, and if your website does not provide the functionality to function on a mobile device, you may be losing customers. Your website may not be mobile-friendly even if it was built 5 years ago. A large number of users (61%), who cannot use a mobile site properly, leave the site and go to a competitor's site. If you want to keep 61% of site visitors, you need a mobile-friendly site. If you don't? Redesign it. User-Friendly & Easy-to-Navigate Mentioned at the beginning of the blog that your business' website is often the first thing customers will see - so you want to make sure that they have a positive experience with it. A good and easy layout page structure and Solid navigation Good presentation, easy to read information, common keywords Stand-out media and images Brand consistency and messaging There is a lot of meaning to details - and if you add all of them up they add up to a lot. Users are trying to stay on your page for as long as possible, so your description could determine whether someone stays on your site longer, or whether they leave right away. Ensure It Is Up To Date When compared to a competitor's website that might be more up-to-date, even a three to a four-year-old website might appear outdated. Using simple patterns with clean, modern lines is the latest design trend for 2021/2022. This look can be applied to mobile devices as well as desktop. Companies such as Microsoft, Apple, Starbucks, etc. have incorporated these design elements. Unlike other countries where competition is fierce, Bangladeshi does not have as much of it, so being on top of it gives you an advantage. Extend Your Services And Capabilities On Your Website Your website must reflect whether your services or your business have grown or changed. Because they aren't aware you offer the service, they will go elsewhere to find it. Customers in Bangladeshi will not have trouble finding a competitor. A redesigned website allows you to clearly explain what services you offer, so that customers and visitors will know what services you don't provide. Update Your Website With Greater Control What if you could update your website yourself every time you offered a new service? Additionally, you can start marketing campaigns at any time and you do not need to wait for someone to change it. The back-end of websites become more user-friendly every year, so updating and changing an old website can prove challenging. The Loading Time Improve Are you aware that 47% of consumers expect web pages to load within 2 seconds of clicking? Furthermore, if the web page takes longer than 3 seconds to load, approximately 40% of visitors will leave the website completely. When your website loads slowly, you risk losing potential customers by the second, while also suffering from poor SEO. Improve Website Security Cybersecurity is one of the foremost concerns of today's digital world, perhaps even the greatest. If businesses fail to update their websites, they are vulnerable to hacks and viruses. Websites that are older are more vulnerable. Third-Party Plugins Many third-party plugins and tools get outdated, particularly if the owner of the website doesn't maintain their own site and doesn't provide ongoing support to the builders. They often have a difficult time using them, or they frequently fail to work, resulting in your website being abandoned eventually."
10,Agile fantasies and harsh business realities,computers-technology," Chronicles from the trenches. Nowadays digital transformation programmes are invariably associated with Agile.  Organizations want to become Agile since they want to increase speed, efficiency, effectiveness, etc. and Agile promises to deliver all that. However, what typically happens on the ground is the quick adoption of a number of Agile ceremonies and tools (the likes of standing crowds in some open space corner, yellow stickers based Kanban boards, the ever present Jira, etc.) and the sweeping away of any deeper organization analysis, let alone alignment. In that sense Agile is remarkably similar to religions. Typically most religions have an exterior part, (i.e. their prescriptive side: Going to the functions at a specific day, do not eat certain food, kneel down at certain moments of the function, etc.) and a substantial or moral part (i.e. behave in a certain way, etc.). The exterior part is far easier to be adopted and “implemented” and usually ends up being identified with the religion itself. Similarly, from the IT trenches you can easily see that most organization cannot even get near at the substantial part of Agile: They just adopt its choreography. The overall result often materializes in a number of recurring anti-patterns that are remarkably repetitive across organizations, and invariably introduce even more inefficiencies and waste. The purpose of this brief article is to provide some insights about some of the reasons why this happens and what are the watch-outs. Basically, far from being tout court derogatory of Agile, this article simply aims at pointing out its many fake implementations, and in doing so, it truly follows one of the Agile key principles, i.e. the one that preaches the need of paying attention to lessons learned and to incorporate remediation actions going forwards. Below is the relevant principle quoted verbatim: “At regular intervals, the team reflects on how to become more effective, then tunes and adjusts its behaviour accordingly”. So why not reflecting on how Agile is typically deployed into organizations for real? The first and foremost observation is that a so called digital transformation almost invariably involves the construction of a distributed solution or a set of solutions. That is: a solution that is made of a number of components that are required to interoperate seamlessly, some to be built from scratch, some already exiting to be modified/enhanced. In essence, there will be the need of building a UI layer (either native mobile or hybrid or web-responsive) that connects to an ecosystem of APIs (also typically to be largely built) that in turn will provide access to a layer of legacy systems of records typically via a number of different types of connectors. So far there is no rocket science.  However, the scope of what needs be done is typically far larger than the scope that a pizza-size team can crack, in a self-contained and self-organized mode. And the latter implies that a couple of cornerstone Agile principles break down just to start with. Further to that, such a big and complex scope would require, as a mean of technical coordination, an upfront elaboration of architecture (i.e. an engineering focused solution design) that in turn does require some clarity about requirements. And the devil is always in the details: Requirements do not make any exception. Here, on the requirements elaboration front, is where the first and very evident failure typically happens. Agile is almost invariably associated with user stories as the format to collect requirements.  And most of the time what gets produced is a set of high-level hollow statements, almost never mutually exclusive nor exhaustive, that nobody is really able to make sense of, let alone architects or developers, who almost never really bother to read these small sentences in their hundreds. And indeed, in fairness, Agile preaches that user stories are not meant to describe functionalities, but rather serve as placeholders for the self-contained and self-organized team to pick them up and further elaborate them (via team communication) to produce all the required details whilst progressing into their implementation.  Something that might work only in a self-contained and small team. So the first failure is requirements. I have seen or heard of programmes that after many months haven’t yet managed to produce any satisfactory description (i.e. with a meaningful level of detail) of the WHAT, in other terms of the functional requirements end-to-end. Meanwhile the architecture teams, sometimes organized into separate work-streams, each focused on specific  ‘views’ of the whole distributed architecture (i.e. data, security, integration, etc.) engage in rather lengthy and  unfocused debates on potentially needed new capabilities, failing though to converge into a real solution design that the engineering team can read, understand and implement. As implied by its subtitle, this brief article is meant to report experiences collected from the trenches; hence it is not my intention here to delve into a detailed analysis of the various remediation I myself have put forward or seen adopted with success. Its goal is rather to highlight recurring anti-patterns with the aim of awakening pitfalls awareness especially in those non-technical stakeholders who often are the decision makers, so to help them to surely recognize whether their programme has fallen in the same anti-pattern. And believe you me, the level of noise typically coming up from any one’s organization is such that it is very difficult to understand what is really going on at ground level, despite the many reports that are usually produced, all looking very professional, polished and often really impressive from a graphical point of view. So what is the main symptom of such not-so-uncommon anti-pattern? In other terms: how do you recognise that your programme has got stuck at the rather basic level of requirements gathering and elaboration? What do you need to probe to assess whether that is really the case? Naturally enough you would need to check the artefact(s) used to document the agreed requirements and read them to assess if they describe with enough clarity and comprehensiveness what the solution will do in front of its specified category of user.  The latter used to be called an actor and still is within the UML formalism. In other more mundane terms, and assuming, as typically is the case, that your distributed solution starts with a UI (either mobile or web) you should be looking that the requirement clearly describes the sequence of screens, and for each screen its input fields together with associated validation rules, its combo boxes together with its associated choices and action buttons). Also, very importantly, look to see if the relevant server-side calls are described in correspondence of any event or user action that can happen on the specific screen. A server-side call should be documented with a logical name, together with its input and output parameters (again documented at a logical level) and a brief description of what it is required to do from a UI (or front-end ) perspective, again in business terms. There is nothing technical in here. Requirement is about describing what the UI should be doing from a user point of view, both in terms of screen interactions and calls it (i.e. the UI) generates to perform business operations. The reading should be sequentially-friendly. That is the document should be amenable to be read sequentially, from the first to the last page, and, page after page, the reader should get ever more convinced that the ground is covered comprehensively and exhaustively with no gaps or vagueness and it makes sense. This suggestion might look trivial and old-fashion. However, if after months, there is no such description available (with the quality attributes I have just alluded to) it means requirements gathering is still all over the places and your programme has fallen in that not-so-uncommon anti-pattern. Better still: the same exercise can be organized by leveraging independent judges with clearly defined instructions on how to perform the assessment so to assure objectiveness as much as possible. And, if beforehand, a requirement template would have been defined with extreme care and attention (as I often recommend) this kind of programme’s progress measurement would be far easier to execute with reliability. Assessing whether the requirements elaboration process has produced the expected results is important though often overlooked. Requirement is often where most of the digital transformation programmes risk to be wrecked, though that is not widely recognised."
11,The development of warfare cyberspace in the United States of America. By Giancarlo Elia Valori.,computers-technology," Weapons and equipment are the foundation of military combat capability and an important factor in determining the outcome of wars. In the current situation of increasingly fierce competition among major powers and of increasingly evident militarization of cyberspace, all countries have increased capital investment; strengthened the development and deployment of cyberspace weapons and equipment; promoted research and development, as well as transformation, and application of emerging technologies; and sought to shape new technologies for military development and future operations. As a concept for integrating cyberwarfare systems, the US Cyber Command created the Joint Cyber Operations Architecture (JCWA) to guide cyberwarfare acquisition and investment decisions, with the aim of enabling cyber forces to execute command and control decisions, as well as training in having access - through a unified platform - to the broad tasks of the system. Since 2021 the US military has continued to use the JCWA as a guide and rely on various services to develop and improve cyberwarfare systems and tools. The JCWA includes several acquisition programs, as well as cyber tools and sensors to support cyber operations. According to the US Defense Department's 2022 budget, the U.S. Air Force is responsible for requesting to the Joint Cyber Command and Control (JCC2) a budget of 79 million dollars, more than double the previous year's 38.4 million dollars due to a number of programs, including the Internet Key Exchange (IKE) project. i.e. an artificial intelligence-enabled tool that will provide a new way for cyber forces to understand the common operational framework in warfare. Funds will be transferred to the project, and the IKE software development has moved from the planning to the execution phase. The US Air Force is responsible for the Unified Platform (UP) for fiscal year 2022. The research and development budget is equal to 101.8 million dollars. The US Army will also be responsible for the Persistent Cyber Training Environment (PCTE) research and development budget for fiscal year 2022, which amounts to 52.9 million dollars. The budget for the US Army's Joint Common Access Platform (JCAP) has so far been kept secret. The US Army offered the PCTE, version 3, in the second quarter of 2021, following the release of version 2 to the US Cyber Command in October 2020. The PCTE version 3 will provide users with additional response channels and give training managers an overview of the network status. It will also include a content repository to host previous scenarios built by content or training curators. This makes it easier to train or simulate the activities. Security Insider (https://www.secrss.com/) says that the US Army plans to deploy and distribute version 4 of the PCTE platform to the U.S. Cyber Command in the first quarter of this year. The version provides a more intuitive engine for discovering training activities, exercises or modules available to troops, designed to reduce redundancy and enable better individual and team training. The Army also continues to lead the Cyber Innovation Challenge to award contracts and apply new technologies to the PCTE platform. The latest contract, awarded in February 2021, includes ""enhanced assessment"" and ""traffic generation"" features and functionalities that will be incorporated into version 5 of the PCTE. The ""enhanced assessment"" is critical to the US Cyber Command, as it helps improve force readiness reports. On the other hand, the ""traffic generation"" is also a key capability that helps cyber forces in areas including ""friendly space,"" ""grey space"" and ""red space,"" operating in the entire IT and intelligence environment, not just in certain networks. In June 2021 the main annual US Cyber Command exercise, i.e. Cyber Flag 21-2, used the PCTE platform again, thus enabling the US Cyber Command to expand the exercise of activities. The PCTE team is applying the exercise readings to future events for subsequent versions of the platform. The PCTE and project team have developed studies to support and monitor thousands of daily events - even the most insignificant - and make them available to the other major Cyber Yankee service as well. The US Army is also exploring the PCTE integration with other JCWA components to enable the interoperability of the US cyber mission forces. The above integration not only reduces access and accounts for multiple systems, but also seamlessly feeds data response to the combat platform. For example, the US armed forces are conducting initial pilot work to enter and incorporate the PCTE data into the JCC2-Project IKE component. The Pentagon formally handed Project IKE over to the US Cyber Command in April 2021 and it is serving as a reference point for key cyber tools for its cyber mission force. The IKE project is considered a precursor to the JCC2, one of the pillars of the JCWA, available to the US Cyber Command. The JCC2 seeks to integrate data from a variety of sources to help inform and support commanders' decision-making; assess readiness down to the individual level; visualize cyberspace and give situational awareness to all levels of combat forces. The IKE project enables users throughout the chain of command to plan, prepare, execute, and evaluate cybersecurity operations. IKE will be used to map the network and assess the readiness of cyber teams and command forces in cyberspace. IKE enables commanders to understand the status of offensive and defensive teams, as well as friendly and enemy forces in cyberspace, which is critical to its command and control, and to ensure the dissolution of crises in conflicts between combat teams. IKE is already used by the US combat troops and currently has thousands of military users. The US Cyber Command plans to migrate its various service network components to the JCAP. It will provide it with the infrastructure for offensive missions by fiscal year 2024. Service cyber forces will move on crisis platforms, using the separate tools that now operate proactively, and link their respective cyberspace activities more closely. The Army plans to withdraw its current offensive cyber tools in 2024 and then move to the JCAP. The Army is developing the tool for the U.S. Cyber Command and the Army, which will be deployed in four joint mission operations commands: the Army, the Air Force, the Navy and the Marine Corps, which have already signed a memorandum of understanding. The JCAP uses an innovative software acquisition approach and the system is updated quarterly to add new functionalities, thus giving the Army the freedom to continue to repeat and gradually add more functionalities to the system itself. In December 2020 Mattel Technologies announced it had been awarded a 265 million US dollar contract to support the project over 42 months. Furthermore, the US Army awarded a 2.4 billion US dollar contract to 14 companies to provide IT services for the national cyber range complex. The companies will provide incident planning and execution, site safety and security, IT management and range modernization services, as well as operational support for the military in cyber missions. The National Cyber Range is therefore a US Army program focused on improving battlefield resilience by creating an operationally representative cyberspace environment for respective mission testing, training and simulations. As part of the Capability Set 21, the Army plans to implement a tool called Cyber Situational Awareness to prepare units for combat as early as this year. Cyber Situational Awareness is a tool designed specifically for commanders on the ground, not intended for use in cyberspace operations, but to help commanders better perceive cyber and electromagnetic situations to make more informed decisions."
