,topic,category,content
11,Democracy in the Crosshairs,politics," I have been a witness to the democratic process for many, many years. I have participated in numerous elections that have brought to office Democrats and Republicans of various philosophies and styles, but I have never before been worried through all of these various changes that our democracy was in danger of not surviving. A democracy is based on the rule of law and when there is an assault on our laws, that is an assault on our democracy. Because I am so concerned, I have been paying more attention to the political changes that are occurring not only in our country but also in the world. I have begun to realize that what is happening in our country is not an isolated event, but is also happening all over Europe. Right wing parties and leaders are running on the same hate agenda as our former president and the current Republican party and getting elected. That agenda is immigration issues and stoking long simmering hatreds and using these issues to gain power and install systematic corruption. The rise of right-wing nationalism in Europe is widespread, and it is making gains in the following countries: Italy–17.4% Germany– 12.6% Spain–10% Austria–26% France –13% Sweden—17.6% Estonia—17.8% Hungary–49%–19% Anti-immigrant laws are being passed in-- Denmark–21% The Netherlands–13% The Czech Republic–11% Right-wing nationalists across Europe and also here in America are now sensing an opportunity. The immigration issue is the catalyst that is causing this world fear and intolerance and is a world problem which must be confronted and solved by all freedom loving people in all the countries of Europe and America working together. Because of climate change, natural disasters, wars, gangs and dictatorships around the world, and the ending of the war in Afghanistan, large numbers of refugees are fleeing their countries to try to survive. This will only continue to increase if the world does not become more stable. What will happen to these millions of refugees? Will the world close their eyes to the fate of all of these vulnerable people and this overwhelming human crisis and pretend it is not happening or should the compassionate countries of the world get together to solve this enormous problem by taking action? World leaders working together must now begin to stabilize those countries at risk and address the problems that are causing this flight of refugees. Leaders need to decide on a fair number of refugees that each country can absorb. if they don’t begin to address these unsolved problems, their inaction will ultimately destabilize the whole world. We need to be very concerned about what is happening. If we are not aware of this assault on world democracy, then we are all in danger of eventually losing our freedom both in America and elsewhere in the world. When hate becomes the norm, not only refugees and minorities are at risk, but it endangers the freedom of all of us. We must become more aware of this imminent danger to democracy and do all that we can to ensure that this catastrophe will never happen here."
12,The Continuing Fight for Equality,politics," “We hold these truths to be self-evident. That all men are created equal. That they are endowed, by their Creator with certain unalienable rights. That among these are life, liberty, and the pursuit of happiness.""-- Thomas Jefferson 1801-1809 The congress will be voting soon on the voting rights Bill HR1—the For the People Act. Why are we still fighting for equality and the right to free access to voting for all of our citizens in 2021.The Republicans in state legislatures in many states are passing bills to limit access to voting. They have already passed over 200 bills to do that. In a democracy that is unacceptable and limits all of our rights and ultimately will destroy our democracy. We, the people, cannot allow them to do this. That is why voting rights bill HR1 must pass and be a protection for us all. The United States and the world have been fighting discrimination for as long as people have walked on this earth. It has been the Catholics against the Protestants, discrimination against the Jews, Jews in conflict with Palestinians, crimes against Chinese workers and other Asians, The Crusades--Christians against the Muslims. Arab tribes against each other. intolerance between whites and blacks. The truth is that people do not like or trust others who are different than they are. It takes understanding and wisdom to learn to get along even in loving families. We have come to a point in our world that we must learn to live together in peace and harmony or we will all ultimately die together because unless we learn to come together and solve our difficult problems together this civilization will ultimately disintegrate through nuclear destruction or unaddressed natural disasters like climate change. Most of our religions have all tried to teach us to love and respect each other, but unfortunately some have also caused us to distrust anyone who is different.. Our moral and ethical leaders have worked hard to bring us closer to becoming more tolerant of differences. We cannot and should not force other people, whether it is our families or our fellow citizens, to think and feel as we do, but we must learn to respect the opinions and the choices of others as long as they also respect our opinions and our choices. We must all learn to make the effort to live together with respect and in peace. I don't know what the religions or political opinions or races of my neighbors on my street are, but we have all lived side by side for many years—each living the life that suits them and we are a good community. Each of us must now look into our own hearts and root out the distrust that we might feel for those who are different from us and begin to live with more respect and tolerance for every human being in the US and in the world. We must reject words and deeds of intolerance and hate whether they come from our families, our religions, our communities, our TV's or our social media. Respect and tolerance for all human beings is the only option that will ultimately save our democracy and our planet."
13,A Question of Survival,politics," Recently I was watching the movie Conquest of Paradise with Gerard Depardieu, a movie about Columbus and his discovery of the new world. As I was watching the cruelty that occurred in those days (1492)– the Spanish Inquisition and the brutality of what was done to the native populations when soldiers from a foreign country came in and killed them at will and took everything they possessed, I realized that although more than 500 years have passed and our world has changed in so many ways, we are still killing each other at the same pace and for the same reasons as we did so many hundreds of years ago. Why, when the world has become so modern with the invention of cars, planes, new medical techniques our enhanced communication through the internet and so much new knowledge about psychology and the better understanding of the subconscious motivations and drives of human beings, why then are we still functioning in this primitive, brutal way. With vast numbers of smart, educated people able to achieve so many modern inventions and innovations to make our lives safer and better and our astronauts exploring the vastness of outer space, why is it that these same smart, educated people still cannot figure out how we can learn to get along with each other better both in our families or in our world. I think perhaps the answer is that no one is really willing to make the effort and spend the required money to try to solve these most important and crucial world issues on which our very survival is ultimately dependent. Our scientists have already warned us that we have now come to the tipping point in our civilization. We will either begin to collectively work with our world partners to face the real problems of our world or we will all continue to go on as we have with blinders on and go to our destruction together in the not too distant future. Why are we not facing our world problems with wisdom and determination to find solutions? I think that our leaders and our citizens are just so ill-equipped and frightened to look at the reality and the challenges of the future that we all just want pretend that everything is fine and there are no problems. It is called denial! To solve climate change will mean changing our society in many new ways. It will mean changing from fossil fuels to renewable energy, with the loss of old ways and old jobs and the beginning of new technologies and new jobs. “Humanity will have given up on planet Earth if world leaders cannot reach an agreement this year to stop the mass extinction of wildlife and destruction of life-supporting ecosystems.” Elizabeth Maruma Mrema, the acting executive secretary of the UN Convention on Biological Diversity, has implored governments to ensure 2021 is not just another “year of conferences” on the ongoing ecological destruction of the planet, urging countries to take definitive action on deforestation, pollution and the climate crisis. “Humanity will have given up on planet Earth if world leaders cannot reach an agreement this year to stop the mass extinction of wildlife and destruction of life-supporting ecosystems,” the United Nation’s new biodiversity chief has warned. Change is always hard and is resisted by many, but when survival is at stake we don’t have any more options. It must be done and as Elizazbeth Maruma Mrema warns it must be done now–this year– 2021. Another challenge that is destabilizing the world is the intermingling of people of different backgrounds, religions and race. Many populations are being displaced because of internal conflicts, climate change and natural disasters. All religions teach us to be tolerant and respect our fellow man. It is time that we followed our oldest values of love and respect. It is often difficult to tolerate others who look and think differently than we do, but if we respect each other and strive to learn to understand each other better and to live together in peace, than although our world will look different and be different than it is now, it will be one of stability and harmony. If every citizen and every leader dedicates himself to working toward these goals now, addressing climate change and dealing wisely and humanely with displaced populations than perhaps we can still avoid the imminent disaster that is awaiting our world in our lifetime."
,topic,category,content
0,A Question for Moderate Republicans,politics," I have been voting for a very long time. Sometimes democrats won and sometimes republicans won. The issues that we voted on then were simple. Republicans voted for fiscal responsibility and lower taxes and democrats voted to improve social conditions for their own families and for the families of all Americans at risk.  Both parties were sincere in their opinions about what was best for the country. America’s strength was about working on compromises to find the best solution that both parties could agree on. Recently the Republican Party has changed. It is now about gaining power and putting into effect their own values and their own opinions on all issues by any means that they can, even when a majority of the voters may not agree with them. Many long-time republicans and also recent moderate republicans are becoming concerned about the direction their party is taking.  Moderate republicans love our democracy just as democrats and independents do, and don’t want to lose the rights we have all fought so hard to win for all of our citizens. They don't really want to vote for the authoritarian leaders their party is backing. They don’t like the campaign of hate and disinformation that their party is using to win at any cost. The question now for more moderate republicans in our country is what will they do with their vote in the coming elections? Moderate republicans are now faced with a difficult decision. If they don’t feel that they can vote either republican or democratic then their only option would be not to vote at all in the next few elections until their party again becomes the strong and valued party that they have always loved and remembered from the past. Will moderate Republicans choose to do the right thing that they feel will save our democracy or will they do the expedient thing and vote with a party that they know is on a wrong and dangerous path? That is the challenging question that many moderate republicans are asking themselves now? The answer to that difficult question has yet to be determined."
1,Fake News,politics," Fake News We hear a great deal these days about misinformation, disinformation, and fake news.  It is leading some people to question the first amendment guarantee on freedom of expression.  This is understandable; after all, it’s only a small step from hate crimes to hate speech.  The above mentioned terms are difficult to define, however, I can think of some concrete historical examples which may give us some insight into understanding the larger concepts.  Let’s start with Ukraine in the 1930’s. Upton Sinclair, a famous progressive writer in the early part of the 20th Century, visited Russia in the 1920’s.  Upon his return to the United States, he stated, “I have seen the future, and it works.”  Sinclair may have been honestly duped, but Walter Duranty knew better.  Duranty was a writer for the famed New York Times who was sent to Russia in 1922 and stayed until 1936.  What we knew about what was happening in Russia during those years, we got from Duranty.  First, let’s take a look at a few facts.  There was a massive famine in the early 1930’s, mainly in Ukraine but also in Russia itself.  There is general agreement that the horrors were brought on by the policies of communist dictator Joseph Stalin.  Three to four million died of starvation in Ukraine and two to three million in Russia.  It was so bad in Ukraine that cannibalism was a common occurrence.  According to the reporting of Duranty, everything was fine.  He absolutely denied there was any problem whatsoever.  His articles, more or less, maintained that there is nothing to see here.  To make matter worse, he heaped scorn on another reporter who had directly witnessed what was taking place.  To add insult to injury, Duranty received a Pulitzer Prize in 1932 during the height of the famine. Herbert Matthews, another Times reporter, did a Duranty imitation of his own in 1957 when he interviewed guerilla leader Fidel Castro of Cuba.  In his article Matthews portrayed Castro in the best possible light.  He said Castro had a massive army, the majority of the people were on his side, and he was not a communist.  He went so far as to say that Castro was actually an anti-Communist.  After Castro took over Cuba in 1959, Matthews continued to proclaim the noncommunist nature of the new government.  He was still holding to this position into 1960 when Castro himself put an end to the nonsense by coming out of the closet and declaring himself a proud communist. Many people alive today remember the energy crisis of the 1970’s.  It was a time of gas shortages, long lines at the pump, and surging prices.  To conserve energy President Nixon instituted day light savings time the year around (it only lasted one year) and set the speed limit at 55.  President Carter told Americans to shiver in the winter and sweat profusely in the summer.  Looking back, it seems fairly obvious that the problem was instability in the Middle East and government control over the price of oil.  However, we were told by the government, the media, and academia that the world was running out of oil.  I personally bought in to this line of reasoning; it seemed entirely logical.  Demand for oil across the board was through the roof, and there is a limited amount of fossil fuel.  I remember a conversation I had with a friend during the 70’s in which I stated that oil was running out.  She said, “There’s plenty of oil!”  I thought she sounded ignorant, but I was the one who was uninformed.  It’s been almost 50 since that conversation, and we still have plenty of oil.  Regardless of how one feels about climate change and other related issues regarding fossil fuels, we were not running out of oil in the 1970’s. George W. Bush, for whatever reason, was determined to get rid of Saddam Hussein in 2003.  At first the government through Vice President Dick Cheney tried to tie Hussein to Al Qaeda.  That didn’t work; there was simply no evidence.  Then, they fell back on weapons of mass destruction.  Bush and the CIA claimed that Iraq had chemical weapons and was pursuing a nuclear capability.  The intellectual community was convinced, and the rest is history.  There was no investigative reporting on the part of the media as they bought the argument hook, line, and sinker.  Of course, it was all a lie.  The only thing relating to weapons of mass destruction the U. S. Army found when it invaded Iraq was a mobile lab which contained a few high school type solutions and materials. There is and always has been an abundance of fake news.  It’s the public’s job to sort things out, and it usually can.  We most always say, “Hey that sounds silly.”  The problem comes in when the fake news is supported by the media and the government.  When that happens, it can have catastrophic consequences."
