,topic,category,content
0,A Question for Moderate Republicans,politics," I have been voting for a very long time. Sometimes democrats won and sometimes republicans won. The issues that we voted on then were simple. Republicans voted for fiscal responsibility and lower taxes and democrats voted to improve social conditions for their own families and for the families of all Americans at risk.  Both parties were sincere in their opinions about what was best for the country. America’s strength was about working on compromises to find the best solution that both parties could agree on. Recently the Republican Party has changed. It is now about gaining power and putting into effect their own values and their own opinions on all issues by any means that they can, even when a majority of the voters may not agree with them. Many long-time republicans and also recent moderate republicans are becoming concerned about the direction their party is taking.  Moderate republicans love our democracy just as democrats and independents do, and don’t want to lose the rights we have all fought so hard to win for all of our citizens. They don't really want to vote for the authoritarian leaders their party is backing. They don’t like the campaign of hate and disinformation that their party is using to win at any cost. The question now for more moderate republicans in our country is what will they do with their vote in the coming elections? Moderate republicans are now faced with a difficult decision. If they don’t feel that they can vote either republican or democratic then their only option would be not to vote at all in the next few elections until their party again becomes the strong and valued party that they have always loved and remembered from the past. Will moderate Republicans choose to do the right thing that they feel will save our democracy or will they do the expedient thing and vote with a party that they know is on a wrong and dangerous path? That is the challenging question that many moderate republicans are asking themselves now? The answer to that difficult question has yet to be determined."
1,Fake News,politics," Fake News We hear a great deal these days about misinformation, disinformation, and fake news.  It is leading some people to question the first amendment guarantee on freedom of expression.  This is understandable; after all, it’s only a small step from hate crimes to hate speech.  The above mentioned terms are difficult to define, however, I can think of some concrete historical examples which may give us some insight into understanding the larger concepts.  Let’s start with Ukraine in the 1930’s. Upton Sinclair, a famous progressive writer in the early part of the 20th Century, visited Russia in the 1920’s.  Upon his return to the United States, he stated, “I have seen the future, and it works.”  Sinclair may have been honestly duped, but Walter Duranty knew better.  Duranty was a writer for the famed New York Times who was sent to Russia in 1922 and stayed until 1936.  What we knew about what was happening in Russia during those years, we got from Duranty.  First, let’s take a look at a few facts.  There was a massive famine in the early 1930’s, mainly in Ukraine but also in Russia itself.  There is general agreement that the horrors were brought on by the policies of communist dictator Joseph Stalin.  Three to four million died of starvation in Ukraine and two to three million in Russia.  It was so bad in Ukraine that cannibalism was a common occurrence.  According to the reporting of Duranty, everything was fine.  He absolutely denied there was any problem whatsoever.  His articles, more or less, maintained that there is nothing to see here.  To make matter worse, he heaped scorn on another reporter who had directly witnessed what was taking place.  To add insult to injury, Duranty received a Pulitzer Prize in 1932 during the height of the famine. Herbert Matthews, another Times reporter, did a Duranty imitation of his own in 1957 when he interviewed guerilla leader Fidel Castro of Cuba.  In his article Matthews portrayed Castro in the best possible light.  He said Castro had a massive army, the majority of the people were on his side, and he was not a communist.  He went so far as to say that Castro was actually an anti-Communist.  After Castro took over Cuba in 1959, Matthews continued to proclaim the noncommunist nature of the new government.  He was still holding to this position into 1960 when Castro himself put an end to the nonsense by coming out of the closet and declaring himself a proud communist. Many people alive today remember the energy crisis of the 1970’s.  It was a time of gas shortages, long lines at the pump, and surging prices.  To conserve energy President Nixon instituted day light savings time the year around (it only lasted one year) and set the speed limit at 55.  President Carter told Americans to shiver in the winter and sweat profusely in the summer.  Looking back, it seems fairly obvious that the problem was instability in the Middle East and government control over the price of oil.  However, we were told by the government, the media, and academia that the world was running out of oil.  I personally bought in to this line of reasoning; it seemed entirely logical.  Demand for oil across the board was through the roof, and there is a limited amount of fossil fuel.  I remember a conversation I had with a friend during the 70’s in which I stated that oil was running out.  She said, “There’s plenty of oil!”  I thought she sounded ignorant, but I was the one who was uninformed.  It’s been almost 50 since that conversation, and we still have plenty of oil.  Regardless of how one feels about climate change and other related issues regarding fossil fuels, we were not running out of oil in the 1970’s. George W. Bush, for whatever reason, was determined to get rid of Saddam Hussein in 2003.  At first the government through Vice President Dick Cheney tried to tie Hussein to Al Qaeda.  That didn’t work; there was simply no evidence.  Then, they fell back on weapons of mass destruction.  Bush and the CIA claimed that Iraq had chemical weapons and was pursuing a nuclear capability.  The intellectual community was convinced, and the rest is history.  There was no investigative reporting on the part of the media as they bought the argument hook, line, and sinker.  Of course, it was all a lie.  The only thing relating to weapons of mass destruction the U. S. Army found when it invaded Iraq was a mobile lab which contained a few high school type solutions and materials. There is and always has been an abundance of fake news.  It’s the public’s job to sort things out, and it usually can.  We most always say, “Hey that sounds silly.”  The problem comes in when the fake news is supported by the media and the government.  When that happens, it can have catastrophic consequences."
2,Politics at Trinity High School,politics," Politics at Trinity High School Those who know me realize I am a very conservative person politically.  When I attended a teacher In-Service after being hired by Trinity High School in 1985 at age 39, I realized I was entering a liberal environment.  A couple of my new colleagues were talking about how horrible the South African government was.  Shortly afterwards in teacher conferences, the principal (Sr. Stephanie Warren) subjected us to some women’s liberation theories.  Some revolved around spouse abuse and how it was caused by a patriarchal society.  Others concerned language and its sexist nature.  I talked to my dad about these developments, and he advised me to go about my job and keep my mouth shut.  Since I needed the job, I decided to take his advice. In looking back, Sr. Stephanie was in many ways ahead of her time.  In 1985, most of her beliefs were considered off the rails; now, they are the norm.  She was also very much an advocate of the nuclear freeze movement.  The year before, when she was just a teacher, she went to the Trinity Board and asked it to take a stand on this issue.  Tom Isbill, one of the Board members, told her to come back when the Soviet Union no longer posed a threat. Anthony Scola was the assistant principal at Trinity.  Anthony was what one might call an old hippie with an effeminate personality and a keen sense of humor.  He was also an intellectual type who could be very aggressive.  You didn’t want to disagree with Anthony; he could cut you down to size in no time flat.  He was a former priest who in his younger years had opposed the war in Vietnam.  Eventually he left the priesthood and the Catholic Church altogether.  He married a former nun (Margaret) who also left the church, and they both became Quakers.  The simple and pacifist lifestyle of the Brotherhood appealed to their sense of right and wrong. Margaret taught at St. Mary’s, one of the grade schools connected to Trinity.  She was also an old hippie who supposedly went so far as refusing to shave her legs or under her arms.  Originally the Scolas were from Milwaukee, but they wanted to get away from the fast paced urban life.  When they were hired to teach at Trinity and St. Mary’s in Whitesville, Kentucky; the town was too big for them so they settled in Deanefield, a smaller community to the southeast.  Whitesville contains about 600 people while Deanefield has less than 100. I discovered there was a divide between the administrators and clergy of Trinity on the one hand and the parents and students on the others.  In 1988 the Evansville Bosse basketball team, mostly Black, traveled to face a mostly White Heritage Hills team.  There had been a history of bad blood between the two schools.  On their journey, the Bosse team noticed burning crosses along the side of the highway.  Sr. Stephanie and some of her fellow sisters who taught at Trinity expressed horror over the situation.  Later I overheard some Trinity parents laughing and hee-hawing about the same incident. Sr. Stephanie left Trinity after four years as principal.  Despite my disagreement with her ideology, I had no problem with her as a person or a superior.  She gave me a job when I needed one, promoted me to athletic director after just one year, and always treated me with respect.  Several times she went to bat for me in disciplinary and personality clash situations.  Her replacement was Dan Fuller, a well traveled school administrator who came to Trinity from Florida.  At first glance he appeared to be more of the same.  In a document he submitted to the Board explaining his philosophy, he used feminine pronouns to refer to non-gender antecedents. Dan was a unique individual.  The students loved him and he commanded their respect.  They called him ‘Dan the Man.’  From an academic standpoint, he and W. A. Franklin (an Ohio County assistant principal) were the most scholarly and well read administrators with whom I have ever been associated.  However, he gave the students an inordinate amount of freedom, and after one year the teachers were a bit upset.  On her principal evaluation form, one teacher included the statement, “Less ‘Dan the Man’ and more Mr. Fuller.”  Some concerned teachers led by Anthony Scola and Sr. Lorraine Lauter (a religion instructor) tried to have Dan fired.  When the attempt failed, Anthony took a one year sabbatical at the University of Kentucky in order to work on a degree in Spanish. During Dan’s first year, Sr. Dianna Ortiz (a friend of Sr. Lorraine) claimed she was kidnapped, tortured, and raped by America’s allies in Guatemala.  Sr. Lorraine arranged for the school to have a special assembly to address the issue.  She turned the assembly into an America bashing session in which United States foreign policy was depicted as evil and sinister.  I sat in the back, and as the negativity toward the United States became intense, I shook my head in disbelief and disgust.  At one point I looked over at Dan who was sitting across from me, and he was cracking up with laughter at my response.  I interpreted this as meaning I had a friend and ally.  It turned out that I was correct because next year he promoted me to dean of students. Margaret Scola, Anthony’s wife, got involved in a running debate with a grade school colleague over the Gulf War of 1991.  She said we needed to give sanctions more time before going to war.  Jamie Clark, her colleague, challenged her by saying, “I can’t think of a worse way to die than starving.”  When Anthony returned from his sabbatical, Dan saddled him with the worst possible classes; they were chock full of troublemakers.  Anthony challenged the scheduling, but the Board upheld Dan.  A few years later, Anthony and Margaret resigned to become African missionaries.  They were stationed in Sudan, and I feared for their safety.  Nothing bad happened; however, as they both attended a Trinity graduation in the mid-90’s.  Also leaving were Sr. Lorraine and Sr. Theresa Henry (another liberation theology advocate).  With these departures, liberalism at Trinity pretty much ceased to exist. Shortly after his third year began, Dan himself resigned to take a principal’s position in Maine.  As chief disciplinarian I basically had the run of the school for the remainder of the year.  Another teacher (Katie Williams) was appointed interim principal, but she gave me the freedom to operate as I saw fit.  In 1992 John Calhoun was hired as principal.  He was a Ross Perot type of conservative, and we were off to the races. There was a bit of backsliding in 2000 when Mike Clark became principal.  Even though Mike was liberal, he did not make a point of advancing a political agenda.  However, one of his hires as a religion teacher did.  One day I noticed a document in my mailbox which was full of propaganda about how military spending was ruining America.  When I complained to the secretary about such items being placed in our personal spaces, she told me it was done by Bob Nicodemus, the religion instructor.  I then confronted Bob, and we became involved in a ferocious argument.  He defended the propaganda and his actions by comparing it to sending a Christmas card.  The argument went on and on, and we ended up yelling at each other.  Anyway, Bob left after one year, and Mike was gone as principal after two.  Afterwards, we returned to normal. It is appropriate in light of current tendencies that I end with a story about the national anthem.  In 1992 Trinity’s girls’ basketball team was playing in a Christmas Tournament at Brescia University.  As athletic director I was always looking to schedule our teams in such tournaments.  Barry McArdle, a public relations and recruitment specialist at Brescia, organized the event; and we played in it for a couple of years.  Shortly before our first game in the 1992 tournament, Barry came to me and said they would not be playing the national anthem.  Instead, a Brescia student would sing “God Bless America.”  He said, “After all, Larry, the national anthem glorifies violence.”  He then asked if what they were doing was okay with me.  I simply responded, “It’s your tournament!”  A short time later, a young Brescia student came to the scorers’ table visibly upset.  She said Mr. McArdle had just ordered her to sing both “God Bless America” and the national anthem even though she had not practiced the “Star Spangled Banner.”  This was probably my most satisfying point in the political wars at Trinity High School."
3,Explaining Civil Litigation,politics," Lawyers can build their careers across various fields, from family lawyers to corporate attornies. One common field of practice is civil litigation. Civil litigation attorneys work with cases with no criminal charges or penalties. Instead, civil litigation attorneys work with various kinds of non-criminal legal disputes in which plaintiffs are looking for some sort of compensation or damages. Read on to learn more about what it means to work as a civil litigator! What Kinds of Cases Do Litigators Handle? As mentioned above, civil litigators handle non-criminal legal disputes. This encompasses many different kinds of cases, so most lawyers working in civil litigation have just a couple of areas of expertise. Civil litigation cases might include landlord and tenant disputes, personal injury claims, intellectual property disputes, medical malpractice claims, education law disputes, and more. Unlike in criminal cases, where the prosecution has to present evidence that proves their case beyond a reasonable doubt, civil litigation trials only require convincing evidence. What Skills Do Litigators Need? Civil litigation requires similar skills as other areas of law. Litigators need to have extensive knowledge of local and federal laws related to their area of practice, strong communication skills, negotiation skills, and more. Negotiation can be critical in litigation cases. Many litigation cases never go to trial, so negotiating terms to resolve the issue outside of the courtroom is a crucial skill. What Are the Steps to a Litigation Case? When a client hires a litigator for their case, the case goes through a particular process, just as in any legal procedure. When a potential client wants to pursue civil litigation against another party, their first step is to meet with a litigation attorney to discuss the case. The attorney will help explain the process and evaluate whether or not the client has a strong case. From there, if the client decides to proceed with the case, the attorney will do extensive research to build evidence. This will be followed by both involved parties filing pleadings, essentially explaining their sides of the issue. Once the court has received both pleadings, the case will enter the discovery stage. This is essentially an extension of the research phase, including witness interviews and fact gathering for each side to build their case. The discovery stage usually takes the most time. Once discovery is complete, the case enters pre-trial, which is the last step for many cases. In pre-trial, the attorneys for both the plaintiff and defendant begin negotiations, trying to reach an acceptable settlement outside of court. If an agreement cannot be reached, the trial will go to court, and a judge will decide the matter."
