,topic,category,content
5,Cyberwar History and Ukraine,politics," People are much more drawn to images of blown-up building, fires, mushroom clouds, refugees in dire circumstances, color pictures of pain that are better in black and white than they are to explanations of code or even fallout from code if it’s not resulting in something blown-up, fiery, or pictures of people in pain that are better in black and white. That is to say, while we see plenty of stories of ransomware, temporary business disruptions, and credit card & ID fraud, it’s not visceral. It goes by quickly on the page and in our minds. So, whatever happened to the stories we saw before the cyberattack age? When the US Cybercommand was  just a twinkle in some geeky eyes? What happened to the discussion that cyberattacks would engender kinetic responses? Bombs not electrons. Perhaps it was a sense of proportion. Perhaps it was a recognition that we consider that an increasing cyberwar, if responded to with bullets, might just result in use seeing those images of things that would be better in black and white on our own doorstep? Did we back off, or did sanity take hold in the minds of the planners? Let’s look at a little history. Back in 2003, a cyberattack originating from China - and christened, “Titan Rain,” by the US - managed to get access to loads of sensitive government information by compromising the systems of US government contractors and of government systems themselves. Only unclassified information was stolen, but the world woke up to this kind of attack. In 2004, the Joint Chiefs of Staff declared cyberspace an important domain of conflict alongside the air, land, sea, and space domains. No doubt, this was prompted by the reality of Titan Rain. As a culture, we were just starting to think about these things on a national level. In 2007, Estonia experienced a broad cyberattack that included their parliament, banks, and media. It was believed to have originated from Russia, or from Russian actors. NATO’s response was to create the NATO Cooperative Cyber Defence Center of Excellence (CCDCOE) in 2007. Now, continents were beginning to wake to the threat and the need to do something about it. The Tailinn Manual The CCDCOE began to develop an extensive study and code about what how international law applies to cyber conflicts and cyberwarfare; these previous acts were beginning to be recognized as acts of war. Calling on legal scholars and legal practitioners that were experienced in cyber issues, the CCDCOE produced Tailinn Manual on the International Law Applicable to Cyber Warfare in 2012. The Tailinn Manual declared that killing hackers in response to certain cyberattacks was justifiable. Killing hackers?! Meanwhile, other state-sponsored cyberattacks marched their way into the public consciousness. The Stuxnet Worm was developed to sabotage Iran’s nuclear development efforts – in particular, the centrifuges used to enrich uranium gas. It is believed to be the first malware designed to and succeeding in visiting physical destruction on physical equipment. Wired Magazine called it the first digital weapon. It's widely considered that the US and Israel collaborated over a period of 5 years to develop this malware. In 2009, Secretary of Defense, Robert Gates, recognizing how important AND vulnerable important computers and networks were (are), directed the creation of USCYBERCOM. It is the unified command for the cyberspace domain in the US and the world. In 2016, the organization described the 2016 espionage ops against the Democratic National Committee while in the midst of a national election “serious business . . . [that] may destroy democracy.” Administration officials at the time considered that cyber weapons were so potentially destructive that they should be unleashed only on the direct orders of the Commander in Chief, like nuclear weapons. I do not know if there is an equivalent “Cyber Football.” Article 51 of the UN Charter allows individual countries to defend themselves and to band together to defend each other. It also allows the same if an armed attack is anticipated and recognizes the right to use force in such a situation. It allows cyberattacks to be considered an armed attack. In 2019, Israel did just this, by conducing airstrikes on a building that they said had Hamas members inside that were planning to launch a cyberattack on Israel. In 2021 the topic was up for noticeable public discussion again. NATO heads of state and government met at NATO’s North Atlantic Council meeting in Brussels and issued a communiqué that ultimately equates cyberattacks with kinetic attacks and leaves the possibility of military action against hackers on the table. Still, what we generally see is that cyberattacks - or anticipated cyberattacks - by states are dealt with by preemptive and after-the-fact punishing cyberattacks. Tit for tat, as it were, and even before the tat. Cyberwar in Action What we have seen in practice in Georgia in 2008, Crimea in 2014 and in Ukraine in 2021 is the “softening up” cyberattack. The attack used to diminish and disable defensive and living systems before a kinetic attack, rather than a kinetic attack in response to a cyberattack. Many said that the 2014-2015 cyberattacks were on a an entirely different – and grander – level than had been seen previously. Several Ukrainian banks and government agencies became inaccessible and malware – using a tool called “HermeticWiper” - was wiping data from hundreds of PCs and servers. But we’ve gotten used to common DDOS attacks, data-wiping and ransomware in recent years on the civilian level. It’s kind of taken for granted that these things are ongoing and all over. The use of cyberwar and kinetic war together has been labeled “hybrid warfare.” And yet, the world seems surprised that Russian cyberattacks on Ukraine in 2021 and 2022have been substantially less severe than anticipated. To be sure, they were and are ongoingly widespread. Hackers caused the Viasat satellites to become inoperative. But that may have affected Russian soldiers and commanders to lose connectivity as well. And said attack has been mitigated somewhat by the Musk’s activation of Starlink Internet satellites over Ukraine. Additionally, Ukrainian modems were zombie-fied by Russian malware, being used as nodes for targeted DDOD attacks within Ukraine. But the ruination from malware that was expected has not really seemed to occur. We haven't seen a cyber-Armageddon. Were they more pr? Were the US and/or the EU pumping up Ukraine’s cyber defenses or attacking the offensive cyber capabilities of Russia? The newspapers wonder about this and government sources overtly express surprise and confusion that there isn’t more cyber damage. I would be willing to wager that they know more about this than they are letting on. But then, isn’t that almost always the case? The coming days and weeks will tell us more about cyberwar in Ukraine. It’s possible that all-out disruption of Ukraine’s Internet will come to pass. We hope not. But one thing about this history stands out. We have not seen the kinetic response to cyberattacks on a wide scale that was being discussed a decade ago. Luck? Cooler heads? Invisible cyber counterattacks? Thoughts of a Cyber version the Mutually Assured Destruction doctrine that has, in theory, kept the world from launching nuclear war? Or is physical destruction on a massive scale enough to satisfy those bent on domination? These times we’re living in will surely shape the times we will be living in. Let us hope and work for that cyberwar doesn’t exceed the malign effects we have seen to date and that going forward we see fewer dire images because of fewer dire circumstances"
6,We Have Met the Enemy and He Is Us,politics," Cartoonist Walt Kelly modified and changed Commodore Perry’s famous quote to, “We have met the enemy and he is us” in a cartoon he created in 1970 celebrating the first Earth Day in 1970. The message being that man from his treatment of the earth is the planet’s enemy. It may also be true that the greatest enemy of democracy is not our corrupt leaders, but that a large part of our country’s citizens do not love or understand what democracy really means. If they do not love or want a free press that allows opposition and differences of opinion to flourish, then they do not love or want democracy. If legislators take away the rights of any minority and hamper free elections and the ability for every eligible citizen to easily cast a vote, then they do not love democracy. If school boards take books out of libraries as Texas is doing, because they consider the books too disturbing or controversial, then they are going down the path of the book burnings that happened in Nazi Germany and they do not love or want democracy.  Instead of democracy they want only their own opinions and their own laws to prevail and flourish and are willing to vote for leaders who will give them what they want. But leaders who willingly lie and bend the laws to obtain power eventually take away not only the rights of the minorities they oppose, but also ultimately take away all their citizens rights as we have seen in other countries that have become authoritarian and have lost their democracy. In the United States we are  on a dangerous road toward losing our freedom. If in the next few elections the people vote for leaders with selfish and corrupt motives and authoritarian tendencies, then the voters will ultimately be responsible for giving away their precious freedom and once you give away your freedom, it is very difficult and perhaps impossible to ever get it back. In a Democracy everyone has a voice and is worthy of respect. Poor people, rich people, minorities and majorities and people of different religions and different ethnicities. If a voter does not believe in that, then they do not love democracy. That is the dilemma that the voters in America will soon be facing in the coming elections in 2022 and 2024. How many voters still love democracy and are willing to vote for and support leaders who will protect it? The future of our country and the future and well-being of our children and all future generations are now in the hands of all of us who are voters—an awesome and frightening responsibility. We must now all work and fight to protect our ability to vote. We must fight for the ""For the People act of 2021"" that will help to protect every citizen’s right to vote. We must all make an effort to get the information we need from many different reliable sources so we can become wise and informed voters and ultimately cast our vote for leaders who will always protect our democracy and the rule of law and keep it forever strong and safe. Democracy needs every voter now as it has never before needed all of us to work and fight for its very survival."
7,A Society in Transition,politics," We all are aware that change in our personal lives is difficult, constant, and inevitable. We notice it when we look in the mirror or see our children grow. What is not so noticeable, however, but is also constant is the change that happens in our country and our world. That change happens so gradually that we don’t always notice it until those changes have made the world that we always knew unrecognizable. I was born before television and computers were in every household and our world then was different and slower-paced. That world, however, is gone now. We can’t get it back and we probably would not want it back. How would we live without our televisions and our computers? There is a segment of our society today that is nostalgic about the past and wants to return to the “good old days”,  but much of the “good old days” was not so admirable. When I was a child we simply accepted discrimination against minorities as normal. We accepted the career limits of women and the limitations on the role of minorities in society as normal. More of our young people today are going to college because of the availability of student loans and they expect their country to give equal opportunity and equality to all of its citizens without exceptions. This more inclusive attitude of a large part of our society is now a threat to those who have held power for a very long time and have denied equal rights to so many people for their own personal gain. When a part of our society denies that climate change is happening, it is because they don’t want to give up the oil and other benefits which make them rich. They are only aware of their self-interest and really don't care that they are damaging the environment or our country.  If they do not want equality for minorities, it is because it serves their self-interest to keep wages and benefits low. These people, who put self-interest before the interests of society, cannot hold back progress indefinitely. They are on the wrong side of history. People in every age have been striving to make their lives better and although it often takes a long time to change prevailing thought and achieve their goals, they inevitably do win. Black people after a very long time of being exploited were eventually freed from slavery. Women, after a long and dangerous struggle, eventually won the right to vote. More and more people are signing on to do the right thing rather than the expedient thing. We must all be prepared to go into the future and embrace the inevitable changes ahead which will ultimately change and also enrich our lives.. Our cities will eventually look different and be more diverse and we will all need to become more tolerant of different religions and ideas and different ways of thinking and living. Tolerance and acceptance for the benefit of all–that is the ultimate goal and the ultimate meaning of democracy and freedom."
8,The Assault on Science,politics," When I was a young girl, there was a great respect for people of science (doctors, scientists etc.). We trusted them and felt that the contributions of all of our world scientists had made our lives healthier and better. Therefore I was very surprised and disappointed when in 2021 after 50 years of warnings from 97% of our most prestigious scientists that we are still living in a dangerous time of climate change our legislators have as yet not taken the actions they need to take to protect us from this life-threatening calamity. The Worlds most Prestigious Scientific Organizations believe that the Climate is Warming The following is a partial list of scientific organizations along with links to their published statements and a selection of related resources. Statement on Climate Change from 18 Scientific Associations “Observations throughout the world make it clear that climate change is occurring, and rigorous scientific research demonstrates that the greenhouse gases emitted by human activities are the primary driver.” (2009) Climate deniers are often funded by corporations, companies and individuals who for their own economic interests do not want environmental protection laws that will limit their profits. American Association for the Advancement of Science “The scientific evidence is clear: global climate change caused by human activities is occurring now, and it is a growing threat to society.” (2006) American Chemical Society “Comprehensive scientific assessments of our current and potential future climates clearly indicate that climate change is real, largely attributable to emissions from human activities, and potentially a very serious problem.” (2004) American Geophysical Union “Human‐induced climate change requires urgent action. Humanity is the major influence on the global climate change observed over the past 50 years. Rapid societal responses can significantly lessen negative outcomes.” (Adopted 2003, revised and reaffirmed 2007, 2012, 2013) American Medical Association “Our AMA … supports the findings of the Intergovernmental Panel on Climate Change’s fourth assessment report and concurs with the scientific consensus that the Earth is undergoing adverse global climate change and that anthropogenic contributions are significant.” (2013) American Meteorological Society “It is clear from extensive scientific evidence that the dominant cause of the rapid change in climate of the past half century is human-induced increases in the amount of atmospheric greenhouse gases, including carbon dioxide (CO2), chlorofluorocarbons, methane, and nitrous oxide.” (2012) American Physical Society “The evidence is incontrovertible: Global warming is occurring. If no mitigating actions are taken, significant disruptions in the Earth’s physical and ecological systems, social systems, security and human health are likely to occur. We must reduce emissions of greenhouse gases beginning now.” (2007) The Geological Society of America “The Geological Society of America (GSA) concurs with assessments by the National Academies of Science (2005), the National Research Council (2006), and the Intergovernmental Panel on Climate Change (IPCC, 2007) that global climate has warmed and that human activities (mainly greenhouse‐gas emissions) account for most of the warming since the middle 1900s.” (2006; revised 2010) There is only a small window of time left for us to act on this life-threatening problem for our planet before we will no longer be able to protect ourselves from this dangerous calamity. International Academies: Joint Statement “Climate change is real. There will always be uncertainty in understanding a system as complex as the world’s climate. However there is now strong evidence that significant global warming is occurring. The evidence comes from direct measurements of rising surface air temperatures and subsurface ocean temperatures and from phenomena such as increases in average global sea levels, retreating glaciers, and changes to many physical and biological systems. It is likely that most of the warming in recent decades can be attributed to human activities (IPCC 2001).” (2005, 11 international science academies) National Academy of Sciences “The scientific understanding of climate change is now sufficiently clear to justify taking steps to reduce the amount of greenhouse gases in the atmosphere.” (2005) U.S. Global Change Research Program “The global warming of the past 50 years is due primarily to human-induced increases in heat-trapping gases. Human ‘fingerprints’ also have been identified in many other aspects of the climate system, including changes in ocean heat content, precipitation, atmospheric moisture, and Arctic sea ice.” (2009, 13 U.S. government departments and agencies) Intergovernmental Panel on Climate Change “Warming of the climate system is unequivocal and since the 1950s many of the observed changes are unprecedented over decades to millennia. The atmosphere and ocean have warmed. The amounts of snow and ice have diminished, and sea level has risen.” “Human influence on the climate system is clear and recent anthropogenic emissions of greenhouse gases are the highest in history. Recent climate changes have had widespread impacts on human and natural systems.” List of Worldwide Scientific Organizations This page lists the nearly 200 worldwide scientific organizations that hold the position that climate change has been caused by human action. Source information: NASA –Global climate change Climate Deniers “Unfortunately there is also a long list of climate deniers who have made a living out of denying the science of climate change. These so-called ‘experts’ often start out their statements with ‘I’m not a climate scientist, but…’ before launching into a series of carefully rehearsed talking points meant to confuse the public on the climate change issue. A great many of them are well-paid operatives of organizations like The Heartland Institute, CFACT, and Americans for Prosperity, which take contributions from fossil fuel corporations — including ExxonMobil, the Koch Brothers and their company Koch Industries — who seek to delay or block any substantial government policy initiatives meant to curb fossil fuel emissions or hasten the rapid growth of cheaper, cleaner sources of energy like wind and solar.” – Source information: Before the flood In  2019, 1.1 million students skipped school for a climate strike protest. These are young people and young voters who care about their future and  took action to show our politicians that they are concerned about what is happening to our environment and to their future. They are also aware that the Republicans in Congress because of their own self-interest and economic greed have been fighting to prevent any constructive action on addressing climate change and making our country and world safer. In 2021 and 2022  we all will have the opportunity to make our voices heard again on this important life and death issue. If we make the wrong choice at the ballot box, this country and this earth that we love so much, and our children and all future generations will ultimately pay the price of living on a more dangerous and life-threatening planet. Now is the time that we must all commit ourselves to protect this fragile earth from that unthinkable fate."
