,topic,category,content
4,5 Popular Types of Web Hosting Services Explained,computers-technology," Multiple websites can use a same server with shared hosting. Typically, you will have no idea who or what websites are sharing a server's resources with you. Each client often has a restriction on the overall amount of server resources that they may use, however this is determined by your hosting package. Shared hosting is perhaps the most cost-effective and inexpensive option for your needs. However, the low price comes with some limitations, which we'll discuss further below. Because most hosting firms provide the same amount of space and storage, it's critical to select a business you can rely on. Advantages of Shared Hosting Shared hosting is by far the most affordable hosting option. Most hosting firms offer different tiers of hosting, so you may gradually improve your hosting service. As a result, shared hosting is ideal for launching a website. Shared hosting often has a built-in cPanel that is simple to use and maintain. Shared hosting is an excellent choice for website owners on a tight budget. Disadvantages of Shared Hosting Shared hosting is inexpensive and simple to administer even without technical knowledge. However, it has several downsides. The load time might be sluggish, and the server can get overcrowded due to other sites using the same server. When your website begins to receive more traffic, you will notice that the load speed of your website becomes noticeably slower, and now is the time to improve. Shared hosting lacks specific choices for optimising your website's performance. VPS web hosting is a newer form of web hosting that has just recently gained popularity. Virtual Private Server (VPS) is an acronym for it. Many individuals and businesses seeking a web host for their Internet endeavours are bewildered by VPS hosting. Because it is a hybrid of shared and dedicated hosting, this is the case. A virtual private server has its own operating system, storage space, and bandwidth. A physical server in a data centre used for VPS hosting is separated into different areas, each of which creates its own virtual server. The server administrator sees just their virtual environment and may utilise or reboot the server as if it were their own dedicated server. Many hosting customers prefer VPS hosting because they have more control over their environment than shared hosting. VPS hosting is a suitable beginner option for consumers who desire dedicated hosting but are unsure about the technological know-how required. They can try it out and expand their skill set without having to invest as much money up front. Advantages of Virtual Private Server (VPS) A virtual private server (VPS) may be configured to perform optimally for your website. Because of the more advanced settings, a company that uses managed VPS will immediately see hosting benefits such as enhanced performance. A VPS is normally more expensive than shared hosting, but it is not more expensive than dedicated hosting. A high-performance VPS is not much more expensive than most shared hosting options. It is easy to understand why a VPS is a much better bargain. In terms of security, VPS is more secure than shared hosting since it has a closed environment with no shared resources. For example, if a virus infects any of the websites housed on a shared network, it may quickly traverse the directory structure and infect everything in its path. Disadvantages of Virtual Private Server (VPS) Virtual private server hosting are usually more expensive than shared hosting. While the cost is greater, you receive more bang for your buck when compared to shared hosting. Dedicated servers are frequently regarded as the best web hosting solution. This is because you get a lot more benefits with dedicated hosting, such as greater uptime and faster speeds. On the other side, dedicated servers are the most expensive type of web hosting. Websites that are hosted on a dedicated server have complete control over the server setup. You have the option of selecting your favourite software and customisations. If you buy a dedicated server, you should expect it to have an extremely high uptime and lightning-fast loading rates. You will never have to worry about other websites' traffic interfering with the operation of your website. However, a high degree of technical skill is necessary for the server's installation and ongoing operation. Advantages of Dedicated Servers Dedicated servers are one of the most reliable and stable hosting. It guarantees that you are not sharing your space with a malicious software or a spammer. Dedicated servers give more security, which is why they are necessary for firms that undertake FTP or SSL transactions. Dedicated server hosting usually includes a 24x7 support team to deal with technical issues to ensure high uptimes. One of the most often held beliefs about dedicated hosting is that you have complete control over your server. As the site admin you can custom all the tools and applications, as long as the hosting provider supports them. Disadvantages of  Dedicated Servers To maintain a dedicated server, you must have strong technical knowledge and be able to troubleshoot any technological difficulties that arise. This might be time-consuming at times. You will also need to employ an expert to address these problems at times. As a result, maintenance expenses will be substantially greater than with shared hosting. Cloud hosting is a server and network architecture that divides a single physical server into several virtual servers using software. These devices are frequently referred to as virtual machines. To suit their daily demands, businesses have begun to migrate to cloud hosting. These servers may be used for a variety of purposes, including web hosting, application development, and remote-accessible desktop work environments. Unlike typical shared hosting, Cloud Hosting allots dedicated resources to each Cloud Server, rather than vying for computing resources among many distinct users' websites and apps. Each Cloud Server is given a partitioned disk with storage space that can only be accessed from inside their own operating instance. Each server is given a set quantity of RAM and CPU cores. In addition to the resources you pay for, your Cloud Server might burst to utilise more resources during off-peak hours. Advantages of Cloud Hosting One of the primary reasons why businesses are shifting to cloud hosting is because it is more cost-effective than on-premise technology. Companies would have to pay money on disks or other storage devices, as well as an IT crew to manage these equipment, with traditional hosting. However, with cloud hosting, you just pay the provider from whom you are purchasing the resources. This saves the firm resources, money, and time. Disadvantages of Cloud Hosting One of the most serious difficulties with Cloud hosting may be security vulnerabilities that may develop if a person without technical understanding attempts to utilise the service. To take use of the service, you will constantly require technical help. Because cloud hosting firms share resources, this might be another source of security concerns. A colocation hosting solution is comparable to dedicated hosting in that it provides several methods to improve your website and its resources. It is safe and dependable, but you will need some technical understanding to get the most out of it. Colocation does not employ the hosting company's servers; instead, you purchase or rent all of your own gear and software and place it in a data centre. Colocation hosting is appropriate for high-traffic websites. Colocation hosting is also appropriate for beginning hosting firms who have not yet built their own data centre. When you choose colocation hosting, you have significantly greater protection than with other types of hosting, as well as total control and flexibility over the hardware and software. Advantages of Colocation Hosting When it comes to network security, colocation hosting is always the best option. This is because data centres contain top-tier network security, such as the most recent firewalls or intrusion detection systems, to identify and block unauthorised network access. Colocation hosting also provides power redundancy through the use of several power grids, diesel generators, double battery backup systems, and good maintenance procedures. It enables you to extend your infrastructure to meet the demands of your company's expansion without incurring capital expenses. Disadvantages of Colocation Hosting Colocation hosting requires a greater initial investment in both hardware and software, as well as upgrades and maintenance in terms of time or resources."
5,5 Most Common Http Errors Explained,computers-technology," This is the most typical error message encountered by online users. This is a generic error that might occur whenever a web server encounters an internal problem. Error 500 is most commonly seen when the web hosting server is overcrowded. You can resolve this error message by refreshing the page, clearing your your browser's cache, removing all of your web browser's cookies, or restarting the web browser. If you get this problem on your website, contact your web hosting provider; if it's a wordpress website, it might be a conflict with one of your third-party plugins. Try deleting these plugins one by one to in the cPanel to verify which is the one that casing the conflict. A 401 unauthorised error is a http status code message that often occurs when a user tries to visit an unauthorised website or after an unsuccessful login attempt to an unauthorised website. The webmaster normally protects these unauthorised websites with a password using cPanel. This error message indicates that something went wrong with your web browser in response to your request. This usually signifies that the data transmitted by the browser does not follow the rules of the http protocol. The server is unable to handle a request with incorrect syntax. This might indicate that the user's internet connection is unreliable, that there is a security vulnerability inside the operating system, that there is a caching issue, or that the browser is malfunctioning. If you try to enter a restricted directory on a web browser, you will encounter this error notice, which indicates that there is no login option on the page. The most typical reason a user would receive this error message is if the website does not allow users to browse the site's file directory structure or if the individual file requested is not allowed to be accessed via the web. You may enable 403 protection on your own site for security purposes by masking the directory structure or files that contain susceptible information. This is a fantastic technique to safeguard your site from being hacked. Although many web servers provide this feature by default, you may add an extra security layer to your site by opening your cPanel account, navigating to the Advanced menu box, and selecting Index Manager. By selecting 'No Indexing' on the directory you desire to protect, you may customise how your users view a certain directory on your website. A 404 not found error message will show whenever a user attempts to visit a non-existent web page. This warning is typically displayed when a user exits the browser, presses the stop button, or clicks on a link too rapidly - however, it may also occur when a file is excessively big or a server is working too slowly. You have most certainly encountered a 404 error when exploring the web. If the server cannot discover anything on the requested location, a 404 message will be shown. This is frequently due to a mistyped URL, but it can also occur when users attempt to access deleted or temporarily inaccessible pages. You should try to decrease the amount of 404s on your website as much as possible because they will almost always boost your bounce rate. It should be observed that the 404 message and the 410 error page are quite similar. While both show that the server was unable to locate the requested file, the 410 implies that this is a permanent condition, implying that the resource was most likely purposely rendered inaccessible."
6,5 Major Advantages of Website Maintenance Services,computers-technology," Cost Savings There is a considerably lower possibility of something major going wrong if you have your business website maintained and updated on a regular basis. Working with an outside agency is frequently extremely cost-effective since it lowers the expense involved with recruiting people. Similarly, you may decrease or eliminate training costs related with staff turnover. Focused on core business One of the most difficult aspects of running a website is managing your time. More often than not, entrepreneurs and company owners just do not have the time to update their websites. Does this sound familiar? Depending on your level of computer knowledge, you may wind up spending more time trying to recall how to perform what you need than it is worth. A skilled web firm can frequently do the same thing in a fraction of the time while also bringing in SEO understanding and best practices. Website Security A web maintenance company is also in charge of doing quarterly security sweeps and upgrades to ensure that your website has not been seized by hostile hackers. The sophistication and expertise of hacker networks has gradually increased. Without regular website maintenance, your website may become vulnerable to any flaws that hackers may exploit. SEO Ranking Advantages Because search engines continually alter their algorithms, the competitive environment is continuously changing. Keeping up with the latest developments in search engine optimisation and maintaining frequent content maintenance enhances search engine ranking. An independent firm can help you measure your success by maintaining blogs, web analytics, and other tools that will help you get the most out of your website investment. Customer Engagement With frequent website maintenance and upkeep, you'll ensure that you're not only keeping your material up to date, but also maximising the full potential of customer client interaction platforms. So, whether it's live chat, forum platforms, or social plugins, staying up to date on the latest technology can help to increase your total customer engagement. In conclusion, professional web maintenance services are extremely required to reduce the chance of a significant disruption to your website and to maintain a website's popularity among its target audience."
7,How De-Packaging Equipment Can Benefit Your Food Waste Business,computers-technology," If you produce, or receive and wish to pre-treat an organic waste such as food waste and are interested in de-packaging equipment, then you are in the right place. In this article, we will discuss how de-packaging equipment can benefit your business. If you are considering investing in de-packaging equipment, you need to consider several factors. In addition to the equipment's performance, it's also important to consider the cost and maintenance. Below are some of the key merits of de-packaging equipment plus we list a selection of manufacturers. Hammermill-based De-packagers The first de-packaging machines were based on the hammermill that is often used in wood-processing operations. This process separates the packaging from the food by smashing it up under that action of the rotating hammers in the mill. Newer models are designed to separate packaging while using minimal force. They use fine adjustments to the angle of small paddles or plates mounted on a rotating shaft. Once separated, the separated packaging is conveyed out of the machine in two output streams. These are the organic fraction or ""pulp"" which has the consistancy of a thick soup, and the reject stream. Paddle Based De-packagers Other models use paddles but these can also berak up the various materials of the packaging very small especially when combined with a shredder. Inevitably this also creates a lot of small plastic pieces known as microplastics. Microplastics are increasingly being recognised as a hazard to the environment, and are also getting into our bodies and are found in human blood. Food-waste De-packaging Machines Large and Small Food-waste de-packaging machines all provide a process that separates organic and inorganic waste from packaging. The types of packaging processed and the rates of generation of this waste vary enormously. Although the manufacturers supply a range of depackager sizes the rate of processing may vary depending on the exact nature of the organic waste.  Despite being available in many types and capacities the manufacturer may suggest configuring their machines with special modifications and many suppliers offer modular systems enabling the addition of further process units for subsequent settlement, for sand and grit removal, and/ or for example a strainer/ dewatering stage. Scott Equipment Company For example, one de-packaging machine, the Scott Equipment Company's model T42 Turbo Separator, can process anywhere from 10 to 30 tons of packaged food waste per hour. It has 56 flat paddles that work together to split, separate, and convey the waste. Organic materials are collected and conveyed to holding areas, while inorganic wastes are pumped into a compactor. These machines use rotating paddles and flails to break open packages. The MEGA-THOR has a capacity of 40 tons per hour. TWISTER De-packagers and Separators These models allow for the separation of organic materials from packaging and Twister has been credited with supplying one of the best de-packaging systems on the market. They are capable of recovering 90% or more of the materials inside the packaging and may satisfy the Swedish inert content standard. They can even separate sticky solids, which are difficult to remove from the packets and wrappers. An optional screw press can dewater the rejected packaging. The best model to choose depends on the size of your project. And be sure to check with the manufacturer for any warranties and technical support. Atritor Turbo Separators The Atritor TS3096 is capable of separating wet and dry materials, handling both wet and dry waste. Avoiding the need to add water can be essential for an efficient waste-to-energy-plant. Customer feedback has attested to the fact that the Atritor they bought enabled the company to expand its vehicle fleet bring in more organic waste and invest in an even bigger de-packaging system. Tiger DePack Machines Designed for efficient and productive operation, Tiger DePack machines are ideal for processing food waste. They are the front-end of the AD process and offer excellent throughput capabilities. Blue Group, the supplier of Tiger Depack machines, has an excellent support network. They are also available from stock in the UK, making it a crucial part of your de-packaging plant's uptime and efficiency. Brask Xtractor An advanced piece of waste-management equipment, the Brask Xtractor depaks packaged liquids. It is good at separating the liquid from the solid materials and is also described as highly durable and maintenance-free. The Dominator The Dominator is credited with being able to handle wet or dry metal tin can products. It can even separate plastic bottles. Mavitec The Mavitec depackaging machine is a horizontal shaft-based machine with paddles and flails mounted on it. The angle of the paddles can be adjusted to accommodate the feedstock. The machine rotates at approximately 800 rpm. The capacity of the Mavitec depackaging machine depends on the complexity of depackaging. This equipment will remove 99.9% of the organic material from the packaging and will be a great benefit to the county."
8,Email Spoofing - What Is It & How to Protect Yourself,computers-technology," Email Spoofing – What Is It & How to Protect Yourself Within days of being hired, a new employee in our accounting department received an email from our CEO asking them to place an order for much needed equipment.  Excited to be part of the team and show responsiveness our new champion almost fell victim to a growing type of cyberattacks. The email seemed appropriate and looked legitimate – we were just a few clicks away from being hacked and compromised by a spoofed email.  This wasn’t the first time we received a suspicious message.  In fact, cybersecurity experts say attacks are up 300% in this past year. What is email spoofing? Email spoofing is a technique used by hackers to trick you into thinking a message came from a person or organization you know or trust – most commonly your CEO or colleague, though often vendors or brands. Can you tell the difference between paypal.com and paypaI.com? Spoofed emails look legitimate – often creating a sense of urgency or need for action.  If pretending to be from someone in your organization, commonly from a person of authority but could be a peer.  If from an external source, even clicking links in them take you to landing pages that look just like the real vendors landing page (branding, logos, layout, etc.) – put next to the real site, they look nearly identical. Email spoofing statistics •	Over 3 billion domain spoofing emails are sent each day •	More than 90% of cyberattacks start with an email message •	43% of cyber attacks target small and medium sized businesses •	69% of hackers say they were never detected by a company’s security measures •	It takes over 6-months on average to detect a breach (they’re in your business for a long time) How to prevent from being spoofed During a recent Cybersecurity Insurance webinar, local experts discussed steps to drastically reduce the risk of being compromised and shared recommended actions to take if you receive a suspicious email.  As Steve Szubinski, president of PCA Technology Group shared, it’s all about layers of protection. Enable Multi-Factor authentication (MFA).  Microsoft 365 includes MFA with the service; however, it is turned off by default.  If you are not sure it has been enabled for your company, contact your trusted IT provider.  According to Microsoft, MFA can block over 99.9 percent of account compromise attacks.  While MFA won’t prevent you from receiving a disguised malicious email, any compromised accounts will be difficult to use. Enable External Email Notification.  When this service is enabled with your Microsoft 365 subscription, a notification banner will appear across the top of any email that originated outside your company.  In the case of our new employee in the accounting department, it would have been obvious that the email did not come from our CEO. Cybersecurity User Awareness Training.  1 out of every 3 people would fall for a spoofing email without regular training.  Effective programs require at minimum annual training.  PCA offers complimentary sessions each month - check our Events page for dates & times.  Tools such as KnowBe4 have proven to reduce the risk to less than 5%. Confirm Requests.  Our attorney partners recommend that you always confirm requests via phone prior to taking any action asked in an email.  Do not follow the instructions in the message, rather use the phone numbers and web address you know for your colleagues, vendors, and customers. If you think an email is suspicious Contact your IT team or your IT service provider, even if the email is urgent or time sensitive.  They will verify if it is legitimate and can even move the email to a “sandbox” where it will not be able to impact your organization.  Fear you already clicked something potentially harmful, turn off your computer and contact IT support. Cyber insurance providers like Lawley Insurance require organizations to have proper protocols in place so employees know what to do if they suspect an attack.  Organizations should have a physical copy of their insurance policy handy along with a physical copy of their incident response plan.  The plans should clearly identify who is responsible for managing an incident and who is responsible for communications – both internal and external communications.  There are legal reasons your company should call a potential threat an incident until it has been verified truly as an attack. Take these straightforward steps to significantly reduce your risk Proactive measures will protect you from costs of business interruptions, data or financial loss, and reputation threats. •	Talk with your IT provider and ensure your layers of cyber security are working for you, •	Ensure all staff at your company attend regular cybersecurity user awareness trainings (consider a service like KnowBe4 for added protection), •	Review your cyber insurance policy with your provider, plus •	Update your Incident Response Plan and prepare your team to follow it when needed. Unsure of your organization’s overall cybersecurity posture, use a Free Cybersecurity Self-Assessment Tool like the one available on PCA's Cybersecurity page or contact our experienced team at info@pcatg.com (by phone at 716.632.5881)."
