,topic,category,content
0,Why It Is Worth Choosing Local SEO Services,computers-technology," People will always seek convenience and they love to shop online. More than that, they want to interact with businesses and seek ultimate experiences. Brands that are not online and don’t have an e-commerce website lose a lot, especially plenty of traffic and potential sales volume. In order to remain competitive in this changing world, it is crucial to improve the online presence, to be always available to customers. How can this be achieved? The key is SEO, and local SEO services have increased in popularity. One of the reasons is because businesses want to rank high in search engine results, and they want to achieve great results, to attract more potential buyers and build their confidence in the brand. Implementing the right marketing strategies has always been challenging, and this is why companies choose to hire specialists, because they know exactly how to come up with the right solutions. Find Out More about Local SEO Services SEO is already a term that many are familiar with. They heard about it, but the idea is still complex, and it involves so many factors that it is hard to keep up with everything. Businesses have a lot of aspects to look into, they need to manage their activity, focus on products and services, train employees, they must develop pricing policies, distribution, delivery, and so much more. It is understandable they are unable to focus on search engine optimization on their own. Instead, they focus on local SEO services. What is SEO exactly? It is an array of practices and strategies used to improve the quality and organic visibility of a website on search engines. Whenever you search something online, you use keywords and two types of results show up, paid ones and organic. Some companies pay for every click on their website, and it is a way to guarantee a top position. On the other hand, organic searches imply improving the website, link building, and many other tactics. It is not enough to place relevant keywords throughout the website, it is necessary to adjust the website, its functionality, speed, the content shown on every page, if it is mobile-friendly, interactive, and more. Optimization is about improving the site and pleasing the customers, but it also implies taking into consideration the guidelines and algorithms of search engines. Eventually, you will get to know more about your customers and what they are looking for. Benefits of SEO There are many benefits of local SEO services and the best part is that they are accessible to anyone interested. Some companies believe they have to hire a team to work within the department, to open positions, pay salaries, benefits, and invest in training. It is not the case, because these services can be outsourced without issues. It is even recommended, because it is cost-effective, and provides long-term value. More than that, you have better control over the services, since you know exactly what you pay for, the specialists are already trained in the field, they are highly skilled, and know everything about optimization. You simply hand over the website, they will conduct an audit, suggest appropriate tactics, improvements that can be made, and eventually help you develop a strategy plan to improve your online business. Increase relevant traffic It is one thing to have plenty of traffic on the website, and another thing to have relevant traffic. When people need something, they type keywords, and once your website pops up, it means they trust it, they will browse through it, until they find what they want. Prospect buyers evaluate the functionality and speed of the platform, and if they like what they see, they will eventually buy. The click-through rate is essential, and once you are on top positions, you can double it. If you want your site to be seen by customers, then it needs to rank high in search engine results. Think about your behavior as well, and how often you visit the next pages of results, how much do you trust those platforms, and how likely you are to buy from them. Improve the web experience Local SEO services will let you know that the web experience matters greatly to visitors and prospective buyers. So, you made it on top positions, people click on the site, but they don’t like what they see. They don’t enjoy the interface, they don’t find the website user-friendly, and they abandon it, going to the next result. The success of your online business depends on many other factors, such as backlinks, page speed, content, interactivity, and such. If you follow the rules of search engines, then you need to keep the site in good health. This way, you obtain more exposure, and users will trust you more, believing that you do something right since you manage to be in top positions. Local SEO Services Improve Brand Awareness Perhaps you have some amazing products and services, and you want to show the world your portfolio. If people see you in top positions, then they will trust the brand more, because they think you deserve to be there, and your products and services are relevant. It takes some time and effort to achieve this, but it can be done. There is no pressure to do it on your own, especially when you can outsource the services and achieve great results. SEO is traceable, and you can collaborate with an agency that will show you their step-by-step plan, and give you feedback after every process. This is the best way to know that you are doing the right thing to develop your business, the fact that you see the progress. An agency has years of experience in the field, it is fully aware of all changing algorithms, and it works close with businesses from all industries, which means it knows very well what works for each. The key is to find the right agency, one that has positive ratings, successful stories, and an impressive portfolio of services. If they conduct site audits first, then even better."
1,How Businesses Can Benefit from Website Content Writing Services,computers-technology," Online businesses have many more opportunities at their disposal to advertise their services and products, and especially to interact with consumers on various channels. On the other hand, the pressure is high as well, and the competition is fierce, and brands need to come up with ways to keep users engaged. Website content writing services make sure you have quality content throughout all communication channels. Perhaps many don’t think about these types of services when they want to promote their businesses online, but they are essential and any experienced SEO agency will tell you the same thing. In fact, specialists working within the field have a dedicated team of writers that manage solely this aspect. This way, others can focus on other tactics, and everyone will help your business boost its online presence and attract more relevant traffic. What Are Website Content Writing Services Creating content regularly takes a lot of time and effort, and not all businesses have a dedicated team that can take on the job. Not to mention there are some structures and keywords involved, and not everyone can simply write articles, blog posts, content on websites, social media, and such. The good news is that website content writing services exist, and those specialized in the field will take care of every aspect, posting content regularly on various sources. One major advantage is connecting with the target audience. Only a few blog posts now and then will not make a lot of difference, because it takes regular posting to attract prospective buyers. Through it, they will have more trust in your brand, and they will help generate more sales. Business owners have a lot on their minds, and they need to worry of business processes, sales, figures, employees, and such. They are not able to manage the content writing aspect, which is why they decide to outsource everything. This means finding a high-quality provider that offers complete digital marketing services, making it possible to optimize your website, rank high in search engine results, and improve brand visibility. Afterwards, plenty of traffic will be generated, and you need to engage with your potential buyers. Rank High on Search Engines This is the dream of many online businesses, to improve their organic rankings, and have a good position on the first pages of search results. However, this is a long process. It takes much effort and plenty of knowledge and skills. it is not impossible to achieve, but it is particularly easier for someone that already have experience in this field, and can provide direct services, without having to learn everything from the basics. Search engines are very complex and have many algorithms. It is often difficult to keep up with everything, but not for someone that does it on a regular basis. Having consistent and unique content definitely improves ranking, especially if it features relevant keywords, topics, and backlinks. Once you collaborate with marketing and SEO agencies, you obtain these great services. Focus on existing content Website content writing services don’t focus on new content, but also optimizing the existing one. Considering that search engine algorithms change constantly, online businesses have outdated content on their platforms, and these eventually affects the rankings. The negative impact on the business is obvious, and soon enough, they find out they don’t have a top position in search results. Agencies that provide website content writing services have a team of SEO professionals that work there, and can take in plenty of tasks, write relevant content for businesses in all fields. On top of that, they have additional optimizing services, including website audit, and link building, to help your business grow online, and attract as many potential buyers as possible. Conversion rate Perhaps you believe anyone can write some content, that they can copy paste data on blogs and websites, but it is not the case. Website content writing services are professional, and they help improve the conversion rate. This is because they focus on persuasive content, with call to action to convert users into leads. Every business wants this, to convert a user into a buyer, and there are some ways to succeed this. The main idea is to attract viewers, to engage them into reading the content on the website, and then invite them on your website, to discover what you have to offer. The landing page is crucial and it should be highlighted throughout the article. A marketing agency will make sure this happens, because it has all the necessary knowledge and skills to assure this. How to Locate the Right Agencies When it comes to putting your business into someone else’s hands, it is not an easy task, and this is what many business owners face. Some believe it is better to hire dedicated personnel, but it is not the case, because not everyone is experienced in digital marketing, and you still need to train them. It will take some time until they are prepared to take over challenging tasks. Perhaps this is a luxury that you cannot afford, and you want everything to happen as soon as possible. Instead, outsourcing services makes more sense. From the minute you sign the contract with the agency, you benefit from their level of expertise, team of specialists, and they will take over the website, analyze it, propose improvements, and focus on other strategies to boost your online presence and grow the business. You don’t have to wait around too much until you see results, and you pay for the desired packages, which means you have better control over costs. Websites that have blog posts and relevant content are better seen by viewers, they have more trust in them, because they get to know more about the business, and about what represents it better. A website that has no quality content, no relevant pictures, does not load fast, and has many bugs, will not be perceived very well by potential buyers, and they will close the pages to look somewhere else for what they seek."
2,A SEO London Agency that Handles Digital Marketing,computers-technology," The online world is the key to the success of a company, but there are quite a few twists and turns along the way. People who want to get the best returns on the resources they invest in the online activity must know how to set their goals and how to achieve them. The best option they have at hand for this purpose is to work with a SEO London agency with knowledge and experience. The First Steps Are not the Only Steps A lot of people are used to investing a certain effort into something and reaping the benefits of their labor at the end. The online world is not the same and there is a lot of work that goes into any online activity. It is important to build a solid website that will represent the interests of the company, but the work is not over when the site is launched. This is just the starting point for it. There are quite a few things that must be done once the site is up and running. First it must be made more popular over the web and the best way to do that is by optimizing it for search engine algorithms. Once it has reached a certain level, it will be a constant struggle to stay at the top. It is not easy to achieve success over the web and it is important to use every bit of help available. Use the Right Methods at the Right Time How can companies make their sites more popular? Popularity over the web will consist of how many people visit the site. The more visitors it will have, the more exposure it will get and the easier it will be to achieve the success the site deserves. Making the right choice is not easy when the knowledge of how the online world works is not as well developed as it should be. When a site is starting out and the main goal is to have as many visitors as possible, pay per click methods can be a solution. This is a solution because it will help search engines see that the site is visited, but this will only happen as long as there is a budget for it. If the funding stops, the clicks will no longer be available and thus the popularity of the company site will also plummet. Even if pay per click is useful at the start, an organic method must be used at the same time. Link building strategies will provide a long lasting solution to improve the popularity of a site. This implies publishing new and original content over the web with links that trace back to the site of the company. This is the best way to achieve success over the web that will last for a long time. Setting Goals with the Help of a SEO London Marketing Agency Investing resources in online marketing is the most important move any company can make, but it is important to set the right goals. Attracting visitors to the site is the first goal that will have to be achieved, but this must lead to other results as well. A SEO London marketing agency can help companies realize how the web can help their activity and what they need to do for it. Brands are the building blocks that create success and a company must use all the tools it has at hand to build a brand that people can trust. A SEO London agency can offer the guidance needed to create a brand that people can trust. Search engines can help, but the main channel they are going to use for this is social media because this is where people express their opinions and trust. Even if two main online marketing goals are achieved, this does not mean the work is done. Any business relies on sales to generate income and profit, but the number of visitors and the brand name does not guarantee this. They are going to help, but the ultimate goal is to convert visitors into paying customers and a SEO London marketing agency is going to provide the solutions. Online Success will Pave the Road to Real Results Boosting sales and the company income is going to make the activity a lot more profitable and this is the goal any business strives for. The financial benefits open the door for investments and the growth of the business in many other areas. It is important to take it one step at a time and choose the right path for the company to ensure its success, but this requires help and support. Working with experts in the field is going to make things a lot easier. This happens because they are going to offer guidance so companies can set the right goals in terms of online marketing, they will help businesses analyze the progress they have made and how to manage it properly. It is easier to reap the benefits of all the hard work invested in the company with the right help. Outsourcing – a Cost Efficient Solution for Achieving Goals Keeping a full time team on the payroll to handle digital marketing is viable for big companies, but outsourcing is better for small enterprises that are just starting out. This happens because the companies can benefit from the experience of an entire team of experts. These guys will put in the time and the effort to be sure their clients will succeed and all their goals will be achieved. People can use the web to explore the market for the best SEO London marketing agency. This is where they will find a lot of options they can turn to and they can learn more about the activity of the experts. The more they learn, the surer they will be about the help they can provide for the success of the company and the areas they will be able to cover from start to finish."
3,The Difference Between Biomethane and Biogas,computers-technology," What is the difference between biomethane and biogas? That's a good question and one that is more and more often being asked. So, let's dive in and answer that question. Both are renewable gas derivatives that are produced from the fermentation of discarded organic materials during the anaerobic digestion process. Biogas is produced where anaerobic digestion occurs naturally in landfills and from digesters which are used to reduce the volume of the sludge produced during aerobic sewage treatment. We explain why biogas products cause the emission of fewer greenhouse gas than others. Biomethane is nothing other than biogas which has been purified in a way which removes the impurities (mostly carbon dioxide and water vapour) in the raw biogas output from the digester tank. In fact, biomethane is usually synonymous with ""natural gas"" because it is pressurised and given a calorific value almost identical to natural gas. The only real difference is that natural gas is a fossil fuel and causes climate-changing carbon emissions when it is burnt while in large, in the bigger scheme of things over a 3 to 5-year timescale, biomethane is not. Biomethane is a renewable fuel and can be made in truly sustainable ways. Because biogas and natural gas have the same methane molecule, it can be used in LNG engines among others. Biogas is regarded as being clean during combustion, but LNG is better because it is made up of 99.9% methane and is created from organic waste. Biomethane and its main source which is ""biogas"" are destined to become big players as key components of the energy transition. The energy transition is a pragmatic strategy to move toward reduced greenhouse gas emissions and diversifying energy matrices as soon as possible while using technology already proven to work. Although today, biomethane accounts for only a fraction of natural gas demand, this will grow as more biogas plants are built and commissioned. Generally, in most nations, biomethane suppliers provide biogas at rates below 10% of the available natural gas supply. Nevertheless, this percentage is rising fast. The difference between biogas and biomethane is that the former is produced through the fermentation of biomass, and the latter is the end product after upgrading. The anaerobic decomposition and fermentation of organic matter to produce methane gas is a natural process that has existed for millions of years, before the emergence of fossil fuels. It is nature's way of recycling waste alongside aerobic decomposition. The first human use of biogas dates to at least 3,000 BC, when the Assyrians burned it for baths. Biogas is a renewable fuel that can be used for a variety of purposes, including generating electricity, and heat, and when it has been cleaned-up  as a low air-pollution transport fuel. In the United States, biogas is mainly extracted from where it is produced in landfills, and from the anaerobic treatment of livestock manure on livestock farms. About 90% of biogas produced in the US comes from landfills unti;l 2020. In the United States, however, biomethane is also produced from agricultural waste from large farms. In fact, livestock carbon emissions account for one-third of the US nation's methane emissions. Due to state and federal support, the United States is the global leader in the use of biomethane for transport. Biomethane is an energy-rich gas that is created during the anaerobic decomposition of organic matter. It is composed primarily of methane and carbon dioxide. In its raw form, biogas may contain between forty and sixty percent methane and only small amounts of water vapour and other gases. After undergoing refinement, biogas can be used as a substitute for conventional natural gas. While biogas and biomethane have similar qualities, there are some differences between them. Biogas generally contains more hydrogen than biomethane but because of the other impurities present, it is not usually seen as being compatible with conventional fuels. Biogas has the same methane molecule as natural gas, so it can be used in LNG engines. Because it is 99.9% methane, biogas is considered cleaner than LNG and is produced from organic matter. Biogas also emits fewer greenhouse gases. In addition to being the raw material for producing biomethane, biogas also has some benefits. But biomethane wins out as experience in biomethane plant ownership it can help prevent emissions throughout the value chain. Biogas is produced naturally in an atmosphere-controlled environment. In addition to reducing fossil fuel use, biomethane also produces biofertiliser, which returns organic carbon back to the soil. That process also helps reduce the need for mineral fertilisers. These are all positive steps in a sustainable energy supply chain. The use of organic materials in biomethane production improves hygienic conditions in rural areas. The process also decreases the risk of watercourse pollution. Biogas and biomethane contributes to the economy of rural communities and preserves nature. There are many similarities between biogas and biomethane, and a better understanding of their different roles will help you make a decision on the best option for your needs. A common biogas upgrade involves the use of a scrubber. It captures the biogas produced by anaerobic digestion and removes the hydrogen sulfide (H2S) present in it. By injecting air into the scrubber tank, the bacteria oxidise the H2S compound further and convert it to elemental sulfur. Some common methods of removing hydrogen sulphide (H2S) from biogas include introducing some air/oxygen to the digester biogas which is added using lagoon aerators and adding iron chloride to the feed slurry."
