,topic,category,content
115,Over 50% of global population suffers from headaches: Study,science,"According to research, 52% of the global population is affected by headache disorder every year with 14% of them reporting migraine. As per research, headaches, especially migraines were more common in females (17%) than males (8.6%). Headaches that last for 15 or more days per month were seen in 6% of females as compared to 2.9% of males.
"
116,Magic mushrooms could be an alternative to depression treatments: Study,science,"The psychedelic compound found in magic mushrooms could be an alternative to depression treatments, a study stated. ""Psilocybin works differently from conventional antidepressants - making the brain more flexible and fluid, and less entrenched in the negative thinking patterns associated with depression,"" a researcher said. It helps to open up people's brains that can become rigid in depression."
117,Heart inflammation after taking COVID-19 vaccination rare: Lancet study,science,"The overall risk of developing myopericarditis (inflammation of the heart muscle) after taking COVID-19 vaccination is very low, a Lancet study has found. The risk of developing the condition was higher for people who received mRNA vaccines with 22.6 cases per million doses than for those who took non-mRNA vaccines with 7.9 cases per million doses, the researchers said.
"
118,One HPV vaccine dose prevents cervical cancer: WHO,science,"A single dose of the Human Papillomavirus (HPV) vaccine prevents cervical cancer, a group of experts from the World Health Organisation (WHO) said. Presently, two or three doses of the vaccine are recommended, but the WHO experts said findings showed that only one dose is as effective. ""Seeing more doses of the life-saving jab reach more girls,"" they said."
119,India's 1st indigenous Polycentric Prosthetic Knee made: IIT M,science,"IIT Madras researchers launched India's ""first"" indigenously made Polycentric Prosthetic Knee, 'Kadam'. It'll help above-knee amputees to walk with a comfortable gait. It's designed with high strength stainless steel and aluminium alloy along with hard chrome plated EN8 pins and high fatigue life polymer bushings. The Society for Biomedical Technology and Mobility India supported the development. "
120,1st all private crew to ISS carries US hospital mascot soft toy,science,"The first all private crew to the space station, launched by SpaceX, carried a plush toy of 'Caramel', the mascot for the Montreal Children's Hospital Foundation, as its zero-g indicator. The crew selected Caramel as their indicator in part because of the mission's connection to the hospital. Caramel was earlier briefly mistaken for Disney's rabbit Thumper from Bambi."
121,Russia to launch lunar probe with Belarus this year: Putin,science,"Russian President Vladimir Putin has said Russia will launch a space probe with Belarus later this year and deepen cooperation on space infrastructure and technology. Russia will launch a probe called Luna-25 to the Moon in the third quarter of this year, he said. Putin has also asked Russia's Roscosmos to train a Belarusian for flight on a Russian spacecraft.

"
122,"Researchers identify over 5,500 new RNA viruses in the ocean",science,"Researchers have identified at least 5,500 new RNA virus species from 35,000 water samples from oceans across the globe. With this discovery, scientists have doubled the number of known RNA virus phyla from five to 10 to capture the diversity of the new findings. RNA viruses are known to cause several diseases in humans ranging from common flu to COVID-19."
123,US space firm shares lounge capsule design to be lifted via giant balloon,science,"US-based Space Perspective has shared its design for a tourist lounge capsule that comes with 360-degree panoramic windows and will rise to the edge of space. It shared the interior of Spaceship Neptune, a pressurised capsule that will cruise high above Earth, lifted via a giant balloon. The lounge will have mood lighting, reclining chairs and plants, among other things."
124,Insomnia could increase the risk of type 2 diabetes: Study,science,"According to a study, people with insomnia are at an increased risk of developing type 2 diabetes. Insomnia symptoms cause higher Hemoglobin A1C levels, indicating it plays a causal role in the condition. ""Eating healthy balanced diet, being active, along with getting enough sleep, are all essential for...those at risk of, or living with, type 2 diabetes,"" a researcher said."
125,NASA to resume crucial Artemis 1 Moon mission's 'wet dress rehearsal',science,"NASA will be resuming its 'wet dress rehearsal' for Artemis 1 Moon mission today. It began the rehearsal, a practice run of the most important prelaunch activities, last Friday. However, the attempt was suspended after a valve issue surfaced during tanking. The rehearsal includes a full countdown, loading the rocket's tanks with supercold propellant and draining the rocket tanks."
126,Unexpected changes seen in Neptune's temperatures over 17 yrs,science,"An international team of astronomers, who tracked Neptune's atmospheric temperatures over a 17-year period, found a ""surprising"" drop in Neptune's global temperatures followed by ""dramatic"" warming at its south pole, the ESO reported. Astronomers do not know yet what could have caused the ""unexpected"" variations. The globally averaged temperature of Neptune dropped by 8°C between 2003 and 2018."
127,Bacteria generate electricity from methane: Research,science,"It's possible to make methane-consuming bacteria, Candidatus Methanoperedens, generate electricity, researchers said. In order to generate power, a researcher said, ""We create a...battery with two terminals...one is a biological...other is a chemical terminal."" She added, ""We grow the bacteria on one...electrode, to which the bacteria donate electrons resulting from the conversion of methane."""
128,Liquorice may help with cancer treatment: Study,science,"Liquorice, a popular candy, may help in preventing and treating certain types of cancers, a study stated. Researchers have found that a substance, glycyrrhizin, derived from the liquorice plant, Glycyrrhiza glabra has great anti-inflammatory and anti-cancer properties. They are studying liquorice further to determine if it could be used to prevent or stop the growth of prostate cancer."
129,Earliest evidence of Maya calendar use found inside Guatemalan pyramid,science,"A glyph representing one of the Mayan calendar's 260 days, called '7 Deer', on mural fragments dating from the third century BC has been found inside the ruins of a pyramid in Guatemala. It represents the earliest-known use of the calendar. Until now, the earliest definitive Maya calendar notation dated to the first century BC.

"
130,Exercise can lower risk of getting bowel cancer: Research,science,"According to research, exercising multiple times a week over an extended period of time can reduce the risk of developing bowel cancer. Cancer-fighting substances such as IL-6 are released into the bloodstream when a person exercises regularly, a researcher said. These substances interact with abnormal cells, repairing their DNA and reducing the growth of cancer, he added."
131,Anti-vaccination beliefs linked to negative childhood experiences: Study,science,"Anti-vaccination beliefs are more common among people who have had negative experiences during childhood, a study has found. The research that involved 1,037 participants compared childhood histories of anti-vaxxers to those who support vaccination. It was found that the majority of anti-vaxxers faced adverse childhood experiences such as abuse, maltreatment, having an alcoholic parent, etc."
132,Largest annual rise of atmospheric methane seen since 1983: NOAA,science,"Scientists observed the largest annual increase of atmospheric methane in 2021 since systematic measurements began in 1983, NOAA said. The increase last year was 17 parts per billion (ppb). Atmospheric methane levels averaged around 162% greater than pre-industrial levels in 2021. Scientists estimate global methane emissions in 2021 were 15% higher than in the 1984-2006 period. "
133,First audio recordings on Mars reveal 2 speeds of sound; NASA shares clip,science,"The first study of recordings from NASA's Perseverance Mars Rover has shown that the speed of sound is slower on Mars than on Earth, NASA said. It also revealed that sound travels at different speeds for low-pitched and high-pitched noises. ""The two sound speeds are an effect of the thin CO2 atmosphere,"" NASA tweeted, sharing the audio clip. "
134,Microplastics found in live human lungs for the first time,science,"Scientists have discovered microplastics in live human lungs for the first time. Researchers from the University of Hull and Hull York Medical School found 39 microplastics in 11 of the 13 lung tissue samples tested. Of the microplastics detected, there were 12 types, which are commonly found in packaging, bottles, clothing, rope/twine, and many manufacturing processes. "
135,What is known about the new COVID-19 variant 'XE' that WHO has warned against?,science,"WHO has issued a warning against the 'XE' variant of COVID-19, which is a hybrid of two sublineages of the Omicron variant- BA.1 and BA.2. First detected in the UK on January 19, the 'XE' variant's rate of infection has been found in preliminary studies to be 10% higher than that of BA.2 (considered most contagious till now), WHO said. "
136,Indian startup Pixxel launches its first satellite to space with Musk's SpaceX,science,"Indian space tech startup Pixxel has launched its first satellite to space aboard billionaire Elon Musk-led SpaceX's Transporter-4 mission from Cape Canaveral, US. Called 'Shakuntala', it is the startup's first fully-fledged satellite and hosts one of the highest resolution hyperspectral commercial cameras ever flown to space, Pixxel said. The startup is aiming to build a health monitor for Earth."
137,"Mysterious lights spotted in sky in Maharashtra, MP, Gujarat; pics go viral",science,"People in Maharashtra, Madhya Pradesh and Gujarat witnessed mysterious trail of lights in the sky on Saturday. Astronomer Jonathan McDowell referred to the event seen over the states as a possible ""re-entry of a Chinese rocket stage"" that was launched in February 2021. Several experts also speculated that event could be a ""meteor shower""."
138,Over 12 maggots removed from man's eye in France; pic surfaces,science,"Doctors in France reported a rare case of tiny sheep bot fly larvae, also known as maggots, infesting the outer surface of a man's eyeball. Doctors removed more than a dozen maggots from outside the eyeball and surrounding tissue, according to the report in The New England Journal of Medicine. Doctors had to pluck the maggots out using forceps."
139,Mt Everest like you've never seen it before: NASA on pic of Earth's highest mountain,science,"NASA shared a picture of Mt Everest and wrote, ""Mt Everest like you've never seen it before."" ""The highest mountain on Earth takes on a different perspective from...vantage point of space. An astronaut aboard the International Space Station...took this near-nadir (almost straight down) photograph of Mount Everest, which towers approximately 29,029 feet (8,848 metres) above sea-level,"" wrote NASA."
140,Scientists to send pic depicting naked man & woman to space for aliens,science,"Scientists have developed a binary-coded new message, which includes a representation of naked man and woman, that will be beamed to aliens that might exist in the Milky Way. ""The proposed message includes basic mathematical and physical concepts...The message concludes with digitised images of the human form, along with an invitation for any receiving intelligences to respond,"" they said."
141,Mushrooms can talk to each other and recognise up to 50 words: Research,science,"Mushrooms can talk to each other and recognise up to 50 words, according to a research. The study of the electrical activity of four species of fungi found electrical impulses were structurally similar to human speech and resembled vocabulary of dozens of words. The research was conducted by professor Andrew Adamatzky from University of the West of England."
142,Earth likely to be hit by geomagnetic storm today and tomorrow,science,"Earth is expected to be hit by a geomagnetic storm on Wednesday and Thursday, as per a forecast by Space Weather Prediction Center of National Oceanic and Atmospheric Administration (NOAA). However, it'll be a minor one, NOAA said, categorising it as G1. NOAA said a coronal mass ejection from an approximately 25-degree-long filament lifted off the Sun on March 3. "
143,"SpaceX, NASA delay launch of 1st private astronaut mission to ISS",science,"SpaceX, NASA have delayed the launch of the 1st all-private mission to the International Space Station, Axiom Space's Ax-1 astronaut mission, to April 8. The mission will fly four civilians, including former NASA astronaut Michael López-Alegría, for a 10-day mission to the space station. The crew will ride atop a Falcon 9 rocket by Elon Musk's SpaceX.

"
144,Russian astronauts were blindsided by yellow suits issue: NASA's Vande Hei,science,"NASA astronaut Mark Vande Hei has said the Russian cosmonauts who arrived at the space station last month wearing colours of the Ukrainian flag were paying tribute to their university which has blue and yellow in its emblem. He added the astronauts were ""blindsided"" by the controversy over their spacesuits' colour. Vande Hei spent 355 consecutive days in Earth orbit.


"
145,UN Human Rights Council names Tuvalu negotiator as climate expert,science,UN Human Rights Council on Friday appointed Tuvalu negotiator Ian Fry an expert on climate change and human rights for first time on Friday. The new independent expert is required to study and identify how the adverse effects of climate change affect the full and effective enjoyment of human rights. Fry has been appointed for a period of three years.
146,US agency confirms damage to 112 million years old dinosaur tracks,science,"US' Bureau of Land Management has confirmed minor damages to the dinosaur tracks at Utah's Mill Canyon, which is about 112 million years old, due to machinery used for construction work there. This comes after a palaeontological assessment of the tracks. The agency said that it will follow the assessment's recommendations, seek public input and work with the palaeontology community."
147,99% of world’s population now breathes polluted air: WHO,science,"Almost the entire global population is breathing polluted air, the World Health Organization (WHO) warned on Monday. The WHO data revealed that 99% of people in the world are inhaling unhealthy levels of fine particulate matter and nitrogen dioxide (NO2) that threaten their health. People living in low and middle-income countries have been suffering the highest exposures, the data stated."
148,NASA conducts last major test before Moon mission launch,science,"NASA has started conducting the ""last major test"" before the launch of its upcoming Moon mission. It's having a ""wet dress rehearsal"" for its Space Launch System rocket. It's designed to launch NASA's new crew capsule called Orion, which will carry future astronauts to Moon. It'll launch Orion, without any crew inside, on a four-to six-week-long mission around the Moon."
149,Didn't take Russia's space chief's tweets seriously: NASA astronaut,science,"NASA astronaut Vande Hei in response to Russian space agency chief Dmitry Rogozin's previous comments on US-Russia cooperation in space, said, ""I never perceived those tweets as anything to take seriously. I just had too much confidence in our cooperation to date."" Vande Hei said that he trusted his Russian colleagues, adding, ""We supported each other throughout everything."""
150,Rare ancient cemetery of flying reptiles found in Chile: Scientists,science,"Scientists have unearthed a rare cemetery of ancient flying reptiles that roamed the Atacama desert in Chile more than 100 million years ago. The well-preserved remains belong to pterosaurs that had a long wingspan. ""Most pterosaur bones that are found are...broken. Nevertheless, we were able to recover preserved three-dimensional bones,"" Chile Museum of National History's David Rubilar said."
151,Even remote areas of Arctic found littered with plastic waste: Research,science,"High concentrations of waste plastics have been found on seafloor, rivers and remote snow-clad areas in the Arctic, scientists said. According to the researchers, large quantities of plastic waste and microplastics are being transported to the continent through oceans, rivers, shipping and air. This plastic may impact the ecosystem directly and exacerbate climate crisis in the Arctic, they added."
152,Smoking during pregnancy may not cause ADHD in children: Study,science,"A systematic review and meta-analysis of 46 prior studies showed though smoking during pregnancy is associated with offspring attention-deficit/hyperactivity disorder (ADHD) it's unlikely to cause it. ""Our...review shows...there's no causal effect between maternal prenatal smoking and offspring ADHD diagnosis. However, pregnant women should still...not...smoke,"" the lead author of the study said."
153,Planet 9 times bigger than Jupiter found forming unconventionally,science,"NASA's Hubble telescope has spotted a gigantic Jupiter-like planet forming in an ""unconventional way"". The discovery supports a long-debated theory for how planets like Jupiter form, called ""disk instability"", NASA said. Sharing the images taken by Hubble, NASA said the planet, called AB Aurigae b, is probably about nine times bigger than Jupiter."
154,Cooperation in Space possible only after removal of sanctions: Russia,science,"Roscosmos Director General Dmitry Rogozin on Saturday said restoration of normal relations between the partners at the International Space Station (ISS) and other projects would be possible only once Western sanctions against Moscow are lifted. He added that plans to end cooperation over ISS with space agencies of US, Canada, EU and Japan will soon be reported to Russian authorities."
155,Bird population in tropical forests drops by 90% in 40 years: Study,science,"According to research, the number of birds living in tropical forests declined by up to 90% in the last 40 years. Researchers recorded a decline in the number of 40 species amounting to 70% of the total bird population. Moreover, 35 species declined to at least half of their initial numbers. Only the hummingbird and puffbird populations saw a rise."
156,UN climate science panel to focus on cutting greenhouse gas emissions,science,"UN's Intergovernmental Panel on Climate Change (IPCC) on Monday said its final report will focus on ways of curbing greenhouse gas emissions. While report is published, it will only be released after 195 governments will ratify the its findings as well as its summary. Experts warned this consensual nature of the report could diverge from the most dramatic warnings."
157,"Fish can perform addition and subtraction, finds study",science,"Cichlid and stingray fish species can perform simple calculations in numbers ranging from one to five, a study stated. Researchers trained them to perform simple additions and subtractions by increasing or decreasing an initial value by one. They can also be trained to detect smaller quantities without counting. It's, however, not known what these fish need their mathematical abilities for. "
158,Ozone may be weakening one of Earth's vital cooling mechanisms: Study,science,A group of international researchers warned ozone may be weakening one of Earth's most important cooling mechanisms. The study revealed that ozone levels in upper and lower atmosphere were responsible for almost a third of the warming in the Southern Ocean. Team used models to simulate changes in ozone levels in the upper and lower atmosphere between 1955 and 2000.
159,New cell discovered in human lungs that may treat respiratory disease ,science,"Scientists discovered a new type of cell named respiratory airway secretory cells (RASCs) in human lungs that could help in treating chronic obstructive pulmonary disease (COPD). These cells have a regenerative ability that could replenish other cells implicated in COPD, which facilitate normal functioning of alveoli. RASCs are found in tiny airway branches near alveoli air sacs in the lungs."
160,"First complete, gapless human genome sequence published",science,"The Telomere-to-Telomere consortium of scientists has published the first complete, gapless sequence of a human genome. This comes two decades after Human Genome Project produced the first draft human genome sequence. Scientists say that having a complete sequence of the roughly 3 billion bases (or 'letters') in our DNA will help them understand all the functional nuances of human genome."
161,"What is aphasia, the brain disorder actor Bruce Willis suffers from?",science,"Veteran actor Bruce Willis has retired from acting after being diagnosed with aphasia. Aphasia is a disorder that results from damage to portions of the brain that are responsible for language. The disorder impairs the expression and understanding of language, as well as reading and writing. It can be caused by dementia, infections, strokes, head injuries and brain tumours."
162,"US, Russian astronauts return to Earth in same capsule amid Ukraine war",science,"Two Russian cosmonauts and one US astronaut returned to Earth on March 30 from the International Space Station, aboard the same capsule, amid the Ukraine war. The flight, which landed safely in Kazakhstan, carried NASA's Mark Vande Hei and Russia's Anton Shkaplerov and Pyotr Dubrov. Hei has set a new US record by spending 355 consecutive days in Earth orbit. "
163,"IIT Delhi startup makes fabric that can destroy 99.9% bacteria, virus in 30 mins",science,"Fabiosys Innovations, a deep-tech healthcare startup incubated at IIT Delhi, has developed a medical textile that can destroy 99.9% of bacteria and viruses within 30 minutes. The startup claims that the fabric, developed using a technology called Hi-PAT, is ""extremely affordable"". Its affordability is due to the technology behind it rather than cheap labour cost, the Founder of Fabiosys said."
164,Researchers discover RNA switching 'on' and 'off'; show how it happens in a video,science,"Researchers in the US discovered one part of RNA invades and displaces another part of the same RNA, enabling it to rapidly change shape. Called ""strand displacement,"" it appears to switch genetic expression from 'on' to 'off'. A simulation showed RNA as it binds to a compound, communicates along its length and folds to turn a gene ""on"" or ""off""."
165,"What is 'celiac disease', the immune disorder Harnaaz Sandhu is suffering from?",science,"Celiac disease, which Miss Universe 2021 Harnaaz Sandhu is suffering from, is a chronic digestive and immune disorder that damages small intestine and is triggered by eating foods containing gluten. Its symptoms include diarrhoea, fatigue, weight loss, bloating, gas, abdominal pain, nausea. While there's no cure for it, patients can prevent long-term complications by consuming gluten-free diet."
166,Pic taken from Earth shows 2 astronauts spacewalking outside ISS,science,"An astrophotographer captured what he called a ""once in a lifetime"" photograph of NASA astronaut Raja Chari and European Space Agency astronaut Matthias Maurer's spacewalk outside the International Space Station. The picture was taken on March 23 by Dr Sebastian Voltmer and was captured ""after sunset in the bright evening sky over Germany"", Voltmer said."
167,"NASA spots farthest star ever seen, shares pic",science,"NASA's Hubble Space Telescope has spotted the farthest star ever seen. The telescope detected the light of the star, named Earendel, that existed within the first billion years after the universe's birth in the big bang, NASA said. The newly detected star is so far away that its light has taken 12.9 billion years to reach Earth, it added."
168,Hyd to have South Asia's largest bio-research facility: Minister,science,"Union Minister for Culture and Tourism G Kishan Reddy on Tuesday said that South Asia's biggest and most technologically advanced medical research facility will be inaugurated on April 2 in Hyderabad. It is the first such institute to be set up in the country for basic and applied biomedical research, exclusively for animal-related research, Reddy further said.
"
169,"Blue Origin makes 4th manned spaceflight, lands crew after 10 minutes",science,"Jeff Bezos-led Blue Origin successfully completed its fourth manned mission, with six crew members, to space on Thursday. The crew was landed safely back on Earth 10 minutes after the launch in the US. Earlier, comedian Pete Davidson had been confirmed as a non-paying promotional guest on the six-member flight, but he dropped out later."
170,UN's final talks on global biodiversity framework remain inconclusive,science,"UN's final talks on global biodiversity framework came to an end inconclusively in Geneva, Switzerland on Tuesday. Nearly 1,000 negotiators from 164 countries failed to secure an agreement over an international pact aimed at halting or reversing nature loss. UN proposal aims to safeguard nature and protect vulnerable species with a target of conserving 30% of countries' territory by 2030."
