,topic,category,content
228,Smokes from wildfires can destroy Earth's ozone layer: Study,science,"Canadian study stated that smokes from wildfires can destroy Earth's ozone layer. In its observations on Australian wildfires, lead author Peter Bernath said fires injected acidic smoke particles into stratosphere which converted ozone-regulating compounds into more reactive compounds that destroy ozone. Team used data from Canadian Space Agency's Atmospheric Chemistry Experiment (ACE) satellite."
229,"China aims to boost renewable power, natural gas output by 2025",science,"China's National Development and Reform Commission on Tuesday said government aims to increase renewable power and natural gas production by 2025. As per commission, China will maintain annual crude oil output at 200 million tonnes and ramp up natural gas output to over 230 billion cubic metres. Beijing would also encourage developing ethanol, biodiesel and bio-jet fuel, the commission added. "
230,EU set to delay sustainable farming plans amid Russia-Ukraine war,science,"European Commission (EC) is set to delay the publication of proposals on sustainable farming amid the war between Russia and Ukraine. This comes as EC was due to have put forth two proposals on binding targets to restore nature and a new pesticides' law on Wednesday, March 23. Notably, agriculture contributes to roughly 10% of EU's greenhouse gas emissions."
231,"Microbes, minerals may have set off Earth's oxygenation: US study",science,US researchers stated that microbes and minerals may have triggered Earth's oxygenation. The team proposed a hypothesis which suggested that oxygen started accumulating in the atmosphere due to interaction between some marine microbes and minerals that are found in ocean sediments. Scientists added that these interactions prevented oxygen from being consumed setting off a self-amplifying process.
232,"US plans to resume oil, gas development on federal lands",science,"US government on Friday said it plans to resume oil and gas development on federal lands. This comes after a court order allowed the government to continue imposing the value of around $50 per ton of greenhouse gases emitted. ""With this ruling, the department continues its planning for responsible oil and gas development..."" said US Interior Department spokesperson Melissa Schwartz."
233,Great Barrier Reef suffers bleaching due to ocean warming: Report,science,"Climate Council, an Australian environmental group on Monday said the Great Barrier Reef is at risk of bleaching as ocean temperatures have increased by two to four degrees Celsius above average. Report added that the reef has suffered three mass bleaching events in past six years. This comes as a UN team is due to assess reef's World Heritage listing."
234,Netherlands to increase wind farms for doubling wind capacity by 2030,science,The Netherlands to increase offshore wind farms for doubling the planned capacity by 2030. A source revealed that government is set to announce new wind farms with a capacity of 10.7 gigawatts (GW) that would be built by end of this decade. This comes as government is working to achieve its climate goals and lessen reliance on Russian gas.
235,Russia bars its scientists from international conferences,science,"Russian scientists will not participate in international conferences this year, Russia's Ministry of Science and Higher Education said. ""We are not calling for abandoning publications in Web of Science and Scopus (academic resources),"" Minister Valery Falkov said in a statement. ""We need to act in accordance with our national interests,"" he added."
236,Study proposes moon's orbit as gravitational wave detector,science,An international team of researchers proposed that a natural gravitational wave detector exists in the Earth-Moon system. They stated that gravitational waves that constantly hit the system produce tiny deviations in Moon's orbit that are measured in the microhertz frequency range. The scientists used this range to propose a new form of studying gravitational waves emitted by the distant universe.
237,New Delhi remained world's most polluted capital in 2021: Report,science,"A report by IQAir, a Swiss air quality technology company, stated that India's overall pollution levels worsened in 2021 and New Delhi remained the world's most polluted capital. As per the report, not a single country managed to meet the World Health Organization standards last year. The report surveyed pollution data from 6,475 cities."
238,Italian researchers survey and study Europe's Calderone glacier,science,"Italian researchers conducted a preliminary radar survey of Europe's Calderone glacier on March 13. As the scientists plan to study the glacier before it melts due to global warming, the team plans to return in April to drill into it and take samples. According to the researchers, these samples will be stored in 'Ice Memory' world archive in Antarctica."
239,"ISRO plans to increase number of launches, satellite manufacturing",science,"ISRO Chairman S Somanath said the agency plans to increase the number of launches and satellite manufacturing. ""ISRO is looking at the important tasks that can be done this year..."" added Somanath. According to him, ISRO will look at increasing space missions with the Polar Satellite Launch Vehicle (PSLV), Geosynchronous Satellite Launch Vehicle (GSLV) and Small Satellite Launch Vehicle (SSLV)."
240,China's Wuhan vows to create 100 billion yuan space industry by 2025,science,"China's Wuhan on Wednesday vowed to create a 100 billion yuan ($15.7 billion) space industry by 2025. As per a city government notice, authorities are offering companies up to 50 million yuan ($7.88 million) as financial incentives in manufacturing projects of satellites, rockets and spacecraft. This comes as Wuhan aims to become the country's ""valley of satellites""."
241,3 Russian cosmonauts wear colours of Ukrainian flag as they arrive on space station,science,"Three Russian cosmonauts arrived at the International Space Station (ISS) wearing yellow flight suits with blue accents, colours that match the flag of Ukraine. “It became our turn to pick a colour. But, in fact, we had accumulated a lot of yellow material so we needed to use it,"" one of the cosmonauts said about the colour of their suits."
242,Pics show 214-million-year-old geological structure on Earth formed by meteorite,science,"Astronaut Kayla Barron, who's currently aboard ISS, shared photos of a 214-million-year old geological structure on Earth. ""The Manicouagan Reservoir and René-Levasseur Island always catch my eye during passes over Quebec,"" she wrote. ""This...geological structure was formed...by a meteorite that scientists estimate was about 5 km in diameter and struck the earth at...17 km/s,"" Barron added. "
243,"NASA rolls out its mega Moon rocket for 1st time, shares pics",science,"NASA has rolled out its mega Moon rocket for the first time. The vehicle, known as the Space Launch System (SLS), along with the Orion capsule atop, was taken to the pad at the Kennedy Space Center in Florida to conduct a dummy countdown. NASA is targeting May as the earliest window for Artemis-1, an uncrewed lunar mission."
244,"World's biggest telescope captures star with ancient galaxies in background, pic released",science,"James Webb Space Telescope, the world's biggest and most powerful space telescope, completed its final round of fine phasing to correct its alignment errors. During the process, the telescope focussed on a single star, however, several ancient galaxies and stars also showed up in the background due to the telescope's sensitive optics. NASA released a picture of the star."
245,Bringing outside shoes inside home is health hazard: Scientists,science,"Wearing shoes in the house is just plain gross and a potential health hazard, scientists who study indoor contaminants have warned. Some of the microorganisms present on shoe bottoms are drug-resistant pathogens that are very difficult to treat. Moreover, they also consist of cancer-causing toxins from asphalt residue on roads as well as endocrine-disrupting lawn chemicals, the researchers found."
246,"China slams 4 firms for falsifying carbon data, forging test reports",science,"China's Ministry of Ecology and Environment (MEE) charged four data verification firms with tampering and forging test reports, making false coal samples and writing distorted, inaccurate conclusions. The move is a part of a campaign by MEE that aims to determine the accuracy of carbon emission verification reports submitted across China. The campaign was launched in October-December last year."
247,Researchers develop algorithm to study Sun's coronal mass ejections,science,"A team of Indian solar physicists has developed an algorithm to study the structure and characteristics of coronal mass ejections (CMEs). Named Simple Radial Gradient Filter (SiRGraF), the algorithm separates the background solar corona to reveal time-scale transient structures of the corona. CMEs are massive clouds of particles that are pushed out into space from the Sun's atmosphere."
248,"EU to propose 'amber' category for gas, nuclear energy investments",science,"EU chief advisor Nathan Fabian on Tuesday said bloc will shortly propose a new category 'amber' for not-fully green investments such as gas, nuclear energy. This comes after Fabian had opposed including both as green investments. Notably, gas, nuclear energy play a role in transition towards green fuel as they are low-carbon but produce greenhouse gases and radioactive waste respectively."
249,"Lead coffin, likely from 14th century, found under Paris' Notre Dame",science,"Archaeologists have found an ancient lead sarcophagus with well-preserved contents, probably from the 14th century, under Paris' Notre Dame cathedral. Christophe Besnier from France's National Archaeological Institute said a small camera placed inside the sarcophagus showed ""cloth remains, organic matter such as hair and plant remains"". A pit was also found immediately below the cathedral floor."
250,Horse mussels under threat due to conservation failures: Study,science,"Horse mussels, a species of giant mollusc found in the UK waters could be at risk due to unprotected areas of the sea, a study has found. Marine experts have described the beds of these molluscs as biodiversity hotspots. Marine protected areas (MPAs) were also introduced to protect them but due to conservation failure, the species is at risk."
251,Invasive insects will kill 1.4 million US street trees by 2050: Study,science,"A recent study has found that invasive insects will kill 1.4 million street trees in the US in next 30 years costing over $900 million to replace. The study predicted that 90% of these tree deaths would be due to emerald ash borer. As per the study, New York, Chicago and Milwaukee would be the hotspots of these tree deaths."
252,"Scientists create material that could make lighter, stronger vehicles",science,"US scientists have created a new lightweight, shock-absorbing material that could help make lighter but stronger helmets, automobiles and aerospace parts. Researchers used Liquid Crystal Elastomers (LCEs) to increase the material's ability to hold strikes. Team observed that the material withstands impact from objects weighing about 1.8 to 6.8 kilograms coming at speeds of about 35.4 kilometres."
253,Species of frog believed to be mute chirps first time in 100 years,science,"Ecuadoran biologist Jorge Brito discovered a toad belonging to the Rhinella festae species chirping in the forest while trekking. The brown frog species characterised by its rough skin and prominent nose was believed to be mute ever since it was discovered 100 years ago. Brito took the toad to a laboratory and found it could sing without a vocal sack. 
"
254,European Space Agency selects Thales-led team to make oxygen on Moon,science,An industrial team led by UK-based Thales Alenia Space has been chosen by the European Space Agency (ESA) to design and build an experimental payload to extract oxygen on the Moon. They would develop a small solar-powered prototype device that will evaluate the prospect of building larger oxygen plants to extract breathable air for astronauts from the lunar soil.
255,Air pollution linked to depressive symptoms in adolescents: Study,science,"A study that examined 213 adolescent participants (aged 9-13 years) has found that exposure to ozone gas, an air pollutant, released by motor vehicles, power plants etc. causes depressive symptoms in adolescents. The study has found that adolescents who lived in areas with more ozone gas levels showed symptoms like persistent feelings of sadness, sleep disturbances and suicidal thoughts."
256,Deep Ocean Mission will bolster observations in Indian Ocean: Centre,science,"Ministry of Earth Sciences Secretary M Ravichandran on Monday said Deep Ocean Mission will strengthen observational network in Indian Ocean. He added the system will help capture long term changes in the ocean's climatic conditions. Reportedly, eight deep ocean gliders, 48 argo floats and 150 wave drifters will be added in coming years as part of the ₹4,000 crore mission."
257,Rare and deadly virus found in ticks in 6 US states: Study,science,"Scientists have found a rare but potentially deadly Heartland virus in lone star ticks in Georgia. Its RNA has been detected in immature and mature ticks in Missouri, Alabama, Illinois, Kansas and New York so far. In 2009, two men were hospitalised with high fever, diarrhoea, muscle pain and symptoms similar to Lyme disease marking the virus' first case."
258,Wind power generation to rise nearly 70% by 2024 in Sweden: Govt ,science,"Swedish Energy Agency, a state-run body on Monday said wind power generation in Sweden is expected to rise by about 70% by 2024. As per the agency, wind power generation is expected to rise from 27.4 terawatt hours (TWh) in 2021 to 46.9 TWh in 2024. The report added hydropower and nuclear energy will remain the country's largest power sources."
259,UN launches final talks on global biodiversity framework in Geneva,science,"UN on Monday launched its final talks to strike a deal on the global biodiversity framework in Geneva, Switzerland. Representatives from 164 countries will discuss over an international pact to safeguard nature and protect vulnerable species with a target of conserving 30% of countries' territory by 2030. The talks are slated to be held from March 14 to 29."
260,Octopuses are using garbage in ocean including beer cans for shelter: Study,science,"Researchers in Brazil have compiled 261 photos and videos of 24 species of octopuses interacting with human litter on ocean floor. These photos show octopuses using beer cans, plastic and glass bottles, battery and a rusted metal pipe for shelter. Researchers, thus, concluded that human-made trash may be more ubiquitous for octopuses to hide in than natural shelter like seashells."
261,Cats evolved from 42 million-yr-old sabre-toothed predators: Research,science,"According to research, cats have evolved from hypercarnivore, sabre-toothed predators that lived 42 million years ago in North America. They were among the first mammals to have an exclusively meat-based diet. The species was double in size of an average house cat and was fierce enough to take down animals such as rhinoceroses, camels, tapirs, pigs and horses."
262,Russia to work on its own Mars mission after Europe suspends project: Report,science,"Russia will start working on its own Mars mission after Europe's ESA announced the suspension of a joint project following the Ukraine invasion, the Interfax news agency reported. The ESA had said it would be impossible to continue cooperating with Russia on the ExoMars mission. Roscosmos head said there were ""big doubts"" about what the ESA could do without Russia."
263,"Pig noises reveal their positive and negative emotions, find scientists",science,Scientists have created an algorithm using 7000 different types of sounds made by 411 pigs throughout their lifespan and found these sounds indicated their emotions. The study revealed that short sounds without much fluctuation in volume indicated positive emotions (happy or excited). Negative emotions (scared or stressed) were shown by longer squeals and vocalisations at higher frequencies.
264,Dengue cases fell drastically during COVID lockdown: Lancet study ,science,"Dengue cases across the globe fell drastically during the COVID-19 lockdown, a Lancet study has found. The study estimated that 7,20,000 fewer dengue cases were reported worldwide in 2020 as public places were shut following the restrictions imposed by government and local authorities to contain the spread of coronavirus. The data was collected from 23 countries spanning dengue-endemic regions."
265,2022 will be among the 10 hottest years on record: Scientists,science,"As per the National Oceanic and Atmospheric Administration, 2022 had a baking-hot start and scientists are certain that this year is going to be among the top 10 hottest years on record. As per the global surface temperature recorded in January and February, 2022 was the sixth-hottest year. Moreover, there's 2.8% chance for 2022 to be the hottest year ever."
266,Germany's greenhouse gas emissions rose by nearly 5% in 2021: Govt,science,"German Environment Agency (UBA) said the country's greenhouse gas emissions rose by just under 5% in 2021 as compared to the year before that. The federal agency added emissions were 39% lower than the 1990s. However, the report revealed that the country emitted 762 million tonnes of carbon-dioxide last year which is 33 million tonnes more than in 2020."
267,Smoke from wildfires destroys ozone layer: Study,science,"Smoke from wildfires can destroy the ozone layer, a study by the University of Waterloo has found. ""The Australian fires injected acidic smoke particles into the stratosphere, disrupting the chlorine, hydrogen and nitrogen chemistry that regulate ozone,"" the lead author of the study said. The smoke converts these ozone-regulating compounds into more reactive compounds that destroy ozone, he added."
268,Sanctions on Russia could cause ISS to crash: Roscosmos chief,science,"Western sanctions against Russia over invasion of Ukraine could cause the International Space Station (ISS) to crash, the head of Russian space agency Roscosmos has said. Calling for the sanctions to be lifted, Dmitry Rogozin said they could disrupt the operation of Russian vessels servicing the ISS. The ISS could ""fall down into sea or onto land"", he added."
269,"NASA shares pic of infant star's energetic outburst, says 'A star is born'",science,"NASA has shared the picture of an energetic outburst from an infant star captured by the Hubble Space Telescope. Sharing the picture on Twitter, NASA tweeted, ""A star is born."" NASA explained, ""This stellar tantrum, produced by an extremely young star in the earliest phase of formation, consists of an incandescent jet of gas travelling at supersonic speeds."""
270,Fish species bearing bright pink colour found in coral reefs of Maldives,science,"A new fish species bearing bright pink colour has been found living in the deep reefs of the Maldives and Sri Lanka. The species have been named 'Cirrhilabrus finifenmaa', one of the first species to be named in Dhivehi, the language spoken in the Maldives. 'Finifenmaa' name was chosen because of its vibrant pink hue resembling a pink rose. 
"
271,"Man's tongue turns black, hairy in Kerala; pics surface",science,"A Kerala man's tongue turned black and hairy after he was put on a pureed diet following a stroke, according to a report published in the JAMA Dermatology journal. Doctors diagnosed him with a medical condition called lingua villosa nigra or black hairy tongue. ""The patient and caregivers were given advice regarding proper cleansing measures,"" the report said."
272,"Rare 250-kg carpenter shark caught in Karnataka, pics surface",science,A rare and endangered species of sawfish or carpenter shark has been caught off coast in Karnataka's Malpe. The shark weighed around 250 kg. It was caught by a fishermen boat and was shifted from the boat to a truck with the help of crane. It is a protected species in India under Schedule I of Wildlife Protection Act 1972.
273,Let the American broomstick fly: SpaceX director on launch of Starlink satellites,science,"SpaceX's launch director took a dig at Russian space agency's chief Dmitry Rogozin's recent remark during launch of Starlink satellites. ""Time to let the American broomstick fly and hear the sounds of freedom,"" the director said as the rocket prepared to take off. Rogozin earlier said Americans could ""fly on their broomsticks"" after Russia stopped selling rocket engines to US."
274,US startup Astrolab unveils rover that can be driven by astronauts on Moon,science,"US startup Venturi Astrolab has unveiled a full-scale prototype of a new rover 'FLEX' designed to transport cargo and astronauts across Moon's surface. FLEX, which can be driven by astronauts, went through a five-day field test in a desert. If NASA adopts FLEX for Artemis, it would become the first passenger-capable rover to travel Moon's surface since Apollo 17 mission. "
275,Earth-forming meteorites may have formed in outer solar system: Study,science,"Japanese researchers suggested that meteorites that helped form Earth may have formed in the outer solar system. Team revealed that these asteroidal materials may have been transported in inner solar system by chaotic mixing during early turbulent phase of solar system. As per study, surface minerals of these outer-belt asteroids may have sourced building blocks of Earth's water and life."
276,Buzz Aldrin's moonwalk photo taken by Armstrong sells for ₹5.9 lakh,science,"An original picture of former astronaut Buzz Aldrin's moonwalk during the first manned lunar landing was sold at an auction for around ₹5.9 lakh. A series of 74 privately-owned photographs from Apollo 8-17 missions sold for ₹1.3 crore in the US. Aldrin's picture was taken by late US astronaut Neil Armstrong, whose reflection could be seen on Aldrin's visor."
277,Caribbean coral reefs have been warming for at least 100 years: Study,science,"US researchers stated Caribbean coral reefs have been warming for at least 100 years. The team analysed sea-surface temperatures and revealed that the reefs were warming since 1915. However, they added that in four out of eight sub-regions, warming may have started during second half of nineteenth century. The team studied 5,326 coral reefs across eight Caribbean regions."
278,Russian space agency head bars employees from leaving country: Report,science,"Dmitry Rogozin, Head of Russian space agency Roscosmos prohibited agency employees from travelling abroad in order to curb brain drain, reported Kamil Galeev, a Moscow-based journalist. This comes as skilled professionals from IT, engineering, and hard sciences are leaving en masse, Galeev added. Reportedly, border guards are instructed to stop IT engineers, specialists from leaving the country."
279,Scientists develop early screening tool to detect autism in 1-2 year olds,science,"Australian scientists have developed a screening tool capable of detecting autism in one to two years old toddlers, which is three years earlier than current methods. They studied 13,500 children in five years and found their tool detected autism accurately in 83% of them. This helped in better verbal and overall cognition at school age in such children, researchers said."
280,"Green agriculture, conservation techniques employed in US farms: Govt",science,US Department of Agriculture (USDA) said farmers adopted conservation strategies to enhance climate-friendly agricultural practices across farms in the country. The findings released on Thursday found that farmers built buffers and wind breaks around fields to prevent soil erosion. The report added that farmers used conservation tillage techniques on over 210 million acres of farms nationwide.
281,UK-based startup Space Forge aim to launch country's 1st satellite ,science,"UK-based startup Space Forge and Richard Branson's Virgin Orbit may launch Britain's first satellite over this summer. ""We're thrilled to be making UK history with our first launch,"" said Space Forge CEO Joshua Western. The CEO added that this is the start of a great collaboration. Space Forge's microgravity satellite, ForgeStar will be launched aboard Virgin Orbit's LauncherOne rocket. "
282,NASA to open moon sample sealed 50 yrs ago to study them in new ways,science,"NASA is about to open vacuum-sealed sample of moon collected during Apollo 17 mission in 1972. ""Agency knew science and technology would evolve and allow scientists to study...material in new ways to address new questions,"" NASA's Lori Glaze said. This sample is expected to contain some gases. A different tool has been designed to capture these gases for further research.
"
283,Italy clears construction of 6 wind farms as part of renewables drive,science,"Italian government has approved construction of six wind energy farms as part of its measures to spur the development of renewable energy. With a capacity of 418 megawatts, the parks will be developed in the regions of Puglia, Basilica and Sardinia. This comes as the government ramps up efforts to lessen reliance on Russian gas imports."
