,topic,category,content
395,Countries aim to study dangers of chemical waste: UN draft resolution,science,"A draft resolution of UN Environment Assembly said a proposal led by Switzerland could form a new intergovernmental panel to study dangers of chemical waste, pollution. The proposal would aim to create a strong ""Science-Policy panel"" similar to UN Intergovernmental Panel on Climate Change. Last week, a UN expert warned chemical waste has been killing more people worldwide than COVID-19.
"
396,"Over 45,000 marine species 'at-risk' due to global warming: Study",science,"A research by University of Queensland has identified over 45,000 at-risk marine species, hugely impacted by global warming and pollution. Molluscs, corals and echinoderms like sea urchins are facing a diverse range of threats in the ocean, Dr Butt from the university said. Starfish, sea snails and flying fish are vulnerable to climate change-related stressors in the ocean, he added."
397,Brain's processing speed remains high until age 60: German study,science,"German researchers found brain's processing speed remains high till age 60. Team analysed over 10 lakh participants and measured their reaction times to a cognitive task. Researchers said slow response times were due to increases in decision caution, slower body movement. Earlier, people had attributed the slower response to mental speed which was believed to have peaked at age 20."
398,Mushroom-shaped micropillars help lizards shed their tails: Study,science,Several species of lizard can shed their tails quickly to distract and escape their predators. Recent research carried out a detailed microscopic study of lizard's amputated tail and discovered it has tiny structures made up of mushroom-shaped micropillars with ultra-small pores on top that help lizards shed tails. These findings may help in solving adhesion challenges in robotics and prosthetics.
399,"Pluto's atmospheric pressure is 80,000 times less than Earth: Study",science,"Researchers from India, France and Brazil revealed atmospheric pressure on Pluto's surface to be 12.23 μbar which is 80,000 times less than that on Earth. Team analysed 12 occultations between 1988 and 2016 through Devasthal optical telescope at Nainital to determine exact value. An occultation occurs when a celestial object gets hidden from observer's view due to another celestial object."
400,NASA's Perseverance rover completes first year on Mars,science,"NASA's Perseverance rover completed first year on Mars after it landed on the planet on February 18, 2021. During the past year, the six-wheeled rover accomplished many firsts such as collection of rock core samples and extraction of oxygen. It also recently broke record for most distance driven in a single day by travelling almost 320 meters on February 14."
401,"US, UAE seek additional $4 bn in farming climate change investment",science,"US Secretary of Agriculture Thomas Vilsack on Sunday said US, UAE pushed for additional $4 billion investment in Agriculture Innovation Mission for Climate (AIM for Climate) to make agriculture resilient to climate change. This comes after $4 billion investment was sought following its launch by both countries in November 2021. Aimed at climate-friendly farming, AIM is backed by 140 partners."
402,"What is Obstructive Sleep Apnea, a condition that Bappi Lahiri suffered from?",science,"Late singer-composer Bappi Lahiri's doctor said that he suffered from Obstructive Sleep Apnea (OSA), a sleeping-related breathing disorder caused by the repetitive collapse of the upper airway during sleep. OSA occurs when the throat muscles relax intermittently and block the airway. Some signs and symptoms of OSA are excessive daytime sleepiness, loud snoring and abruptly waking up gasping."
403,US patient with cancer becomes 1st woman to be cured of HIV after stem cell transplant,science,"A US patient with leukemia has been cured of HIV after receiving a stem cell transplant from a donor who was naturally resistant to the virus that causes AIDS, researchers said. ""This is now the third report of a cure in this setting and the first in a woman living with HIV,"" President-Elect of International AIDS Society Sharon Lewin said."
404,"Musk shares animation of SpaceX's future mission to Mars, says 'this will be real'",science,"SpaceX CEO Elon Musk on Tuesday tweeted an animated video showing the aerospace company's Starship spacecraft and Super Heavy rocket on their future expedition to Mars. The five-minute video showed Starship's take-off from Earth and its landing on Mars. It also showed astronauts looking out on a lit-up Mars base. ""This will be real in our lifetime,"" the billionaire tweeted."
405,Rare volcanic storm sends bolts of lightning in sky during Mount Etna eruption,science,"Mount Etna's eruption created a volcanic storm that sent bolts of lightning across the sky over eastern Sicily. A volcanic expert said such volcanic storms are rare but can happen in particularly violent eruptions or with volcanoes located near the sea. The eruption, that took place earlier this week, shot ash 10 km into the air above sea level."
406,ISRO's PSLV-C52 successfully launches 3 satellites in 1st mission of 2022,science,"Marking the first launch mission of 2022, Indian Space Research Organisation's Earth Observation Satellite EOS-04 and two small satellites were successfully placed into the intended orbit by the PSLV-C52 rocket on Monday morning. EOS-04, weighing 1,710 kg and with a mission life of 10 years, is a Radar Imaging Satellite designed to provide high quality images under all weather conditions."
407,Rare baby ghost shark found by New Zealand scientists; say 'its belly full of egg yolk',science,"New Zealand scientists have discovered a rare baby ghost shark at a depth of approximately 1,200 metres. ""You can tell this ghost shark recently hatched because it has a belly full of egg yolk. It's quite astonishing. Most deep-water ghost sharks are known adult specimens; neonates are infrequently reported so we know very little about them,"" scientists said."
408,Billionaire who flew to orbit with SpaceX buys 3 new crewed missions,science,"US billionaire Jared Isaacman, who flew to orbit on SpaceX's Crew Dragon capsule last year, has purchased three additional upcoming flights with SpaceX, a series of missions called 'Polaris'. He said the first four-member crew could launch as early as the fourth quarter of this year. The first mission, Polaris Dawn, would feature the world's first commercial spacewalk."
409,"46-inch fully woven, smart display created by Cambridge scientists",science,"University of Cambridge-led researchers have created a 46-inch fully woven, textile display with smart sensors, energy harvesting and storage functionalities integrated into the fabric. It can operate as a display, monitor various inputs or store energy for later use. Researchers said this could lead to curtains that are also TVs, energy-harvesting carpets, and interactive, self-powered clothing."
410,Misidentified object set to crash into Moon as SpaceX rocket: Astronomer,science,Astronomer Bill Gray has said that he misidentified the object when he claimed last month that a part of a SpaceX rocket launched in 2015 is on course to crash into Moon. He now believes that the object is Chang'e 5-T1 rocket's booster that was launched by China in 2014. The collision is set to occur on March 4.
411,SpaceX engineer to fly on mission attempting 1st commercial spacewalk,science,"SpaceX engineer Anna Menon will be flying to space in a new SpaceX mission, Polaris Dawn, along with US billionaire Jared Isaacman and two others, this year. The team's goals include attempting the first-ever commercial spacewalk. The mission is the first of a three mission program, Polaris, which involves a mission that would be the first human spaceflight on Starship."
412,US corn-based ethanol biofuel worse for climate than gasoline: Study,science,"Researchers said corn-based ethanol biofuel used at US pumps is worse for climate than gasoline. ""Corn ethanol is not a climate-friendly fuel,"" said Dr. Tyler Lark, lead author. The study said corn ethanol is at least 24% more carbon-intensive than gasoline due to emissions resulting from corn's processing and combustion. Earlier, experts said corn ethanol was relatively friendly for climate."
413,UN to finish report on impact of global warming on environment today,science,"UN's Intergovernmental Panel on Climate Change (IPCC) will finalise its report on impact of global warming on people's lives, environment and Earth on Monday. ""We are losing living spaces for species and for ourselves..."" said report co-chair Hans-Otto Poertner. The report contains seven regional chapters detailing risks, benefits of adapting to a warmer world and will release by February-end."
414,Experts review water release plan for Japan's Fukushima nuclear plant,science,"International Atomic Energy Agency (IAEA) experts on Monday began reviewing Japan government's plan to release over a million tons of treated radioactive water into sea. The 15-member team will meet government officials on Tuesday and conduct a safety review of the water. Reportedly, they will evaluate radiation effects on humans. In 2011, a massive tsunami destroyed the plant's three reactors."
415,Dark matter interacted with ordinary matter at heart of galaxy: Study,science,"Scientists suggested interaction at centre of galaxy between dark matter and ordinary matter. The team studied 300 distant spiral galaxies and found a dark matter halo at the centre whose dimensions increased with time, indicating interaction between dark and ordinary matter. Researchers attributed the change in dimensions to contrasting properties of near and distant galaxies."
416,'Math neurons' that fire during specific math operations in brain identified,science,"A study by Universities of Tübingen and Bonn has identified 'Math neurons' that fire specifically during certain mathematical calculations. There are some neurons in the brain that are active exclusively during additions, while some others are active during subtractions, irrespective of whether the operations are written in words or symbols. The study has been published in Current Biology journal."
417,UK scientists to study effects of new COVID-19 variants in pregnancy,science,"Oxford University scientists on Tuesday said they will study effects of new COVID-19 variants such as Omicron and vaccines on women during pregnancy and childbirth. ""The effects of COVID-19 in pregnancy have been insufficiently studied,"" said José Villar, co-lead author. Study will evaluate nearly 1,500 women infected at any stage of pregnancy with 3,000 non-infected women over four months."
418,"Corbevax vaccine is safe, offers good immunogenicity: NTAGI Chief",science,"E Biological's COVID-19 vaccine, Corbevax is safe for use and offers higher antibody levels with good immunogenicity as compared to some other vector vaccines, Dr N K Arora, Chairman, National Technical Advisory Group on Immunisation (NTAGI) said. ""They can be used in our usual childhood immunisation settings...without any difficulty...It is not very expensive,"" he added."
419,"COVID-19 infection, not vaccine may improve antibody function: Study",science,"Israeli scientists said only previous COVID-19 infection and not vaccination may improve performance of antibodies. Researchers said while protection against re-infection lasts long, breakthrough infections are common six months post infection. Scientists compared immune response in unvaccinated people who recovered from Delta variant with those who received two vaccines but were never infected."
420,Quarter of world's rivers affected with pharmaceutical pollution: Study,science,"Rivers worldwide are dangerously polluted with pharmaceuticals like diabetes and epilepsy drugs and caffeine, a study has found. Led by the University of New York, the study published in PNAS journal measured the concentration of 61 active pharmaceutical ingredients at 258 rivers in 104 countries. As per study, a quarter of these rivers contained contaminants at potentially harmful concentrations."
421,"Due to slow evolution, lichens losing race against climate change: Study",science,"Lichens may be evolutionarily outpaced due to warming climate as they are adapting to climate change at a rate of just 1°C every million years, Frontiers in Microbiology study found. ""The predicted rate of modern climate change vastly exceeds the rate at which these algae have evolved...certain parts of their range are likely to become inhospitable...,"" researcher Matthew Nelsen said."
422,UK zoo to save species from extinction by freezing genetic samples,science,"UK's Paignton Zoo has partnered with biobank Nature's SAFE to save species from extinction by cryogenically freezing their genetic samples. As part of cryopreservation, tissues and reproductive cell samples of endangered animals will be stored and preserved at -196 degree Celsius. Mouse deer, Colombian black spider monkey and panther chameleon are animals which are cryogenically preserved so far."
423,Pollution causing more deaths than COVID globally: UN report,science,"An environmental report published by the UN claimed pollution from pesticides, plastics and electronic waste is causing more deaths worldwide than COVID-19. While COVID-19 has claimed nearly 5.9 million lives as per Worldometer, pollution is causing 9 million premature deaths a year, the report revealed. UN has also called for an ""immediate and ambitious action"" to ban certain toxic chemicals."
424,DNA testing of elephant tusks reveal ivory trafficking networks,science,"Scientists and special agents from US conducted DNA testing of seized elephant tusks to reveal ivory trafficking networks. The researchers tested over 4,000 elephant tusks across 12 African countries. The team found majority of these shipments contained tusks from repeated poaching of the same elephant population or from close relatives. The study analysed seized consignments from 2002 to 2019."
425,US agency extends environmental review of SpaceX program to March 28,science,"US Federal Aviation Administration (FAA) on Monday said it will complete environmental review of proposed SpaceX Starship spacecraft on March 28. ""We are continuing consultation... with other agencies,"" said FAA. Agency added they need to determine the impact of the program on the area including an adjacent wildlife reserve. Notably, SpaceX Starship has been made for voyages to moon, Mars."
426,Arctic's Svalbard seed vault to receive new deposits on February 14,science,"Arctic's Svalbard Global Seed Vault will receive new deposits on February 14 from gene banks of Sudan, Germany and three others. Lebanon-based International Center for Agricultural Research in Dry Areas (ICARDA), the first organisation to make a withdrawal from vault, will also deposit around 8,000 samples. Home to over 1.1 million seed samples, the facility was first opened in 2008."
427,Autonomous biohybrid fish made from human cardiac cells: Harvard,science,Researchers at Harvard University and Emory University have developed a fully autonomous biohybrid fish from human stem-cell derived cardiac muscle cells. The artificial fish is inspired by a zebrafish's shape and swimming motion and swims by recreating muscle contractions of a pumping heart. Researchers said the advance brings them closer to developing a more complex artificial muscular pump.
428,NASA shares video of storms that look like pizza toppings at Jupiter's North Pole,science,"NASA recently shared a video showing an infrared view of the North Pole of Jupiter and it showed storms that resembled the pizza topping pepperoni. Calling the phenomenon ""pepperoni storms"", NASA explained, ""The yellow areas are warmer (or deeper into Jupiter's atmosphere) and the dark areas are colder (or higher up in Jupiter's atmosphere)."""
429,Countdown begins for ISRO'S first launch mission of 2022 scheduled for tomorrow,science,"The countdown for the launch of PSLV-C52 that's carrying three satellites, began on Sunday morning. Scheduled for Monday at 5:59 am, this will be the space agency's first launch mission of 2022. The launch vehicle will take off from Satish Dhawan Space Centre in Sriharikota in Andhra Pradesh."
430,"1st images captured by the world's biggest, most powerful telescope; NASA shares pics",science,"NASA has shared the first-ever images captured from its James Webb Space Telescope, which includes a 'selfie' of its primary mirror. One image mosaic released by NASA shows 18 little white dots, with each dot being a different view of the same isolated star. The other image included a 'selfie' of the telescope's primary mirror."
431,Starship launches to cost less than $10 mn each in 2-3 years: Musk,science,"SpaceX's billionaire CEO Elon Musk said the company's Starship rockets will cost less than $10 million per launch within 2-3 years. ""It may be as little as a few million dollars per flight...These are crazy low numbers by space standards,"" he added. The 394-feet tall reusable spacecraft is designed to carry both crew and cargo on long-duration interplanetary flights."
432,"CoEs in carbon capture & utilisation to be set up in Mumbai, B'luru",science,"Two Centres of Excellence (CoEs) in carbon capture and utilisation, a key way to reduce emissions, will be set up in Mumbai and Bengaluru, the government announced on Thursday. The centres will help create a roadmap for innovations in the field, it said. They'll be set up in Mumbai's IIT-Bombay and at Bengaluru's Jawaharlal Nehru Centre for Advanced Scientific Research. "
433,US startup Astra's NASA mission launch ends in failure mid-flight,science,"California-based rocket startup Astra's first operational satellite launch out of Cape Canaveral, a NASA mission, ended in failure mid-flight, a little more than three minutes after takeoff. An unexpected issue cropped up during flight, Astra said. The live footage reportedly showed the rocket spinning out of control just after the two main stages of the vehicle separated as planned."
434,Highly confident we will get to orbit with Starship this year: Musk,science,"SpaceX CEO Elon Musk in an interaction with media said the firm is ""highly confident"" that SpaceX's Starship, designed for voyages to the Moon and Mars, will reach Earth orbit for the first time this year. Discussing environmental review of the project by FAA in Texas, Musk said SpaceX has a fall-back plan of shifting entire Starship programme to Florida."
435,"NASA says 30,000 SpaceX satellites could raise potential collisions",science,"NASA has raised concerns about SpaceX's plan to deploy about 30,000 satellites for its Starlink, saying it could lead to a ""significant increase"" in potential collisions in low Earth orbit. It added the satellites could cause possible impacts to NASA's spaceflight missions. NASA noted there are currently 25,000 total objects tracked on-orbit and SpaceX's expansion will add to it."
436,"Luc Montagnier, who won Nobel Prize for discovering HIV, dies at 89",science,"French scientist Luc Montagnier, who won the Nobel Prize in Physiology or Medicine in 2008, has died at 89. He shared the Nobel for discovery of human immunodeficiency virus (HIV), that causes AIDS, with his colleague Françoise Barré-Sinoussi. In 2020, Montagnier had claimed that COVID-19 was laboratory-made and was a result of an attempt to make vaccines against AIDS virus. "
437,"Australia lists koalas as endangered species in 2 states, 1 territory",science,"Australia has listed koalas as endangered species in New South Wales, Queensland and the Australian Capital Territory after their population declined dramatically. Several factors like disease, climate change, land clearing, bushfires, drought, among others have possibly ravaged the marsupials. Environment Minister Sussan Ley, however, pledged to work toward a national recovery plan for koalas.
"
438,Scientists develop synthetic tooth enamel stronger than natural layer,science,"Replicating the composition and structure of biological tooth enamel, scientists have developed its synthetic form that is harder than the natural layer. As per study published in Science journal, scientists assembled hydroxyapatite nanowires intertwined with polyvinyl alcohol polymer chains to form the new material. It has atomic, nanoscale and micro-scale organisation similar to natural teeth. 
"
439,US museum to show 120 life-size orange statues of women scientists,science,"US' Smithsonian Museum will display 120 life-size neon orange 3D-printed statues depicting women who have excelled in science, technology, engineering and math (STEM) to commemorate Women's History Month in March. The exhibits will be showed in the Smithsonian Gardens and in other select museums of the network. Reportedly, statues will have QR codes to know more about these scientists. "
440,NASA selects 2 new solar missions to understand Earth-Sun environment,science,"NASA on Friday announced two new solar missions to understand Sun's dynamics and the Earth-Sun connection. Named as Multi-slit Solar Explorer (MUSE) and HelioSwarm, they will offer key information to help protect astronauts, communication signals and satellites. While MUSE will study heating of Sun's corona, HelioSwarm is a constellation of nine spacecraft which will study solar wind turbulence."
441,Centre aims to replace diesel with green fuels in farms by 2024,science,"The Ministry of Power on Friday said the country will replace diesel with renewables to achieve target of zero diesel use in agricultural sector by 2024. ""We are working for a new and modern India, which cannot happen without modern power systems,"" said Power and Renewable Energy Minister Raj Kumar Singh. However, government didn't specify any details about the plan."
442,Climate protection awareness rose in last 20 years: German govt,science,"A study by German Environment Agency (UBA) found that the awareness regarding issues such as climate protection and pollution have risen in Germany in the last 20 years. Out of the 2,115 residents surveyed from age 14 and above, 93% supported reduction in pesticide use, while 92% backed environment-friendly farming practices. Further, 84% of participants favoured bike paths for transport."
443,Robot captures pics of damaged Fukushima reactor as part of probe,science,"A remote-controlled robot sent to probe worst-hit reactor of Japan's Fukushima nuclear plant captured images of broken structure and mounds of melted nuclear fuel, Tokyo Electric Power Company Holdings (TEPCO) said on Thursday. As per TEPCO, the highly radioactive fuel fell to the bottom of reactor's primary containment vessel after meltdown. In 2011, a tsunami destroyed plant's three reactors."
444,TN CM launches excavation to ascertain palace design of Cholas,science,"Tamil Nadu CM MK Stalin on Friday launched archaeological excavation projects, including those to ascertain the town planning and palace design of the Cholas. The excavations in Ariyalur will bring out the town planning of Gangaikonda Cholapuram, the capital city built by Rajendra-I between 1023-27 AD, and Maligaimedu palace. Gangaikonda Cholapuram remained the capital city for 256 years."
445,"Researchers find 18,000 ancient notepads depicting Egyptian society",science,"German researchers found over 18,000 pottery fragments known as 'ostraca' used as notepads depicting life in Egypt, 2,000 years ago. Researchers said fragments were used to inscribe shopping lists, receipts etc. The team also found some school texts with repetitive characters which they thought would have been a punishment for ""naughty"" students. The inscriptions were found in Athribis, Egypt."
446,Nations pledge to protect oceans at 'One Ocean' summit in France,science,"Nations pledged to protect oceans from overfishing and plastic pollution at 'One Ocean' summit in Brest, France on Friday. ""It is time for an alliance between us and the ocean,"" said European Commission President Ursula von der Leyen. Meanwhile, France, USA said they would work on a global agreement to address full lifecycle of plastics and promote a circular economy."
447,Astronomers discover exceedingly rare binary star system: Study,science,"Astronomers have discovered an extremely rare binary star system, Vanderbilt University said. One of the stars in this star system exhibits a hybrid of two existing stellar pulsating behaviours. ""Stars exhibiting either of those pulsating behaviours are quite rare; a star exhibiting hybrid pulsating behaviour is even more so,"" a researcher said. The star also has a strong magnetic field."
448,"Humans lived in Europe 10,000 years earlier than thought: Study",science,"Researchers from US, Europe said early humans lived in Europe about 54,000 years ago, 10,000 years earlier than previously believed. They found fossilized homo sapiens remains sandwiched between remains of Neanderthals in Grotte de Mandrin, a cave in France's Rhone Valley, indicating two may have co-existed. Earlier, researchers believed arrival of modern humans led to Neanderthals' extinction."
449,NASA captures first-ever visible light images of surface of Venus,science,"Using its Wide-Field Imager for Parker Solar Probe (WISPR), NASA's Parker Solar Probe has captured the first-ever visible light images of the surface of our sister planet, Venus. Describing the pictures, NASA said the images reveal a faint glow from the surface that shows distinctive features like continental region Aphrodite Terra, the Tellus Regio plateau and the Aino Planitia plains."
