,topic,category,content
0,'International bestsellers' open up about life and racism during 'human library' sessions,society,"  Human 'books' fight racism in Bunbury one story at a time For the latest flood and weather warnings in Queensland, search on ABC Emergency Racism is uncomfortable: It's uncomfortable to experience, uncomfortable to speak about and uncomfortable to call out but a group of residents in a popular coastal city near Perth has found an innovative way to discuss the subject. Inspired by the concept of ""human libraries"", Bunbury Multicultural Group vice chair Shamara Williams decided to set up a collection of ""international bestsellers"" as part of the area's multicultural and Fringe festivals. Over two days, strangers borrowed the ""human books"" for an hour of private conversation and spoke about everything from everyday life to individual experiences of racism. ""It's important to keep these conversations intimate to allow people to open up and actually share what's really in their heart: to be authentic, honest and raw even,"" Ms Williams said. The experiment, inspired by the Human Library movement which began in Denmark more than 20 years ago, has been set up in other places including Hobart and in Queensland. ""It's an amazing concept."" Ms Williams, a migrant from Sri Lanka, has been living in regional Western Australia for more than 30 years and jokes she's ""still not a local"". ""There's an expectation you're here for a certain number of years but that number is unknown [and] it's a lot harder on new migrants until they get to that point,"" she said. She believes the opportunity to bring people from seemingly different worlds to simply speak to each other in a safe space can reduce prejudice. ""Stories are so powerful and it has the ability to change perspectives,"" she said. ""I'd tell anyone to give it a go in your own little community."" When Shizleen Aishath first moved to Australia in 2013, she hadn't given much thought about the headscarf she wore until an incident at the shops. Ms Aishath moved to Bunbury to get settled before her husband and children joined her from the Maldives. ""I was at the shops with a friend [and] this little lady came up and spat on me and said, 'go back to where you came from',"" she said. ""The shock was so big that I did not even react ... did not even realise that I'd been spat on."" While the incident has made Ms Aishath more cautious when out in public, it has also given her more drive to stand up against discrimination. ""It made me really, really aware of our role in the community to both educate and actually speak up,"" she said. ""Because my worry was there'd be a lot of people who wouldn't."" For Ms Aishath, the library initiative provided a ""beautiful way"" for people to ask questions. ""There is a lot of miscommunication out in the community and this brings that to the table,"" she said. ""Us being such a multicultural community, we need to start doing stuff that is not just celebrating a day."" Through one-on-one conversations in the library, she was able to open up about her matriarchal upbringing and challenge assumptions about why she wore a scarf. ""[In the Maldives], it's very normal to wear a scarf and it's also very normal not to wear a scarf,"" she said. ""I was the first person in my whole family to start wearing a scarf. ""For us, it's a choice."" Ms Aishath said similar conversations had the potential to help many other minority groups including people living with disabilities and those who identify as LGBTIQA+. ""It also allows the community to have a chat about those positive experiences,"" she said. ""All these different diversity groups do bring something to the table that isn't normally discussed."" Bunbury Mayor Jaysen Miguel said while a lot of work had been done to celebrate and acknowledge diversity in the regional community, there was always room to do more. ""Support, both financially and in-kind, to events such as the Reconciliation Week bridge walk, NAIDOC Week, the South West Multicultural Festival and the new This is Me series, is crucial to not only continuing to educate our community, but acknowledge our diverse community and provide a safe, welcoming place to [be],"" he said. ""While unfortunately there may be some in the community who express outdated views, many of our residents welcome and support our culturally and linguistically diverse community."" The Mayor also encouraged people who witnessed racism and discrimination to speak out. ""When people who witness racism speak out against it, this makes the person being targeted feel supported, and can make the person being racist reconsider their behaviour,"" he said. ""Don't put yourself at risk. But if it is safe to do so, speak up and stand with the victim. Even a simple gesture can be powerful."" We acknowledge Aboriginal and Torres Strait Islander peoples as the First Australians and Traditional Custodians of the lands where we live, learn, and work. This service may include material from Agence France-Presse (AFP), APTN, Reuters, AAP, CNN and the BBC World Service which is copyright and cannot be reproduced. AEST = Australian Eastern Standard Time which is 10 hours ahead of GMT (Greenwich Mean Time)"
1,"After 800 editions and 17 years, the future of Wilcannia's treasured local paper is in doubt",society,"  The Wilcannia News is an archive of the town's history — so what happens if it shuts down? For the latest flood and weather warnings in Queensland, search on ABC Emergency Ever since it went to print 17 years ago, the Wilcannia News has been run by an enthusiastic and dedicated team of volunteers. The paper's content is gathered, collated and printed independently in Wilcannia. While the already sharp decline in readership of newspapers around the country was exacerbated by the pandemic, the vital role of the Wilcannia News only became more apparent last year as the town grappled with an outbreak that was spreading like wildfire. The team has consistently managed to produce a weekly 15-page newspaper that informs and engages readers across the region and beyond — digital copies are sent as far as Brighton in the UK. But the publication has struggled to attract and retain new volunteers and has been forced to slash its weekly edition to monthly. If the volunteers can't find more help soon, the paper will be forced cease printing. Wilcannia-born Nola Whyman has used the paper as a crucial way to stay in touch with her country and community while she lives and works elsewhere. ""It's really important for me to know what's going on there, what's happening with family on the ground, what programs are being offered,"" she said. ""It's great for my kids to see photos of their cousins, uncles and aunties and everyone gathering, and it's been so consistent."" As a child, Ms Whyman used to rush out the front of the house to meet the mailman and help deliver the newspaper to the neighbourhood. ""Seeing, over the years, the positives reported in Wilcannia paper is important, because all we ever see coming out a lot of the time is quite negative of our hometown,"" she said. ""To me now what's in the media sometimes isn't the full story and that doesn't give justice to our community."" Robert Clayton from Wilcannia River Radio said the paper had been a vital platform to encourage better community outcomes. ""There are a lot of good stories here in Wilcannia, but due to the lack of volunteers they're not being told,"" he said. ""People in the community wouldn't quite push themselves as much in doing good, in what they're doing. ""To see your photo in the newspaper you'd buy three copies just to give to family. ""It's just a really good feeling that we have that sort of newspaper where we can put local people's and students' achievements in."" Christine Elliot has long volunteered at Wilcannia News, but between managing the golf club and sourcing and writing much of the paper's content, the time to hang up her hat is looming. ""We've always been stretched for labour and four of us have been involved in the paper every week since December 2004,"" she said. ""So it's been a 17-year haul and we're not getting any younger."" With more than 800 printed editions, the paper focuses on the preservation of the town's deep colonial history and provides a physical archive of happenings in the town through its regular ""History Corner"". It also publishes eulogies in full. ""One thing that has been lacking in Indigenous communities is that background of their family,"" Ms Elliot said. ""Many years ago I was asked by a couple of elders how they can do their family tree and I thought, 'Well, I don't know.' ""But this is a way we can help people in the future do their family tree, because it will be there."" The paper also acts as a public noticeboard, publishing upcoming health service visits and school information for parents. ""I just rely on it for the hospital clinics — you can put it on the fridge,"" Ms Elliot said. ""In football season we publish the football draw and most of them get stuck on fridges, and the … recording on what's happening at the schools, which is just as important. ""I think it's like everything you probably don't realise until it's not there."" Wilcannia News president John Pineo said the paper proved a vital source of accurate information when the town became the epicentre of a COVID-19 outbreak last year. ""The Washington Post picked up on Wilcannia's outbreak at the time and a lot of media scrutiny wasn't totally accurate,"" he said. ""I think living here through the outbreak, we probably did capture really the true sense of how it was."" With a mission statement to inform, connect and unite, Mr Pineo said focusing on publishing positive news while not ignoring the negatives had played an instrumental role in keeping community unified. ""What we print each week is not to point out something negative and whinge … [but about helping to] find the solution to it,"" he said. ""We try and focus on the good things happening in the town. ""I hope in a hundred years from now people will look back on it and see what life in Wilcannia was like back then."" The uncertainty of the paper's future has attracted the interest of local economic developer, RED.I. Site manager and Wilcannia River Radio host Brendon Adams has earmarked the potential for a collaboration with the town's media sector to create more secure employment opportunities. ""Even for us, as part of the radio station, we read a lot of information from the paper to inform listeners of our deadly station,"" he said. ""If Wilcannia News does fall, we are looking at making our radio station a larger media hub where we not just have radio but video and print. ""Media is such an important part for remote communities and we think it needs to continue."" We acknowledge Aboriginal and Torres Strait Islander peoples as the First Australians and Traditional Custodians of the lands where we live, learn, and work. This service may include material from Agence France-Presse (AFP), APTN, Reuters, AAP, CNN and the BBC World Service which is copyright and cannot be reproduced. AEST = Australian Eastern Standard Time which is 10 hours ahead of GMT (Greenwich Mean Time)"
2,"So you want to be a backyard beekeeper. You, and many others",society,"  Growth in amateur beekeeping contributing $173.5 million per year to the sector For the latest flood and weather warnings in Queensland, search on ABC Emergency For this group of students, it has been a dream to keep bees. They're taking part in a beekeeping course run by one of Tasmania's most experienced commercial beekeepers. Some, like Ellie Langdon, are keen to take it up as a hobby, others are looking for a new business. ""There's a lot to it, more than I thought, but I've found it really interesting finding out the intricate details about their life and how they work,"" Ms Langdon said. ""I've nagged my husband for so long about beekeeping he did cave in and make me a hive and bought me a course. ""I'm glad I've done the course before leaping into my active hive."" Beekeeping has surged in popularity in the past five years. In that time, numbers of recreational beekeepers have tipped over 28,000 nationally, up from 23,000. Trevor Weatherhead, chair of the Australian Honey Bee Industry Council, attributes the upsurge in recreational beekeeping to media highlighting concerns about declining bee populations and the popularity of the hobbyist's Flow Hive. Mr Weatherhead said COVID lockdowns had also prompted a spike in beekeeping. ""Ironically, I think COVID has played a little bit of a role in this. I've seen a few stories out there where people have got into bees in their backyard because of COVID they couldn't go anywhere,"" Mr Weatherhead said. Military veteran Marc Webb struggled to leave his house in Adelaide, years after a serious incident in Afghanistan left him wounded and traumatised. He never thought bees would be what save him. The backyard industry has become a valuable sector in Australia. The AgriFutures Australia snapshot of the country's honey bee industry likens recreational beekeeping to recreational fishing: comparable in size to the commercial arm of the industry and just as important economically. The report authors estimate the economic value of recreational beekeeping at $173.5 million per year. In comparison, the commercial honey bee and pollination sector is worth $264 million. Agrifutures, the government's research and development arm, estimates that recreational beekeepers spend $72 million per year on bee equipment including hives, bee suits, smokers and beekeeping courses. Southern Tasmanian commercial beekeeper Peter Norris has been in the business for years. He has been running classes as well as selling bee equipment. He said the past couple of years had seen an increase in their popularity. ""People are becoming more aware of how important bees are,"" Mr Norris said. ""It increases the appreciation of how much is involved and the necessity of bees and hopefully it will help educate people about being more careful with sprays and things like that."" Mr Norris said he had run three courses so far this season, an indicator of the growing interest in the backyard hobby. A growing number of women are among Australia's surging beekeeping hobbyists. Anita Long and Jenni MacLeod run beekeeping education programs and a group called Sister Hives. ""Sister Hives started as an idea around Anita's kitchen table,"" Ms MacLeod said. ""We talked about how great it would be to run a program specifically for women."" A weekend pilot of the female-only program sold out in 48 hours. ""It demonstrated to us that there was a need for connection, community and skills-building; particularly among women who want to do beekeeping,"" Ms MacLeod said. Spring boarding off the success of the trial, the pair went on to secure funding from the Tasmanian government to run a 12-month program for aspiring women beekeepers. ""We were overwhelmed with inquiries,"" Ms MacLeod said. ""We were funded initially for 25 places but we received over 120 inquiries from across the state. ""We ended up receiving 60 applications and we then went back to our funding body to make sure that everybody could be included in the program, because the key point about this program is connection, the skills."" Across Australia there are a multitude of classes for amateur beekeepers, a multitude of groups they can join, and plenty of equipment they can buy to support their hobby. It is particularly important at a time when the industry is keen to protect our island nation's bee population from some of the devastating diseases that have wreaked havoc overseas. Industry bodies are encouraging hobby beekeepers to register with their state's Primary Industries Department, but it is not yet compulsory everywhere. Tasmania is the only state or territory that does not have mandatory hive registration, although there is hope to have it in place by April 2022. Mr Weatherhead said it was vitally important for backyard beekeepers to register their hives. ""It's important that you do register because it's a biosecurity matter,"" he said. ""If ever we did get an incursion of a pest that is not in Australia we need to know where those beehives are, then we can go out and check them."" But without penalties it could be considered soft regulation and the Australian Honey Bee Industry Council admits it is almost impossible to enforce. Taking a beekeeping course is the first step towards being able to recognise when a hive becomes unhealthy. ""We encourage beekeepers to join up with the local bee club so that way … they then realise what their responsibilities are,"" Mr Weatherhead said. ""You've got to know how to look after your beehive. They're not something you put there and leave and don't look at. You need to look at bees to make sure they're all right. ""You don't buy a new car and keep driving it and driving it without servicing it, [it's] the same sort of thing with bees. ""You need to check on them at least every two weeks to ensure they're getting enough food, they've got water supplies, the hive is not too crowded and there's no disease."" We acknowledge Aboriginal and Torres Strait Islander peoples as the First Australians and Traditional Custodians of the lands where we live, learn, and work. This service may include material from Agence France-Presse (AFP), APTN, Reuters, AAP, CNN and the BBC World Service which is copyright and cannot be reproduced. AEST = Australian Eastern Standard Time which is 10 hours ahead of GMT (Greenwich Mean Time)"
3,'People would be outraged': Women evacuated in latest confronting domestic violence case,society,"  Remote community shocked by latest domestic violence allegations For the latest flood and weather warnings in Queensland, search on ABC Emergency Two women have been evacuated from a remote Aboriginal community in northern Western Australia amid allegations of prolonged sexual and physical assaults. It is the latest in a string of disturbing domestic violence cases in remote Kimberley towns that have highlighted gaps in services and the complex cultural context making it almost impossible for women to escape. The two women had been living with a man in a house within a bush community since March. In mid-September they sought help from local police, alleging they had been subjected to repeated sexual and physical violence. People who spoke to the women in the hours after they came forward say they alleged the man held them against their will at the time, and took control of their bankcards and money. The women were flown several hundred kilometres to a larger Kimberley town for medical checks. One woman was taken to hospital and both have since given statements to police. WA Police have confirmed that a man has been charged with one count of common assault and one count of aggravated assault occasioning bodily harm. A woman who has been a social worker in the area for a number of years and knows the pair said it is a distressing case. Speaking to the ABC on condition of anonymity, she called the alleged victims ""two of the bravest women I've ever met"". ""Violence is normalised in the communities here, but this case has blown me out of the water."" She said it should be a wake up call about the severity of the violence occurring in remote communities. After a history of abuse, they are living proof that people can change. ""I feel like this would not be allowed to happen in the city — it would be leading the 6:00pm news and people would be outraged."" ""It's almost impossible for women to get out of these situations, because even if they can physically find a way to get a lift or a plane ticket to a different community, there's often pressure from families to return to their partner. ""We need help. But it's very hard to get staff out here, so the whole situation is really frustrating and really upsetting."" The police investigation is ongoing, with detectives planning to fly to the bush community in coming days to interview residents. The evacuation comes amid growing calls for violence-prevention programs tailored to protecting First Nations women; research shows they are 11 times more likes to die from assault. The Kimberley courts regularly hear horrific cases of abuse. Earlier this year, a man was jailed after he and his nephew raped a woman who they had lured from the local women's refuge. In her victim impact statement, the victim said her family had shunned her when they found out she had been sexually assaulted. In a separate case, Kimberley man Daniel Chungarai was jailed for subjecting his partner to a six-hour ordeal, in which he punched her while she was breastfeeding, shaved her head, stabbed her repeatedly, jumped on her, and tied her feet together with electrical cord. The couple's children witnessed the assaults and one — a 12-month-old baby — was showered with broken glass. Most northern towns have women's refuges run by local Aboriginal organisations, but thousands of people live in bush communities where support is limited for those wanting to escape a violent relationship. Community leaders say there is also a desperate need for programs to empower young women and challenge the normalisation of violence linked to jealousy and controlling relationships. Earlier this month, Women's Safety Minister Anne Ruston committed to developing a standalone strategy for Indigenous communities, to sit alongside the national plan currently being developed to end violence against women. The existing plan has been in place for twelve years, and the new documents will come into effect for a decade, starting in July next year. Indigenous rights activist June Oscar, the Aboriginal and Torres Strait Islander Social Justice Commissioner, met Minister for Aboriginal Australians Ken Wyatt last week in Broome to discuss the issue. ""I think we are making some change, but it is slow,"" Ms Oscar said after the meeting. ""We must grasp this opportunity to be frank and honest about the issues. ""But we need other ministers and all parliamentarians to listen; not just Indigenous affairs, because local women are bringing solutions to the table."" Minister Wyatt said he was committed to bringing about practical change. ""We are increasing the budget in this [domestic violence] area, but I do know there are gaps,"" he said. ""Isolation and distance to services is always problematic ... and in some circumstances people are aware of the [violence], but because they're in a small community they don't report it. ""This is a priority one for me, because the flow-on effect to children is having the visual images of a battered mother, or a battered aunty, or a battered sister. ""And that is unacceptable and it is cowardly."" Minister Ruston's office says the government is working with the Aboriginal and Torres Strait Islander Advisory Council, state and territory governments and Indigenous communities to develop the plans within the first half of 2022. We acknowledge Aboriginal and Torres Strait Islander peoples as the First Australians and Traditional Custodians of the lands where we live, learn, and work. This service may include material from Agence France-Presse (AFP), APTN, Reuters, AAP, CNN and the BBC World Service which is copyright and cannot be reproduced. AEST = Australian Eastern Standard Time which is 10 hours ahead of GMT (Greenwich Mean Time)"
