,topic,category,content
11,"Safety audit finds 'immediate, severe risk' to residents at a Gold Coast aged care centre",society,"  Safety audit finds 'immediate and severe risk' to Southport Lodge aged care centre residents For the latest flood and weather warnings in Queensland, search on ABC Emergency A Gold Coast nursing home has failed every quality standard in a surprise audit by the Aged Care Quality and Safety Commission (ACQSC). A report published by the ACQSC shows the Southport Lodge was non-compliant in all eight of its measured quality standards during an audit conducted December 15-18, 2020. The ACQSC identified that there was an ""immediate and severe risk"" to the safety, health or wellbeing of Southport Lodge residents. It has imposed a six-month sanction on the Southport Lodge, barring it from receiving Commonwealth subsidies for any new care recipients for six months. ACQSC's report said the facility did not have a sufficiently skilled workforce to ""provide safe and timely quality care"". ""The service does not adequately demonstrate that deterioration or change of a consumer's mental health, cognitive or physical function, capacity or condition is recognised and responded to appropriately, specifically in relation to consumers who experience a fall overnight or develop an acute respiratory illness,"" the report says. ""There are no registered staff available overnight to assess consumers who may experience a deterioration during this time."" A lack of understanding of strategies required to minimise a potential COVID-19 outbreak was also noted, as well as no documented palliative care or end of life procedures. The facility also faced losing its approved aged care provider status unless it appointed an adviser to help it comply with ACQSC standards, and provided relevant training within six months for officers, employees and agents. The ACQSC said Southport Lodge, which is owned by Planlow Pty Ltd, had already taken action, appointing an adviser on December 31, and it would continue to be monitored. The Southport Lodge has been contacted for comment. Fadden Federal MP Stuart Robert said the health, safety and wellbeing of senior Australians was of utmost importance to the Australian Government. ""If the provider fails to take timely remedial action, there are other actions that the commission may take to ensure the safety of care recipients,"" he said. ""The Serious Incident Response Scheme legislation includes additional regulatory tools providing the Aged Care Quality and Safety Commissioner with functions and powers to respond to serious incidents and provide compliance notices and directions to take action, and will also include imposing civil penalties, infringement notices, enforceable undertakings, and injunctions."" It follows the abrupt closure of the Earle Haven nursing home in Nerang in 2019, which left 68 elderly residents homeless. Earle Haven also formed part of the Royal Commission into Aged Care, which heard half of the residents were being physically restrained in the weeks before it closed. Aged and Disability Advocacy Australia CEO Geoff Rowe said he was surprised by the breaches. ""What really concerns me is this is happening at a time when there is a spotlight on aged care,"" he said. ""Over the past 18 months they have had a Royal Commission that has been looking at the quality of care in aged care and you would think that is a time when providers would be on their absolute best behaviour."" He said unannounced audits by the ACQSC to nursing homes, like the Southport Lodge, were turning up concerning results. ""Rather than in time gone by where aged care facilities were told, 'You're going to have an audit on this date, you can expect the quality auditors to come in', we saw quite bizarre things happening — and this is not about Southport Lodge — but certainly other facilities on the Gold Coast where special crockery and cutlery was brought in for the audit, there were special meals, clients who were seen as difficult were taken out for the day,"" he said. ""There was a real facade around the whole audit process. ""Now with the unannounced visits, they're just turning up and getting a phone call to say, 'We're out the front, we're coming in' and we're seeing it, warts and all."" Beth Mohle from the Queensland Nurses and Midwives Union said the issues raised reflected ""a fundamental failing"" of the aged care system. ""There's not even a requirement for there to be one registered nurse on duty 24 hours a day in our aged care facilities,"" she said. We acknowledge Aboriginal and Torres Strait Islander peoples as the First Australians and Traditional Custodians of the lands where we live, learn, and work. This service may include material from Agence France-Presse (AFP), APTN, Reuters, AAP, CNN and the BBC World Service which is copyright and cannot be reproduced. AEST = Australian Eastern Standard Time which is 10 hours ahead of GMT (Greenwich Mean Time)"
12,'I don't need alcohol to be myself': Why more people are going booze-free,society,"  Sober lifestyle grows in popularity, with more Australians giving up alcohol For the latest flood and weather warnings in Queensland, search on ABC Emergency Ten years ago, teenager Ezrah Waith was in a bustling nightclub on the Gold Coast's glitter strip, with lights flashing and music pumping, when he had an epiphany. ""I just remember standing in the middle of Sin City and realising I didn't need alcohol to be myself,"" Ezrah said. It was almost sacrilege in the schoolies' capital of Australia, where drinking alcohol is a veritable right of passage for many. ""They call it 'liquid courage' for a reason — because it gives people the confidence to do things, but I felt I was always comfortable with myself."" Now 30, Ezrah and his wife Tyrene are proud to remain booze-free and it seems their sober lifestyle may be catching on. According to an Australian Institute of Health and Welfare (AIHW) triennial survey, the number of people who had ditched the drink rose from 1.5 million to 1.9 million between 2016 and 2019. Weight gain and hangovers were cited among the reasons. The AIHW report found the proportion of ex-drinkers had fluctuated since 2001, but 2019 recorded the highest proportion of ex-drinkers over that period. The coronavirus pandemic may have disrupted people's drinking habits in 2020, however, the AIHW said no clear patterns had emerged yet of the effects of COVID-19 restrictions on alcohol and other drug consumption. Christmas parties and work social gatherings can often be an irritating experience for the sober-minded, but the advent of no and low-alcohol drinks has allowed people like Ezrah and Tyrene Waith to fly under the radar. ""It's not so much that the questions annoy me, but it gets repetitive after a while if you are constantly explaining why you are not drinking,"" Ezrah said. ""I like non-alcoholic beer and gin and tonics; I've found ones that are quite enjoyable. They taste very similar [to an alcoholic drink]. ""It's more socially acceptable to drink non-alcoholics. When you are not drinking, people think you are not having fun. ""People will hardly ever notice you're drinking non-alcoholics."" Faye Lawrence is the founder of Untoxicated, a non-drinking network of 8,000 Australians who socialise over morning teas and activities like mini golf and camping. They are part of a growing movement called ""sober curious"". Ms Lawrence said whether people drank alcohol or not did not have to be ""black or white"". ""It's about having that sense of curiosity and picking for the individual what works for them and how they want to show up in the world. ""It's that mindful drinking, where one day you might have an alcohol-free vodka or wine, and other days you might want to go out with mates and have a big night."" Ms Lawrence said ""cool, fun and attractive"" alcohol-free alternatives helped non-drinkers overcome the fear of missing out. ""We're social animals, we also want to fit in and if you turn up and have an alcohol-free cocktail, no-one is going to notice that you're not drinking, so a big deal doesn't have to be made about it,"" she said. With the rise of the sober curious, Burleigh-based distiller Catie Fry is tapping into a market that traditionally only catered for beer and wine drinkers. Ms Fry is the first distiller in Australia to produce a zero-alcohol and mid-strength range of white spirits. ""I wanted to make something that was complex, bold and rounded, but do it in a lower-alcohol form and be able to have a couple of drinks and be okay,"" Ms Fry said. ""You'd call them a botanical vodka, but they're crafted very much like a gin."" The distiller's inspiration came after being treated ""like a house plant"" during her two pregnancies, when the only drink options were water or juice. ""It's distilled in exactly the same way; I work with 21 different botanicals all up in my range of three infusions and I craft my botanicals with a wheat-based spirit,"" Ms Fry said. The mother, wife and entrepreneur said she was also determined to change the culture of the male-dominated distilling industry. ""I didn't have much of a chance to be in the distillery uninterrupted, which I get. You can't have kids running around in the distillery, someone's got to look after them,"" she said. ""But I got excluded a little bit, so I bought a copper still and experimented when the kids went to sleep."" Her three varieties are marketed to a female audience, but the mother of two said she was surprised by the overwhelming interest they had from men. ""People said if I was too feminine or female-focused, then you'll lose half your market and alienate men,"" she said. ""But I don't think anyone's ever said that to Jack Daniel, Jim Beam, Johnny Walker or XXXX, which are marketed to men and consumed by women. ""Little wins like this for women show young girls that they can be a distiller too, or have their own distilling company, or mechanic shop, or anything really."" Ms Fry hoped her company would help bring about a shift in the drinking landscape. ""Things are changing and there are so many amazing craft distilleries that are getting with the times and becoming more inclusive so look around, be proud and you'll find others who want to come along with you,"" she said. We acknowledge Aboriginal and Torres Strait Islander peoples as the First Australians and Traditional Custodians of the lands where we live, learn, and work. This service may include material from Agence France-Presse (AFP), APTN, Reuters, AAP, CNN and the BBC World Service which is copyright and cannot be reproduced. AEST = Australian Eastern Standard Time which is 10 hours ahead of GMT (Greenwich Mean Time)"
13,"In 2021, the NT will introduce surrogacy laws — but that's 'too late' for some",society,"  The NT Government will introduce surrogacy laws in 2021 — but it's 'too late' for some For the latest flood and weather warnings in Queensland, search on ABC Emergency Tara and Luke Kaspar have been trying to have a baby for the past decade. They've spent nearly $100,000, raided their superannuation accounts and been through 28 rounds of in-vitro fertilization (IVF) — falling pregnant twice and miscarrying both times. Luke, who comes from a big family, says as tough as it's been financially, it's been tougher still on their mental health. ""It was tough mentally and on the hip pocket, but more mentally,"" he says. After years in limbo, Tara and Luke are just months away from becoming parents using Tara's sister as a surrogate and egg donor. But the couple lives in the Northern Territory — the only jurisdiction in Australia with no surrogacy laws — so their journey is far from over. When their twins are born in June, Tara and Luke will find themselves in a stressful legal purgatory, because surrogacy in the NT is neither legal or illegal. Doctors still don't know why Tara hasn't been able to carry a baby to term. After her second miscarriage, Tara and Luke asked their doctor about legal surrogacy options. They say they were stunned to discover the Northern Territory had none. Darwin council alderman and mother-of-two Rebecca Want de Rowe says she was similarly shocked when making her own enquires about surrogacy five years ago. Rebecca, whose husband Kent is the Director of NT Parliament, had a miscarriage in 2016 when she was 11 weeks pregnant with the couple's third child. ""Through my grief, and sharing my story with a lot of people, it really became obvious how many women out there are struggling with infertility [and] miscarriages,"" she says. ""People who I thought were choosing to not have a family, were actually not having families because they were not able to."" Rebecca wanted to be a surrogate herself, but without the legal framework to support her, she wasn't able to push ahead with her plans without leaving the Northern Territory. So, in 2018, she launched a petition calling on the NT Government to introduce altruistic surrogacy legislation, laws which can't be used for financial gain. The NT Government has now committed to introducing surrogacy legislation, but with the bill yet to be introduced or debated in NT Parliament, their ascension to law could be months off. For Rebecca, that means having to travel interstate to become a surrogate for friends in Sydney — if coronavirus travel restrictions allow — which will also mean taking time away from her job and two young children. And for Tara and Luke, whose children are due in June, it will also be too late. Tara's sister Renee Andrews says she didn't hesitate to offer to be a surrogate for her sister and Luke. ""Of course I was going to do it, that's my younger sister,"" Renee says. ""They're very loving people and these kids are going to be very blessed."" Renee, who has three young daughters herself, will deliver Tara and Luke's twins at the end of June. But because Renee is giving birth to the babies, and there's no surrogacy legislation in the Territory, it will be Renee's name on their birth certificates — not Tara's. Tara will need to adopt the babies or push for a parenting order after they are born and until then, she won't be able to get maternity leave, which means they will continue to chew into their savings. ""It's like we haven't endured enough pain to have to endure more,"" Tara says. ""It feels like it's never going to end, we'll have to keep jumping hurdles."" Sarah Jefford is the only lawyer in Australia who exclusively practices in surrogacy and donor conception law in Australia. She's also an IVF mum, egg donor and former surrogate and describes helping another couple start their family as ""one of the very best things"" she's ever done. ""When surrogacy hits the headlines, it's often negative,"" Ms Jefford says. ""I never once regretted it, and I've never spoken to a surrogate that has regretted it."" Across Australia, between 60 and 80 babies are born via surrogacy every year, and Ms Jefford wants Australian families to be able to discuss infertility without the fear of stigma. She says she knows dozens of Northern Territory families who have moved interstate to access surrogacy or used an overseas surrogate because they didn't want to relocate. ""I probably get one or two enquires a month from people in the Northern Territory who think, 'I need to pack up and go,'"" Ms Jefford says. ""All the other jurisdictions have had surrogacy legislation from as early as 2004. ""Most surrogacy legislation is from about 2008 to 2010, so it's been a while, it would have been nice if the Northern Territory had caught up a little sooner."" For families who choose to stay in the Northern Territory, such as Tara and Luke, the way forward isn't clear cut. And Ms Jefford says any new laws introduced in the NT must put the rights of the child first, before the interests of the surrogate or the intending parents. ""Any laws around children really need to focus on the child's best interests at heart,"" Sarah says. This means giving children access to information about who their biological parents are and if they're conceived with the help of a donor. Tara and Luke hope that sharing their story will help other Northern Territory families struggling with infertility, and to let them know they are not alone and there is hope. Despite the legal challenges ahead, Tara and Luke are simply grateful to have two healthy babies on the way. ""It's amazing, thinking we'd never have kids, to now having two,"" Tara says. They're catching up on all the sleep they can before the twins come home in June. We acknowledge Aboriginal and Torres Strait Islander peoples as the First Australians and Traditional Custodians of the lands where we live, learn, and work. This service may include material from Agence France-Presse (AFP), APTN, Reuters, AAP, CNN and the BBC World Service which is copyright and cannot be reproduced. AEST = Australian Eastern Standard Time which is 10 hours ahead of GMT (Greenwich Mean Time)"
14,Regional Victoria and Melburnians embrace as COVID-19's 'ring of steel' falls,society,"  For the latest flood and weather warnings in Queensland, search on ABC Emergency Melbourne woman Sarah Vincent was on the road with her family well before the crack of dawn today as Victoria's ""ring of steel"" was lifted. Over four months, Ms Vincent and millions of friends and family members were kept apart by the separation of greater Melbourne and the rest of the state, enforced at the height of the state's coronavirus crisis to limit travel. On Sunday at 11:59pm it was finally relaxed, and Melburnians and regional Victorians came together on Monday for the first time since July. Melbourne has come into line with regional Victoria's coronavirus restrictions. Here's what that means for cinemas, sport and travel. ""We know so many people have missed those they love the most, those they need to see and have been desperately keen to see for such a long period of time,"" Premier Daniel Andrews said. Ms Vincent had not seen her mother, Wodonga resident Jennie Johnson, in six months — aside from the odd message or video call. The escape to the north-east Victoria also meant her two-year-old son Blake would have more space to play and spend precious time with his grandparents. ""It felt so good to see my mum and have a cuddle. I've been waiting a long time for it,"" Ms Vincent said. ""It's been very difficult, especially with a little one and not being able to have everyone around. ""I had a lot of mental health issues being in lockdown all the time, I couldn't go anywhere."" Jennie Johnson said she was on the verge of tears when she saw her daughter pull into the driveway with her young family after counting down the hours. ""We've been hanging out for this, it's been very difficult not being able to see them all,"" Ms Johnson said. ""It's been difficult not watching the little one grow up — missing his birthday, missing everyone's birthdays. It's given me a new appreciation for family."" The family said they planned to go on picnics, visit the shops, and spend some quality time together. ""Blake seeing his grandparents is a massive thing, and him being able to be a kid and run around having fun, getting muddy, and not being locked down,"" Ms Vincent said. ""It's so different out here. It's like I can breathe again."" Melbourne woman Zoe told ABC Radio she was headed for Anglesea this morning for a surf at long last. She told Virginia Trioli's Mornings program it ""felt like life was coming back"". ""It looks like it's going to be heaven,"" she said. ""We gave a big 'whoop' when we hit the 25-kilometre mark and the ring of steel, and said 'goodbye Porpoise Spit'."" Kate from Ballarat said she was looking forward to seeing her son this weekend, having been separated for five months. She said the most frustrating thing had been tough restrictions in areas of the state where there had been few cases. ""We've been waiting for Melbourne to open up, we've had very low numbers. Some areas in the western region have had none,"" she said. ""You've got little businesses that are struggling because we're waiting for the whole state to be on par, and that's the hardest part."" The timing of the Government's decision could not have been better for Gordon Bahn from Leongatha in South Gippsland. Mr Bahn and his wife Gillian today celebrated their 52nd wedding anniversary with their daughter Diane and granddaughter Zoe who travelled from their home in Melbourne's south-east. He said it was ""lovely"" to see his family for the first since June. ""One of the things that Diane wanted to come down for was to wish us a happy anniversary,"" Mr Bahn said. ""And Zoe loves to do her cooking, so she cooked us a little cake for our anniversary, that was very enjoyable, and just an enjoyable time to have them here together."" But he said he did not have plans to travel to Melbourne to see his other grandchildren while there was still a risk of catching coronavirus. Mental health service Beyond Blue received thousands of calls from Victorians seeking support over the past four months. Among the main queries received were concerns about isolation, general uncertainty, job losses, and not being in touch with family and friends. Beyond Blue's lead clinical adviser, Grant Blashki, said with the state open again, there was a great feeling of enthusiasm and relief as people could reunite. We offer tailored front pages for local audiences in each state and territory. Find out how to opt in for more Victorian news. ""There's obviously a lot of joy and relief, but I'm also seeing mixed emotions,"" Dr Blashki said. ""There's a bit of apprehension — particularly older members of the community who have lost confidence and are nervous, and also those who may be dealing with anxiety getting back out there. ""I think a lot of regional people not having access to tourist dollars has been a really big hit and they're excited to see people visit again."" Dr Blashki said it could be tough for some people affected by the lockdown and separation moving forward. ""I'm suggesting people take it slow, particularly those who have had anxiety or stress."" For Beyond Blue's Coronavirus Mental Wellbeing Support Service call 1800 512 348. See our full coverage of coronavirus We acknowledge Aboriginal and Torres Strait Islander peoples as the First Australians and Traditional Custodians of the lands where we live, learn, and work. This service may include material from Agence France-Presse (AFP), APTN, Reuters, AAP, CNN and the BBC World Service which is copyright and cannot be reproduced. AEST = Australian Eastern Standard Time which is 10 hours ahead of GMT (Greenwich Mean Time)"
