,topic,category,content
15,"Puppy prices soar during lockdown, with breeders and shelters struggling to match demand",society,"  For the latest flood and weather warnings in Queensland, search on ABC Emergency Barb Traeger knows just how hard it has become to get a dog. When she retired in June, she decided it was the perfect time to get a puppy. She had owned dogs previously, she had space at her Langwarrin home in Melbourne's outer south-east and she knew she would have the time to spend with a pet. Ms Traeger initially looked for a Jack Russell puppy online but the cheapest puppy she could find was selling for $5,000. ""They were just way out of our price, they were very expensive,"" she said. It took many applications, but Ms Traeger was able to adopt a dog instead. She has been enjoying training her dog Allie during Melbourne's extended lockdowns, saying it has given her something positive to focus on. For teacher Kate Ellis, it was a case of just in time, when she purchased her puppy. She organised to buy a dog before COVID-19 for her 40th birthday, but by the time she was able to pick up her Airedale puppy, Melbourne was in its first lockdown. ""It was incredible timing, I was living on my own at the time and I got this incredibly vivacious, very hilarious dog,"" she said. She said her puppy brought a lot of fun to her life during a difficult time. Data from Melbourne councils show just how strong demand for dogs has been. In Maribyrnong City Council in Melbourne's west, more than 1,000 more dogs have been registered this year, compared to the same time period last year. Hume City Council in Melbourne's north has seen nearly 700 more dogs registered since lockdown started this year compared to the same time period last year, while the City of Stonnington in the city's south has seen a rise of nearly 200 extra dogs being registered. Read our full coverage of the coronavirus pandemic The RSPCA's Tegan McPherson said the organisation had seen a significant increase in applications for pets this year. ""We have seen in excess of 26,000 online applications to adopt a pet since the start of the pandemic,"" she said. She said the RSPCA has had hundreds of applications for some dogs. ""It has been really difficult for the staff as well, because obviously people are disappointed or become a bit frustrated (if they miss out on a dog) and unfortunately it is just the nature of the demand we are seeing at the moment,"" she said. Border Collie breeder Jacqui from Gippsland said demand for her puppies had gone through the roof since lockdowns started, with a lot of enquiries coming from Melbourne. But she said some people were not thinking through how big a decision it was to get a dog. ""You don't just get a puppy because you are bored, you get a puppy because you have been looking for a while, you are focusing on it and you want a puppy long-term,"" she said. Jacqui is worried the state will see more dogs in shelters after lockdowns end. She has not raised her puppy prices because of the pandemic, and said she was shocked to see some border collie puppies being sold for about double the usual price. The Australian Association of Pet Dog Breeders president Tracee Rushton said there had been an incredible jump in demand particularly for small, apartment-friendly dogs, and oodles — dogs that are crossed with a poodle. Ms Rushton said registered breeders had to match market rates, to avoid creating a secondary puppy market. ""The problem is if we don't price our puppies in accordance with the current market rate, what we have found is that we get people purchasing puppies for a cheap price, then turning around and immediately reselling those puppies for a greater amount,"" she said. ""That is not what we want to see as breeders, we want to see our puppies go to a forever home."" She said families struggling to find or afford a dog could consider adopting a breeding dog, with many retired by the age of about four, or contacting breeders to see if they are willing to negotiate on the price. While Julie Nelson from the Master Dog Breeders and Associates said supply had become a problem during the pandemic because many Victorians usually bought dogs from interstate, but that had become difficult with border closures. See our full coverage of coronavirus We acknowledge Aboriginal and Torres Strait Islander peoples as the First Australians and Traditional Custodians of the lands where we live, learn, and work. This service may include material from Agence France-Presse (AFP), APTN, Reuters, AAP, CNN and the BBC World Service which is copyright and cannot be reproduced. AEST = Australian Eastern Standard Time which is 10 hours ahead of GMT (Greenwich Mean Time)"
16,"'Parliamentarian, soldier, rail enthusiast, family man': Tim Fischer memorial plaque unveiled at Albury Train Station",society,"  Tim Fischer memorial plaque unveiled at Albury Train Station For the latest flood and weather warnings in Queensland, search on ABC Emergency Members of Tim Fischer's family have attended a memorial plaque unveiling at the Albury Train Station to honour the former deputy prime minister. The plaque was unveiled on the first anniversary of Mr Fischer's state funeral that was held in Albury on August 29, 2019. Although Mr Fischer's wife, Judy Brewer, was unable to attend the event due to the coronavirus pandemic and the NSW-Victoria border closure, Ms Brewer witnessed the event via FaceTime. The Fischer family was represented by Mr Fischer's brother, Tony Fischer, and his sister, Vicki Baudry, who unveiled the plaque. As well as being a parliamentarian, diplomat, author, rail enthusiast, farmer and soldier Tim Fischer was also a broadcaster and chose to host his ABC Great Train Show podcast series out of the Wodonga studios in 2008 and 2009. The plaque was gifted by the ABC and honoured Mr Fischer's contribution to the local community and beyond and acknowledged his love of the Albury Train Station. Ms Brewer said she was pleased a memorial plaque for her husband was now at the station. She said the station was one of his favourite places and he often used it for travel, meetings, interviews and book launches. ""It  was our 'meeting place' in Albury both before we were married and after. He could always entertain himself there if I was running late!,"" she said. Before his state funeral was held at the Albury Entertainment Centre last year, Mr Fischer's funeral train stopped at the station and a military service was held on the platform to honour the Vietnam veteran. In the Great Train Show podcast series, Mr Fischer often spoke of his love for the station and its important place in Australian history. The Albury Railway Station is heritage-listed and officially opened in 1882. It was designed by the engineer-in-charge for the New South Wales Railways, John Whitton, and includes a platform that is 455 metres long — one of the longest in the southern hemisphere. The station played a significant role in the Second World War, the different gauge system between states on the New South Wales and Victorian border meant hundreds of soldiers swapped trains in Albury during the war. Mr Fischer often spoke of the individuals who stood on its platform due to the change in rail gauge. Notable travellers included authors Mark Twain and Agatha Christie, opera singer Dame Nellie Melba, cricketer Don Bradman, and military leaders General Sir John Monash and General Douglas MacArthur. The Duke of York, who later became King George VI, would have once stood on the platform, as would Saint Mary MacKillop and various politicians including Australia's first prime minister Sir Edmund Barton and the first woman elected to the Australian House of Representatives, Dame Enid Lyons. We acknowledge Aboriginal and Torres Strait Islander peoples as the First Australians and Traditional Custodians of the lands where we live, learn, and work. This service may include material from Agence France-Presse (AFP), APTN, Reuters, AAP, CNN and the BBC World Service which is copyright and cannot be reproduced. AEST = Australian Eastern Standard Time which is 10 hours ahead of GMT (Greenwich Mean Time)"
17,Adelaide Showground 'eerie' with inactivity after first cancellation in 75 years,society,"  Adelaide Showground 'eerie' with inactivity after first cancellation in 75 years For the latest flood and weather warnings in Queensland, search on ABC Emergency A veritable ghost town has replaced what should have been the city's busiest location at this time of year, according to Royal Adelaide Show (RAS) stakeholders, but all is not lost thanks to online interest in some of its most popular offerings. Originally scheduled for a September 4 start, the Adelaide Show's stages, carnival rides, marquees, stables and exhibition displays would have been getting assembled behind the Showground fences for an annual event that brings about $317 million to the SA economy. ""We'd be in the final stages of set-up here, about seven days from where the livestock start rolling in, so we'd be right in the thick of it,"" Royal Agricultural and Horticultural Society of SA chief executive John Rothwell said. Instead, the show was cancelled in April due to COVID-19 restrictions, the biggest in a string of event cancellations at the 26-hectare multi-purpose venue in Adelaide's inner-south. Other than skeleton staff, maintenance workers and perhaps a few tourists in its new caravan park, the showground has been at its quietest since the last disruption during WWII. Mr Rothwell said the ""dark days"" in the pandemic's first few months created an ""eerie"" atmosphere at the venue. Just 10 per cent of its full-time staff were still coming to work, while others were made redundant or put on reduced hours with the support of the Federal Government's JobKeeper package. ""We have lost 95 per cent of our income, which is extraordinary, and it happened in the third week of March when all our events and exhibitions just disappeared overnight,"" he said. The show is by far the biggest loss, however, accounting for up to 60 per cent of the society's revenue in regular years. The digital world has offered some respite, with the show's two high-profile ram sales, the Elite Sale and the Merino and Poll Merino sale, to be held online. The Royal Adelaide Beer and Cider Awards will also still be held, along with its Wine Show, despite the public elements of those competitions having been cancelled. ""We have a few exhibitions and events still booked for the last quarter of this year, so our focus now is on those we can accommodate, as well as those in February and March next year,"" Mr Rothwell said. Other stakeholders feeling the loss include Showbag Shop director Emily Williams, whose company usually produces about 1.1 million showbags for capital city and rural shows, including about 250,000 for the Adelaide event alone. She said 90 per cent of their income came from shows right across the country, most of which had been cancelled. Despite her company also relying on the JobKeeper package to retain staff on reduced hours, Ms Williams said they turned out to be busier than expected thanks to a boost in showbag sales online. ""I think there are a lot of families who couldn't go to their show but wanted to retain their tradition of buying showbags,"" she said. ""When they hear they can still buy them, they do. ""It can also be people buying gifts, showbags for the kids to keep them entertained, birthday presents and kid's parties."" Mr Rothwell said the first time the Adelaide Show was cancelled was during the Victorian Gold Rush of 1852 when men rushed interstate, erroneously ""assuming that the women who were left behind could not run the show"". It was also cancelled during the WWI and WWII years, as well as during the Spanish Flu pandemic, which was spread by soldiers returning from WW1. He said the society had gone into debt in order to stay afloat, but had benefited from the City of Unley waiving its council rates for 12 months, and a Federal grant of more than $2 million. It had also used the time to finish a versatile caravan park ahead of schedule in the south-east corner of the showgrounds, where old stables were demolished. Among those missing their chance to present their best efforts at the Adelaide Show this year are photographers, artists, cooks, horticulturists, pet owners, livestock workers, dairy farmers, tropical fish enthusiasts and flower lovers, to name a few, plus countless companies from the exhibition halls. Embroiderers' Guild of SA member Susannah Whitney, who won Best Handicraft Exhibit in Show during 2019, said members would otherwise be very busy preparing for the show. ""I think everyone is still working on things, but we just haven't been able to get together and see them,"" she said. ""Normally we have our stitching group meetings every week, where we all meet and stitch together and look at what each other is doing, but we had to close down in March and are only just starting to reopen."" We acknowledge Aboriginal and Torres Strait Islander peoples as the First Australians and Traditional Custodians of the lands where we live, learn, and work. This service may include material from Agence France-Presse (AFP), APTN, Reuters, AAP, CNN and the BBC World Service which is copyright and cannot be reproduced. AEST = Australian Eastern Standard Time which is 10 hours ahead of GMT (Greenwich Mean Time)"
18,National shearer shortage looms as New Zealanders battle the border,society," ABC Rural For the latest flood and weather warnings in Queensland, search on ABC Emergency Australia's shearing contractors and wool producers fear a national shearer shortage with COVID-19 border closures and travel restrictions, making it difficult for New Zealand shearers to enter the country. Key points: Every August an influx of 500 shearers from New Zealand arrive in Australia primed for spring shearing — but not this year. They handle at least seven million sheep over three months and head home to New Zealand for their own season in December. Shearing Contractors Association of Australia (SCAA) secretary Jason Letchford said the looming workforce shortage was a major concern for the industry. ""We are really in a desperate situation to get the sheep shorn this year in spring,"" Ms Letchford said. Read our full coverage of the coronavirus pandemic He said if sheep were not shorn in time, the season would be extended, which would cause financial losses for producers and also pose a risk to animal welfare. ""If you don't have good animal husbandry practises you lose your asset,"" he said. The SCAA is working with the Department of Agriculture, Home Affairs and state governments to find an agreement on New Zealand shearers coming to Australia. Mr Letchford believed a fast and proper solution was needed. ""I realise that the governments are walking this very narrow band between safety and keeping the virus at stake, but there are jobs and commercial issues at stake,"" he said. ""It can't just be a blanket approach where we turn of the tap in one area and it has unintended consequences across other industries. ""But we have a critical shortage of shearers in Australia and we the New Zealand workers who are COVID-19 free,"" he said. ""At this point in time with the $3,000 entry for quarantining and actually getting through an Australian port is making it look unlikely any will be able to come across."" Mr Letchford said with the drought breaking in many parts of Australia the national sheep flock was only set to surge from the current 65 million head as farmers look to rebuild and retain more stock and more shearers would be needed. Craig Gilbert, who runs Woolaway Contract Shearing in Naracoorte, South Australia, feared he might not be unable to secure a full workforce if the agreements for NZ shearers entering Australia did not change. His business brings half of its staff into the area as seasonal workers from interstate and overseas, but he might have to work with a skeleton workforce and ask growers for more flexible shearing arrangements. ""We simply don't have the numbers of shearers here in Australia to cover all that to get it done in the time frames that growers require,"" Mr Gilbert said. ""If the sheep need to get shorn and they don't get shorn that will have a significant impact on the area, on growers and on their price and on the wellbeing of the animals."" ""It's not just like you can say we are going to shear your sheep in December instead of October. Of course the season changes, and it gets a bit hotter, the animals can suffer from grass seeds, they can suffer from flies, and that's distressing for the animal."" He found it ""somewhat frustrating"" to see New Zealand shearers denied entry to Australia and believed the Department of Agriculture needed to step up and understand the significance of shearer coming from New Zealand, which now was a COVID-19 free country. Mr Letchford recognised many Australian's were out of work due COVID-19 and were looking for work. Shearing was still a skilled trade that had to be learnt over time. ""We do welcome people to the industry but the reality is you won't be able to pick it up overnight, so we are not going to be able to retrain a Virgin flight person to be a be a shearer suddenly,"" Mr Letchford said. ""People come into the industry and start as a shed hand and we would love that, and there is plenty of training available for that."" However, he is not aware of any people from COVID-19 impacted industries trying to enter the shearing and wool handling industry. ""New Zealand has the labour force that we need as we just don't have enough skilled workers here in Australia to do it."" ""It's very frustrating that we can't easily access those workers in New Zealand."" But it's not only Australia's shearing sheds that are short-staffed. New Zealand's industry also fears a workforce shortage for its peak season starting from November to March, when usually shearers from Australia and the UK flock to the nation. New Zealand Shearing Contractors Association president Mark Barrowcliffe said a delay of their season was on the cards and despite talks with their Department of Immigration there were additional challenges to bring overseas shearers into the country. ""We have to comply with quarantining rules for the staff, that's putting a cost on either the person coming over or the employer, so there is a few issues to deal with there,"" Mr Barrowcliffe said. ""We want to do it faithfully for the employee and whatever country they are coming to or are leaving from."" While the industry remained hopeful about their discussions with the Department of Immigration, Mr Barrowcliffe said they were also upskilling local stuff to partly pre-empt the looming shortage. However, with the situation of New Zealand shearers heading to Australia, he believed there was a 'bigger reluctance' from workers due to the increasing coronavirus cases in Australia. ""We are a very family-orientated industry, so once you move away from your family at the moment, you can't just pop back quickly if something happens, and the family coming first is definitely keeping a few people at home,"" he said. ""They are just not prepared to risk their own communities or risk not being able to attend and event if something happened."" The Australian Government Department of Agriculture, Water and the Environment said in a statement provided to the ABC that WoolProducers Australia (WPA) and the National Farmers' Federation (NFF) hade identified the need for more than 480 seasonal New Zealand shearers and shedhands for July-November. ""The department recognises that the wool industry traditionally uses a mobile pool of workers, including a group that moves from New Zealand to Australia for a substantial proportion of its workers and that extended delays to shearing can pose serious problems with regard to animal welfare, on top of the commercial impact for wool producers,"" the statement said. WPA and the NFF are seeking support for New Zealand shearers and shedhands to enter Australia using exemptions from the Australian Border Force Commissioner. In the statement, the Department of Agriculture said, at this point in time with Australia's borders closed, the only means to get workers in is for travellers to seek an exemption from the Australian Border Force Commissioner based on those workers providing critical skills. ""Ultimately it is the decision of the Australian Border Force Commissioner as to whether or not to approve a border exemption."" The movement of workers between different states is governed by state health directions, the statement said. ""It is important that potential workers and employers understand those requirements before they seek to travel."" ""Feedback from industry to the department is that recent border closures are, in general, being managed well and not causing significant difficulties."" See our full coverage of coronavirus We acknowledge Aboriginal and Torres Strait Islander peoples as the First Australians and Traditional Custodians of the lands where we live, learn, and work. This service may include material from Agence France-Presse (AFP), APTN, Reuters, AAP, CNN and the BBC World Service which is copyright and cannot be reproduced. AEST = Australian Eastern Standard Time which is 10 hours ahead of GMT (Greenwich Mean Time)"
