,topic,category,content
8,A majority of Australians say they're trying to lose weight. Jen's not one of them,society,"  The Australia Talks survey has revealed 60pc of us are trying to lose weight. Let's unpack why For the latest flood and weather warnings in Queensland, search on ABC Emergency Jen Bray spent years of her life on diets, but these days she isn't trying to lose weight — and that puts her in the minority. The small business owner from Melbourne said her parents put her on Weight Watchers when she was just nine years old. ""So from nine years old I learned how to count calories, how to restrict and how to deny myself things that were enjoyable and food that's not even unhealthy — I denied myself cheese and bread,"" she said. ""They're not bad foods, but I learned before I was even a teenager to stop eating those things."" The results from the Australia Talks National Survey 2021 reveal 60 per cent of Australians are currently trying to lose weight. In fact, more people agree than disagree with this statement across all demographics — age, gender, income, region, education, ancestry and voting preference. Jen said she started to earn praise for her weight loss when she left school, but it came at a huge personal cost. ""The more weight I lost, the more attention I got, the better people saw me — society saw me — but the worse I felt,"" she said. ""I was living in constant fear of putting on weight and my whole life became about staying thin and it was at a huge cost where I couldn't go out for dinner anymore, I didn't even have enough energy to socialise."" Things hit rock bottom when one day, on the way to uni, she did not have enough energy to get off the tram. ""I couldn't get off, I couldn't stand up, I couldn't will my body to move,"" she said. Jen's mum picked her up and took her to the doctor — the event sparked a decade-long recovery. ""Even though I wanted to change, it was still so hard,"" she said. ""I'd kick the wall in the dietician's office and scream ... even just wanting to get better wasn't enough, it was many years of trying to change the way I felt about myself."" ""I've slowly gotten better and now I follow so many accounts on Instagram of beautiful fat people enjoying life, and the more fat people I'm exposed to, and see that they are living and loving and enjoying themselves fat, has slowly changed the way I think."" Now 40, Jen exercises five times a week and chooses healthy foods. ""But my weight crept back to what it was when I was 18 and I feel like when it comes down to it, maybe I'm supposed to be that way, maybe … there's no such thing as an ideal way,"" she said. ""I used to think I'd rather be dead than fat, and now I turn up at the gym, the fattest person in the class and I'm proud like, I want to show people what fat people can do."" Alex Haslam, a psychology professor at the University of Queensland, said it could come down to the stigma around size. ""The fact that everybody wants to lose weight tells you something about social norms, obviously around losing weight, but more generally the idea that being overweight is seen as undesirable,"" he said. ""If you are overweight and you're seen to be overweight then you potentially open yourself up to criticism from other people. ""So in a way, what people are saying here is, I don't want to be in a group that's stigmatised."" Associate Professor Tegan Cruwys, a clinical psychologist at the Australian National University, agreed. ""We do live in a culture which does highly value certain body shapes over others, and those body shapes aren't super easy for most people to obtain, especially in an environment where we've got this hyper-availability of delicious foods and a culture that makes it challenging for people to get enough activity in a day,"" she said. ""It is the case in our society that lots of people are carrying extra weight, not just more weight than is necessarily healthy, but also more weight than is socially valued and, as a result, a lot of people are unhappy about that. ""We do see a relationship between people who want to lose weight and and poor mental health."" Dr Cruwys says weight discrimination has become an acceptable form of discrimination in society and is often presented as constructive criticism. ""There's a really strong belief that by discriminating against people with obesity, we will somehow encourage them to lose weight, that it's like an effective behaviour change strategy,"" she said. ""But in fact, we see the exact opposite — the data tends to suggest that the more people are exposed to discrimination and stigma for their weight, the more weight they gain."" We asked 60,000 Australians about their lives. See where you fit on the issues that matter. Size discrimination is something Jen has experienced firsthand. ""Every time I go to the doctor it [my weight] is constantly pathologised without even any medical tools to find out if I actually am unhealthy,"" she said. ""I keep getting told that the way I am is wrong, but I'm healthy and I exercise … and I'm still wrong."" Jen said she recently consulted an endocrinologist about whether there were any other underlying reasons she carries more weight. ""She took a bazillion tests and it came back that I was perfectly healthy, I'm healthier than most people … no diabetes, no signs of elevated blood sugar, my heart rate, everything was great and she still said, 'have you considered weight loss surgery?' ""I just find it so frustrating."" Dr Cruwys says there is a perception our bodies can be easily changed by ""health kicks"" — but that's not the reality. ""It is extremely challenging and most people who attempt to lose weight — and most people who do lose weight — will regain it,"" Dr Cruwys said. She likened it to pushing a boulder up a hill. ""We've got all these factors working against us that are kind of pushing us as a society towards weight gain and towards unhealthy lifestyles. ""And when we as individuals try to push against that, we are really fighting a losing battle most of the time."" Dr Cruwys says what tends to be more effective for long-term change is adjusting the social context we find ourselves in, rather than individual behaviours. ""When we are spending more time at organisations that support healthy lifestyles, when we are living in environments that are really walkable … those are the sorts of things that support long-term change."" According to Australia Talks, people aged 40-49 are the most likely to say they are trying to lose weight. Ray Bondzulic is one of them. The 49-year-old Brisbane-based sales manager said the reason he wanted to lose weight was to live longer, stay fit and look good. ""I think moreso I'm trying to turn back the clock a little bit,"" he said. ""I've trained on and off for a lot of years, but I've been always trying to get the top results, and then I'd go back to my old lifestyle of just eating junk food every day and drinking every night."" Ray broke his back in a jet ski accident not long ago, which gave him a new perspective on his health. ""As I get older I think health is more important than weight, even though they're kind of related, but yeah, I feel like if I'm healthier I can deal with things a lot better,"" he said. The survey also revealed 65 per cent of Australians would characterise their physical health as good or better, and almost half of Australians said they exercised several times a week. Australians are also more likely to be part of a sporting club, gym or exercise class than a religious group, social club, or political organisation. So if large portions of the population say they're healthy and exercise regularly, why is there still such a strong desire to lose weight? Tim Douge, accredited exercise physiologist at Studio 99 in Brisbane, said the survey results highlighted the disconnect between weight and health. ""Weight loss is really complex, there are a lot of different variables that go into it,"" he said. ""Our weight is often a lot more symptomatic of how we're feeling personally and it can tie into self-confidence and body issues, so people often focus on exercise for weight loss, not for health reasons."" Dr Cruwys says the survey results suggest people are much more motivated to change their physical appearance than their health. ""My sense is that what's happening there is that most of those people who are saying they want to lose weight, they're not trying to do so for health reasons by and large, even though they might associate weight loss with health."" Two years ago the ABC asked tens of thousands of people to share their thoughts, feelings and experiences. The Australia Talks National Survey is back again — here's what we found out. When it comes to getting active and exercising, Tim said weight loss alone could be the wrong motivator. ""Exercise for weight loss is really quite hard to do — you have to exercise at a high volume every day to reach success."" While Tim said people who do regular physical activity have a better chance of weight loss, the reason people stick to exercise for weight loss long-term is for the other benefits — more energy, better mental health and better sleep. ""They then stick with their lifestyle change for other, more beneficial reasons [and] weight loss becomes a nice side effect,"" he said. The Australia Talks National Survey asked 60,000 Australians about their lives and what keeps them up at night. Use our interactive tool to see the results and how your answers compare. Then, tune in at 8:00pm on Monday, June 21 to watch hosts Annabel Crabb and Nazeem Hussain take you through the key findings and explore the survey with some of Australia's best-loved celebrities. We acknowledge Aboriginal and Torres Strait Islander peoples as the First Australians and Traditional Custodians of the lands where we live, learn, and work. This service may include material from Agence France-Presse (AFP), APTN, Reuters, AAP, CNN and the BBC World Service which is copyright and cannot be reproduced. AEST = Australian Eastern Standard Time which is 10 hours ahead of GMT (Greenwich Mean Time)"
9,How to talk to your family at Easter (without summoning the Four Horsemen),society,"  How to get through difficult conversations at family lunch this Easter long weekend For the latest flood and weather warnings in Queensland, search on ABC Emergency Millions of Australians will don masks and brave highways to catch up with family this long weekend, but family lunch can sometimes take a turn for the worse. Nearly all of us have ideological and political fault lines in our immediate and extended clan, often along a generational divide. The SIgnal is the ABC's daily news podcast. Subscribe wherever you get your podcasts. Whether it's climate change, religion, border closures, or just plain old party politics, most families have topics that are conversational land mines. So how do you get through family lunch without setting one off? Georgie and her brother Charlie first started making their views known to their dad Peter when they were in their late teens. ""Georgie probably more so than Charlie, but both have got very strong thoughts about what's right and wrong,"" said Peter. Peter and his wife are both retired and live in regional Victoria, and Georgie works for an NGO in Melbourne, specialising in education. ""Georgie certainly has some very different political persuasions and ideas to what I was brought up thinking."" The list of tricky conversations they've had since then is long, but one stands out. Both Georgie and Peter point to one big disagreement several years ago, and Georgie said it was a catalyst for change in their family. ""I have a fairly strong view around gender equity and I remember having a conversation with my dad around him joining an elite men's club,"" she said. ""First of all, he didn't tell me he was going to join, because he said to me: 'I knew you'd cause a fuss.' ""My brother basically spilled the beans when we were all together and I reacted in a fairly profound and devastated and frustrated way. ""I would have said to him: 'How could you possibly do something like this, I'm a woman and you are married to a woman and you'll probably have a granddaughter one day, and don't you care that you are contributing to what is gender inequity?"" ""That didn't land beautifully with my kind and generous dad, who absolutely strives to be a very good person and is a very good person."" Georgie made a special trip to see her dad and talk about it later, and she made her case about why she thought he shouldn't be a member. ""He said to me, 'Is this a deal breaker?' and I said, 'it's not a deal breaker, it's your life but it will always be something that I'll be challenged by.'"" It never came up again. ""From what I understand he's not a member of said club, but I don't actually know,"" said Georgie. Peter said he is still a member of the club. Recalling the disagreement, said it ""was not deemed to be politically correct, within the family, especially by Georgie."" ""The solution was, over all these years, 'you'll do something that I might not necessarily approve of, and I'll do the same' but I'm not going to lose a daughter over it."" Despite that specific clash remaining unresolved, it sparked a bigger shift in Georgie's family. She pitched an idea to them that from then on, rather than give gifts to each other at Christmas, they donate the money to charity — but not just any charity. In the lead up to Christmas, there's a big family discussion about where the pool of money should go and it has opened up a proxy discussion about their values, according to Georgie. ""What we value is the conversation that we can spark around areas of interest that we want to support."" She said she would recommend the same approach to other families Peter added that there's no doubt his children have shifted his own views over the years. ""Growing up in an all-boys school, going through the private school system there were things that were ingrained into us,"" he says. ""I have no hesitation in saying I was a homophobe and I am certainly not now. ""That has come about through considerable discussion and interaction with a number of the younger generation, [who] I admire immensely"". He said the same shift has happened on a range of other topics and he has no doubt his views will continue to evolve. Clinical Psychologist Dr Charlotte Keating gives Peter and Georgie's family full marks for their approach, but said it's easy for things to go a much uglier way. ""When the particular issues at hand are ones that feel very personal, where people's communication style can be more combative or reactive or judgemental."" ""When relationships break down, it's got a lot to do with poor communication leading to that loss of connection."" If the disagreement is to do with an immutable part of a person's identity, such as their sexuality, it can be incredibly painful. ""Often, deep down, there's that real sense of feeling unloved, or feeling rejected, when there's parts of ourselves that are not understood or misunderstood."" As for how to avoid family catch-ups taking an ugly turn, Dr Keating has some practical advice. ""I think it's really important to stick with your truth and to speak it from a place of heartfelt lovingness,"" she said. But that doesn't mean you're obliged to talk about topics likely to start world war three. ""We do have some level of choice about what we are prepared to actually talk about on the day."" She says if things do get heated, it's okay to hit pause and make time to discuss it later, in a different setting, perhaps without alcohol in the picture. ""That's a way of setting some boundaries about what you're comfortable with."" If a proverbial landmine has gone off, Dr Charlotte Keating also has advice on how to keep the argument from escalating. She refers to the well-known psychological framework, known as the Four Horsemen of the Apocalypse, coined by an American husband and wife team of clinical psychologists, Julie and John Gottman. The Gottmans' research suggests the presence of these so-called four horsemen are very accurate predictors of whether or not a couple will ultimately separate. But Dr Keating said the theory is also a useful tool in managing family conflict. The Four Horsemen: Noticing these behaviours in yourself and in others can help cut problems off before they become a problem, said Dr Keating. ""You want to notice things getting emotional before it gets to that point,"" says Dr Keating. And finally, being aware of these behaviours can also help to plan for conversations ahead of time, so you can prevent the Horsemen from showing up. ""Even role playing with a partner or a friend,"" said Dr Keating. ""It takes the anxiety and the tension out of it for you because you've got a way of navigating it, you've done it before."" We acknowledge Aboriginal and Torres Strait Islander peoples as the First Australians and Traditional Custodians of the lands where we live, learn, and work. This service may include material from Agence France-Presse (AFP), APTN, Reuters, AAP, CNN and the BBC World Service which is copyright and cannot be reproduced. AEST = Australian Eastern Standard Time which is 10 hours ahead of GMT (Greenwich Mean Time)"
10,Nerrissa says she's suffered years of racism at school in Victoria — and not just from other students,society,"  Greater Shepparton Secondary College student says racist incidents left her feeling 'subhuman' For the latest flood and weather warnings in Queensland, search on ABC Emergency Senior student Nerrissa Leitch should be concentrating on her studies, but she says she is often exposed to racism at school that makes her feel ""subhuman"". ""Many of my friends come from different backgrounds, different nationalities, and they've been told to go back to their own country. Things like the n-word,"" said the 17-year-old Yorta Yorta and Gunaikurnai woman. Ms Leitch is in her final year at Greater Shepparton Secondary College (GSSC), which was found to be ""a picture of systemic racism"" in a scathing report obtained by the ABC. Commissioned by the Department of Education and Training after a series of race-related incidents, the independent report found the workplace was ""complicit"" in racism experienced by students. Ms Leitch said she had encountered racism over a number of years at the school. ""It's not only the students with racist opinions, it's also the teachers and the staff,"" Ms Leitch said. ""I really think the staff also need cultural awareness training, and to be more culturally inclusive."" The same recommendation was made in the report, written by cross-cultural consultant Georgia Birch, which was presented to the school in November but has not been publicly released. The ABC has attempted to contact GSSC for comment. Among the report's 47 recommendations is for the school's all-white leadership and all-white teaching teams to take part in ""ongoing cultural intelligence training"". The report found ""a high number of racist incidents"" experienced by students had involved teachers. It also said some teachers were reluctant to report racist behaviour for fear of being isolated or bullied by colleagues. There are approximately 575 students from multicultural backgrounds enrolled at Greater Shepparton Secondary College, and more than half are Aboriginal. Other students come from Iraq, Syria, Iran, Pakistan, India, Afghanistan, Congo, Malaysia, Philippines, Samoa and Tonga. When I was a teen, I wanted to be the cool black girl, the safe black girl. But that came with baggage I wasn't ready for. Despite its diverse cultural mix, the report found the school's leaders had one-dimensional view of multiculturalism and Aboriginal culture in the school, and had suggested that ""tokenistic interventions, such as having Aboriginal artefacts in the foyer"" were enough. Meredith Peace, the President of the Victorian branch of the Australian Education Union, said neither the union nor the school's staff had been given a copy of the report. ""Media reports in relation to the Department of Education's report suggest there are significant issues that would concern our members and the school community,"" she said in a statement. ""GSSC staff must have the opportunity to understand the contents of the report and be engaged properly in the work required to address the issues raised. ""Racism should never be tolerated and we expect the Department to provide the additional resources necessary to assist the school community to tackle the issues."" A spokesman for the department said that racism was never acceptable, and that a cultural steering advisory committee had been established to examine the report and its recommendations. ""It will be the cultural advisory steering committee that provides advice to the school about the best way forward from this point,"" said David Howes, the deputy secretary of schools and regional services. ""The challenges that the school faces are the challenges that the broader community faces and what is happening outside the school does impact what does happen inside the school."" Suzanna Sheed, the independent member of state parliament for Shepparton, said aspects of the report were ""obviously very concerning,"" and that resourcing in the area was an ongoing issue. ""We have high levels of disadvantage in Shepparton and we have to fight for resources,"" she said. ""And we've been doing that for so long with so many groups in our community, all addressing issues, putting out fires, treating things as a crisis when they arise. ""I think this is a real opportunity for us all to work together, look at all the programs and organisations we have in our town and see how we can go forward."" The report comes at a time of immense change, as four high schools are merged into the college to address poor educational outcomes. New facilities are being built to create a ""super school"" at a cost of $121 million. Once the capital works program is completed, Greater Shepparton Secondary College will become Victoria's largest government school, with an anticipated enrolment of 2,700 students. Ms Leitch said she would love to see the school introduce more programs to allow Indigenous children to connect with their Elders, and wellbeing areas so that students have a safe place to go. ""A language program would be something that's so special, and just more programs for Indigenous kids, and not just Indigenous kids, for all cultures,"" she said. The changes may come too late for Ms Leitch, as she prepares to graduate this year. But she says change is needed so that other children don't have to experience the same racism she and her friends endure each day. ""I don't want the future generations to experience what we've experienced,"" she said. ""It's just not good enough. I think everyone deserves to belong, and everyone deserves to have a safe space."" We acknowledge Aboriginal and Torres Strait Islander peoples as the First Australians and Traditional Custodians of the lands where we live, learn, and work. This service may include material from Agence France-Presse (AFP), APTN, Reuters, AAP, CNN and the BBC World Service which is copyright and cannot be reproduced. AEST = Australian Eastern Standard Time which is 10 hours ahead of GMT (Greenwich Mean Time)"
