,topic,category,content
6,Hong Kong's iconic Jumbo floating restaurant sinks in South China Sea,trends," Jumbo floating restaurant, a once famed but financially struggling Hong Kong tourist attraction, sank in the South China Sea after being towed away from the city, its parent company said Monday. It capsized on Sunday near the Paracel Islands after it ""encountered adverse conditions"" and began to take on water, Aberdeen Restaurant Enterprises announced in a statement. ""The water depth at the scene is over 1,000 meters, making it extremely difficult to carry out salvage works,"" it added. The company said it was ""very saddened by the incident"" but that no crew members were injured. It said marine engineers had been hired to inspect the floating restaurant and install hoardings on the vessel before the trip, and that ""all relevant approvals"" had been obtained. The restaurant closed in March 2020, citing the Covid-19 pandemic as the final straw after almost a decade of financial woes. Operator Melco International Development said last month the business had not been profitable since 2013 and cumulative losses had exceeded HK$100 million ($12.7 million). It was still costing millions in maintenance fees every year and around a dozen businesses and organisations had declined an invitation to take it over at no charge, Melco added. It announced last month that ahead of its licence expiration in June, Jumbo would leave Hong Kong and await a new operator at an undisclosed location. The restaurant set off shortly before noon last Tuesday from the southern Hong Kong Island typhoon shelter where it had sat for nearly half a century. Opened in 1976 by the late casino tycoon Stanley Ho, in its glory days it embodied the height of luxury, reportedly costing more than HK$30 million to build. Designed like a Chinese imperial palace and once considered a must-see landmark, the restaurant drew visitors from Queen Elizabeth II to Tom Cruise. It also featured in several films -- including Steven Soderbergh's ""Contagion"", about a deadly global pandemic. Jumbo's departure from Hong Kong was met with regret and nostalgia from many Hong Kong residents. Some online commentators described pictures of the floating palace sailing across a charcoal grey ocean towards the horizon as a metaphor for Hong Kong's future."
7,"World Music Day: History, significance, greetings and quotes",trends," World Music Day is celebrated annually on June 21. This day was first celebrated as Fete de la Musique in France in 1982. Since then, World Music Day has taken on a special significance worldwide. It’s a day when people come out on the streets with music instruments, when free public concerts are organised and the melodious notes ring from parks and public spaces. Today, World Music Day also sees promotional offers from music labels, sound system companies, streaming services and more. History and significance of World Music Day World Music Day was organised by Jack Lang in 1982, who was then French Culture Minister, and Maurice Fleuret, Director of Music and Dance at the French Ministry of Culture. Together, the two started Fête de la Musique (festival of music) on the streets of Paris. The idea behind this celebration was to gather both amateur and professional musicians on the streets to celebrate the beauty of music. Later on, other nations also adopted this practice of street concerts to celebrate music. In 1997, a charter was signed at the European Festival of Music in Budapest to recognise June 21 as World Music Day. Since then, it has been celebrated in countries like Italy, Belgium, India, Greece, UK, Japan and many more. The aim of World Music Day is to provide a platform to both professional musicians and budding talent, and to make music accessible to the public. Quotes, greetings and messages to share on World Music Day “One good thing about music, when it hits you, you feel no pain.” ― Bob Marley “If music be the food of love, play on.” – William Shakespeare “I live my daydreams in music, I see my life in terms of music.” – Albert Einstein “Where words fail, music speaks.” — Hans Christian Andersen “Music is the universal language of mankind.” ― Henry Wadsworth Longfellow “Music is healing. Music holds things together.” ― Prince"
8,Cristiano Ronaldo’s $2 million Bugatti Veyron damaged after crashing into wall,trends," A luxury car owned by Portuguese footballer Cristiano Ronaldo was damaged in a crash by his bodyguard. The 37-year-old footballer had shipped his Bugatti Veyron supercar, valued at 1.7 million pounds or $2 million, to his holiday home in Majorca, Spain, as per local reports. The supercar was damaged in the crash on Monday. Cristiano Ronaldo 's Bugatti Veyron suffered an accident on Monday morning in Mallorca. Apparently Cristiano was not inside the vehicle. [@UHmallorca] #mufc pic.twitter.com/WtG5crWWsd Although no one was injured in the accident, the luxury car suffered extensive damage after crashing into the wall in the east coast resort of Sa Coma. The Mirror reported that Ronaldo’s bodyguard got out of the Bugatti after the crash and continued on the journey, leaving other employees to deal with the police. Spanish police have confirmed that Ronaldo was not behind the wheel at the time of the crash. A source with knowledge of the incident said: “The car smashed into a wall but there was only material damage with no-one injured and the driver accepted full responsibility for what happened. “The information about who was behind the wheel and what occurred is registered on a police database and is there for a court or officers to access if any further investigations need to be conducted.   The Portuguese football star is in Majorca with his five children and girlfriend Georgina Rodriguez, where the family is reportedly renting a luxury villa and spending their days out on Ronaldo’s superyacht."
9,"Interview | Virtual reality has the capacity to transform learning outcomes for medical students: Adith Chinnaswami, co-founder, MediSim VR ",trends," Adith Chinnaswami is a surgeon by training who, along with two partners, set up India’s first fully automated Virtual Reality (VR) lab in the Puducherry Institute of Medical Sciences for MBBS students to learn key medical skills and patient diagnosis in VR. MediSim VR started at the Indian Institute of Technology, Madras- HealthTech Incubator with the aim of transforming medical skill training in India using futuristic technologies. Its patented technology helps healthcare professionals to develop essential skills virtual patients and situational training modules. With continued research on haptics (the perception of objects by touch and proprioception, or the sense of self-movement, force, and body position), MediSim VR is also the first Indian entity to become a resident company of Johnson & Johnson Innovation Labs, Boston. In this conversation with Moneycontrol, Chinnaswami talks about the role of VR in medical colleges and the company’s future plans. Edited excerpts: How does virtual reality in medical colleges work and how is it beneficial for students? VR technology has many applications in the medical field. The main use, you can say, for virtual reality is always going to be training-oriented. This is the area with the maximum focus right now because it sets this gold standard in terms of simulation experiences. And the medical fraternity as a whole has started focusing on giving students immersive training. So this basically entails simulation-based training, to teach them skills rather than the academic curriculum, and that is where VR is going to play a major role. There are also various other uses, such as continuing to learn academic content through VR. There are a lot of studies which have shown that there are much greater involvement rates meaning that when VR is being used, there is a significant improvement in learning outcomes; one such study has been conducted by Harvard University. So for VR, the biggest area of application would always be skill training, followed by academic uses as well. Also read I Explained | Poliovirus detected in sewage water in Kolkata: how worried should we be? How did the setting up of the company come about? I completed my Masters in 2017 and followed up with my fellowship in minimal access surgery. So, that was when I started doing some research into surgical simulation, simulation-based training and what the training solutions currently available were. At this point, I met my business partners Sabarish Chandrasekaran and Jeno Manickam Durairaj, who were already into VR. And once we started talking, I realized that the talent they had could easily be used to address the problems facing medical education and training. So we put in some research in terms of seeing how well we could translate the skill set into the medical field because the accuracy and the finesse required for medical simulation is a lot more when compared to any other industry. So once we nailed our research, targets and milestones, we were very confident we could achieve what we were trying to do. And that’s when we decided to incorporate. So we started as a registered company in India and subsequently gateways opened at IIT-Madras, followed by Johnson and Johnson Innovation Labs in Boston. This meant that we could also set up a US entity as well. So, we now have a presence in the US and India and we are now a global company. Can you also tell us how the training of medical students is different using VR? Current-day scenario is that students are not really getting trained adequately, it can be due to a multitude of reasons. One, the most important thing is that the previous generation of technology, which is the mannequins, was not built to cater to high volume centres, which means students often tend to observe it and then directly go start practicing it on patients and then learn by making mistakes. This is something which was acceptable as a general consensus for a long period of time, but now we are waking up to the fact that once there is a way to safeguard the patient’s interest by making sure they train ahead, that is no longer acceptable. And I think that’s where VR plays a major role, students will start learning all their basic essential patient-facing skills on the VR systems. Even before they start approaching a mannequin or a patient, they will be well prepared in terms of what to expect. So they will have access to a skilled training module set out as part of their curriculum during various years. We are currently focusing on pre-final and final years. And subsequently, when they get to internship, they will have a good amount of confidence and knowledge about the skills which they are about to execute on a patient. And that will be the crux of using VR. The biggest advantage of using VR, I would say, is competency assessment, those which are built in. So students often, when they are learning with mannequins, they may pick up a wrong habit, a wrong way of doing something that essentially will never get corrected unless or until it causes a big mishap. With our system, the student will now know when he is doing something right or when he is doing something wrong. And eventually the institution can assess the competency of students and make sure they attain a certifiable level of competency before they allow a student to graduate. And I think this will give further confidence to the user base as well that they know something well enough. And patients tend to trust doctors a lot more when they are well trained and confident in what they are doing. I think that is going to make all the difference in terms of their perspective. Also read I India’s largest private hospital in Faridabad looks at a launch date this August What are the expansion plans of MediSim VR for medical colleges? So currently, like I mentioned, we are targeting the pre-final and final years of MBBS degree. Moving forward within the end of this year, we will have content for the first and the second years as well. We are also looking to launch content for nursing and allied health professionals. So in terms of this, content is almost ready. We are looking to tie up with the right partners and work on that field. And we expect to have some announcements very soon. So we will expand to not just the medical fraternity but the entire healthcare fraternity. And of course, regional expansion is next on the radar. We have essentially been South Indian. We have focused on our local market, but we do want to start opening up to all regions across the country. And we already have a US partner base but we have inbound interest from Southeast Asian countries. Other than all of this, I think the major thing we are also looking for is to eventually move into the clinical side of things as VR has a lot of applications in terms of getting used in therapy, in vocational counselling, phobia management, and pain management. And that’s an area where we have been putting in a lot of research over the last few months and we hope to enter the market with a product in that space as well. There has been a sort of boom in the medical technology field in India and now there are so many firms operating in the space. How are you different from others? I think MedTech is a huge, a very general term, and it encompasses a very huge array of industries. But the advantage we would have is that we are essentially placed at the overlap of – if you were to draw a Venn diagram with say MedTech, EdTech and medical, I would say we would be at the cross section of all of these three fields and that gives us the edge. Through our collaborations with partners and Johnson and Johnson, we are making sure that the quality of what we bring in is also matching global standards, the highest possible level in terms of the quality of the product, and making sure that it’s something which is adoptable by the Indian industry as well. In the medical field, we often tend to need to wait a long time before the benefits of technology are eventually brought down to Indian affordability levels. But since our base is here and that is where our roots are we made sure like right from day one we want our product to be something which the Indian user or the Indian patient will actually benefit from."
10,Alliance Air denies boarding to award-winning artist over battery-run wheelchair,trends," An award-winning physically challenged artist has claimed she was prohibited from boarding an Alliance Air flight from Bengaluru to Kochi recently as she was not willing to leave behind her battery-operated wheelchair. The only option the airline provided to Sarita Dwivedi was -- leave behind her wheelchair or book a flight on another airline, she claimed while talking to PTI on Monday. Alliance Air did not even refund the amount of around Rs 8,000 she had spent on the tickets for herself and her friend who had come from Kochi to Bengaluru to take her here. She also accused a staff member of hostile behaviour towards her. Hi Ms. Dwivedi,We regret the inconvenience caused. The concerned team is looking into the matter and will update at the earliest. Kindly accept our assurance that this information will be taken into account and used in our constant endeavor to improve our services. Dwivedi said she had to subsequently shell out around Rs 14,000 for travelling on another private carrier to reach here along with her friend. The airline also carried her wheelchair in the plane's cargo without any hitch, she said. However, what transpired at the Alliance Air counter at Kempegowda International Airport on Saturday was a very bad experience, she said. On being asked whether she plans to sue the airline or take any other action, she said she was not sure how to go about that. Giving details of her ordeal, Dwivedi said she reached the check-in counter around 8 am, an hour ahead of the flight's departure, conforming to the one-hour rule. ""On seeing me, the first thing the person from the airline said was that if you are travelling with a motorised wheelchair, you should come a little early. Then I got little angry and said I was on time. I told him to get the scanning person to scan the wheelchair so that I can go. Again he said I was late. Then he said 'madam you cannot travel with the motorised wheelchair as it was battery operated'."" On being asked whether the airline official gave a reason for not allowing the wheelchair, she stated ""they said there are certain guidelines against it. But these guidelines are there with every airline."" ""They said that in view of the guidelines, I cannot take my wheelchair. So either I should leave it behind or I cannot travel on the flight. That is how they were talking to me. I felt so bad,"" she said. She had earlier tweeted about the incident, tagging Union Civil Aviation Minister Jyotiradita Scindia. Asked if the airline offered any alternatives, she said, ""They were not willing to do anything for me. I was ready to leave the wheelchair there, provided they could send it to my place in Kochi. I am not from Bangalore. I am a humble person. I did not want to argue, so I asked them what they can do to help me,"" she said. They said they cannot do anything but can refund her ticket amount. However, ""they have not refunded the ticket amount.. I had spent around Rs 8,000 on two tickets for myself and my friend.. even my friend could not travel as I was not allowed to travel. Not only did they not refund the amount, I had to, thereafter, spend around Rs 14,000 on two tickets to Kochi on another airline,"" she claimed. Dwivedi reached Kochi on Saturday afternoon instead of the morning as she had originally planned. When asked whether Alliance Air has got in touch with her subsequently to refund the amount, Dwivedi said, ""Nothing. They have no facilities. They do not know how to talk to people. They just keep arguing and shouting. It was irritating."" She claimed initially the airline did not allow them to get their boarding passes and then they said that their manager was coming and to wait for him as after he arrives, then only they can do anything. After a long wait, a person came who was a senior supervisor in Alliance Air and not the manager. ""So I asked the person at the counter who had stopped me from boarding earlier as to whether this was the same person he spoke about. But he did not give a proper response."" She said the man started shouting at her that he was the responsible person and that he would be taking the decisions in the absence of the manager who was not here. Dwivedi said she asked him why she was made to wait so long at the airport, if the manager was not going to come. ""I, thereafter, calmly asked them to send me to Kochi. I said I do not want a refund... they said we cannot do that and that I can get a refund only. They said I should book a flight on another airline. That is how they replied. Then they said that I could travel by their airline, but the wheelchair cannot be taken along,"" she added. For Dwivedi who had travelled the long distance from Indiranagar in Bangalore to the airport, everything had been ""spoiled"" by then and she subsequently demanded that the airline gave in writing why she was not allowed to board her flight. @JM_Scindia Dear Sir, Need help regarding @allianceair behaviour. I am Divyang travel with my Motorized Wheelchair but stuck at Bangalore airport since @allianceair not allowing me to board in my flight alongwith my wheelchair. Missed my flight. #RPWD Act 2016 pic.twitter.com/GGvTJqZXMT   ""After travelling so far alone and managing everything physically, mentally and financially, they spoiled everything for me. For a person like me it is difficult. It is in my nature that I speak softly to people and I was speaking calmly to them at the airport to find a solution. They are the ones who started arguing and then shouting at me,"" she alleged. Personnel of the Airports Authority of India were present there and provided her with food and water and comforted her. They even tried to reason with the airline official, but in vain. ""So then I asked him to give me in writing why I missed my flight, why I was not allowed to board,"" she said. Thereafter, for the sake of formality the official wrote down why she was not allowed to board and she also agreed to get a refund to book tickets on another flight as she was getting late, Dwivedi said. However, when the official realised she was going to fly on another airline, he said he would not give anything in writing and walked away with the paper, she claimed. On how the experience was with the other carrier she later flew in, she said, ""They never created any issue for me. They were quick and gave a very good service. My wheelchair has a dry battery. The rule is that you cannot travel with a wet battery on an airline."" ""I just removed the battery supply and gave it to the airline and they put the wheelchair in the baggage,"" she said. ""I travel a lot and wherever I go, I have never faced this problem. This time the travel agent booked the tickets on Alliance Air. He did not mention that I was differently abled or wheelchair user while booking the ticket. That is required if I need a wheelchair. But I carry my own wheelchair, so where is the need to put that (while booking a ticket)?"""
11,Elon Musk’s daughter files for name change: I ‘no longer wish to be related’ to him,trends," One of Elon Musk’s children wants to ditch his powerful last name. Xavier Alexander Musk, born male, has filed to change their name legally to reflect their new gender identity as a female. TMZ reported that Elon Musk’s trans daughter, who was formerly known as Xavier Musk, filed documents in LA County to change her name to Vivian Jenna Wilson a day after her 18th birthday in April. The documents state the reason for the name change as “Gender Identity and the fact that I no longer live with or wish to be related to my biological father in any way, shape or form.” Vivian is ditching the Musk surname in favour of ‘Wilson’, which is her mother Justine’s last name. Justine Wilson and Elon Musk were married from 2000 to 2008. Their first son, Nevada, was born in 2002 and died at the age of 10 weeks of sudden infant death syndrome. Vivian and her twin Griffin, born in 2004, are the eldest of the Tesla chief’s seven children. TMZ reported that “neither Elon or Vivian has previously said anything publicly about their relationship or her transition.” It is worth noting that Elon Musk, in July 2020, tweeted “Pronouns suck.”"
12,"Meet Captain Monica Khanna, who safely landed SpiceJet flight after engine fire",trends," Captain Monica Khanna’s quick-thinking saved the lives of around 185 passengers on board the SpiceJet flight that caught fire shortly after takeoff on Sunday. The Delhi-bound SpiceJet flight safely returned to Patna after cabin crew noticed sparks flying out of the left engine of the aircraft and alerted the pilots. Captain Monica Khanna – the pilot in-charge – acted calmly and took control of the situation. After consulting with First Officer Balpreet Singh Bhatia, she switched off the affected engine and landed the ‘overweight’ aircraft skillfully in Patna. Her quick-thinking and prompt action saved the lives of around 185 passengers and crew on board the flight. A senior SpiceJet official lauded the pilots who made the emergency landing after being alerted to the engine fire, which was reportedly caused by a bird hit.  “Captain Monica Khanna and first officer Balpreet Singh Bhatia conducted themselves well during the incident. They were calm throughout, and handled the aircraft well,” Gurcharan Arora, SpiceJet's chief of flight operations, was quoted as saying by news agency ANI. ""Only a single engine was functioning when the plane landed back. Engineers inspected the aircraft, and confirmed that a fan blade and engine were damaged as a bird hit. The Directorate General of Civil Aviation (DGCA) will probe further,” Arora further said. Fire Visual From Inside Spicejet Plane.#SpiceJet pic.twitter.com/fbZuiVyB1p"
