,topic,category,content
23,'32GB phone carrying 31.9GB data': Telangana Police uses viral video to spread road safety awareness,trends," The Telangana police on Wednesday used an innovative method to spread awareness on road safety -- using a viral video. A Twitter user, who goes by @sagarcasm, posted a video showing a man riding a scooter stacked with goods. While there is hardly any space for the man to sit on the vehicle, he is surprisingly wearing a helmet. “My 32GB phone carrying 31.9 GB data,"" the user captioned the photo. There is a possibility to retrieve the data from the Mobile, even if it's damaged.But not life...So our appeal to people avoid putting their life's at risk and others too.#FollowTrafficRules #RoadSafety @HYDTP @CYBTRAFFIC @Rachakonda_tfc @hydcitypolice @cyberabadpolice https://t.co/Z6cipHFfDr  Soon, Twitter users joined in on the humourous take on the video. “Most of them are the files generated in what’s app database folder!” Hiren Jagad commented. Another Twitter user Panoti (@theusoo_) said, “Me after downloading app to increase my phone space from play store."" There were others, however, that urged the police to take action against the man for flouting traffic rules, risking his life and that of others. ""Shouldn't any action be initiated, as this man is putting others life at risk in case of any accident takes place?"" wrote Pijush Das. ""Please take action and ensure that existing rules are executed. They get more confidence in these things if they see that law and order are not enforced,"" user Ranjeet Patil commented. "
24,Here’s what the new TDS rule means for social media influencers,trends," Content creators are making calls to tax experts, chartered accountants and influencer marketing agencies to understand what a new clause, Section 194R in the Income-tax Act which is applicable to social media influencers, means for them. Ocean Sharma, an e-sports player with an Instagram following of 328,000, is reaching out to his CA friends to find out more about the new provision which mandates tax deducted at source (TDS) on freebies influencers receive from businesses for sales promotion. It was Budget 2022-23 that had brought in the provision of TDS at 10 percent for any person providing any benefit or perquisite exceeding Rs 20,000 in a year to a resident arising from the business or profession of such resident. For influencers, this means that they will have to disclose the free samples they receive from brands or companies while filing their income tax return and TDS will be applicable if the freebies are retained by them since such items will be deemed a perquisite. In case the influencer returns the free samples, TDS will not apply. Hidden promotional expense “People used to get benefits but there was no avenue for the government to track this because it was not reported in (income tax) filing and to plug this gap the tax authorities have introduced this new section,” said tax expert Ravishankar Raghavan, partner, tax and private client group, Majmudar & Partners. He added that the new provision is to widen the tax base and to ensure that recipients declare the free samples they receive as income while filing their taxes. Influencer marketing platforms that are the bridge between content creators and brands pointed out that many brands that offer influencers free samples or gifts as a goodwill gesture in return for a post on social media would not show it in their books as a promotional expense. While a promotional expenditure by brands, this remained untracked because influencers did not disclose it while filing income tax returns. “Free samples often shared with the influencers are also shared with the expectation of them endorsing it, which benefits the company. By marketing the product the influencer is extending a service to the brand, making it a transaction. But now with such a provision, a lot of influencers may hold back from barter collaborations largely because of the lack of clarity around the subject,” said Ishan Jindal, founder and CEO, Wobb, an influencer marketing agency. He added that barter collaborations are one of the primary go-to methods for both brands and influencers. “For brands because of the cost efficiency and for influencers because of the feasibility and availability of such collaborations,” he said. Vaibhav Odhekar, Managing director India & Middle East, AnyMind Group which operates influencer marketing platform AnyTag said that while many brands and influencers had started complying with 10% TDS for commercial transactions like cost per post or brand endorsements, the same was not applied to barter deals. Now, under the new rule, influencers can be asked to file advance tax if the value of the gifts received exceeds Rs 20,000 in a year, said Arpan Soni, head of client servicing and talent management, IPLIX Media, an influencer marketing firm. According to the Central Board of Direct Taxes circular on TDS on benefits or perquisites, if a person is providing benefit in kind to a recipient and tax is required to be deducted under Section 194R, the person has to ensure that the tax that has to be deducted has been paid by the recipient. Impact of new TDS rule “This will affect micro-influencers negatively as they primarily do barter associations only. It is a way for them to build relationships with these brands while they are setting up their base in the field,” said IPLIX Media’s Soni. Micro-influencers are categorised as those who have 100,000 to a million followers. Soni added that the tax rule will also impact tech influencers as they get gadget review units from brands to keep. “Both the tech brands and influencers will now have to track these exchanges in detail. Travel influencers get flight or hotel tickets in exchange for promotion. It will be tricky for these people to work as it used to be mutually beneficial for both brands and influencers,” said Soni. Ketan Dalal, MD, Katalyst Advisors, an advisory firm, said that the new section was not in keeping with the concept of ease of doing business. “This is going to be an extremely cumbersome process for everyone—the creators, the agency and the brand—to track and file these deals,” said Shivam Agarwal, founder, Deckster.Live. Kunal Kishore Sinha, co-founder and COO, ClanConnect, an influencer marketing platform, pointed out that a lot of content creators are young professionals who are not aware about tax filing. “These people don’t have access to an accountant or CAs. In fact, a creator from Bhubaneswar who we were in touch was not able to give us a proper invoice.” Validation for influencers But he said the reason for the new rule is because it is an unorganised sector and the government wants to bring the entire industry under the tax ambit. “There is a recognition at the government level that this is a new breed of professionals that are getting created. This means a massive validation for the (influencer) space. Generally, you have mention of professionals like CEOs but now you have an influencer also.” Digital content creator Rasleen Grover said that given the strong growth the influencer space has been seeing in revenue, it became necessary to have regulatory framework. In addition, Pranav Panpalia, founder, OpraahFx, an influencer marketing agency, said that the new tax rule is a wake-up call for creators and agencies who have been very actively working via barter deals. “While barter may be a good way to pay in kind, it definitely doesn’t help creators pay their bills. This regulation was a need because cash or not, an earning via any mode is an earning and one has to pay tax on it.” Sharing similar sentiments, Vedant Rusty, who creates content on films and web series, said, “This method of collaboration (free samples) was fundamentally unfair to the creators since, in my experience, not all products are used, most of them are actually discarded, handed down or resold.” Earnings and brand deals Pranav Agarwal, co-founder, Sociowash, a digital marketing firm, expects such deals to decline due to the new tax rule. Some, though, don’t expect any substantial financial implication due to the new tax rule. Influencer Paritosh Anand, who creates content on various subjects and has a social media following of around 200,000, believes content creators’ earnings will not be affected but adds that the new provision is a complication. But agencies think that there will be some impact on earnings. “Such a provision is bound to affect the earnings of the influencers largely because a lot of collaborations are barter and sampling-based. The grey area might make some influencers hesitant about such collaborations altogether,” said Jindal."
,topic,category,content
0,UK rail strikes: What to expect and do if you are visiting Britain this week,trends," If there’s one activity that affects the economy and also has the greatest direct impact on the lives of people, it is transport strikes. England is now in the midst of its biggest train strike in over three decades. The Rail, Maritime and Transport Workers (RMT) union called for the strikes in disputes over pay, working conditions and job losses. Unlike India, the railway sector is not nationalised in the UK and there are 28 different train operators across the UK. The RMT is the country’s largest transport trade union which has 83,000 members in railways, shipping, buses, and road freight. The walkout this week has been called for June 21, 23 and 25, with the possibility that there would be strikes in July as well, although no dates have been set. This is because the union says that if demands are not met, travellers must expect six months of industrial action. (Photo: Danish Khan) Though the strike in June is for three days, the impact will be felt for the entire week as there will be a cascading effect that will upset travel schedules. Employees of Transport for London (TfL), which is a government body responsible for transport network in London, joined other rail workers only on June 21, disruptions are still expected in London this entire week. Hospitality, high street shops, small businesses are also affected due to the strike. The strike presents a huge problem for those travelling to the airports in London as all of them – Heathrow, Gatwick, Luton, Stansted, London City – are served well by trains. But in situation like these, the quicker and cheaper train connectivity becomes a bane from being a boon. Here are some tips if you are flying into London, to help negotiate the strike: Airport services: Apart from the cheaper TfL lines, all the airports have special train connections which have been badly affected, but are operational. The Heathrow Express, Gatwick Express, Stansted Express, services to Luton are all running, but with the advice to travel only if the journey is absolutely necessary. Well, if you have a flight to catch, you can’t afford to miss, or are landing in the UK that should count as necessary. Be ready for disruption and give plenty of time for the journey. Buses: The airports are also connected by the National Express, England’s major coach operator. Megabus is another coach operator that offers airport connectivity. They are cheap, efficient, and accept contactless payment, but in the wake of train strikes, prices have been increased. It will be handy to have their apps for latest updates and ease of buying tickets. They won’t be as fast as trains, but far cheaper to travel to cities outside London. If you are going to be in London, then you can make the most of London buses which will of course see added pressure. You can take multiple TfL buses within one hour at the single journey cost of £1.65. Cabs: This is the moment when cab services see a huge demand accompanied by surge pricing. It is handy to remember that mini-cab services – London has innumerable local cab operators – are generally cheaper than the traditional black cabs. The price difference can be staggering (especially airport transfers) between black cabs and mini-cab services. You can simply google local mini-cab services, and call them to book a cab. You can bargain, if what they quote sounds astronomical. You can also choose from the bigger networks like Uber, Bolt, Ola, Via and others. Prepare to pay surge pricing. Sudden cancellations and longer waiting times are not uncommon right now."
1,"Forced to give up studies 37 years ago, woman clears Class 10 exams with flying colours",trends," A 53-year-old Mumbai woman who was forced to give up her education due to financial problems 37 years ago, has recently cleared Class 10 SSC board exams and scored 79.6 per cent, her proud son shared on LinkedIn. Sharing the story, software engineer Prasad Jambhale wrote, ""So, the story goes back when my mother was of the age 16 years, her father died and the financial crisis followed, to ensure that her siblings continue their education, she had to quit the education and start working."" Kalpana Jambhale got a chance to resume her education last year during a visit to a government school in Mumbai when a teacher informed her that there’s a government scheme which can help people who have not completed their SSC exams appear for it again for free. Using this as an opportunity, Kalpana Jambhale resumed her education and began to attend a night school to prepare for the exams. But she kept this a secret from the family, even from her son. ""As I stay in Ireland, I came to know about it just recently when I was about to get married before her exams. Whenever I was in Ireland and used to call during Indian night-time, I used to ask where’s mom? And I was told that she has gone for a walk, I thought that’s odd that she got interested into walks. Little did I know that she was attending night school,"" Jambhale wrote on LinkedIn. He added that his mother also juggled arrangements for his wedding held just a month before the exams in March. Read more: 50-year-old Mumbai sweeper clears Class 10 board exams, thanks kids for helping him study ""And now, here is the result she cleared SSC, not just with passing marks, but with a whooping 79.60 per cent,"" Jambhale wrote. ""Sometimes I feel I am so fortunate that I had no worries about anything... Who knows what my mother could have achieved if she had the same privilege as me."" The proud son and his mother's success story went viral and won thousands of hearts. ""Hats off to your mom. I have no words to express my happiness. Such women are such an inspiration,"" commented business analyst Divya Gupta. ""This is truly inspiring. Her story will encourage many others to complete their dreams,"" wrote engineer Kankan Kumar Das."
2,"Blood test that can detect breast cancer, available in India now",trends," A first-of-its-kind blood test that can detect breast cancer even in very early stages was launched in the country on June 22 and has been made available by Datar Cancer Genetics which has partnered with the Apollo group of hospitals. The test, being branded as EasyCheck Breast, will cost Rs 6,000. It was approved by the US Food and Drug Administration in November last year and is indicated as an annual test for healthy women above the age of 40 years who may not have any symptoms. It is available in nearly 15 countries including in Europe under different brand names. The technology claims to have nearly 99 percent sensitivity, which means it has less than 1 percent of false-positive reports, with over 88 percent specificity, which means that in about 12 percent of cases there is a chance of false negativity though. To begin with, the test will be available through Apollo’s hospitals but the group wants to expand it to all of its 1,600 blood collection centers eventually. Also read: Explainer | Dostarlimab for cancer cure: Hope or hype? Prathap Reddy, founder, and chairman of Apollo hospitals dubbed the test as a revolutionary step in the direction of catching breast cancer very early in Indian women. Datar, however, has made it clear that despite the test’s high success rate in detecting cancer at a very early stage, this should not be treated as a replacement for the conventional screening tools for breast cancer such as mammograms and ultrasonography. Dr. Ramesh Sarin, a senior surgical oncologist with Apollo hospital in Delhi pointed out at the launch of the test that women who test positive for cancer using the new technology can forego conventional screening examinations and can straight away go for a biopsy and plan their treatment. However, those who test negative should still also go for other screening tests to rule out cancer completely. How it works This blood test uses a proprietary technology developed by Datar Cancer Genetics to detect circulating tumor cells and clusters or biomarkers that are specific to breast cancer with very high accuracy. Data from clinical trials, conducted on over 8,000 women in India, for the test has shown that it can detect stage 0 and Stage 1 breast cancers with an accuracy of better than 99% without any false positives. The test has been validated on more than 20,000 women comprising healthy and cancer patients, the company said. The advantage of the test is that it requires only 5 ml of blood and does not involve exposure to any radiation or discomfort associated with mammography. The data presented by Dr Chirantan Bose, director, of patient services at Datar showed that the test can detect more than 80 percent of cases in stage 0, over 90 percent cases in stage 1, over 95 percent cases in stage 2 and 3 and 100 percent cases in stage 4 of cancer. Also read I Ray of hope for blood cancer, lymphoma patients as CAR-T cell therapy to be available in India Breast cancer burden in India While breast cancer is the most common malignancy among women globally and has now surpassed lung cancer as the leading cause of global cancer incidence in 2020, in India too, the incidence has increased significantly, almost by 50 percent, between 1965 and 1985. The estimated number of incident cases in India in 2020 was 180000 and experts say that nearly 50 percent of those diagnosed with this malignancy die due to late diagnoses and bad prognosis (treatment outcome). Statistics show that a whopping 80 percent of the breast cancer cases in India are detected at stages two and three while this number is just 29 percent in the case the USA."
3,Watch: Presidential candidate Draupadi Murmu sweeps Shiv temple floor in Odisha,trends," A day after the BJP declared Droupadi Murmu as NDA’s Presidential candidate, 64-year-old visited was spotted sweeping a Shiv temple before offering prayers. Ahead of flying to Delhi, the former Jharkhand Governor visited several temples of Lord Jagannath, Hanuman and Shiva in Rairangpur with her friends and family. Murmu is headed to the capital to file her nominations on Saturday. #WATCH | Odisha: NDA's presidential candidate Draupadi Murmu sweeps the floor at Shiv temple in Rairangpur before offering prayers here. pic.twitter.com/HMc9FsVFa7  Murmu's candidature was announced shortly after 17 Opposition parties picked Yashwant Sinha, a former Union minister, as their joint candidate for the presidential polls. Declaring the party's decision, BJP president JP Nadda said on Tuesday, ""We announce Draupadi Murmu as NDA's candidate for the upcoming Presidential elections."" He added that ""for the first time, preference has been given to a woman tribal candidate"". Born on June 20, 1958, in Baidaposi village of Mayurbhanj district in Odisha into a Scheduled Tribe (ST) family, Draupadi Murmu went on to become a graduate and served as an Assistant Teacher at Shri Aurobindo Integral Education Centre in Rairangpur without taking any pay. Read more: Meet Draupadi Murmu, BJP-led NDA candidate for race to Raisina Hills Murmu made her entry into state politics in the 1990s and was appointed as the first woman governor of Jharkhand in 2015 by the BJP-led central government. She held the position till 2021. If Murmu is elected as the President, she will become the first member from the ST community to hold the top constitutional office. Read more: All you need to know about NDA’s presidency pick Draupadi Murmu"
4,"Oncologists welcome FDA’s proposal to limit nicotine in cigarettes, but say India has a long road ahead",trends," Indian oncologists welcomed the US Food and Drug Administration’s (FDA) proposal to limit nicotine levels in cigarettes in that country but said India’s battle against tobacco is far more complex and challenging. Ganesh Nagarajan, Director - HPB Surgery & Gastrointestinal Oncology, Nanavati Max Super Speciality Hospital, Mumbai, said capping the level of nicotine will directly reduce the incidence of cancer given that nicotine is a highly addictive substance and that reducing its levels could reduce dependence on the carcinogenic substance, but added that would be of limited use in India. “It’s a welcome step, a lot of cancer specialists have been lobbying a lot to reduce the accessibility of cigarettes, but in semi-urban and rural India, apart from bidis (tobacco wrapped in tendu leaves, which are much cheaper than cigarettes and more easily available in rural areas, chewable tobacco is the reasons behind oral and laryngeal cancer,” he said. Also read: CBI apprehends Joint Drug Controller in alleged Rs 4 lakh bribery case Rahul Bhargava, principal director, haematology-oncology, Fortis Memorial Research Institute, Gurgaon, outside Delhi, too said that a lot of recent cancer cases are from rural India and added that cigarettes form just one component, and that the bulk of tobacco addiction in rural India is due to chewable tobacco. According to a professional with a US-based multinational company working in the healthcare and pharmaceuticals segment, the largest number of cancer cases in India relate to the neck and head, almost always caused by tobacco consumption, followed by breast cancer. This clearly indicates that chewing tobacco was of greater concern than combustible tobacco when it came to cancer, the person said. Tough task for India to limit nicotine in tobacco products When asked if India should also consider limiting nicotine levels in tobacco products, Dr Nagarajan reiterated his point. “In India apart from smoking, people chew it, they use it as toothpaste. It will need huge political will to get something of this sort implemented in India,” he said. Also read: Online gaming pushing adolescents into aggressive behaviour: Experts Dr Bharagava said the poor consume chewable tobacco to kill the appetite so that they can work without food. “Social evils need to be dealt with first. Addiction doesn't start at the age of 18 or 20, rather they start taking tobacco at a very small age. This is where the government's holistic approach for tobacco control is needed,” he added. Akshat Malik, senior consultant, head and neck oncology, Max Hospital in Delhi’s Saket, said that limiting nicotine content in cigarettes will probably bring down the addiction in some but the magnitude of the tobacco problem in India won’t change. “It’s a step in the right direction but one needs to understand that in the Indian scenario, smoking is just one aspect, one-third of our population consumes tobacco in one form or the other. A majority of Indians are tobacco chewers and not smokers,” Dr Malik added. Also read: Air pollution India’s worst health threat, shortening life by 10 years in Delhi, says AQLI report FDA’s proposal on limiting nicotine in cigarettes The FDA is planning to develop a proposed product standard that would establish a maximum nicotine level to reduce the addictiveness of cigarettes and certain other combusted tobacco products. “Nicotine is powerfully addictive. Lowering nicotine levels to minimally addictive or non-addictive levels would decrease the likelihood that future generations of young people become addicted to cigarettes and help more currently addicted smokers to quit,” FDA commissioner Robert M. Califf said. According to the FDA, the goal of this potential rule would be to reduce youth use, addiction and death. “Each year, 480,000 people die prematurely from a smoking-attributed disease, making tobacco use the leading cause of preventable disease and death in the United States. Additionally, tobacco use costs nearly $300 billion a year in direct health care and lost productivity,” FDA said in a statement. What is nicotine? Nicotine, one of the additives used in cigarettes and other tobacco products, is an addictive factor and it makes it very hard to quit smoking. It is present in other tobacco products as well, including supari (betel nut, an ingredient in paan), guthka (packaged chewing tobacco made of, among other things, betel nut and tobacco, with a sweet or savoury flavouring) and bidis. Nicotine, apart from being a component which can cause cancer, it also affects the heart."
