,topic,category,content
5,Bizarre blue light spiral spooks stargazers in New Zealand,trends," Sky watchers in New Zealand caught sight of something bizarre yet fascinating on June 19 -- a spiral of blue light which seemed like a giant galaxy. Quickly, they took pictures and shared them on online astronomy groups.   Among those who witnessed the spectacle was Alasdair Burns, a stargazing guide. He told the Guardian a friend texted him on Sunday night to step out of his house and watch the sky. What he saw next was astounding. ""It looked like an enormous spiral galaxy, just hanging there in the sky, and slowly just drifting across,” he added. ""Quite an eerie feeling.” He alerted his neighbours to the sighting too. “We quickly banged on the doors of all our neighbours to get them out as well,"" the told the Guardian. ""And so there were about five of us, all out on our shared veranda looking up and just kind of, well, freaking out just a little bit.” Another resident said that to her, it looked like a planet or star. She added: “It wasn’t blinking or twinkling, and it was moving fairly fast... so fascinating,” she said. Witnesses came up with theories about what could have caused the spiral to appear. Was it aliens at work? A UFO? A black hole? The explanation was much simpler. Professor Richard Easther from the University of Auckland pointed to a SpaceX satellite launch off Florida's Cape Canaveral on Sunday. He said that when a rocket takes a satellite into orbit, strange-looking clouds can become visible. “When the propellant is ejected out the back, you have what’s essentially water and carbon dioxide – that briefly forms a cloud in space that’s illuminated by the sun,” he was quoted as saying by the Guardian."
6,Fluctuating credit score got you confused? OneScore's Find Out Why feature has all the answers,trends," If you're in the market for a loan, a strong credit score can be a huge asset. The first step in building a strong credit score is to understand how it is calculated. However, this can be challenging - there are 4 different credit bureaus in India, and each has their own formula. This is why your credit score is slightly different according to each bureau. While you can educate yourself on the parameters that go into the calculation (your payment history, credit utilization, age of credit, consistency of personal information), you can't really say for sure why your credit score moves up or down each month. The trouble is, if you don't understand what you're doing right, how do you do more of the right things? This is particularly important when you're trying to recover from tough financial circumstances. If you don't have strong credit scores, you can't avail credit; and often, that is when you need credit most. Can the internet help? Of course it can! But only as far as education goes. You'll find generic information, tips, best practices, etc. What you won't find is information specific to your case. Credit bureau reports tell you what your score is, and the details about your credit history, but make no recommendations or predictions. The OneScore App however, does both. The Find Out Why feature in the app tells you exactly why your score moved up or down, helping you mold smarter financial habits that allow you to consistently work towards a better financial future. Using the app is easy - once you've signed up, the app shows you your credit score according to Experian and Cibil each month. You can click on the 'Find Out Why' button for personalized insights on why your credit score is changing each month. Is it easy to understand? The OneScore App aims at making it easy for everyone to maintain a strong credit score. The reasons listed in the Find Out Why feature are in simple, easy to understand terms: no jargon. For instance, if you've used your credit card extensively the previous month (even if you paid on time), your credit utilization increases, bringing your credit score down. The feature explains this. Similarly, small increases in the credit score occur when you consistently pay all your bills and EMIs on time. The Find Out Why feature lets you see how you're progressing each month. The OneScore App makes it easy to monitor and build your credit score, month on month. By checking your credit score, using the Find Out Why feature, and keeping up with the AI recommendations on actions you can take, building a strong credit score (even after financial mishaps) is now within everyone's reach. For more articles, information and tips, visit our page #ScoreDekhaKya."
7,Jeff Bezos shares throwback pic with dad on Father's Day with a short and sweet note,trends," Jeff Bezos on Sunday shared a throwback photo with his stepfather Miguel Bezos on Father's Day. I love you, Dad. pic.twitter.com/GSqHUGlgt8  In May, the Amazon founder had recalled the challenging situation in which his father, also known as Mike, had fled from Cuba to the US after Fidel Castro came to power. And Mile was only 16. Speaking about his immigrant roots at an event, Jeff Bezos said, ""I think in every immigrant you'll find a deep optimism and a deep resilience too. Every immigrant who has come to this country, they all have their own unique stories. Fighting for a better life, hardships but they also end up having a belief in America."" He then added that he and his sibling could ""not have had a better role model."" Bezos has always been quite public in his admiration of his stepfather. In 2018, he made an appreciation post for him on Twitter in which he wrote, ""My dad came here from Cuba all by himself without speaking English when he was 16 years old, and has been kicking ass ever since. Thank you for all the love and heart, Dad!"" My dad came here from Cuba all by himself without speaking English when he was 16 years old, and has been kicking ass ever since. Thank you for all the love and heart, Dad! pic.twitter.com/nuavG0yEtM   Miguel Bezos, who attended the University of Albuquerque in New Mexico and worked at ExxonMobil for over 32 years in engineering and managerial positions, co-founded the Bezos Family Foundation with his wife Jackie and their children in 2000 to support the education of children, reported Fortune."
8,Telegram introduces Premium subscriptions at $4.99 a month,trends," Messaging app Telegram has rolled out Telegram Premium, a monthly subscription service that gives paid users access to exclusive features. The subscription plan has been priced at $4.99 per month (around Rs 389). Some of the features that the team highlighted in a blog post are the ability to upload 4GB files, against a 2GB limit imposed on free users. Premium users also will also be able to download media at the fastest possible speed. There are doubled usage limits across the board for paid users as well, such as the ability to follow and join up to 1,000 channels, create up to 20 chat folders with 200 chats per folder, support for a fourth account, and the ability to pin 10 chats in the main list and save up to 10 stickers. The subscription will also let user's create longer profile bios along with support for links. Premium users can add more characters to media captions and can save up to 400 favorite GIFs. They can also reserve up to 20 public t.me links. Voice-to-text allows premium users to get full transcriptions for voice messages and they can also rate them to improve transcriptions. Paid users also get dozens of exclusive stickers, extra emotion and expression effects that can be viewed by free members, the post said. Unique reactions are also part of the suite, and better chat management, with options to change default chat folders. Paid users can also have animated profile videos, that will play for everyone throughout the app, including chats and chat lists. Premium users get a special Premium badge that will appear next to their name in chat lists, chat headers and member lists. You also have access to Premium app icons, and Telegram lets you select between three to put on your home screen. There are no ads for Premium subscribers. It is not clear when the subscription will be available for users in India or how it will be priced. A few days ago, India Today Tech shared to screen grab of a Windows 11 user who claimed to have access to Telegram Premium."
9,Video: Leaking roof at Bengaluru’s Chinnaswamy Stadium draws ire from fans,trends," Cricket fans have taken to Twitter to complain about a roof leak at Bengaluru’s Chinnaswamy Stadium, where the deciding match of the India-South Africa T-20 series took place on June 19. The match was abandoned due to rain. Videos shared on the social network showed spectators waiting under a roof from where rainwater was pouring. Twitter users described the facilities at the stadium as “disappointing”. “The richest board in the world and these are the kind of conditions their fans need to put up with,” a user named Srinivas Ramamohan said. “When will BCCI and KCSA (Karnataka State Cricket Association) improve fan experience befitting the stature of the sport?” What was even more disappointing was the state of affairs inside the stadium! The richest board in the world and these are the kind of conditions their fans need to put up with! When will @BCCI @kscaofficial1 improve fan experience befitting the stature of the sport?? pic.twitter.com/eacucPnwUp  Another person wrote: “These are the kind of facilities we fans have at the stadium! High time BCCI used all the money pouring in to provide better facilities to the fans who take pains of coming to stadia to watch matches!”  These are the kind of facilities we fans have at the stadium! High time @BCCI used all the money pouring in to provide better facilities to the fans who take pains of coming to stadia to watch matches! #BCCI #Banglore #chinnaswamystadium #INDvsRSA #RuturajGaikwad pic.twitter.com/6N2TWmfFfU   A user named Vajapeyam Srivatsa said: “Very disappointing to see the status of our Chinnaswamy stadium. One of the best stadiums is in shambles today. Hope someone address this issue and give value for the money of the fans.” The India-South Africa series ended in a draw because of the fifth and deciding match being abandoned. South Africa had won the first match in Delhi and second in Cuttack by seven and four wickets, respectively."
10,Navy officer-turned-CEO's advice on how to succeed in business,trends," United States Navy Officer Thomas Douglas made a big investment in 2001. He bought the IT solutions company that he had joined as an entry-level engineer. Now, over two decades later, as the CEO of JMARK, he has established himself as a noteworthy leader. On LinkedIn, has been endorsed as someone with a rare combination of “business management acumen and positive, high- performance attitude”. Since he took charge, the Missouri-based company has found itself counted among top private companies in the US multiple times. JMARK says that it adheres to a “People First, Technology Second” philosophy. This is something its CEO emphasised in an interview with the Military Times website. When asked for advice on how to succeed in business, the first point he put forth was team work and building relationships Some sacrifices are also necessary along the way, he added. “I often had to pay talented people more than myself to ensure we had the right people around us,” he told the website. “If you invest and believe in people, it will pay off."" Forgiveness is important, he added. “Grace is key in learning as a team and making sure you ultimately win”. Douglas said people will always be essential to business, but more automation will make success easier. “Automate as much as possible,” he was quoted as saying by Military Times. “From accounting, processes, communications, etc. There are more tools available now than ever before. Do the research to figure out how to minimize the humans that you need to accomplish the outcomes to control costs and volatility.” Douglas advised entrepreneurs to keep cash reserves in case of contingencies. “Winter is always coming,” he said. “I ran for years without much cash and was fortunate that we didn’t have really bad times. It would have destroyed us.” And last, the learning must never stop."
11,Agnipath protests: Anand Mahindra says his company will recruit Agniveers,trends," Mahindra Group chairman Anand Mahindra said he will recruit Agniveers, the defence troops who will be hired in the Armed Forces for four years, in his tractor-to-financial-services conglomerate, the first such announcement by a major corporate house."
12,"In crisis-hit Sri Lanka, ex-cricketer serves tea, snacks to people lining up for fuel",trends," Former Sri Lankan cricketer Roshan Mahanama is teaming up with a non-profit organisation to serve refreshments to citizens waiting in long queues to get petrol in the crisis-hit country. Sri Lanka is experiencing its worst economic troubles since its independence in 1948. The country has run out of funds to import even fuel, food and medicines. In a tweet on June 18, Roshan Mahanama said Sri Lankans needed to look after each other in difficult times. We served tea and buns with the team from Community Meal Share this evening for the people at the petrol queues around Ward Place and Wijerama mawatha.The queues are getting longer by the day and there will be many health risks to people staying in queues. pic.twitter.com/i0sdr2xptI  “We served tea and buns with the team from Community Meal Share this evening for the people at the petrol queues around Ward Place and Wijerama Mawatha,” he said. “The queues are getting longer by the day and there will be many health risks to people staying in queues.” Mahanama advised citizens to look out for others standing in queues with them. “Bring adequate fluid and food and if you’re not well please, reach out to the closest person next to you and ask for support or call 1990,” he added. Sri Lanka has been witnessing protests and riots since March. As outrage against the government's handling of the crisis intensified, Mahinda Rajapaksa stepped down as prime minister in May. The situation in the island nation is so dire that four out of five people have begun skipping meals , the United Nations said, AFP reported. The World Food Programme, UN's food assistance branch, is attempting to raise $60 million to fund a food relief effort for Sri Lanka between June and December. Earlier this week, it started handing out food vouchers to pregnant women in the capital Colombo."
13,Morning Scan: All the big stories to get you started for the day,trends," Indian banks may tie up with Russian lenders not affected by sanctions Indian banks such as Canara Bank, Bank of Maharashtra, and UCO Bank may join hands with Russian banks that are not under Western sanctions to facilitate bilateral payments. These banks will likely open accounts at their Russian counterparts and vice versa, as decided last week in meetings held in New Delhi. Why it’s important: Bilateral trade between India and Russia has been impacted due to the Ukraine war. The partnership between banks will ensure smooth trade flows without violating the economic sanctions imposed by Western nations.  Apollo in talks to buy real estate loan book of L&T Finance Apollo Global Management is in advanced talks with L&T Finance Holdings to acquire realty loans worth Rs 8,000-9,000 crore. The deal, pegged at $1 billion, will also help L&T get cash upfront instead of through staggered payments, allowing it to deleverage its balance sheet, while the private equity group will get a portfolio of real estate assets with some first-loss protection. Why it’s important: L&T Finance is looking to focus on the retail segment by pruning its infrastructure and real estate exposure. This deal will help it to accomplish that.  Regulator considers linking insurance fraud with credit score The Insurance Regulatory and Development Authority of India is considering a proposal to make insurance frauds a parameter for calculating credit scores to restrain an increase in such illegal activity. The proposal is being considered by the insurance regulator because such frauds have been estimated to cost over Rs 450 billion every year. Why it’s important: If the proposal is approved, insurance frauds would feature when the risk profiles of individuals are evaluated, which would reflect on their credit scores. A poor credit score can prevent an individual from availing financial services such as loans and credit cards.  Finance ministry to relaunch Banks Board Bureau with expanded mandate The finance ministry will expand and relaunch the Banks Board Bureau by bringing in more representatives from the insurance sector. The development is aimed at legally empowering the body to recommend candidates for public-sector insurers and hasten top-level hiring at all state-run financial institutions. Why it’s important: The revamp will enable the bureau to recommend top executives at financial institutions. It would also address judicial orders that have held the bureau was not the competent authority to recommend appointments at state-run general insurers.  India’s bad bank rushes to complete first transaction to avoid missing deadline India’s bad bank is racing against time to complete its first transaction by 30 June, failing which it will have to seek an extension from the Reserve Bank of India. The National Asset Reconstruction Company, the government-backed asset turnaround company, had earlier set itself a deadline of 31 March to acquire Rs 500 billion worth of bad assets, but failed to meet it due to procedural reasons. Why it’s important: The central bank’s licensing norms say NARCL must start operations and complete a transaction by 30 June. It is, however, still valuing assets proposed to be sold by lenders. It is unlikely that the agency will be able to meet the deadline.  LIC valuation will reflect its inherent strength once market stabilises The stock price of state-owned Life Insurance Corporation of India has eroded as much as 25 percent since its initial public offer. Chairperson M R Kumar said once the market stabilises, its inherent strength and performance will be recognized. Why it’s important: Investors looking to book quick profits from the initial share sale has been disappointed. LIC shares are now likely to fetch reasonable returns only in the medium to long term.  Employee payments in virtual digital assets to attract 30 percent tax Employers will have to pay 30 percent tax on virtual digital assets such as cryptocurrencies they offer to employees as compensation or otherwise. The tax will be levied on the difference between the cost of asset acquisition and transfer price to the employee. In the case of employees, the transfer price would be considered the cost of acquisition. Why it’s important: The value of cryptocurrencies have crashed in recent weeks. Companies looking to pay employees in virtual digital assets are unlikely to find many takers, more so it they are taxed at a high rate.  Reliance Industries likely to make important announcement in AGM The 45th annual general meeting of Reliance Industries may be held in the next few weeks. Some experts said it may revive plans of an oil-to-chemicals demerger, which was shelved last year. The company may also spell out its future plans for its retail and telecom businesses that operate as separate units. It could also make further announcements in the green energy sector. Why it’s important: Reliance derives almost 60 percent of its revenue and nearly 50 percent of pre-tax earnings from its refining, petrochemicals, and fuel retail business. Retail and telecom account for 34 percent of revenue and nearly 45 percent of pre-tax profits. The ratio might change as the conglomerate focusses more on its consumer businesses.  Telecom operators call for tougher norms for private captive networks The Cellular Operators Association of India, which counts Bharti Airtel, Vodafone Idea and Reliance Jio as members, has demanded tough conditions for allowing enterprises to set up captive non-public networks. The demand comes a few days after the cabinet, despite opposition from telcos, permitted enterprises to set up private networks, with the department of telecom assigning them spectrum directly. Why it’s important: The telcos are strongly opposed to private networks, which they fear might erode the viability of their businesses. The tech companies, who stand to benefit, are strongly in favor. It’s not clear how this will play out, given the high floor prices for G spectrum.  India’s win on fishing subsidies at WTO is start of a long fight India’s successful defense of the rights of developing countries to subsidize fisheries at the World Trade Organization’s ministerial conference is just the start of a long battle. The small print suggests the matter will require further negotiations. Members will need to announce comprehensive guidelines within four years, or the current agreement will be terminated."
14,Tamil Nadu man collected Rs 6 lakh in Rs 10 coins to buy a car. Here's why,trends," A man from Tamil Nadu spent a month collecting Rs 6 lakh in Rs 10 coins to buy a car. Surprised? So were the employees of the car dealership where he turned up. Vetrivel, a resident of Arur, said that his mother, who runs a shop, had come across several instances when customers refused to accept Rs 10 coins. As a result, Vetrivel ended up with a large heap of those coins at home. Sharing another incident, the man added that he also saw children in the area playing with Rs 10 coins as if they were worthless. That's why he decided to create awareness by buying a car with only Rs 10 coins. “My mother runs a shop and since people don't want to accept the Rs 10 coins, they have been piling up at home. No one is ready to accept the coins. Even in banks, officials are reluctant to use them. They claim they don't have the numbers to count the coins,"" Vetrivel told India Today. ""When RBI has not said that the coins are worthless, why aren’t banks accepting them? Even if we complain, no action is taken."" To spread awareness about this problem, Vetrivel spent nearly a month collecting Rs 10 coins worth Rs 6 lakh to buy the car. Initially, the car dealership in Dharmapuri was hesitant to go ahead with the transaction, but considering Vetrivel’s determination, they agreed to go ahead with the deal."
