,topic,category,content
17,Experience Matters,Business,"
					I recently attended a PMI event on the age old question of what makes a project more successful than another. The discussion started by stating the obvious need to focus on the 5 W's, but also the importance of 'how' things are done. The discussion was primarily philosophical, asking us to each think of the differentiators.				"
18,What Are Micro Switches And Why Are Are They Popular?,Business,"
					As the electrical devices are becoming smaller and the efficiency of usage is increasing as well, the need for more efficient switches is in demand. This is the reason why microswitches are the most demanded. Popularly known as snap action switches, these are one of the most popular miniature switches that are used in the appliances and various modern technology devices.				"
19,Variety of Microswitches With Unionwell,Business,"
					Unionwell specializes in the manufacture of different modules, precise electronic components and microswitches that are assembled with various brands at global and local levels. Our headquarters is present in the southern part of China; our workshop is located between Dongguang and Shenzhen; the size of our workshop is 22,000 square meters. Our technicians and development and research team are filled with veterans who have a huge amount of experience along with honorable achievements.				"
,topic,category,content
0,Factors To Consider While Picking The Right Micro Switch,Business,"
					Microswitches are very popular these days, as they are not only micro in size they are also highly effective. They can be used in various devices and appliances, which requires quick and effective switch which can work with less current flow as well. These switches are used in heating systems, industrial equipment, alarm systems, etc.				"
1,Complete and Self-Contained Miniature Snap-Action Unit,Business,"
					What are those tiny, compact things that are consistently used in every minor to major electrical circuits? What is the most preferred and first- considered appliance that is used with power supplies to turn your complex machines on and off in a snap? MICRO-SWITCH is the answer to it all.				"
2,The Macro World of Micro Switches,Business,"
					Introduction The word micro does ring a bell of being small, right? But it is this micro system that does wonders in the electrical world. Big miracles often tend to happen through small people, just like the story of Goliath.				"
3,Micro Switches - Effective Controllers For All Machinery and Appliances,Business,"
					Microswitches are considered to be one of the most common components of the industrial world. Practically known as miniature snap-action switches, these are widely incorporated in several types of machinery, electric appliances, cars, and other industrial applications. This switch is constructed using the tipping point mechanism.				"
4,Cosmetic Tubes: Everything There's to Know,Business,"
					Introduction There are literally a million products in the market of the modern world all available for people to choose from and use. With a consumer base of almost 8 billion people, the competition in every category is always fierce. This is why, companies always have to put their best foot forward when dealing with the marketing and packaging of their product because it is as they say, 'first impression's last'.				"
5,What Are Microswitches and Their Pros?,Business,"
					WHAT IS MICRO SWITCH? A micro switch is a great revolution in the area of electrical switches. Synonymously known as the snap action switch, it does what its name proclaims.				"
6,What Are Micro Switches Used for?,Business,"
					WHAT IS A MICRO SWITCH? Microswitches are electrical switches operated mechanically that open and close sets of shifting contacts inside an electrical unit. HOW DOES A MICRO SWITCH WORK?				"
7,Get Long-Lasting Micro Switches for the Smooth Functioning of Your System,Business,"
					Miniature snap-action switches, nicknamed as micro switches are small electric circuits that are installed in a wide range of machinery and electric appliances. These switches respond to any external changes which are quite uncommon or which affect the continuous functioning of a particular system. These are used in a wide variety of fields such as industries, transportation, security, automation, etc.				"
8,Search Engine Optimization - In-House or Out-Source?,Business,"
					SEO (Search Engine Optimization) is, and has been, a really hot topic for some time now. Though this is not my area of expertise, I do have some thoughts. As with any tasks that you are considering whether to outsource or bring in-house, there are some pretty easy indicators as to which option will work the best for you and your business goals.				"
9,What to Look for When Buying a Microswitch?,Business,"
					WHAT IS A MICROSWITCH: Before diving into what a microswitch is, let's understand the basic concept of a switch. A switch is an electromechanical device used in applications where it is activated with little contact or pressure. It causes an 'on' and 'off' action where it changes the flow of current to produce the required operation of the appliance.				"
10,What Are Microswitches and Their Uses?,Business,"
					WHAT ARE MICRO SWITCHES? A microswitch is also known as a miniature snap-action switch. It is an electric switch that is made to work by a little force (physical).				"
11,True Agility Starts With Collaboration,Business,"
					Organizational design and business agility has always been an area of interest to me, long before they were buzz terms. I enjoy assessing the people and goals of organizations and analyzing the psychology behind it all. In 2007, I completed my first formal agile training and certification (Scrum Master).				"
12,Be Authentic,Business,"
					Good or bad, I am always the same. In my profession, I may tailor my message to my audience, but my core values, personality and ideas are the same regardless of who I am talking to. I think this goes a long way towards building teams, developing loyalty and relationships.				"
13,Ideas That Stick,Business,"
					If you follow my column, you have seen my articles on how good project managers have radar and are able to predict situations. Good project managers are also strong, insightful business leaders. This can be both challenging and rewarding.				"
14,No Pain No Gain,Business,"
					Exceptional project management is an uncomfortable place. Those who are the most successful, are those who swiftly identify risks and are able to provide deep insight into what could happen if situations are not resolved. The beauty of these individuals is they have an innate, internal magnifying glass and can almost predict situations.				"
15,A Confident & Prepared Experience,Business,"
					About a year ago I had a less than desirable personal service performed. What I was told was a very small, routine dental procedure, that according to the computer would take 18 minutes turned into a situation where I lost all confidence and trust in my dental provider. The issues presented and takeaways really apply to all types of projects and businesses.				"
16,Managing Team Stress,Business,"
					Look for signs that your team members are off. Read between the lines and pick up non-verbal cues.				"
17,Call It What It Is,Business,"
					Anyone in the project management field has heard of gold plating. For those less familiar with the term it basically means adding features outside the original scope and requirements. Working with teams less familiar with all of the downstream impacts and risks, may think this scenario isn't that dangerous and will help please the customer.				"
18,Strengthening and Enforcing Our Profession,Business,"
					In order to be an effective project manager (PM), we should look at our definition of project management. Definitions surprisingly vary greatly by organization and individual. We should be careful about calling something project management that really is not.				"
19,Are Your Remote Staffing Teams Out of Control?,Business,"
					Managing remote teams is a new art. Most managers were caught off guard when suddenly their office was evacuated and they were forced to manage their teams remotely. So how can a team continue to produce expected results without the personal interaction that most teams are accustomed to?				"
,topic,category,content
0,What Are the Advantages of Using Micro-Switch,Business,"
					A microswitch is a type of momentary contact switch. It is also called miniature snap action switch and is widely used in the automotive, medical, and electronics industry. The term ""micro"" used in its name is the name of the company that first started manufacturing it.				"
1,Micro Switches and Their Uses,Business,"
					Micro switches have a wide range of applications in today's day to day used electronic gadgets. They also have use in industrial areas. It has its use in many areas, according to the type used.				"
2,Types of Micro Switches and How They Work?,Business,"
					What is a Micro Switch? Unlike regular switches, though, micro switches are triggered by even the smallest of forces acting on them. A mechanism called the tipping-point mechanism is what senses those forces and causes the triggering of the switch.				"
3,Unionwell Germany Is a China Micro Switches Manufacturer That Is Rising to the Occasion,Business,"
					About the company Unionwell is a company based in China that has over the years specialized in creating special micro switches. The world has developed technologically in the past few years by leaps and bounds. So much so that in the places where the electricity was once a luxury, it has now become an integral part of our daily life.				"
4,What Are Electrical Switches and What Are Its Common Options?,Business,"
					In every electrical appliance or electronics, one of the major additions is a switch. Without a switch, there is no way you can operate an appliance. Every appliance has its own usage of the switch and has different types attached to them.				"
5,Unionwell Switches - The Brand You Can Trust,Business,"
					Home appliances without switches are impossible. We require them for fans, tube lights, bulbs, air conditioners and also for phone & laptop charging sockets. The same thing applies to our offices and industries too.				"
6,Essential Tips for Buying Micro Switches,Business,"
					Micro Switches are very important for any electrical appliance and they play a vital role in its sustainability. These switches can be found in many applications and are widely used in consumer and industrial devices. Let's take a look at some essential tips to buy these units.				"
7,Microswitch a Simple Tool Lasting Life Long,Business,"
					Microswitches also known as Snap action switch is a tool that can change the course of the supply of current from one way to the other with minimal physical pressure. A microswitch has 3 unique connections namely Common, Normally Open, and Normally Closed where all the connections are connected to certain circuits. It consists of a spring where one end of the spring is connected to the body of the switch while the other end is connected to the lever which changes momentarily with an outside force which in turn changes the connection inside the...				"
8,Main Things to Notice in a Miniature Snap-Action Switch,Business,"
					A miniature snap-action switch, also known as the microswitch, can operate with less physical force. The microswitches make use of the tipping-point mechanism. Most of the people can afford to use these switches as they come at low cost along with high durability.				"
9,Evolving Trends and Risks of Micro Switch Procurement Market,Business,"
					Micro Switches are being produced and supplied on a large scale because of its significance in any electrical appliance. Over the past few years, many new players have entered the market and raised the competition among participants. Let's find out more about this trend.				"
10,4 Tips To Help You Choose The Best Micro Switches,Business,"
					Regardless of the electrical appliance type you have, the importance of micro switches cannot be denied. These units are so important that they can be used for a variety of purposes. They can be found in both consumer and industrial products.				"
11,Everything You Need to Know About Microswitches,Business,"
					Microswitches are electrical switches, and these can be initiated using very little force using a tipping-point mechanism. These are also very popularly known as miniature snap-action switches. There are around 19 kinds of microswitches which are used in different mechanisms.				"
12,A Guide for Replacing Your Refrigerator's Micro Switch,Business,"
					Many of us like to repair appliances on our own at our homes. The reason is not always saving money. Sometimes, this adds to our knowledge about a certain appliance.				"
13,The In And Out Of Micro Switches ,Business,"
					What are 'Microswitches'? They have a resilient built to themselves, which can make them endure about 9 to 10 million cycles before eventually breaking down to being of no use. They do not cost a lot and can be easily put into the application.				"
14,Micro Switches: The Tiny Soldiers With Big Impacts,Business,"
					What are they and How They Work? Microswitches are operated mechanically. These are electrically operable switches with an actuator and also, terminals known as common which are normally open and closed.				"
15,Micro Switches-The Component That Makes Your Machine 'click',Business,"
					What are micro switches? Miniature snap-action switches (or micro switches as they are frequently called) are simple but novel electrical switches that are found in almost all electrical appliances ranging from residential to industrial purposes. The interesting feature about them is that they require the application of very little physical force to switch.				"
16,6 Common Type of Switches,Business,"
					If you are interested in finding out more about microswitches, you are on the right page. In this article, we are going to take a look into different types of micro switches. This will help you opt for the right unit to meet your project needs.				"
17,The Fundamentals Of Micro Switches,Business,"
					You may have seen micro switches in different types of devices, but you may not know the full name of this product. The term micro switch refers to a miniature snap-action switch. The name is given because this type of switch requires a small amount of force to activate.				"
18,Precautions for Safe Use of Micro Switches,Business,"
					If you are looking for some tips to use a micro switch the right way, you are on the right page. In this article, we are going to get a deeper insight into the precautions for the safe use of these products. Apart from this, you will also learn to use the product properly.				"
19,What Are Micro Switches and Where Are They Used?,Business,"
					This article is about a technology that all of us are surrounded by. However, you can't feel the presence of this technology unless you belong to the field of technological sciences. We are going to talk about a micro switch.				"
,topic,category,content
0,The Types and Functions of Mechanical Switches,Business,"
					Basically, a switch is a type of simple device that can be used to break the circuit to stop the flow of current. It can be either open or closed. When it's in the ON position, it allows the flow of current.				"
1,Common Problems With Micro Switches,Business,"
					It can be debated that micro switches have certainly increased the reliability of electrical appliances and thereby elevated the demand of these switches among manufacturers over the years. In order to meet this demand, many suppliers have entered the market because of which variety has also enhanced. Since the supply is rising with the increasing number of sellers in the market, you need to be cautious while opting for the right quality switch, especially if you are having a little or no knowledge about them.				"
2,What's Inside a Micro Switch and How Does It Work?,Business,"
					We are going to discuss a technology that is very commonly used by automotive, medical, household and medical industries across the world in numerous markets. The technology may be very small in size but can have a greater impact on any machine or equipment to normalize its operations. Read on to know more.				"
3,Micro Switches and Things to Consider While Using Them,Business,"
					Do you know what is common among vending machines, printers, refrigerators, air conditioners, microwave ovens and photocopying machines? It's a technology called micro switch. This technology is not confined to these machines and you will find many of them in almost every household or office premises.				"
4,The History and Evolution of Micro Switch,Business,"
					You use these units in your home appliances or while working in your office. They are very small and may not be visible to you when you are using a printer, changing floors in the elevators, baking food in ovens and what not. Let's find out more.				"
5,There Is No Going Back to Normal: How Jobs & the Workplace Will Be Affected Permanently,Business,"
					No one can predict the future, but experts expect the #workplace to look a lot different going forward, even after a vaccine is found for COVID-19. Learn how it is expected to change and how you can begin to prepare for the new norm.				"
6,How to Create a Video Marketing Strategy That Gets Results,Business,"
					Having a video marketing strategy is key to reaching your ideal customer. Video is an often-overlooked marketing tactic that should be part of your marketing strategy. Here are three steps to create a video marketing strategy that increases engagement, leads and sales.				"
7,An Introduction To The Design And Application Of Micro Switches,Business,"
					Micro switches, aka miniature snap-action switches, what developed by Peter McGall in 1932. 5 years later, he started the Micro Switch Company. Around 13 years later, Honeywell bought out this company.				"
8,What Are the Advantages of Micro Switches?,Business,"
					The technical term for micro switches is a miniature step-action switch. This is a type of electrical switch that gets actuated through minimal force. These units use a tipping-point mechanism.				"
9,Pure CNG Compressors: Back to Basics,Business,"
					CNG refers to compressed natural gas. This type of gas is commonly used in combination with a fuelling system in order to fuel different types of CNG vehicles. CNG compressors are connected to a regular supply of natural gas just like the gas supply found in homes or workplaces.				"
10,7 Steps to Replace Your Fridge Micro Switch,Business,"
					If you know how to perform basic repairs, you can make your appliances last much longer, which can save you a lot of money. In this article, we are going to help you replace your fridge micro switch. In the beginning, it may not be easy for you to replace the unit.				"
11,How Does an Oxygen Compressor Work?,Business,"
					The air around us is a combination of 20% nitrogen and 80% oxygen. An oxygen compressor is a medical device that helps patients who suffer from a low level of oxygen in their bodies, especially in the blood. These units get their power from a battery for an electrical outlet.				"
12,Top 4 Advantages Of Micro Switches,Business,"
					The introduction of micro switches in the world of electronic devices and appliances was a revolution. If you are a manufacturer of electrical appliances, you can stay ahead of the competition using micro switches. The reason is that the devices offer a lot of advantages.				"
13,Common Questions About Micro Switches,Business,"
					In this article, we are going to talk about a few common questions about micro switches. The answers to these questions will help you get a better understanding of these units. Without further ado, let's get into the details.				"
14,What Are the Applications of Micro Switches?,Business,"
					Micro switches have a number of applications. They can be used at homes and in a lot of industrial environments. For example, you can find them in homes and the security and automation of buildings.				"
15,Micro Limit Switches: Back to Basics,Business,"
					Micro switches come in a lot of types based on the purpose they are designed for. Therefore, you need to choose the right one based on the application. For example, a micro switch designed for a refrigerator won't work for one designed for a microwave oven.				"
16,Importance of Wholesale Packaging Boxes,Business,"
					In the retail industry, the importance of packing products appealingly is THE most imperative thing. The concept of display packaging comes into play when the customers are out in the store or the market to look for something and most customers tend to buy something they haven't seen or heard of just because it looks attractive. So you see how good packaging can be the key to success for your product as portrayed very rightly by the age-old saying, ""that which is seen is sold"".				"
17,Medical Records Technician Job Roles,Business,"
					What does a medical records technician's job require? Becoming a medical records technician will require you to work in clinics, nursing homes, and hospitals. Most of the job requirements deal with handling the hospital reports of the patients as well as managing record systems that are computerized.				"
18,Medical Coder and Biller Job Qualifications,Business,"
					A medical coder analyzes clinical documents and translates them into proper codes by using specifications. They work behind the scenes of every hospital or clinical setup. Medical billers are health claim specialists who typically work in an office setup, and are responsible for processing insurance claims on health for hospitals and other medical staff.				"
19,3 Benefits of an Aluminum Tool Box,Business,"
					An aluminum toolbox can be greatly beneficial for you whether you have a tractor or trailer. You can buy these products from a lot of manufacturers, but it is better that you buy from one that offers tool boxes made of aluminum. In this article, we are going to discuss the primary benefits of these boxes.				"
,topic,category,content
0,Micro Switches and Their Usage: What Are Their Applications:,Business,"
					WHAT IS A MICRO SWITCH AND WHY TO USE IT: A micro switch is officially called as a miniature snap-action switch. It is a switch that is operated by a very little amount of force. It can be seen in usage in home appliances and security systems and in the architecture of major appliances.				"
1,Cosmetic Tubes - The Perfect Cover for Your Brand,Business,"
					If you use make up products or if you have seen somebody using makeup products, you must have noticed the cosmetic tubes that the product is stored in or which it is packed in. These tubes are truly the best form of packaging for makeup products. They truly come in handy if you are working in the cosmetics industry or if you own your make up brand.				"
2,Communicate to Be Heard,Business,"
					When communicating with others, we need to think about the words we are using, and their intent. And we need to listen with clarity and comprehension to those words used by others with communicating with us.				"
3,Split Case Pumps: Everything You Need to Know,Business,"
					What are split case pumps? Pumps are mechanical devices that are used to move fluids or slurries by converting electrical, mechanical, or wind power energy into hydraulic energy. They came in a variety of sizes from microscopic to large industrial pumps.				"
4,Boiler Feed Pumps: A Complete Guide,Business,"
					What are boiler feed pumps? Pumps are mechanical machines devised for supplying water and slurries from one location to another. They can be driven by electricity, manual operation, wind energy, and convert these to the hydraulic form of energy.				"
5,Multi-Stage Pumps With All the Right Features,Business,"
					Many of you may not know what is the difference between multistage pumps and single-stage pumps. The basic difference between the two is the impellers and how they are being used in their operation. Multi-stage pumps have two or more impellers rotating or circulating near the shaft, unlike a single-stage pump.				"
6,Features of the Best Mining Pump,Business,"
					When talking about mining pumps, it is one of the most important machines for the mining industries. It is necessary to have an efficient pumping machine to get the best results. If you are also in the search for a proper mining pump, then you are in the right place.				"
7,The Future RCFE License Criteria,Business,"
					What's new in the world of residential care facility for the elderly licensing? Well, after the coronavirus just about everything is new. Our industry is rapidly changing, many will not be able to keep up. It's important to stay up on these changes, and there is opportunity for those industry participants who can. Those who fall behind will not be in business in the next year.				"
8,What to Know Before Buying an RCFE,Business,"
					As America ages, it goes without saying that the assisted living business will be blooming for years to come. It's no wonder we see new facilities popping up all around us - most of them doing quite well. Investment groups and private owners are buying existing homes, building out new locations, and/or expanding the facilities they already have - all to meet the ever-growing demand. There is a lot to know about this business model. Buying an existing REFE, and expecting a guaranteed profit is a lot harder than it looks, but if you are smart and buy right it can be a wise investment.				"
