,topic,category,content
19,An Irish Tale: Passage of the King Snake And a Poem: The Demon Follows,Arts-and-Entertainment,"
					The Hyperborean Mythos - Passage of the King Snake - (An Irish Tale) - Outside of old Dublin, there resides a passageway, where the snakes cross, As they make their way to Dublin-! May die on the way of exhaustion. The King Snake, waits for the impending fog to rise-otherwise known as bog, to sweep over all.				"
,topic,category,content
0,Stuff - Best Tech Magazine to Like-Minded Tech Fans,Arts-and-Entertainment,"
					Stuff is the world's best-selling gadget monthly magazine for over a decade, published by Haymarket Consumer Media. The magazine started off as a bi-monthly in the US in 1996 by Dennis Publishing and the focus shifted to being more lifestyle orientated in 1998; the same year that rival publishing group Haymarket Consumer Media bought the title in the UK. Haymarket Consumer Media also took over ownership of Stuff magazine in 25 other territories, such as: Australia, China, France, Germany, India, Indonesia, Lithuania, Malaysia, Mexico, Middle East, Netherlands, Poland, Russia, Singapore, South Africa, South Korea, Spain, Taiwan, Thailand, Turkey, Vietnam.				"
1,Hosting A Fun Kiddie Party With A Bouncy Castle Hire,Arts-and-Entertainment,"
					Planning an event that will also be accommodating kids on the side must have been one of the most challenging things you've ever been made to do. It's one thing to invite children to an event. To make sure they're entertained and looked after as well, since they will be somewhat separated from their parents' or companion adults' company at some point, this usually requires some thinking out of the box.				"
2,Balangiga and the IDPs in My Mind,Arts-and-Entertainment,"
					From mid-2003 to sometime in 2006, I was part of a team that facilitated community meetings in Balangiga, Eastern Samar. Ours was one of several teams working in poor municipalities selected by the Department of Social Welfare and Development (DSWD) for its KALAHI CIDSS Project.				"
3,"What Is the ""Creative Filter"" and How to Avoid It?",Arts-and-Entertainment,"
					Do you know someone creative who's talents are only recognised by those close to them? Or are you that person? If you answered yes then you have an untapped talent and are likely the victim of the 'Creative Filter'. But it doesn't have to be that way...				"
4,Why Have Adult Coloring Books Become So Popular?,Arts-and-Entertainment,"
					Recently a couple of coloring books for grown-ups became the top best-selling books on Amazon. (Yikes!) In addition, for quite a while five of the top ten best-sellers in Britain were adult coloring books.				"
5,"The Hyperborean Mythos, The Lost Dark Book Of Islam",Arts-and-Entertainment,"
					I read of it first in a journal of antiquities, the strange 'Dark Book,' which was said to be the draft of the first Qur'an, before it was put together some time in the mid-7th Century, but what others have now called, a strangeness of an eccentric clergy of his day, has been brought to my attention. He apparently lived a life of curiously and died in a grisly and mysterious fashion, he was the scribe of the so called 'Lost Dark Book of Islam', and in lack of his name we shall call him, with a capital letter, the 'Copyist.' It was my fortune to have access to this nameless scribe, the Copyist, to find the original editing of this so-called, 'Lost Dark Book... ' was a marvel. And to my understanding only a half dozen of these books ever existed, as for the Copyist, he wrote the original (with side notes, the side notes being the most important to the discovery)...				"
6,The Hyperborean Mythos Amsterdam: Deserted Orchard (1975),Arts-and-Entertainment,"
					I entered the room with my twin boys. Like the hall and hearth downstairs, it contained the furniture necessary for the most meager hospitality of a guesthouse in Amsterdam. It was 11:00 P.M., it had an iron bed with a brown-drab-colored spread over it, a wooden chair next to it, a hat-rack and a washbasin, nearby. The walls were a dirty pale yellow, and naked of any pictures, a nail here and there, short and rustic, a sinister looking room. I fed the boys a ham and cheese sandwich, they were per near four years old. Then I put them to bed, ""What can I do until I'm tired?"" I asked myself; a rhetorical question perhaps. Horrified by the idea of being shut up in this room sober. I paced the room shrugged my shoulders, it was fall of 1975, and there was a chill in the Amsterdam air.				"
7,"My Celebrity Encounters: Kurt Russell, Part 1",Arts-and-Entertainment,"
					I grew up in southern California, and spent most of my life working in the entertainment industry. I am currently a professional touring musician, and I have worked in the motion picture business as a driver, courier, production assistant and actor. This series of articles focuses on some of the people I have met over the course of my life. With the exception of a few, these were positive experiences, and I will try to present these in a chronological order.				"
8,Tips To Design A Large White Dream Catcher For Your Space,Arts-and-Entertainment,"
					Dream catchers are loved and used by many people today to bring only good dreams and trap the bad ones. Nothing brings more positivity to life than when you dream of only nice things and if you are a strong believer in the dream catcher, then this is the exact thing you stand to achieve. Dream catchers are not only exciting because they can be hung at virtually any given place, including your indoors or outdoors depending on your preferences, but you can actually make one yourself and enjoy impressive results.				"
9,The Hyperborean Mythos Land of the Forbidding,Arts-and-Entertainment,"
					In the deep twilight when snow covered shrubs look like ghosts, and wandering deer look like monsters, beyond the cities and the farmlands, the farthest regions of Minnesota forests, and to the Canadian Arctic, nothing seems to appear in its right perspective; everything is too large, too tall, too wild, too ugly, too far, too near, too fierce, thus one never sleeps at ease in the wild of winter nights in the land of gray strangeness, in the land of the forbidding. When the northern lights appear, never are they the same, they, like the cold forest wavers and shimmers like the crossbones on a black flagged ship at sea. The Inuit's know the land and its old legends. Its ghosts, death, for death is common in this place, should you make the wrong, move, turn, step, choice, you must live with its results.				"
10,World From the 4th Dimension,Arts-and-Entertainment,"
					The report read: ""Bashar al Assad, president of Syria a malefic conqueror with his pal Putin, of Russia is as if they are in cohesion with some madman from the 4th Dimension, who are pals in world conquest, lest the leader called Mordieu, whose plans for the world conquest was to start in Syria, and will make Genghis Khan and his Mongol horde look like armatures."" Said professor Evens, professor at Los Wanaka University, in Huancayo Peru, for 'World New Reports' (February 20th, 2016.) From World News Reports, March, 20th, 2016, by Professor Chick Evens (Bacterium Biologist), ""Should you move about in Syria you will see 350,000-less inhabitants, these shapes of humans: men, women, and children and the elderly were not long ago alive now corpses of Bashar al-Assad's regime. Because he has refused the UN's resolution 2254, for peace talks, he is directly responsible for all those lives, to include 11.5 million misplaced Arabs, no longer available to live in their homes, short of water,				"
11,Worlds Beyond Unleashed Asteroid ((2019-Earth Bound) (With Dr. G.B. McGee)),Arts-and-Entertainment,"
					At the Louisiana Space Station, Dr. G.B. McGee, has just released to the radio, and television networks, information concerning the strike of an Asteroid that hit the Gobi Desert today. What had taken place-prior to this event-was that a supernova (a star/sun) explosion, took place in one of the one-hundred-galaxies that can be seen behind the Milky Way, causing a gradational wave, which has been traveling at the speed of light for some time now, Dr. McGee has separated this wave from what is called an electromagnetic radiation, whereas he has determined it to be a GW (gravitational waves), on the grounds it does not interact with matter. It has traveled throughout the universe from those galaxies, unimpeded through the universe, and has caused an asteroid to wobble off its course, the size being 0.6 - miles wide and it has hit ground in the Gobi Desert, had it been a six mile wide asteroid, the size of the one that wiped out all the dinosaurs eons ago, well it would be a different story-McGee has inferred to his audience: he has told the radio audience as well as television...				"
12,"The Hyperborean Mythos Strange Days ((Mantaro Valley Region) (Huancayo, Peru))",Arts-and-Entertainment,"
					His house was old-old, adobe style, high up in the Andes, way in the deep back woods of the township called, 'The 9th of July,' with its high uncountable umbrella like eucalyptus trees shading the old winding dirt roads, clustered all the way to the cemetery, a half mile away. It had a faint miasmal odor which clings about houses that have stood too long. We all thought his house dated back to the days prior to or shortly thereafter those days Catalina Huanca, no joke, somewhere along 1624 A.D., thereabouts. The old man, Juan Pablo was never too glad to see a visitor, or for that matter, a trespasser, although we had a curiosity relationship-he and I- myself being a poet, and he liked poetry, and being a gringo, and not of the area per se, although the Poet Laureate of the township. Plus I always brought him a bottle of Chicha de Jora.				"
13,Tips for Finding a Good Corporate Event Singer,Arts-and-Entertainment,"
					There is nothing to make a corporate event go better than some quality musical entertainment, and there is a variety of different types of singer available, ranging from opera singers for hire right through to those who offer a more traditional rat pack style. Finding a good singer, however, is potentially quite difficult, so here are some tips on how to go about that.				"
14,Get Excitement and Thrill-Filled Fun at a Trampoline Park,Arts-and-Entertainment,"
					How about visiting a place that has activities for one and all, be it kids, teens and adults? And how about visiting a park where a whole variety of fun-filled activities are available in a safe environment? Such a place without doubt would be something surreal, if it exists at all. Yes, it does exist! Just look around and see how a growing number of families are switching to trampolining for their weekend outing.				"
15,"The Hyperborean Mythos Agonies of the Grave ((Burial Before Death) (Huancayo, Peru))",Arts-and-Entertainment,"
					THE conqueror worm, the bleak and blackness of night, the damp soil, clinging onto one's garments, oppression of the lungs, the embrace of the narrow coffin, the body now entombed for evermore. The lack of air, fumes, the grass above one's head, and above that a moon, and sun and stars, galaxies, the universe, you are in a new world, beyond. Your friends are at home sleeping, drinking, laughing, all informed of your death, yet not your fate; that they are uninformed of. You are buried alive, in a hopeless position. Appalling it may be, an intolerable horror, an agonizing dream, as nothing half so scornful, but it is real, and somehow you must tolerate the burden of that reality.				"
16,All You Need to Know About Polyurethane,Arts-and-Entertainment,"
					Polyurethane rubber is a multipurpose plastic that works extremely well as a mold making material. Read on to find out more about polyurethanes.				"
17,Joy of Learning,Arts-and-Entertainment,"
					Humans have ability to lean during their entire lifetime. We should continue to learn and experience new things. Arts may be good place to start, but the possibilities are unlimited.				"
18,The Hyperborean Mythos & Worlds Beyond The Treaded From Earth's Underworld,Arts-and-Entertainment,"
					I have seldom been able to resist the allurement of a new city, to explore its beaches, it its main quarter, its rocky structures by the sea; in 1998, last year, about the same time, July, I went to Tangier, this year its it's Algiers. I am on vacation from the Los Andes Space Center high up in the Andes of Peru where I work as a scientist, I am kind of an astrophysics technician, along with several comrades that work in the same area. As I said, this all took place yesterday. When climbing on some of the rocky structures by the sea, to browse around for a few minutes having come upon this mystery, brief as it was, and thereafter had an idle forenoon to ponder on it, as now I write it out on journal paper for posterity sake. Actually the group I was with, I stepped away from them for a while. Sometimes the slow and smooth mediocrity of life gets to me, being a scientist, and I had brought nothing to read ahead of time, and talking with strangers on the bus, I got so hurriedly and grotesquely tired of miner chitchat I could almost...				"
19,The Hyperborean Mythos & Worlds Beyond The Tides of Light and Darkness,Arts-and-Entertainment,"
					The Stone shops, and houses, buildings and archways, alleys, cobblestone streets of Tangier, the hills and walls, and the coastal sea next to its city-dwelling, some of the old structures from the days of the Moors, Dr. Nutt had went back to Tangier in the year 1999, having visited it in 1997 and liking the climate. Previously he had visited Algiers in 1998, when he had his run with Agaliarept, Henchman from Tartarus, Lord of Five Legions. Again he was on a tour, vacation from his work at the Los Andes Space Station high up in the Andes of Peru. He parted his group, just inside the Kasbah, to go out on his own, as often he did. He liked to feel his feet on those old cobblestone streets. Should you have stood on the upper wall of one of a two or three story building, you would have seen a yellow lighthouse overlooking the sea, the plateau streets below the hills, to the upper part of the city proper.				"
,topic,category,content
0,These Artists Turned Used Cars Into Art,Arts-and-Entertainment,"
					While, to most people, used cars are nothing more than a reliable form of transportation, some artists around the U.S. have instead been using them as a reliable form of transcendence. Here's how some folks have turned automobiles into artistic masterpieces.				"
1,"Learning to ""Play Along"" in the Role of Dementia-Challenged Caregiving",Arts-and-Entertainment,"
					A poignant look at what may await many of us: The care of an elderly parent afflicted with disease and rampant dementia. The author cares for his father, a former FBI Special Agent whose greatest attributes are an extravagant sense of humor and a highly comedic personality. The relationship the two share during the father's hospice period -- a lengthy 19-month long timeframe -- is colored by the father's ""episodic dementia,"" a series of funny, real and imagined adventures owing to his condition and his ""re-living"" of former life experiences as well as those of an FBI Agent.				"
2,6 Essential Trampolining Facts,Arts-and-Entertainment,"
					Everyone, from suburban moms to your favourite celebs, is ""jumping"" on the trampoline bandwagon... and a quick internet search for a ""trampoline park near me"" will most likely prove it. You'll see that many local trampoline parks and gyms have plenty of great options for grownups, including adults-only fitness classes. Who knows, you might even run into a famous face... if Madonna, Julianne Hough, and Victoria Beckham are fans of hopping their way to health, why shouldn't you be?				"
3,How Embroidery Has Evolved Over the Years,Arts-and-Entertainment,"
					Such has been the importance of embroidery in our world and its culture that its value has only increased over the years. Don't even think for a second that this form of art is the creation of the modern world. It's as early as the 1700s when having embroidered clothes in possession was a clear sign of wealth. Back then, there were no clothes or colourful threads which are why bone, sinew and animal pelts were used to create designs				"
4,Ode to the Coloured Pencil,Arts-and-Entertainment,"
					The coloured pencil, sadly, does not get nearly as much recognition or appreciation as it deserves. Whilst there are hundreds of websites, blogs and galleries dedicated to the popular mediums of oil paints, watercolours and acrylics, the coloured pencil often remains a forgotten tool in the artist's repertoire.				"
5,Metal Casting Via Sand Molds,Arts-and-Entertainment,"
					Sand is mixed with water glass and reacted with carbon dioxide to form a solid mold which can be used for metal casting. The article also shares some important facts on casting.				"
6,Four Ways to Getting Creative With Picture Framing,Arts-and-Entertainment,"
					Over the years, it is not unusual to amass many photos, mementos, and prints to liven up walls, the ledges, and mantels of the house. Nonetheless, with so some these pictures lying around can be hard to have the knowledge of what all to do with them; picture framing might not be cheap, but when pinned to the wall with thumbtacks, pictures and posters often appear disorganized and cluttered. Luckily, there are boundless possibilities when it comes to showing and framing your keepsakes.				"
7,My First Memory Was My Most Embarrassing Moment,Arts-and-Entertainment,"
					You would think my first memory would be something great. However, as with all things in human existences our expectations are crushed into dust.				"
8,A Review of Art Paper Terms and Types: What's the Best Type of Paper for Artists?,Arts-and-Entertainment,"
					There are many types of papers for artists for drawing, watercolor, acrylics, inks, printmaking and mixed media. This article looks at the many terms used in discussing paper types and what they mean.				"
9,How To Purchase Art Online,Arts-and-Entertainment,"
					You love art and want art - but don't know where to start! As a first time collector, you want to make the right decision. When first starting a collection, it can be pretty intimidating to go into a gallery or speak to a dealer when you don't know what kind of art you like.				"
10,Different Things You Can Do On A Bouncy Castle,Arts-and-Entertainment,"
					Imagination is very important when thinking of ways on how to make a bouncy castle more entertaining. The possibilities are certainly endless.				"
11,How to Choose the Best Festivals for YOU,Arts-and-Entertainment,"
					Explore events around the world, from mega music raves to quirky cultural experiences. Discover how to sort through thousands of celebrations - the biggest, smallest, most popular, least known, or most bizarre festivals on the planet - and find the ones just right for YOU.				"
12,Mysterious Ways of Life,Arts-and-Entertainment,"
					In this article I examine life and its mysterious ways. As our experience of live expands, we gain larger perspectives of the events of our life and the mysterious powers that govern it.				"
13,The Hyperborean Mythos - The Night of Dead Ages (A Monstrously Vivid World) (Al-Baghdadi),Arts-and-Entertainment,"
					From the lost scroll, 'This is an Islamic Testament of the Cadaverous Codex' from Mohammad the Dreadful, the Wizard who givith prophecy, this year of 660-years after Christ, to the 21st Century Founders of the New and perfect Islam,' I am the Wizard of the Dust, so they have called me, and I speak from my grave, I will call in this time one and many to follow him, to bring ultimate corruption to flesh and bone on earth's soil, that do not abide the treading of these words now I write: to all Christians and to all that cling onto the pant of those infidels, and to Islamic betrayers and alike, you will crumble beneath the feet of my grave... ' The cleric's name not being fully known, but was referred as Mustafa, or just plainly Wizard, and his writings have been radiocarbon tested, putting the written date of the Testament Scroll at: 645 to 650 A.D.; Muhammad dying in the year 632 A.D. and the Qur'an being standardized around 656 A. D.				"
14,4 Ways to Boost Your Last Minute Ticket Sales,Arts-and-Entertainment,"
					When it comes to concerts, selling tickets of your event at the last moment is often very difficult. As such one can make use of some simple marketing tricks and do some activities that can help boost sales at the last moment. The below listed techniques can really help especially when it comes to last minute tickets selling they have all been tried, tested and implemented in real time scenarios time and again. Here you go...				"
15,The How-To's of Proper Mixing,Arts-and-Entertainment,"
					Avoid under mixing or improper mixing of the molding/casting material with these handy tips. The article also shares some of this important tics on casting-molding.				"
16,Rajdeep Sardesai: Breaking Views,Arts-and-Entertainment,"
					Be it covering the breaking news that covers an attack to the nation or having a strong political debate in the newsroom or be it speaking to an IIT Topper one must admire the passion and pride with Mr. Rajdeep Sardesai (Currently: Consulting Editor, India Today Group) has been doing it brimming with confidence. What I have appreciated in this individual is not only the way he would present us with the news but also create an equal interest over the subject in the minds and hearts of the viewers. One of his biggest strengths I would say is intonation - the rise and fall in the pitch of his voice and his ability to probe questions and then later getting into the heart of the story.				"
17,A Short SF Vignette - Pluto Waiting! ((A Primitive Story) (in Poetic Prose)),Arts-and-Entertainment,"
					I live, on the planet Pluto. I live like mist, vapor in a kind of impregnable bright bubble, as thick as the old walls of Troy. Waiting, I'm always waiting, it is all I know. I see the cold stars of night and the glitter of the sun- At times I see the blue planet called Earth, it is nearly as old as Pluto. It is hard for me to explain who I am, when I really don't know what I am, or how I came about. I need comparisons! And I know of none! Thus, I cannot explain. I am lonely and old, I know that.				"
18,A Short SF Vignette - Far Boundaries of Gravity (Silas Caine),Arts-and-Entertainment,"
					The planets, move around the sun, and the sun with all its planets and moons, thereof, revolve forevermore, or so it appears on their straight and narrow orbits, as the universe pours out with care its widespread gravity, like manna. Gravity, the thing that keeps our solar system activated, our galaxy in motion. In essence, the universe's black energy, black matter. Should a star collapse, we know it's an act of gravity, to a certain extent, as then a black hole is ready to be created if not already created, to swallow that dead star, whole. Yes, the hand of providence has provided a waste basket, for its surplus. Put another way, gravity shapes space and time, has energy, creates a reaction, produces a black hole, if not a wormhole that may develop into a black hole, or a black hole acting like a wormhole.				"
19,Black Moon Widows,Arts-and-Entertainment,"
					Kerberos, orbits 60,000-km planet Pluto; Pluto which has five moons, and in comparison in distance, Earth being 93-million miles from the sun, Pluto, is 4-billion miles from Earth. But Kerberos is where our story leads us. It is the most obscure of the five moons I do believe, all being nearby the Kuiper Belt. Kerberos' largest lobe is but 8-km across and its smaller lobe being only 5-km across.				"
,topic,category,content
0,The Transformative Power of Sacred Art-Making,Arts-and-Entertainment,"
					Learning to make sacred textile art is a powerful practice that engages body, mind, and soul. Stitch by stitch, students can integrate their own creative and spiritual paths while connecting to ancient wisdom.				"
1,Four Ways to Get Creative With Picture Framing,Arts-and-Entertainment,"
					Say goodbye to clutter and hello to creativity! These four great tips help get the most out of picture framing.				"
2,Molds And Then Some Secondary Molds!,Arts-and-Entertainment,"
					Making a secondary mold from an original mold is helpful in different ways. Cold casting powders make it very easy to duplicate the look of various metals, stones and even wood.				"
3,Custom Framing Can Help Preserve Your Investment,Arts-and-Entertainment,"
					Custom framing is not only beautiful and tasteful, it is also a great way to protect your artwork. Here we see the different ways your work of art can be compromised.				"
4,"Unique & Interactive Museums For Curious, Young Minds",Arts-and-Entertainment,"
					Most modern museums offer multisensory, hands-on activities for children. Here is how technology and interaction have changed school field trips for today's youth.				"
5,"The Palace Cinema, Warrington",Arts-and-Entertainment,"
					The Palace, Friars Gate, Warrington Cheshire was built in 1907 and opened as The Palace Hippodrome theatre on 23rd September 1907. It was part of the MacNaughton Vaudeville circuit. It opened its doors to John Tiller's High Jinks company.				"
