,topic,category,content
0,Why I Will Never Gatecrash A Party Again,Arts-and-Entertainment,"
					It is Saturday night, I am working, the neighbors have amazing music, I feel like asking them to turn it up...				"
1,Get Your Service Running Successful,Arts-and-Entertainment,"
					5 Ways To Get Your Service Running, Successful, and also profitable Within 90 Days What will you do when you're job ""disappears"" in front of your eyes, as well as leaves you without earnings? Like great deals of individuals, I comprehend that feeling all also well.				"
2,"Do Not Worry, Heaven Is A Spiritual Ghetto And Hell Resembles An Earthly Palace",Arts-and-Entertainment,"
					We all turn somewhere when we are in crisis, especially when we had it too easy for a long time and get it hard in life after taking the ease too much for granted. My point is: heaven is how appreciative we are of the good times whenever they happen, hell is how much we hate paying when the bad times after the misuse of the good times happen. Deliverance is when we finally jump off the cycle of good and bad and just plain understand it all.				"
3,Need a Lead Magnet Assistance?,Arts-and-Entertainment,"
					Required assistance with style? Since I've beat it right into you that your core lead magnet needs to be easy Allow's talk regarding the style.				"
4,When Grandma's Talked to Her Hairy Bush & Veges,Arts-and-Entertainment,"
					Grandma's Hairy Bush & Vegas An intelligent older female as soon as claimed to me: "" It is among one of the essential life abilities you can ever before find out."" Currently, you could be assuming it's regarding financial investments or monetary tools.				"
5,So You Want to Be Beyonce? This Is How You Can Be,Arts-and-Entertainment,"
					An exploration into the habits and ways of thinking which have made Beyoncé one of the greatest performers of all time. Also, one of the wealthiest women in the world.				"
6,DIY Original Halloween Costume Tips and Ideas,Arts-and-Entertainment,"
					Many adults have art and craft skills to make their own Halloween or special events costume. Hand or machine stitching, glue, and paste are the basic fasteners. Creativity and imagination are the magic ingredients.				"
7,Artistic Product Print Works,Arts-and-Entertainment,"
					In case you have any huge sales coming up later on, I would encourage a similar strategy. Indeed, sports can be a method of networking. For lots of people, it is a second home place to hash out family difficulties, play backgammon, take pleasure in the day's very first drink.				"
8,Acrylic Painting and Prints For Sale,Arts-and-Entertainment,"
					Take pleasure in the painting that you do. Painting with acrylics is a great option for a beginning painter. If you wish to make your painting interesting you must offer enough of variety so the viewer is curious and wants to come back to observe it.				"
9,8 Smart Approaches to Crack CAT in Three Months!,Arts-and-Entertainment,"
					Common Admission Test (CAT) is considered as one of the toughest exams in our India. A lot of students prepare for years together to score well in CAT.				"
10,Philosophic-Historical Truths Confer Juventus Winner of 2018/2019 UEFA Champions League,Arts-and-Entertainment,"
					This article is a summarization of a research paper titled The Philosophy of the UEFA Champions League. Both the summary and the paper puts forward the hypothesis which seeks to prove and establish the real existence of metaphysics in the cosmos. Particularly that Eyjafjallajokul of April 2010 moved owing to call from human beings; an urgent call to the abstract force of planet earth, the spirit, to spring into action. Taking the UEFA Champions League as our laboratory, the conclusion will be reached when the order of Juventus, Liverpool and Bayern Munich emerge as champions ahead of FC Barcelona in the coming years.				"
11,Motivational Whatsapp Status 2018 Collection,Arts-and-Entertainment,"
					Here in this article we are going to tell you lots of Motivational WhatsApp status where you will get best WhatsApp motivational status videos and much more stuff. You can download those status free of cost by just simply tapping of them. So real this article to get different-different and lots of motivational WhatsApp Status				"
12,Artist Vs Craftsman Vs Artisan,Arts-and-Entertainment,"
					A career in the arts and crafts enterprise may or may not require academic studies. Are you thinking of becoming an artist, craftsman, or artisan? Your interest choice determines academic needs. If you are unsure, take informal classes to experiment or treat these interests as a hobby.				"
13,6 Important Benefits Of Designing Custom Name Badges,Arts-and-Entertainment,"
					While carrying out a name identification strategy for your organization, have the option to disclose to your workers why it is fundamental. In the event that you have not considered name identifications for your organization yet, the accompanying advantages might alter your perspective. A Design That Portrays Your Personality, However, most organizations just require their representatives to wear the Custom Name Badges identifications while at work, there's a decent possibility that these identifications will be noticeable somewhere else, as in conferences and expert get-togethers.				"
14,War Hobbit,Arts-and-Entertainment,"
					What is the perfect job? Many people believe that their perfect job is creating something that they enjoy that other people pay them to have.				"
15,Canadian Film Wins Kevin Hart's Laugh Out Loud/ Just For Laughs North American Film Competition,Arts-and-Entertainment,"
					The Writer and producer of ""Sweet Revenge"" Pascal Atuma is a Canadian/Nigerian actor, screenwriter, film producer, film director, and comedian. Born in Umuahia, Abia State, Nigeria to a large family of seven, Pascal moved to the United States in 1995 after attending Government College Umuahia and the University of Port Harcourt in Rivers State, Nigeria. He initially tried pursuing a career as a civil engineer before switching gears and pursuing a career in the entertainment industry.				"
16,Do I Have to Submit an Experience Outline?,Arts-and-Entertainment,"
					I received an email today from a reader who was looking for an answer to this question: Do I have to submit an experience outline with my application if I held the same classification over five years ago? The email stated: Dear Mr.				"
17,Why You Should Trust Online Betting Houses?,Arts-and-Entertainment,"
					Betting houses have become a popular place in the context of gambling houses. Special authorities have been given the responsibility for the regulation of the gambling process. The Kirol group has many offices located in Spain.				"
18,Your Attorney Is Here,Arts-and-Entertainment,"
					Many television shows give us a look at how the courts of the world work. They actually involve four characters only.				"
19,All You Want to Know About Korean Dramas/Series/K-Dramas,Arts-and-Entertainment,"
					Introduction Korean dramas are Korean-based television series that are popular worldwide with the name of K-dramas. They are widely available via streaming services like Netflix with subtitles in multiple languages. They attract attention for their unique culture, fashion, and style, which are being adapted worldwide.				"
,topic,category,content
0,Chinese Dramas and Their Growing Popularity,Arts-and-Entertainment,"
					China is quite famous for its television dramas. Chinese dramas, popularly known as C-dramas, are popularly broadcasted throughout Asia on the television screen. You can easily discover and explore C-dramas because of global streaming sites like Netflix, WeTV, etc.				"
1,The Growing Worldwide Popularity of Chinese Series,Arts-and-Entertainment,"
					Introduction: These days we spend a lot of time watching series, and it is safe to say that they have started giving a strong competition to western series. Chinese dramas have made a very strong place in the global market. Their popularity has bloomed so much that we often compare them with western dramas.				"
2,All You Need to Know About Thai Series,Arts-and-Entertainment,"
					Thailand is one of the best places to visit during holidays since it presents a unique combination of delicious food, attractive beaches, and friendly people. Apart from that, the Thai film industry is also quite popular, and it has been able to attract many people into watching their famous series and dramas. These are available in various genres and have been able to keep the audience hooked to their screens with their amazing stories.				"
3,God Is Inviting You to the Secret Place,Arts-and-Entertainment,"
					""He shall call on Me, and I will answer Him; I will be with Him in trouble; I will deliver Him, and honor Him. With long life I will satisfy him, and show him My salvation.				"
4,LáSzló AlmáSy,Arts-and-Entertainment,"
					Fiction can be based on anything, including facts. Most people read fiction or watch a fictional story on film simply to be entertained. But entertainment can be taken to a higher level for a reader or a viewer when the fictional character is revealed to be a real person.				"
5, The Complete Overview of the Korean Series,Arts-and-Entertainment,"
					In the early 2000s, Korean dramas became famous in nations all over the world. They are popular for a wide range of reasons, including family-centered stories, gorgeous background music, and/or exquisite Hanbok in historical dramas. Korean series are famous, due mainly to the expansion of Korean popular culture and their broad availability via streaming platforms that frequently include subtitles in various languages.				"
6,The Top 4 NETFLIX Series You Should Watch,Arts-and-Entertainment,"
					Looking to watch something new on Netflix? Here is the list of the series you should watch. This list includes my personal favorites but with the best IMDB rating.				"
7,Everything You Need to Know About Korean Dramas,Arts-and-Entertainment,"
					Korean dramas, also known as K-dramas in non-standard language, are Korean language television series spanning about 16 to 20 episodes, made in South Korea. Korean culture has been extensively influential lately because of the greatest artists we get from South Korea in all aspects and the examples? I don't think you need any examples because you already know - the one and only great K-pop boyband BTS, followed by many other K-pop groups and solo artists.				"
8,Korean Series: An Escape to Fantasy,Arts-and-Entertainment,"
					Breakthrough of Korean Series: Korean Series, also known as Korean Dramas or K-dramas, are television series in the Korean language based in South Korea. K-dramas became popular worldwide in the early 2000s due to its Korean pop culture, also known as Hallyu/Korean Wave, and far-fetched plot twists. However, the Korean entertainment industry started booming when ""Gangnam Style"" by PSY hit YouTube like a tsunami.				"
9,6 Tips for New Fans of Anime,Arts-and-Entertainment,"
					If you are a new fan of anime, and you have just started watching these animated cartoons, you are on the right page. In this article, we are going to share with you a couple of simple tips that will help you improve your experience as an anime viewer. Read on to find out more.				"
10,Features of Good Online Betting Company,Arts-and-Entertainment,"
					In today's world, every single person in the world has been running day and night having an ultimate thought in mind - Minting money. With booming opportunities every day and the diversifying fields where an individual can earn money, one of the up-and-coming platforms to multiply cash along with a risk factor is online betting. Betting - A brief overview...				"
11,Here Is How Anime Influenced Millions of Viewers Across the Globe,Arts-and-Entertainment,"
					As far as animated movies are concerned, anime is your best bet in the here and now. This will allow you to enjoy your freedom of expression and target any genre that you want. On the other hand, cartoons are aimed at children only.				"
12,9 Foolproof Tips to Help You Watch Hentai Safely,Arts-and-Entertainment,"
					If you are interested in watching anime hentai, you need to take the right steps in order to make sure you don't get caught red-handed. As a matter of fact, watching hentai is much more than an espionage mission. But it won't be a problem for you if you live alone in your own apartment.				"
13,8 Shocking Facts About Anime You May Want to Know,Arts-and-Entertainment,"
					If you are a fan of anime, you will find this article quite interesting. In this article, we are going to share with you a few common but shocking facts about these Japanese TV series. Read on to find out more.				"
14,Top 10 Common Words Used In Anime and Their Meanings,Arts-and-Entertainment,"
					If you are a fan of anime, you are on the right page. Today, these TV shows use numerous different words. Some of these words are quite commonly used in the series.				"
15,5 Of The Most Interesting Creative Brands to Watch in Africa,Arts-and-Entertainment,"
					5 of the most interesting creative brands to watch in Africa. There is something truly special unfolding in Africa at the moment. Africa is rising.				"
16,The Off-Season Christmastide Vibes!,Arts-and-Entertainment,"
					Christmas in Sydney is done differently, with two celebrations - one in July and one in December! The trend of sending out Christmas cards adorned with snowmen and reindeers or welcoming Santa dressed in red woollies does not make any sense as the Southern Hemisphere experiences summer in December. If you've been to Sydney during the 'real' Christmas season, your memories would revolve around sun-kissed beaches, cricket tournaments, Carols by Candlelight and Santa dressed in shorts!				"
17,The Benefits Of Watching Anime for Your Kids,Arts-and-Entertainment,"
					Watching anime offers a lot of benefits for everyone, especially young children. In this article, we are going to get a deeper insight into the benefits of watching these animated shows. Without further ado, let's get to the point.				"
18,Here Is Why Anime Viewers Are Wonderful,Arts-and-Entertainment,"
					Your mother may have scolded you for watching too much TV like all mothers out there. And she is right about that. Spending too much time watching TV is not a good practice.				"
19,Top 7 Reasons Why People Watch Anime Today,Arts-and-Entertainment,"
					Over the past 20 years, Anime has been rising in popularity across the globe. If you have never tried this series, you will once you have gone through this article. In this article, we are going to talk about 7 convincing reasons why people watch Anime.				"
,topic,category,content
0,Should You Read Manga Or Watch Anime?,Arts-and-Entertainment,"
					In this article, we will share a few tips with you that will help you decide whether you should read Manga or watch anime. This is the most popular question asked by those who are just getting started with the series. Therefore, if you are looking for some help to make a choice, this guide may help you.				"
1,Common Differences Between Anime And Cartoons,Arts-and-Entertainment,"
					Japanese anime is different from cartoons. While both are caricatures that may be animated, anime usually has visually distinct features for characters, and a more ""limited animation"" style for depicting movement. There is a difference between cartoons and Japanese anime.				"
2,One Piece: Tips To Start Watching The Anime Series,Arts-and-Entertainment,"
					Today, almost everyone has watched some episodes of One Piece. Over the past two decades, they have released more than 900 episodes of the King of Shounen and the counting is still on. If you have not watched One Piece, this is one of the best times to get started.				"
3,Here Is How You Should Watch One Piece For Best Experience,Arts-and-Entertainment,"
					In this article, we are going to share with you a few tips to catch up to the series called one piece. These tips will help you whether you want to read One Piece or watch the TV series. Read on to find out more.				"
4,5 Reasons You Should Anime Today,Arts-and-Entertainment,"
					Entertainment offers a lot of fun and enjoyment regardless of the form it is presented in. Today, animated TV series are quite popular across the globe. Among all of these animated series, anime is quite popular.				"
5,7 Tips for New Anime Fans to Improve Their Experience,Arts-and-Entertainment,"
					If you have just started watching anime shows, you are on the right page. First of all, we want to congratulate you on finding your best source of entertainment. In this article, we are going to share with you a few simple tips that will help you enjoy your experience as a fan.				"
6,Top 5 Reasons Why You Should Start Watching Anime,Arts-and-Entertainment,"
					In Japan, animation movies are known as anime. Although these animation movies are popular across the world, most fans of this series are still from Japan. If you have never watched it before, we suggest that you give it a go to discover the rich, fascinating world of animation.				"
7,Introduction to Paul AKA: Bitmarque,Arts-and-Entertainment,"
					If you are interested in digital art, you are on the right page. In this article, we are going to introduce Paul AKA: Bitmarque. He is one of the best digital artists from Merseyside, England.				"
8,Why Is Anime So Popular in Japan?,Arts-and-Entertainment,"
					Manga and anime are the best representatives of Japanese culture. As a matter of fact, they are one of the most popular art styles in the world. There is a lot of Japanese animation TV series.				"
9,5 Tips To Help You Choose An Anime,Arts-and-Entertainment,"
					If you are an anime fan, you already have a pretty good idea about how to opt for the best anime. Most fans check almost every anime out there. But if you are just a beginner, it may be harder for you to make a choice.				"
10,7 Reasons Why Anime Nerds Are Satisfied in Life,Arts-and-Entertainment,"
					Today, a lot of grown-ups love watching those Japanese cartoons. And it's just you. As a matter of fact, these anime nerds are very content in real life.				"
11,8 Benefits Of Watching Anime for You,Arts-and-Entertainment,"
					Although you can benefit from watching all types of video content out there, there is something special about anime. In this article, we are going to take a look at some common benefits of watching anime. Read on to find out more.				"
12,Trea Turner and Sean Newcomb Apologize for Racist and Homophobic Tweets,Arts-and-Entertainment,"
					Trea Turner of the Washington Nationals apologized for years-old homophobic and racially insensitive tweets.CreditEric Espada/Getty Images WASHINGTON - Washington Nationals shortstop Trea Turner apologized Sunday night for some years-old homophobic and racially insensitive tweets, becoming the latest in a series of major leaguers to address offensive language they used on social media. The tweets surfaced hours after Washington's 5-0 loss to the Miami Marlins at Miami.				"
13,Why You Should Have a Reusable Packaging,Arts-and-Entertainment,"
					Reusable packaging is an upcoming trend and popular taste. But what can be your motivation to shift to reusable packaging for your age old and trusted packaging? Here are a few points to enlist about it.				"
14,The Reasons for the Popularity of the Chinese Series,Arts-and-Entertainment,"
					Advantages of Chinese series There are many reasons why Chinese series are getting so popular, especially in recent times. The Chinese entertainment industry has many advantages that are considered comparative rather than competitive. The Chinese series is unlike the Korean series, which are in the topmost in the list of the popularity of web series, as the advantages of the Korean series are competitive.				"
15,The Best Chinese Dramas You Should Watch,Arts-and-Entertainment,"
					If you are a big fan of Chinese web series, then you must have searched for the best web series or the most viewed Chinese web series on the internet. There are basically two broad genres of Chinese web series to look out for if you search for the same. These genres are wuxia and xianxia.				"
16,The Main Characteristics of the Chinese Series,Arts-and-Entertainment,"
					Various storylines There are many characteristics of the Chinese series that make it unique in content. The first characteristic that makes a Chinese drama stand apart from other series such as the Korean series is that they offer a wide range of genres. The content of the Chinese drama is not monotonous or repetitive in any case.				"
17,Where to Watch the Best Japanese Drama 2021?,Arts-and-Entertainment,"
					Japanese dramas are the new craze. Drama has always been the most popular genre when it comes to entertainment. Many people worldwide love watching drama series and thanks to the internet now they can watch not only their dramas but also other interesting ones from all over the world.				"
18,Japanese With Japanese Drama: A Self-Paced Way to Learn,Arts-and-Entertainment,"
					Learning Japanese with Japanese series helps the viewer learn the language to start a conversation with a friend from Japan or engage in a workplace discussion. Though the language can be learned by watching Japanese movies, making it into a habit is difficult as not everyone would spend two hours regularly watching movies. Therefore, watching Japanese series is a more efficient way of learning the language as they last for a maximum of 40 minutes to an hour.				"
19,Japanese Series V/S Korean Series: What Makes Them Different?,Arts-and-Entertainment,"
					Asian cinema has undeniably become popular in recent times. The global audience is particularly hooked to Korean series, their exciting characters, and stories. The success of Korean drama has paved the way for drama from other countries like Japanese series, which are seen to be as engaging as Korean drama.				"
,topic,category,content
0,Japanese Series: A Cheap Way to Know Japan,Arts-and-Entertainment,"
					With the rise of international platforms, it has become easier for audience to know more about countries and cultures stories are set in. Lovers of Japan can now get to know more about Japan's society and popular culture directly with the help of international streaming platforms. Japanese Food Culture Food is something that Japan is popularly known for.				"
1,Explore Japanese Drama for Exciting Content,Arts-and-Entertainment,"
					The popularity of Japanese drama The internet and various streaming services have broken the boundaries when it comes to consuming content from around the world. Everyone now has unrestricted access to some of the best series across the globe. Among these various Japanese drama series has been successful in carving out a massive following for themselves.				"
2,Chinese Dramas - Entertainment for Anyone and Everyone,Arts-and-Entertainment,"
					Is there anyone who does not love drama and entertainment? Of course not! It is practically impossible to find such a person even if one looks all over the world.				"
3,"Types of Chinese Dramas - Modern, Period, and Ancient",Arts-and-Entertainment,"
					It is common knowledge that Chinese TV series or Chinese dramas or C-dramas provide several choices and categories. However, most of us do not know what the varieties entail. To speak comprehensively, C-dramas fall under three main groups.				"
4,Three Classical Books From the 17th Century to Read on a Stranded Island,Arts-and-Entertainment,"
					Literary critic Harold Bloom asked a perplexing question in his article, ""The 3 Books You'd Want on a Desert Island"". Bloom answered the ""Desert Island Question"" to readers with ""authentic judgment"": ""The Authorized King James Bible"", ""The Complete Shakespeare"", or ""Don Quixote"" by Miguel de Cervantes. Coincidentally, these are the same three I picked before reading Harold Bloom's article.				"
5,Various Aspects About Doujin Games,Arts-and-Entertainment,"
					The Doujin tag is mainly given to all the self-published magazines or works created by the fans. These Doujinshi are not at all any professional work, but these are amateur publications. Keeping this aside, the bright side of the Doujinshi is that it is done by many talented creative folks, musicians, writers, and artists; this is also considered to be their first step towards the world of professional series or anime creation.				"
6,Reasons Why the Original Creators Appreciates Doujin,Arts-and-Entertainment,"
					We know that Doujinshi is a kind of magazine self-produced by a Doujin, and it takes various famous characters and presents sexually or differently than the original one. This new trend has gained a huge number of followers and a wide range of acceptance by people worldwide. You might think that the characters' original creators might have issues about taking their characters and presenting them differently, but in reality, the matter is totally opposite.				"
7,Read Popular Doujinshi and Hentai Manga for Free,Arts-and-Entertainment,"
					If you are looking forward to reading free manga and doujinshi, then you have come to the right place. With a large collection of comics based on your favorite series, you can explore an entire ocean of doujin anime. This online reader will give you hundreds of options of hentai manga as well as other comics.				"
8,Best Doujin Anime to Binge on Right Now!,Arts-and-Entertainment,"
					If you didn't know, then let us tell you that doujins are just like manga. The only difference is that their authors publish them on their own. Even though there are very rare anime adaptions coming forward from doujin, few of them manage to break into the glam of mainstream popularity.				"
