,topic,category,content
11,"Hot, Cold, & Warm Plastic Surgery Leads. Now What?",Business,"
					You know you are losing a lot of money because you don't have a successful plan in place to follow-up, so your staff pretty much gives up on these ""lost"" leads. The point is, you can continue to throw more money at advertising for new leads, or you can train your staff to move a lot more of these leads to booked cash procedures.				"
12,Five Common Mistakes Made by Plastic Surgeons,Business,"
					You are so busy running your practice, attracting new patients and doing surgery, that it's easy to miss what's NOT working. Consistent communication keeps your name in front of your patients so when they're ready, they call you rather than your competitors!				"
13,Scripts to Convert More Cosmetic Patients,Business,"
					You lose more cosmetic patients and profits every day and don't even know it because it's so subtle. It doesn't matter how high-tech and gorgeous your Website is if your receptionist can't convert a caller to an appointment. What does matter is them asking for the appointment in a strategic way that encourages the caller to book a consultation.				"
14,What Google Said About Plastic Surgeons,Business,"
					Websites have evolved through the years. They look so different than they used to so be sure yours has a fresh, updated look and it must be mobile-friendly. You may not understand social media or want to put your time there, but it's become a must-have patient attraction channel to attract more patients.				"
15,The Specialty of a Good Tailor,Business,"
					Pay special mind to the complete of the suit before getting it. In a quality completed suit, there would be besom pockets and two back pockets. Generally fine jeans would have at any rate the leg front lined to the knee.				"
16,How To Create Internet Income Fast,Business,"
					People today are able to create a lot more opportunities for themselves than ever before. The reason why this is true is because the internet allows it. If you have high speed internet on your phone, through a library, or just about anywhere, you can end up with a positive push forward in terms of making money online, and creating income.				"
17,Here Is What You Need to Do Before You Learn to Ski,Business,"
					Has your latest vacation in a winter resort charmed you so much that you have decided to learn to ski? Maybe you already wish to purchase a property in Bansko or some other winter hotspot ideal for skiing. In any case, you need to get to grips with the activity first. Skiing is a sport best enjoyed when you are prepared. Otherwise, it is impossible to practice it without feeling overwhelmed at some point. Here are a few things you should do before you hit the slopes:				"
18,Turning Your Ideas Into Riches,Business,"
					Of all the quotes I've come across, Les Brown's ""Richest man in the Graveyard"" resonates strongly with my imagination and emotional pride. We are all creative creatures, with our unique talents. Somehow, we get lost in the day-to-day expectations of a society that exists to keep the wheels of commerce and industry turning, to set boundaries around our lives that keep us safe and fed,  ensuring we stay focused with aspirations of progress and reward. Like mice following the bait. Our dreams and aspirations are put to the side and before we know it, our time has run out. We are on our death beds wondering what happened. What stopped us from living the dream?				"
19,Grow Your Business With Bulk SMS Marketing,Business,"
					If you have a business in this digital era, it is essential to market your content well to reach a broader section of the audience. One of the best strategies to follow to promote your business is through promotional bulk SMS. Also known as SMS solutions, it is a sure shot way of reaching your desired audience. Here are some points to consider running an effective SMS campaign:				"
,topic,category,content
0,Digital Marketing - Competitive Advantage,Business,"
					Why Digital word has become a synonym to be advanced and more connected to the customer because the world has become complex and much more connected than a decade ago. The more you connect with the people on a regular basis the more you grow has become the trend. I'm sure your inquisitive mind asking provide examples - Facebook's revenue grew from 7.				"
1,How To Effectively Use Second-Hand Products In Your Business,Business,"
					More businesses than ever are keen to save money. Due to these challenging and uncertain times, many companies have been forced to cut costs and reassess their budgets. Even those who are flourishing are keen to ensure that they are set for the future and protected against uncertain and unforeseen circumstances.				"
2,Getting Your Wisdom Teeth Removed,Business,"
					Today's increasing dental treatments can give people a stronger smile that can last an entire lifecycle. Wisdom teeth Calgary, in East Village Dental Calgary, can assist anyone to keep your gums and teeth happy.				"
3,4 Powerful Ways To Build A Community Around Your Business,Business,"
					Now is the time to connect. Whether you have been separated from friends and family over the past year, have struggled to get your business out there, or have been otherwise unable to do the things you want to do, now is a great time to get creative and reconnect with the community around you. The same is true in business.				"
4,How You Can Use Stained Glass Panels to Make Your Home Look Fabulous,Business,"
					Are you thinking about giving your interiors a makeover within a budget but without being mediocre? You need to try using stained glass texture panels or mirror glass to brighten up your living space. Think about how gorgeous the traditional cathedrals look with their vibrantly painted windows.				"
5,Know About the Various Advantages and Uses of Fiberglass Yarn,Business,"
					One of the new in-demand industrial materials in markets these days is a product called glass fiber yarn. Depending on the use, the glass fibers are manufactured from different types of glass. The fiberglass is then flattened into a sheet form before being woven into a fiberglass fabric.				"
6,Top 10 Digital Marketing Companies,Business,"
					It was difficult to dream that we will be ranked so high on Digital Marketing companies list in Bangalore. We thank to our customers in helping us out with the great review ratings and positive and encouraging response on our services. We are thankful to our clients for recognizing our efforts and providing great response to the surveyors on all the parameters - 1) Business Outcome and ROI 2) Brand Development and Marketing Strategy 3) Value Proposition and Potential 4) Customer Outreach 5) Ideas and Innovation Pls...				"
7,Here Are 5 Solid Reasons to Put Money in an Automatic Screw Locking Machine,Business,"
					In this article, we are going to discuss 5 reasons to get a good automatic screw locking machine. These versatile machines are designed to tighten tiny screws of various sizes on different digital devices. Therefore, you can get the most benefit from these units as far as repairing appliances is concerned.				"
8,7 Advantages Of Using Automatic Screw Feeder For Your Business,Business,"
					As far as development is concerned, an automatic screw feeder has been going through a lot of improvements. This is true as far as improving the quality and efficiency of the products is concerned. In this article, we are going to talk about a couple of salient advantages of these machines.				"
9,5 Simple & Effective Tips To Spring Clean Your Business,Business,"
					Spring is the perfect time for fresh starts and new beginnings - and that goes for your business too. Spring cleaning may normally involve physically cleaning, decluttering, and organising your space, but in business, it can extend to so much more than that. For example, why not declutter your digital files, organise your budget, optimise your processes, and more?				"
10,Art of Digital Printing and Choosing the Right Fabric for Digital Printing in the Field of Textiles,Business,"
					Hello buddy this article is about digital printing on fabric. As we all know that the digital printing is the future. so through this article i have given you the right direction. Beginners in this filed must read this article as they will get the direction of how to choose the right fabric.				"
11,Automatic Garage Door Repair in Dubai 0553612961,Business,"
					Good Qualities of an Automatic Garage Door Repair Company in Dubai Did your automatic garage door stop function all of a sudden? If the answer is yes then it is essential for you to have it repaired as soon as possible, considering the importance it holds. When it comes to garage door repair companies in Dubai, which company should you put your trust in? Here are some of the qualities that a good repair company should possess: Skill The professionals of an automatic garage door repair company need to be skilled at the job that they are required to perform. If they are not suitably skilled, it just means that they will not be able to repair your automatic garage door in the best possible manner. Remember: the skill of the contractor counts the most if you want to receive the best bang for your buck! Professionalism A quality contractor for automatic garage door repairs should not only be skilled but professional as well. What this means is that they should be mindful of their conduct. For instance, if you have got a broken garage door, it is only natural for you to want it to b				"
12,Welding Equpiments,Business,"
					D&H Scheron Electrodes Pvt Ltd is the supreme manufacturer and exporter of Welding & Cutting Equipments. D&H has automated Welding & Cutting Equipments Facility. Our welding experts will provide you with the best welding & cutting equipments in the industries. Visit our website to get more information.				"
13,Beauty Net a Online Beauty Store,Business,"
					Beauty net is a online beauty store where we offer you all kinds beauty products in a big range of variety. All kinds beauty materials are available under one roof we are offering you best quality genuine things and we are a certified company who offers beauty materials we are not saying we offer you cheap items we are offering you quality beauty items. We have all variety of items for men's and women's and kids we are not limited in one particular area we are selling our globally.				"
14,The Need of Digital Marketing for Business,Business,"
					This article states the meaning and importance of digital marketing for small and large businesses. It also states the benefits of digital marketing.				"
15,A Guide to Buy Websites and Make a Profit,Business,"
					Selling and buying of websites are the most trending topics that you will come across the internet. A lot of people dealing with such business have claimed to earn higher profits. Through this blog, we will be guiding you throughout on how you can buy a website online and make a profit out of it.				"
16,"Exploring the Nuances in the Relationship ""Culture-Strategy"" for the Business World",Business,"
					Abstract: The current article explores interesting, significant and recently identified nuances in the relationship ""culture-strategy"". The shared views of leading scholars at the University of National and World Economy in relation with the essence, direction, structure, role and hierarchy of ""culture-strategy"" relation are defined as a starting point of the analysis. The research emphasis is directed on recent developments in interpreting the observed realizations of the aforementioned link among the community of international scholars and consultants, publishing in selected electronic scientific databases. In this way a contemporary notion of the nature of ""culture-strategy"" relationship for the entities from the world of business is outlined.				"
17,Your Information and Marketer's GOAL,Business,"
					As a consumer you leave your footsteps on all the platforms that you use. And this is the data which helps marketer's to develop intelligent REACH to CONSUMERS.				"
18,Best Methods of Making Money Online Without Any Investment,Business,"
					The desire to make huge money is in a perpetual increase, particularly the desire to make money from home. A lot of people are searching for easy ways to making money online and millions of people are already getting this done. There is no age barrier when it comes to affluence, and this is the reason why anyone, irrespective of his/her age, that is reading this content will learn a lot and most likely start to make money from home today.				"
19,Awfis Is One of the Vibrant Shared Office Spaces in Navi Mumbai,Business,"
					Coworking can be a task. But if you work in a co-operative community where everyone else has similar goals, it makes it worthwhile. Founded in 2015, Awfis is a coworking space provider, that creates affordable, tech-enabled and collaborative working environment for freelancers, professionals, startups, and small teams.				"
,topic,category,content
0,Advantages of Private Label and Contract Manufacturing,Business,"
					Saving on your investments should be the first and foremost priority for your business when introducing a product in the market. Tons of money is spent researching and developing the product, setting up manufacturing units, hiring workers to manage such units. You can save all this money by hiring a company that takes care of all these activities at an effective price.				"
1,How Private Label Products Are Suitable to Dynamic Market Environment,Business,"
					WHAT IS PRIVATE LABELING Private labeling of products refers to a business practice in which manufacturing is done by one company, and the product is sold under the brand name of another company. The company, whose brand name is being used to sell the product, directs the manufacturer to make the product according to specific design, composition, and packaging. This practice has been adopted mostly by companies that are starting in the market.				"
2,How Private Labelling Skincare Products Is Leading to Profitable Businesses,Business,"
					INCREASING IMPORTANCE OF PRIVATE LABELING The option of private labeling products is revolutionary for businesses. All the hassle of manufacturing, packaging, and labeling products is now done away with due to this new business practice. Nowadays, companies can only focus on marketing and selling their products instead of spending time and money behind building the product.				"
3,"Coupon,Discount and Promo Codes 2018",Business,"
					Couponssun is always provide best and helpful Coupons Promo Codes, Coupon Codes best deals Discount Codes, Free shipping Codes for you. Don't worry about huge prices and extra pay. Couponssun gives you the way of save money and your precious time for finding best online shopping stores and latest brands.				"
4,The Growing Popularity of Scented Candles,Business,"
					What makes smell the most visceral of all senses? Scent can transport you back to grandma's kitchen or enliven your senses of a pristine beach with a soft murmur of waves and pleasant breezes. That is why buying perfumes is such an impulsive and extremely personal activity.				"
5,ZOOM UP Your Virtual Presentations,Business,"
					Your presentations no doubt look very different these days, now that we're forced to present virtually. Our ""virtual reality"" doesn't mean you have to be boring or ineffective. Try these simple tips to keep your presentations ALIVE and lively!				"
6,How to Start and Manage a Blog,Business,"
					Managing a blog is just like adding another product or service to your company in that this new endeavour will take time to set up, manage and promote. Blogs will require time in your schedule for marketing, networking, writing and scheduling in posts and managing comments. However blogging can be very flexible - you can schedule posts to go live twice a day or you can choose to post once a month, it is up to you.				"
7,What It Takes To Be Self-Employed,Business,"
					Starting a self-employed, home-based business can be very stressful - there's a lot to do and pressures are running high, while you watch the budget trickle away. Unfortunately a lot of folks rush into their dream of running a business and find out in one big awful moment that there is a lot more to it than skipping off to your dream. Initially, the goal should be getting known, building that name recognition, developing a super strong platform and getting a reputation. How one goes about this varies with the genre, personality, budget and location.				"
8,A Quick Reference Guide to Coffee Beans,Business,"
					While looking around the coffee aisle of your local grocery store, you have probably come across bags with 'Arabica' and 'Robusta' written on them. Have you ever wondered what these names mean? Well, these are names of the various types of coffee beans that tell us about the taste and other bits of information about the coffee.				"
9,Manage Your Blog Effectively,Business,"
					I've studied marketing for some time in business management classes, forums and communication boards or groups, online radio shows, blogs and every book I could get my hands on from 1994-2012. I have discovered that there are a lot of techniques and tools involved in effectively managing a blog.				"
10,6 Things To Consider To Help You Find The Best Packaging For Your Cosmetics,Business,"
					In this article, we are going to talk about different types of packing for cosmetic products. Just like soaps, you have a lot of options to choose from, such as bottles, jars and tubes. Therefore, it's important that you opt for your color, size, and shape after a lot of thinking.				"
11,What Do You Need to Know Before You Buy a Used Copier?,Business,"
					We've all been there. You have a report, a schematic, or a brochure that needs to get printed out and shown to the boss by the end of the week. You did all the hard work, all that's needed is a reliable printer to finish it for you. Then, it happens... nothing. Maybe it's out of paper? Maybe a jam? Nope- this is beyond your ability- of course it is! You're not a technician. This isn't in your pay grade! ""Can I get a copier doctor in here STAT please?!"" Glad you asked. STAT business systems is on it. A reliable and accessible copier repair in Palm Beach, Florida is there for you and your business.				"
12,Changing Patterns of Banking and Spending Require New Skills From Professionals,Business,"
					New normal means a few things for both customers and professionals in the BFSI (Banking and Financial Services Industry). Where customers need to learn the proper use of a few apps and sites, and practice caution in spending and in sharing information, professionals have a heavier burden. No longer is it enough to be the ""Banker"" who sits in the cubicle and lords it over paper and over people. It has become essential to become well versed in the basics of a range of technological platforms, along with mastering the subject skills in finance and accounting. In addition, a hirable, employable, successful banking sector employee today must also be skilled in communication across media, the nuances and differences in selling face to face or over a phone call or online. They must master the art of ""hooking"" people in 30 seconds or less, learnt to keep pace with this fast moving world, and acquire the specific skill-set for online selling and service.				"
13,Types of ELearning Solutions to Empower Corporate Training,Business,"
					Organizations can ensure employee commitment and retention by bettering corporate training programs. Traditionally, employee training was conducted by instructors who had expertise in specific subjects based upon the training needs of a company. The company would then organize training sessions, workshops, and seminars led by the subject matter experts. All this has transformed in the age of digital learning because of the introduction of the internet.				"
14,Top 3 Ways to Make Performance Based Learning More Effective,Business,"
					Performance-Based Learning is an impressive approach to organizing and stimulating employees' learning. Here are the best ways to make it more efficient.				"
15,Strategies to Make Mobile Learning More Effective,Business,"
					With constant use of these impressive Mobile Learning strategies, you can enhance the impact of corporate training. Mobile Learning has become an essential part of corporate training and with constant use of these impressive Mobile Learning strategies, you can enhance the impact of training. These strategies will also help you in creating a positive impact on your ROI.				"
16,Software Systems Training Can Enhance Peer Learning,Business,"
					Social learning allows learners to expand their perspectives. Here are a few ways by which corporate learning management systems enable social learning.				"
17,How to Respond in a Toxic Workplace Caused by the Boss,Business,"
					Leaders set and enforce proper culture. Leaders cause toxicity in the workplace, too. Effective leaders respond to employees' legitimate issues, and share company performance with the workforce. But what happens when the boss is the source of toxicity. It depends on the organization? Staff in Canada's Governor General's office show an example of how to succeed and have the boss removed. 				"
18,Know More Information About The Volunteering for Abroad Programs,Business,"
					The volunteer work seems to provide you precious time and energy to work on the project without payment. The volunteering program work is prepared by the organization you go in.				"
19,Best Place for Your Relaxing Corporate Gathering,Business,"
					After a long hard day, relaxing with your friends and colleagues is very necessary nowadays due to the tiring work pressure in the corporate sector. There are so many restaurants and clubs that organize parties for the corporate sector. In Delhi/NCR region, Gurgaon has some of the best enjoyable and exciting places for a corporate get-together.				"
,topic,category,content
0,6 Benefits of Using Ruby on Rails (RoR) for Your Startup,Business,"
					For startups, Ruby on Rails is one of the best frameworks as it's user-friendly and flexible. If you do some research, you will come to know that there are a lot of startups that prefer Ruby on Rails for their business sites. As a matter of fact, this coding language is considered an ideal choice for startups.				"
1,Visa and Mastercard Rate Increases Coming Soon,Business,"
					Visa and Mastercard Interchange increases are happening soon. What impact will they have on your bottom line? You need to get a complete understanding and nobody cares more about your business, and profitability, than you.				"
2,Leadership For An Uncertain Future,Business,"
					Thanks to the Coronavirus Pandemic, we have never needed leadership more than we do now. The question ownership must ask itself is, Do our current leaders have the capacity to lead my organization into an unknown future? Leaders today must be: forward-thinking, strategically flexible, and adaptable, with a willingness to challenge the status quo and conventional wisdom.				"
3,4 Types of Nectar Collectors That You Can Choose From,Business,"
					Today, the use of nectar collectors is a new trend. The popularity of these units is on the rise, especially among people who smoke. If you love dabbing, you will just love these devices.				"
4,"In-Person Jekyll, Social Media Hyde",Business,"
					Ahh, social media. Where from the comfort of your living room you can make your point known to millions of people. People and businesses have grown from being virtual unknowns to worldwide phenoms (think ""Gangnam Style"") thanks to social media. Then there are those who fell from grace like a lead balloon (think Roseanne Barr, Anthony Weiner, or Paula Deen) because of social media. Both the rises and falls can happen swiftly and without advance warning.				"
5,6 Tips to Help You Choose a Spring Making Machine,Business,"
					If you are looking to choose your desired spring making machine, we suggest that you follow the 6 tips given in this article. By keeping these tips in mind, it will be a lot easier for you to make the best decision and go for a unit that can satisfy your business needs. Read on to find out more.				"
6,Tips to Help You Maintain Your Automatic Coiling Spring Machine,Business,"
					The use of a coiling spring machine offers a lot of benefits. For example, they can be used for the mass production of springs. Apart from this, you can design and make different types of spring coilers.				"
7,6 Types Of Spring Making Machines,Business,"
					There are different types of spring making machines out there. Therefore, it's not easy for potential buyers to make the best choice. But if you have the fundamental knowledge of these spring making machines, you can find it a bit easier to choose the right one to meet your business needs.				"
8,Tips to Help You Purchase a Spring Making Machine,Business,"
					A lot of things have changed since the introduction of spring making machines. Before the advent of these machine, making springs and washers was a manual process. With the passage of time, this technology is getting better as far as features and functionalities are concerned.				"
9,Blockchain's Impact on Our Daily Interactions and Exchanges,Business,"
					Today, trust is the basis of many of our every-day interactions and exchanges. We put money into a bank trusting that it is safer there. We give information to one another on the basis that they will not share it with someone else without prior permission.				"
