,topic,category,content
1,A Tree With Strong Roots,Arts-and-Entertainment,"
					Paul sends Timothy out into the world to do his work with the following words: 18I'm passing this work on to you, my son Timothy. The prophetic word that was directed to you prepared us for this.				"
2,Benefits of Playing a Musical Instrument for Adults,Arts-and-Entertainment,"
					It appears that adults who wish to play an instrument become interested because they never had the opportunity as a child to do so. Adulthood allows freedom to pursue and experiment with various hobbies and interests. Learning to play an instrument may also be is recommended by medical staff, friends, and family.				"
3,The Chicken Came Along,Arts-and-Entertainment,"
					I couldn't stop laughing when I read Anne-Marie's (not her real name) story: We recently bought a smallholding and to augment our income, we are busy raising broilers. They range freely in the yard.				"
4,Surprised by Peace,Arts-and-Entertainment,"
					I no longer watch the news, because I simply no longer enjoy it. It is not uplifting.				"
5,Tips: Indecent Expectations,Arts-and-Entertainment,"
					Tips are earned. I should actually just stop there; drop the proverbial mic and walk off, but all of us enjoy clarity, so let's continue on, shall we? Tips were never intended to create an entitlement nor give the expectation of the existence of any absolute ""Minimum.				"
6,What to Look for in an Investment Property,Arts-and-Entertainment,"
					I was recently asked what key things we look for in an investment property and what criteria we use to determine how much to offer for it. Number one, it has to make us money quickly.				"
7,Why Is Astrology Reading So Popular in Recent Times?,Arts-and-Entertainment,"
					It is tough to understand what might come next in your life, especially when you are getting prepared for your life's purposes and objectives. Getting prepared in advance is certainly not a problem; but an answer to all those tensions, which have engrossed your mind while you think about your upcoming days.				"
8,"""Negotiate More Effectively By Knowing How To Act Better"" - Negotiation Tip of the Week",Arts-and-Entertainment,"
					Do you plan how you'll #act when you #negotiate? What #role do you decide you'll play?				"
9,5 Things You Wanted To Know About Mold Making,Arts-and-Entertainment,"
					There's a lot that goes into making molds right from what is needed to how to do it and everything in between. Understanding what mold making is all about and why you need it will simplify the process.				"
10,Are Keywords in Your Domain Name Necessary?,Arts-and-Entertainment,"
					The answer to that question can go either way. There are many people who believe that it is necessary to have a strong keyword as part of your business' domain name and others who don't understand the need for it. Then there is the third school of thought that believes that it can't hurt but that it doesn't do that much either way.				"
11,"It's the Holidays! Time to Take Some Much Needed Time Off, or Is It?",Arts-and-Entertainment,"
					Here at PMA, we're very much a family, both within the team and with our clients as well. So as we get ready for the holidays, we want to respect the family time that our team enjoys and works so hard for, but are the holidays necessarily a time to take off?				"
12,If You Were to Die Today,Arts-and-Entertainment,"
					In the Christian series, ""The Galilean"" (Poems for the Soul), and his sequel ""The Nazarene"" (Poems for the Son of Man), from per near over ninety-sources-in a 30-month period, and over 3200-hours- the author brings to life, the ancient sacred scriptures, in a most profound historical melodramatic way; in poetic prose canto; to be read and reread. This book, has its own soul. Written in English and Spanish.				"
13,Go-To-Heaven Card,Arts-and-Entertainment,"
					When I was a child, Monopoly was one of my most favourite board games. We could play for hours to acquire the most property.				"
14,A Matie in an Accident,Arts-and-Entertainment,"
					One day as I was driving home I came upon a dilapidated car stuck in the middle of the road. It couldn't move and I could see the student had no idea what to do.				"
15,"""The Lack of Leverage Can Destroy Negotiator's Abilities"" - Negotiation Tip of the Week",Arts-and-Entertainment,"
					""We need to destroy their lead negotiator's leverage to weaken his abilities to negotiate effectively."" Those were the words uttered during the planning stage of a pending negotiation.				"
16,Are You Ready to Start Generating More Leads - NOW?,Arts-and-Entertainment,"
					Of course, you are, who isn't? You've developed a program that will change lives.				"
17,Is Art Necessary?,Arts-and-Entertainment,"
					I am a paper collage artist. In this article I have shared my thoughts on how art helps us live and why we need art.				"
18,Artwork Online,Arts-and-Entertainment,"
					Insights derived from the survey outlined below must be taken primarily as anecdotal indications of popular, culturally specific sentiment. It would be nonsensical to weigh interviewer-constructed, curtailed answers received by under a thousand respondents as some form of undisputed truth when gauging the art world's almost incomprehensibly diverse and expansive practices. Respondents preference's do although hint at more broadly applicable considerations. The survey raises thought provoking questions regarding the future shape of online art sales across a variety of mediums.				"
19,Lawyerizing Imagineering,Arts-and-Entertainment,"
					Many people believe that they have had a great idea that might make them wealthy. Some act on their idea, and a fewer number of those people realize that their talent alone will not be enough to make their idea succeed. Even those who resource their idea with talent, money, and drive, usually leave something out of the mix.				"
,topic,category,content
0,Coloring Books for For Adults,Arts-and-Entertainment,"
					Do you like to color? It is no longer an activity restricted for children. Adults are enjoying coloring for therapy, hobby, or learning techniques to better their coloring or painting. The books and papers for coloring help you to understand the value of color, how to make other colored tints, and blending colors for various highlights, contrasts, and shading.				"
1,4 Useful Tips for Cosplay Beginners,Arts-and-Entertainment,"
					Cosplay can seem a little intimidating for those just starting out, especially if planning to attend a convention. Dressing up to match the look of a favorite character from a comic book, anime, television series, movie or video game is now a very enjoyable pastime for more and more people every year.				"
2,The Reality of Reality Shows,Arts-and-Entertainment,"
					Day by day the popularity of Reality Shows is increasing, especially liked and followed by the young generation. What is the actual reality behind these popular reality shows in India? Is there any dark side of them? Reality television is a television programming genre that displays usually unscripted over dramatic or hilarious situations, documents actual events, and usually features ordinary people instead of trained actors, sometimes in a competition or other circumstances where a prize is awarded.				"
3,The Wheel of Destiny,Arts-and-Entertainment,"
					Are we the product of our actions, or do the dictates of destiny control us? Do we get everything by effort, or does fate have a different story to tell? Read on.				"
4,Holi 2018: The Underlying Significance Behind the Celebration of Colours,Arts-and-Entertainment,"
					This write-up talks about all those things that you ought to know about the festival of Colors ""Holi"". We have also discussed the way this festival originated and the reasons why the colorful powder known as ""gulal"" is being used for playing Holi.				"
5,American Teen Sensation or American Patriot?,Arts-and-Entertainment,"
					Was Paul Revere the one and only person to ride through the night carrying a dire call to action in a time of revolution? Though not thought of as a teen sensation, one young patriot answers the call to duty.				"
6,What First-Timers in a Nightclub Should Know,Arts-and-Entertainment,"
					For every one of us, there might be a first time to enter a nightclub. Most people may have heard many stories, as well as seen the hype, and now they are ready to witness it directly. However, before they go past the ropes, these are some tips to consider: Q: What advice can be given to first time club goes to get inside faster and to take full advantage of their first experience at a nightclub?				"
7,Dyes & Pigments: Totally Dissimilar Colorants,Arts-and-Entertainment,"
					The colorful world as is seen to us today is in a large measure a result of the use of colorants in every sphere of our lives. Colorants are responsible for imparting colour to a substrate like paper, paint, plastic, textiles and so on.				"
8,Mind Mapping for Creating Characters,Arts-and-Entertainment,"
					A Mind Map is a tool used to visually organize information or ideas. As a writer, it can be used for solving writer's block or creating a workable outline. Today I am going to show you how to create a character sketch.				"
9,Being A Human Whisperer,Arts-and-Entertainment,"
					We have the Ghost Whisperer, Dog Whisperer, Cat Whisperer, Horse Whisperer, but have we thought about being the Mother of all whisperers? The Human Whisperer?				"
10,Clowns Are No Laughing Matter These Days,Arts-and-Entertainment,"
					Has the curtain come down on the benevolent, balloon-bending clown of yesteryear? This article delves beneath the grease paint and harlequin suit to take a look at the scary clown phenomenon.				"
11,The Mind of an Artist,Arts-and-Entertainment,"
					Art Student, Chiamaka Okenwa, answers the question, 'What runs through the mind of an artist before the birth of a true masterpiece?' This is a question that plagues everyone, especially in today's chaotic world where your identity is easily lost.				"
12,I Might Have Known Him,Arts-and-Entertainment,"
					I schedule my sessions so I can take a break to walk through the neighbourhood. What a wonderful way to clear my head. As I meander down tree-lined streets, I occasionally glance at a house, as if there's some connection between me and someone living there. And for a moment, I stop and wonder...				"
13,Museums and the Marathon Man,Arts-and-Entertainment,"
					In the first of a series of articles, Professor Whitfield focuses on the tremendous value and role of small American museums - educational gems that outnumber all Starbucks and McDonald's combined in the USA. He explores visiting museums while discussing a journey to regain his health.				"
14,Eight Common Characteristics Famous Celebrities Have,Arts-and-Entertainment,"
					Celebrities come and go. They can either stay for a couple of years, but some fail to carve a niche in the entertainment industry and remain a starlet. Some are successful and become iconic in the music scene, television and movies.				"
15,Wax Prints - An Integral Part of African Society,Arts-and-Entertainment,"
					Africa is known for many things; its natural resources, human resources, beautiful weather and many others. One of these many Africa is known for is its wax prints. As you may already know we are people who love color and design and our wax prints are not left out.				"
16,Effects of Typography on User Experience,Arts-and-Entertainment,"
					Typography is essential and central to any designer's skill. It's much more of an art and a lot of technique goes into it rather than just making words readable. Typography is one of those things that if you do not know how to do, no matter how could your designing or software skills may be, your illustration will always look incomplete or quite unsettling. When deciding on what to work with, it's important to consider the layout, design theme, color scheme and other such factors that make a huge difference but a good and the best design. Typography has been around for a long time, so it's best that if you want to last a long time in the design industry, you start familiarizing yourself with it. It does take a good while to master the discipline.				"
17,The Good News at the Right Time,Arts-and-Entertainment,"
					When you have a Damascus experience like Paul, it changes your life radically. Before, Paul killed Christians; now he supports the other side 100%.				"
18,The Doors: Never Duplicated,Arts-and-Entertainment,"
					This article sums up how the music of The Doors captured the attention of many audiences both when they emerged in the 1960's and other generations. Their sound is unique and has never been duplicated.				"
19,The Place of History in the New Time,Arts-and-Entertainment,"
					History, they say, is the propaganda of the victor. And rightly so, if what obtains now will be used as a yardstick for historical analysis. For History as it is written today is a product of either a single story or an emergence of a winner in the contest among multiple stories.				"
,topic,category,content
0,Types of Female Modeling Jobs,Arts-and-Entertainment,"
					Everybody believe all females models are models like Gisele Bundchen, Heidi Klum or Naomi Campbell, but fact is there are several types of famous models, who you probably ignore, who are making an excellent income. Most of them are working what's called 'behind the scenes' as fit, showroom and commercial models. They're working in a wide range of companies, I can name some of them here: pharmaceutical, fitness, suppliers, manufacturers, airlines and many others. You can certainly fit into these categories, it doesn't matter if you cannot be in the supermodel category, I'm going to list you all types of modeling so you can identify yourself in one or several of them.				"
1,Sculpture Anyone?,Arts-and-Entertainment,"
					Sculptured works have been here for many centuries. Are you getting bored with your current art and craft outlet? Giving sculpting a tryout. This art and craft art form can be very challenging and satisfying. No room for boredom with this unique expression.				"
2,The Magic of 'Glow in the Dark' Pigments,Arts-and-Entertainment,"
					Have you ever wondered how do some fabrics glow in dark? How do galaxies painted on kid's bedroom ceilings glow at night? Is it because of magic? No, obviously not, it is pure and simple science. The use of some pigment powders mixed and processed with certain elements in certain combinations help to create the 'glow in the dark' effect.				"
3,Dyeing of Wool,Arts-and-Entertainment,"
					Woolen garments are mostly flaunted during the winters or when there is a chill in the air or just to make a fashion statement. Woolen garments, carpets and rugs come in varied qualities and varied hues and with all of them being vividly colored and patterned. Do you know at what stage does the wool get its color?				"
4,Use of Colorants in the Plastic Industry,Arts-and-Entertainment,"
					Dyes and pigments play an important role as colorants in the plastic industry. The beautiful pastel shaded plastic store ware or the vividly colored plastic containers are all a result of dyes and pigments used in their making.				"
5,It's a Secret,Arts-and-Entertainment,"
					I've been a reader for a long time. I read with the expectation of entertainment or enlightenment. I've been a writer for much less time, but readily acknowledge the monumental burden of these objectives. Correspondingly, there are two kinds of writers. The first may be called responsible. These writers make primary the needs and desires of their readers. They use an outline and write with an organized plan. The second may be called cathartic. They write to cast off whatever is inside.				"
6,Nagamanathhu Tamburan,Arts-and-Entertainment,"
					""People cannot pass through that temple road,"" my friend Krishnakumar vented his anger. I asked what exactly happened. ""A new person has been appointed as temple priest"".				"
7,Types of Weave,Arts-and-Entertainment,"
					When we look at a piece of fabric closely we can see the tiny weave that makes it up. These weaves differ depending on what is being made. Here are the top three types.				"
8,The Old Diviner,Arts-and-Entertainment,"
					The Old diviner My father had a geologist friend who knew of my interest in crystals and attractive pieces of coloured ore. He was going on a day's journey into the bush with an old water diviner to site a new mine. My father asked if I could go with.				"
9,Hosting an Event,Arts-and-Entertainment,"
					Many people go to all of the events that are held here at the University of West Florida but they don't understand the hard work that goes into planning and hosting an event on campus. This requires a great deal of work and you have make sure that your vision is understood, so that your plan can be executed perfectly by your team and the organization that is assisting you. There are many steps that you must follow in order for your event to be successful and this rubric will help you insure this.				"
10,Funding Opportunities for Artists,Arts-and-Entertainment,"
					With limited methods for the accurate tracking of individuals with arts as their primary income source, estimated figures of total US working artists (from literary to performing, cultural and visual) are around 1.4 million. It's often very difficult for working artists to conveniently finance the creation, exhibition, and marketing of their arts thanks to their relatively low earnings.				"
11,A Love Letter,Arts-and-Entertainment,"
					From My Heart to Your Heart, May we recognize the Divine Love's presence. May we see each other as One.				"
12,Best Winter Amusement Destinations in Hyderabad,Arts-and-Entertainment,"
					Winter has taken all its beauty to entertain and encourage the locales and residents of Hyderabad. As we all know, Hyderabad is the metropolitan city with rich in climate and best place for entertainment and enjoyment to anyone and everyone planning to make their holiday most entertaining. Let's look at the best amusements destination in the Hyderabad: Ramoji Film City: It is a magical realm filled with enthusiasm and magnificent wonders at every turn.				"
13,Letting It Go,Arts-and-Entertainment,"
					Carlos telephoned me because he wanted to hear from his father, Gustavo, who'd died several years ago. At the beginning of our session, he told me he'd dreamed of his father, who appeared as a phantom-like figure on the edge of his unconscious awareness. Gustavo had spoken to him, but his voice had sounded blurred, like he was speaking underwater. And that made no sense to Carlos, because his father hadn't drowned.				"
14,The Alien World,Arts-and-Entertainment,"
					A one-script scene about an Alien World. The main characters struggle in fantasy world as they find it to be too real. The suspense in Alien World unfolds.				"
15,It Pays to Get Locked Up! Escape Rooms: The Marketers' New Playground,Arts-and-Entertainment,"
					What exactly is an Escape Room? You may ask. Picture this - you are in a locked room. You have a few random clues and you have no idea how to get out. You might think this is just another plot from one of the Saw film franchises but it is in fact the makings of an Escape Room experience.				"
16,Tips To Use A Chalk Marker,Arts-and-Entertainment,"
					Have you heard about chalk markers? You may have because they have been increasing in popularity in the here and now. As a matter of fact, they are so popular and useful that they are being used at home, events, restaurants, schools and parties, just to name a few places.				"
17,Palazzo Pitti's 7 Galleries - Largest of Florence's 70+ Museums - Filled With Priceless Treasures,Arts-and-Entertainment,"
					Palazzo Pitti (also called the 'Pitti Palace') is the largest museum complex in Florence, Italy. It houses a vast amount of priceless artwork that has been acquired over a period of hundreds of years. It can be difficult to fully comprehend the importance of the museum and its art collections. This article lists the museum's galleries, along with brief descriptions of the priceless treasures that they contain, to help in gaining a full appreciation of the museum.				"
18,Different World Views of Art,Arts-and-Entertainment,"
					It's an analysis of the various schools of art. Artistic trends like naturalism, romanticism, impressionism, surrealism and postmodern art have been explained.				"
19,Everything You Wanted To Know About Alginate,Arts-and-Entertainment,"
					Alginate is a multi-purpose product. Though it is mainly used in life casting, it has immense benefits across a range of usage.				"
,topic,category,content
0,Even the Tiniest Hand Can Hold a Diamond,Arts-and-Entertainment,"
					I recently attended a circus wedding. I'm referring to a circus-themed wedding, not a wedding ""under the big top,"" though there were a great deal of fanciful shenanigans and enough clowning around that one might have difficulty differentiating the two.				"
1,Life Casting in Animatronics,Arts-and-Entertainment,"
					The unique techniques of life casting have found favor in many other fields such as prototype tooling, prosthetics, taxidermy, architectural restoration and special effects for film and television. The advanced technology used in animatronics also incorporates life casting techniques in the initial stages of creating the characters.				"
2,5 Most Artistic Cities in the World,Arts-and-Entertainment,"
					There's no doubt that some cities across the world are an artist's paradise. Filled with the world's greatest works and home to some of the best performers of our time, these cities are more than likely on your bucket list if you are an artist or an art connoisseur. Let's take a look at some of the greatest artistic cities in the world, and why you absolutely have to visit them.				"
3,Palaeocommunities in Upper Campanian Stratigraphy of Alberta,Arts-and-Entertainment,"
					Abundant Ornithischian Fossils shed light on Late Cretaceous mega-fauna With the re-examination of many of the lost quarries within the Dinosaur Provincial Park of Alberta more data on the palaeocommunities from this region has been collected.  This has provided some intriguing information that may indicate a succession line of ornithischian genera (both ceratopsia and hadrosauridae) and lead to a greater understanding of the type of habitats preferred by many types of dinosaur.				"
4,All You Wanted to Know About Life Casting,Arts-and-Entertainment,"
					Life casting is a simple and interesting process of making perfect reproductions of the live human body. Find out how it's actually done.				"
5,Science and Art: Their Striking Differences and Similarities,Arts-and-Entertainment,"
					Science and Art are two giant disciplines in the Academic Arena. Many scholars have been groomed by them. Yet, many scholars wonder if these two disciplines are the same or they share striking similarities. Of course, the variance in their identities as Science and Art clearly shows their demarcation. Their differences are particularly from their procedural dispensations.				"
6,An Autograph Please,Arts-and-Entertainment,"
					An autograph connects the collector and celebrity in an instance so one needs to keep few things in mind while collecting autograph. Start exploring more about the personalities so as to keep your hobby more interesting and fun-filled. Try to find newer ways to get your favourite star autograph.				"
7,What Does God Want for You?,Arts-and-Entertainment,"
					The biggest challenge each of us faces is to live within God's will. If we could just do that, then it will go well with us.				"
8,On Knowing Everything,Arts-and-Entertainment,"
					The impossibility of knowing everything may lead us to remain in the backwaters of a narrow specialization. But statistics offers a way out: a well-chosen sample permits valid generalizations about a large population. In this case, a matrix with cultural categories on one axis and time on the other can lay the groundwork for producing a picture of western culture.				"
9,Angel Lore,Arts-and-Entertainment,"
					Angels... What are they... Who are they... find out about these celestial beings and what impact have they had in our literature culture? Versions of the word ""angel"" occur in many different languages around the world. The Greek word angelos translates to ""messenger"" and is considered the basis for modern-day literary interpretations.				"
10,5 Health Benefits of Art,Arts-and-Entertainment,"
					The profound effects of art on the mind and body We often wonder what purpose art serves. Why would anyone want to spend their hard-earned money at a museum or a concern? There must be some reason why we've evolved to appreciate art.				"
11,The Often Unappreciated Value of an Enemy,Arts-and-Entertainment,"
					By ""enemy"" I mean the person or persons other than us who we feel or think are hurting us or, at the least, wishing us ill. Also, an enemy can refer to something bigger than persons, such as a whole nation or group of nations-which I hope to be able to talk about later in this post-but what I have in mind when thinking about how valuable an enemy can be are more or less limited to dynamics that arise from interpersonal relations.				"
12,Costume Play Is A Popular Hobby,Arts-and-Entertainment,"
					Cosplay, which is a coined word for costume play, describes people who enjoy wearing costumes for Halloween or special events. This imaginative world of original or copied costumes created by individuals is a popular hobby and is an excellent outlet for costume enthusiasts. Many conventions and public gatherings are more exciting and interesting with cosplay attendants.				"
