,topic,category,content
0,How Cromacoin Functions to Enhance Businesses Productivity?,Business,"
					Instead for entire details relevant piece of information in this world of modernized technology Cromacoin usually operates on wide-spread public ledger known as Blockchain where entire confirmed transactions. Entire ways where users are aware of each transaction avoid stealing and spending the same currency within stipulated time. This process also supports Blockchain as it is trustworthy for an appropriate piece of content. Cromacoin is one of excellent digital currency which has been stepping up to correspond with better digital currencies exchanges.				"
1,Uses of Silicon Carbide Ceramics in Different Industries,Business,"
					With the passage of time, there has been continuous development in the world of solar energy, nuclear power, smart grid, electric vehicles, rail transportation, aerospace, aviation, and navigation. Therefore, this trend has increased requirements for power equipment performance. These days, the first generation of silicon materials is about to hit the theoretical limit that was originally determined.				"
2,An Overview of SiC Material,Business,"
					Basically, silicon carbide ceramic is one of the most advanced materials. As the name suggests, it is made from carbon and silicon. In nature, it's found as a rare form of mineral moissanite.				"
3,5 Applications of Cast Aluminum,Business,"
					From the personality point of view, you cannot find anything better than cast aluminum. This is the reason this type of metal is used in terms of products, which includes smartphones and large trucks. Since it is a strong metal, it features heat resistance.				"
4,8 Advantages of Fiberglass Fabric,Business,"
					Fiberglass strands are weaved together in order to make a basic sheet of cloth, which is known as fiberglass cloth. The good thing about this type of fabric is that it has a number of applications. For example, it is used for construction, commercial, filtration, and insulation purposes.				"
5,7 Benefits of Custom Aluminum Cases,Business,"
					If you want to carry your expensive electronic items or any type of fragile instrument, we suggest that you be on the safe side. We suggest that you pack your expensive stuff in a reliable case. In other words, you may want to invest in a dependable custom aluminum case to carry your items with you.				"
6,Tips To Help You Gather Camp Kitchen Box Supplies,Business,"
					If you have a list of your kitchen gear, you should be ready to look for the best camping kitchen supplies. In this article, we will help you gather the supplies and then go for the best camping kitchen box to cover your needs. Without further ado, let's get started.				"
7,An Overview of the Potential of Silicone Release Coatings,Business,"
					If you are on this page, chances are that you are looking to find out more about the performance of silicone release coatings. First of all, it is essential to keep in mind that these coatings are applied on two different types of substrates. For this purpose, many techniques are used.				"
8,Importance of Restaurant Marketing Agency,Business,"
					Restaurants need to encompass considerable marketing avenues for the sake of success. Without publicity and marketing, there are chances that the restaurant may not survive in the market. But with thorough planning and enactment, the restaurant's promotion can grab the customer's attention just like that.				"
9,Worker Shortage Might Be Excellent News For The Economy,Business,"
					A worker shortage might be excellent news for the economy! Maybe, just maybe, firms will awake and see workers' substantial contribution to their success. Some CEOs take unconscionable sums and destroy their firm's value, unlike many frontline workers who create value.				"
10,7 C's Of Effective Business Communication,Business,"
					The corporate world has its own infrastructure, ethics, language and way of doing things. Thus, every person should be well-acquainted with all the core principles of the sphere before entering it, for a successful start and a perfect journey. Communication plays a vital role in the corporate world as it is something that can either seal the deal or cancel it. Effective communication allows you to put your message, thoughts and ideas across in the right way, such that it garners attention. In order to deliver effective communication, there are seven vital concepts				"
11,5 Reasons HR Management Is Imperative For Every Organization,Business,"
					The manpower is the biggest asset of any organization and its efficacious management acts as the cornerstone behind the success of the business. A Human Resource Manager has a key role to play in almost every sector of an organization.&hellip				"
12,How an Effective Presentation Can Boost Your Business?,Business,"
					Technological advancements are boon for organizations. The businesses which were once limited to paperwork now fully transformed to digital mediums. Organisations are now implementing new software's, advanced technology tools for running operations smoothly. One of the most beneficial advancement is Slide Presentation Software. The slide presentation can be used to add visual effects, collaboration tools, easy access etc. Using it a lengthy content can be conveyed in an entertaining way. It is a powerful tool to make your presentation more attractive and engaging. One of the most popular Slide Presentation tools is PowerPoint Presentation. PowerPoint contains unique color themes and fonts, clipart's, attractive backgrounds. A great content can be scrap if not delivered in an entertaining way. Adding templates helps to convey the information in an attractive way, enabling to grab the audience attention throughout the topic.				"
13,Proffer Before You Offer,Business,"
					We see environment concerned people and associations talking about the use of paper and plastics for other than one time use products and there are articles and events all over about the issue. Do you think, awareness & education enough to shift consumers from #plastic to #paper? May be not!				"
14,Affiliates - What Is an Affiliate?,Business,"
					Step-by-step course on how you can build an online business from the ground up. Master seller on ClickBank and JVZoo, John Thornhill, will guide you safely through the whole process. There will be non-stone unturned. Grab it now.				"
15,6 Crucial Things to Check Before You Select a Payment Gateway Provider,Business,"
					You might be bullish on an E-Commerce business and might also be planning to launch your own e-venture in near future. The trend is so strong and profitable that even the brick and mortar companies are opening up their web stores to support their physical stores.				"
16,Stay In the Most Luxurious And Secure Dorms In Singapore,Business,"
					However, the population of over land area is Metropolitan Region and the ultimate level of buying the shops. In addition, the residential and commercial shopping area like information technology parks, home to many malls, hotels and etc. There are commercial spaces for rent with high demands for today. It is more than 500 commercial shop properties are rent to the reasonable price and you can find easily in the given website				"
17,5 Types of Packaging Material for Your Cosmetic Cosmetics,Business,"
					If you want to make a cosmetics line of products, you need to do a lot of tasks, such as making a list of ingredients, creating formulations, and then putting the product to test. But the most important step is to go for the best packaging for your products. According to experts, you may want to go through this process as soon as you can.				"
18,4 Reasons to Opt for Kraft Boxes for Your Business,Business,"
					These days, businesses are using modern packaging solutions, such as kraft boxes. They are available in a lot of designs and styles. Therefore, they are an ideal choice for businesses to package their products efficiently.				"
19,4 Advantages of Kraft Drawer Boxes,Business,"
					Kraft drawer boxes can serve a number of purposes as they are available in a lot of styles and sizes to meet the needs of a wide range of uses. Apart from this, they are quite popular because they are biodegradable, recyclable, food-grade, and sturdy. In other words, these boxes are more durable than a lot of other packaging materials, such as paper or plastic products.				"
,topic,category,content
0,5 Advantages of Using Different Types of Kraft Boxes,Business,"
					Nowadays, kraft boxes are used quite commonly as they are popular and eco-friendly. Primarily, it is due to the type of paper material that the manufacturers use for making these units. Therefore, these boxes can be recycled after they have been used for a while.				"
1,Best Practices to Follow for the Installation of Fiber Optic Cable,Business,"
					Today, companies require a fast internet connection and a strong computer network. Although it is possible to create a good connection using copper cables, nothing can replace fiber optic cables. Basically, copper cables transmit information via electrical current.				"
2,Life Of Spiral Steel Pipe,Business,"
					Spiral steel pipe itself has no life limit, and the service life is mainly related to the operating environment and production process. Its operating environment is relatively poor, in order to extend the service life, the outer wall and inner diameter of the steel pipe are preserved.				"
3,7 Natural Methods to Boost Fertility,Business,"
					When it comes to fertility improvement, you should know that it is something a lot of couples can use. Nearly 15% of all people have some problems in regards to conception. Numerous reasons contribute to this. What is more important though is that there are many ways to help with fertility problems. Even though most of them are simple enough, they can boost fertility significantly. Take note:				"
4,"US Telecom Industry Assessment, Trends, Size and Forecasts 2011-2020",Business,"
					According to the latest report published by Frank N Raf Market Research the Global US Telecom industry is a complex business with numerous segments, which has undergone strong growth over the past ten years. Recent history has manifested significant change with extensive mergers and a rapid flow of technologies supporting faster speeds, broader coverage and expanded market penetration.				"
5,The Most Important Rights And Responsibilities Of Landlords And Tenants,Business,"
					The renting of homes is a mutually beneficial undertaking for both homeowners as well as tenants. However, like every successful working relationship, this one also entails a set of rights and responsibilities that the two parties need to be aware of. This can help prevent a range of major and minor legal disputes and common misunderstandings that can take place in the absence of this information.				"
6,Use the Machine Accessories for the Car Maintenance,Business,"
					These types f burners can be designed and developed by using the speed grade of the components in accordance with the industry set norms and the standards. These offers can be ranged for the designed and it is used in out and superheated water boilers.				"
7,Important Things To Check Before Moving To An Apartment,Business,"
					You've found a great apartment in your price range and ready to move in. But before you pack your bags and boxes and load up the moving truck, you'll want to do an apartment walkthrough. Essentially, it's like running through a home safety checklist; you walk through the apartment with your landlord or rental agent and determine if there are any issues that need fixing before you move in.				"
8,How to Choose an Emergency Dentist?,Business,"
					There are many times that a person may need emergency care for their mouth. It can be due to pain, an accident or other types of dental woes. Emergency dentists Calgary are adept at what they do, and they are willing and able to help a person with what needs done.				"
9,Mumbai an Its Stopovers,Business,"
					MUMBAI AND ITS FAMOUS STOPOVERS. Mumbai is a city of charms. It is known as a financial capital of India.				"
10,6 Tips for Creating a Great Team,Business,"
					If you decided to build a successful work team, you should remember that it will be very challenging as different personalities will collide, influencing each other. Each team member will bring their opinions, knowledge, past experiences, and values into the new team. Some people might lack communication skills and team building making it harder for you to manage the whole business team.				"
11,What Is the Value of Your Dental Gold?,Business,"
					If you run a dental practice or a dental laboratory and you are not selling your scrap precious metals, you may be missing out on some serious cash. In general, the use of precious metals - gold, silver, platinum, and palladium - in dental restorations has been decreasing in recent years with the advancement of technology. However, because many restorations with metal placed over the past decades have now reached their life expectancy, they are now being removed from the patients' mouths to be replaced with new more advanced implants.				"
12,Ip Tv,Business,"
					Change the way that you watch TV with the most recent broadcasting technology, ipTV. To comprehend why mobile TV doesn't utilize IPTV, the unicast temperament of the cell phone network should be explained. Web Protocol Television is about creating an alternative which is capable of obtaining and also displaying video clip streams that are encoded as a vast array of IP packets.				"
13,Online Assignment and Essay Help in Sydney,Business,"
					Ozpaperhelp is one of the leading online assignment writing service providers in Australia, the UK and USA.Our expert academic writers have provided effective Research Paper Writing Services, dissertation, essay and thesis writing services in accordance with the University's guidelines.				"
14,Samyak Electric & Trading Company,Business,"
					SAMYAK ELECTRIC & TRADING COMPANY was established in the year 1960 with the name ""JAIN ENGG. WORKS"" after few years its name changed to ANUJ ENGG. WORKS and finally we works with SAMYAK ELECTRIC & TRADING COMPANY, we, deals in manufacturing and suppling of all type of A.				"
15,SAP Concur,Business,"
					SAP Concur is integrated with the leading online booking tools. You can configure these tools to fit your travel policies which helps ensure compliance in regards to costs and preferred vendor rules. This enables your company to economize your travel expenditures andspeed				"
16,The Difference Between Bespoke & Made-To-Measure: A Tailor Tell All,Business,"
					They say you can have anything you want if you dress for it. But whether that anything is decided by your tailor or the options available to you at a store, that's what makes all the difference. When you go into a store, you are presented with a range of options, from formal blazers to casual jackets.				"
17,Hospital Creditation Is a Journey and Not a Destination,Business,"
					In the present scenario, quality is the biggest driver for any business to succeed. Quality remains at the heart of any business. Healthcare is one such industry where quality of care cannot be compromised at any cost.				"
18,Top 5 Uses of Marble,Business,"
					Marble which is considered as one of the most fascinating and elegant stone. You can see various uses of Imported Marble in India. Marble is formed under intense heat and extremely high-pressure that is caused out of geological process. Even today the marble tile flooring is an eminent choice when it comes to adding an exquisite look to your home.				"
19,Business Water Saving Tips - Avoid Throwing Money Down the Drain!,Business,"
					Is your business taking steps to actively safe water? Not only can your business stand to save money by saving water, but you'll also be helping the environment by conserving earth's water resources. Did you know?				"
,topic,category,content
0,How Can Volunteering in Ethiopia Help The Nation,Business,"
					With its capital Addis Ababa, Ethiopia is a beautiful nation in the easternmost part of Africa. It is the second most populous country in Africa and is one of the fastest growing economies.				"
1,Insight Regarding Plastic Ban (Year 2018),Business,"
					The insight of store owners doesn't differ with each other when pertaining to plastic ban. After all, it all affects them the same way no matter what their profile is. When it regards to a business, it doesn't matter what is the profile of the store owners. All types of people become practical once they engage in the business industry which is necessary for them to survive.				"
2,History & Current Status of Digital Printing on Fabric,Business,"
					With the advancement in the field of technology, the fashion field is blooming at a rapid pace. One of the fashion technique that has seen a major change in the recent times is the printing technique. Printing of fabric has witnessed a rapid evolution and is rapidly changing path.				"
3,Advantages of Java Programming Language,Business,"
					Java is a relatively high level language. It offers several ready-to-use resources, which facilitates learning for today's developers and focuses on the actual implementation of the business, instead of worrying about the management of the infrastructure at the system level. Few of the advantages of the Java programming language are: Platform independence: java is independent of the platform, which means that if a program is written and compiled in Java on any platform (underlying hardware and software), it can be run on any other platform of similar capabilities subject to available hardware (power...				"
4,"\""Uber"" Dream in Cargo Transportation",Business,"
					In 2015, the Ministry of Traffic and Transportation in Vietnam announced that about 70% of trucks had no cargo in their backs on their departing way, which meant that seven out of ten inter-provincial trucks had empty backs on their departing way. Consequently, to make up for income loss, carriers had to require more amount of payment than that of two-way trucks. This fact was one of the reasons why logistics costs in Vietnam accounted for 25% of GDP.				"
5,Vaishnavi Serene - A Residential Project,Business,"
					Vaishnavi Serene,as titled this residential project is located in the Yelahanka, north zone of Bangalore, In the recent years this location has evolved as the real estate destination of Bangalore.AH 49 which connects Hyderabad runs though this region which acts as subsidiary link for various zones of Bangalore. The Outer ring roads which get started from the Hebbal junction through this Highway will connect West and North zones of Bangalore in a short time span.				"
6,Choosing a Notary Signing Service,Business,"
					This article is to help you find a quality Notary signing service. I have written about the most important things to look for when choosing a mobile notary company.				"
7,Hyper-Collaborative Modern Workplace: Back to Basics,Business,"
					Today, the modern workplace has gone through a lot of positive changes. Due to the changing demographics and dispersed workforce across the planet, the definition of workplace collaboration has also been changed. These days, face-to-face meetings have now been replaced by internet-enabled video conferencing and real-time messaging.				"
8,Made A Perpetual Surge For More Commercial Insurance Leads,Business,"
					Presently 3,990,946,999 Internet users across the Universe and increases lakes in every single second The Statistics not only define the users but also conclude the Requirement of Tech Leads for the Unbelievable Growth for any Organization. Business Owners are one of the Busiest Personalities always focus to create innovativeness to get marketise with more norms for getting the desired Profit. Even in Behalf of the Above Line Still, there are many Business Representatives made avail there Fortune via the Internet.				"
9,9 Tips To Help You With Fiber Optic Cable Installation,Business,"
					Are you looking for some tips for the installation of fiber optic cable? If so, you are on the right page. In this article, we have shared some tips that will help you with your fiber optic cable installation.				"
10,Truxapp - We Make Things Move,Business,"
					Truxapp started with a passion to revolutionize The Global Trucking Industry. It was founded in January 2015 by a group of passionate, like-minded people from different domains to change the landscape of Global Road Freight System. We are experts in road freight transport and logistics, SCV to HCV, Intercity to Intracity, Long Haul to Last Mile Delivery - We have everything Covered!				"
11,How to Stay on Top of Your Product Development and Easily Organize Your FDA and CE Submission,Business,"
					A non-compliant FDA or CE audit is costly, no matter who you are... small or big, but especially if you're a startup. So, how to avoid disaster?				"
12,Paperboard Tubes - A Step Towards Sustanability,Business,"
					It is the 21st century and we're waking up to a huge environmental crisis. Humans are using up all available non-renewable sources of energy on the planet. There are multiple crises at play which are contributing to this global environmental crisis - non-uniform human population explosion, large scale deforestation, excess consumption, unimaginable production of non-biodegradable waste, a lack of responsible waste management and recycling issues which as this story today on BBC News.				"
13,What Are The Best Lead Generation Tools?,Business,"
					Buying, selling - the whole process has really changed over the years. In the past, marketing efforts have all been geared toward mass advertising, finding customers and representing the company. But today's plan is all about letting the customer discover you by using targeted methods to reach prospects through meaningful conversations centered around the value your product brings to customers. It's all about building relationships with your prospects and customers.				"
14,Private Labeling and Marijuana Packaging,Business,"
					Private Labeling and Marijuana packaging. Branding and launching a Cannabis brand in the USA today is becoming a huge market with the legality of Cannabis shifting towards federally legal your brand needs to stand out.				"
15,Understand the Significance for Large Scale Machine Learning,Business,"
					Managing AI projects is no more a difficult job. With the help of AI platform, you can easily manage your code, projects or data at the same time. If you need help with scaling artificial intelligence or need to manage your high-end AI projects effectively then make sure you prefer ClusterOne.				"
16,"If You Are Looking for a Guangzhou Sourcing Agent in China, Read This!",Business,"
					If you are looking for a good Guangzhou Sourcing agent in China, you are on the right page. Since there are numerous agents in China, it may be difficult for you to compare their services and make the best choice. This type of comparison can make you suffer from tons of anxiety.				"
17,A Detailed Guide to Sourcing Furniture From China,Business,"
					China manufactures and exports almost everything that the world needs. As a matter of fact, most of the things that we use today are manufactured in China. According to statistics, today's most popular brands outsource their furniture orders to China.				"
18,Ways To Source Products From China During Covid-19 Pandemic,Business,"
					In 2020, the entire world was locked down due to the coronavirus outbreak. These restrictions involved the social, cultural, political, and economic life of every country across the globe. Therefore, China has not allowed foreign customers in the country for business purposes.				"
19,10 Most Common Issues You May Face While Dealing With Suppliers In China,Business,"
					Do you want to import products from China on a regular basis? If so, you have landed on the right page. If you go through this article, you will be able to deal with your suppliers without experience in major issues.				"
,topic,category,content
0,Tips to Keep in Mind While Buying PCBA,Business,"
					Before discussing what factors should be considered before buying PCBA, it should be learned what exactly is PCBA. And by definition, PCBA or printed circuit board assembly has many components assembled on a board like IC, capacitance, connector, resistance, etc. PCBA is found in almost every electronic device and machine.				"
1,Titanium Alloy Market Analysis and the Current Development Status in China,Business,"
					Titanium Alloy Market Analysis and the Current Development Status in China: The application field of titanium alloy expanded The total titanium alloy market is increasing. Along with the steady and rapid development of China's economy, the continuous improvement of people's living standard, as well as the continuous development of titanium alloy technology, the demand for it in the civil field is increasing day by day.				"
2,An Exclusive Look at Krisanta Enterprise's Uplifting Story,Business,"
					I can go on and on and on with their testimonials and trust me, they will have the same sentiments about the company that they work for. This company aims to help and inspire people. It has proven that it has the capability and the management force to take care of their employees. Let their story inspire you. If you want to be a part of their family, come and join them. Visit their office and attend one of their business previews. They have free cocktails and Taco Tuesdays				"
