,topic,category,content
6,Multi-Tasking Confessions - Be a Productive Multi-Tasker!,Business,"
					Did you ever reach the end of the day and feel like you didn't accomplish anything? Here's how to become a productive multi-tasker!				"
7,Why Public Corporations Delist Their Shares From Stock Markets To Become Private Corporations,Business,"
					Many public corporations choose to be on an earnings treadmill to satisfy Wall Street's appetite. They believe they must provide quarterly earnings estimate publicly (guidance) or their shares won't trade at their optimal values. Therefore, they focus on next quarter's earnings, which better be accurate! Otherwise, the ""market"" might clobber their shares. instead of ignoring Wall Street's quarterly earnings desires, and remain public, some firms delist their shares!				"
8,8 Invoicing Mistakes Small Businesses Must Avoid,Business,"
					Invoicing may be a mundane task, but holds utmost importance as it deals with the cash flow of your business. As a business owner, you must realize that it is your duty to send an invoice on time, and make sure to remind clients for the same. Here are a few common mistakes that you must avoid.				"
9,Big Data's Role in the Craft Brewing Process,Business,"
					The use of what is commonly called ""Big Data"" can play a key role in the operation of any craft brewing company. How that data is gathered, analyzed and implemented can make a large difference in the efficiencies and profitability of any sized brewer, from new startup to the established multi-state operation. Nearly all brewers realize that attention to detail is a hallmark of the industry.				"
10,"Amazon Isn't Killing Your Business, You Are",Business,"
					A few days ago, I went to the store to pick up a few items after work, which was the peak time in retail. When I went to pay, I looked at two registers with cashiers and very long lines. I then chose to contend with self-service, and when I got stuck in the particular sequence I was supposed to do to pay, the human who in the earlier days of self-service stood around helping people become familiar with the payment machine was nowhere to be found.				"
11,3 Tips When Choosing a Food Courier,Business,"
					Nothing beats the taste of homemade food and it is when you are in a foreign land that you certainly appreciate your native cuisine. Do you know that you can courier your food items from India to any part of the world? In this article, we will be looking at 3 tips when it comes to choosing an international food courier.				"
12,Tips to Choose the Best Steel Bar Gratings,Business,"
					If you are going to purchase bar gratings, you may be finding it hard to opt for the right gratings, which is normal. Given below are a few tips that can help you choose the best steel bar gratings to meet your needs.				"
13,4 Green Cleaner That Work Like Wonders,Business,"
					If you are all about green cleaning and you wish to stop using harsh chemicals for your home, you best turn to safer solutions. There are quite a few options you have since people have found the use for some 100% safe and natural products. The best part is you likely already own these in your home, maybe you just didn't consider their cleaning prowess. Following is a guide on how to use some of these eco-friendly cleaners to great success:				"
14,Strategy Choices and Long Term Plans,Business,"
					Ask ten business people what strategy is, and most will give the same answer: Strategy is a long-term plan. My undergraduate students give a similar reply on the first day of my strategic management class.				"
15,Have You Seen a Purple McDonald's Logo?,Business,"
					Do you ever think of selling your company one day? Even if you don't believe you would ever sell your business, brand consistency, promise, experience and image are vital to the success of your company. I've heard it many times from small business owners that they can't make a significant investment in branding because of lack of funds.				"
16,The Fear of Failure - Welch Report,Business,"
					Never be afraid to make a mistake. Those who never make mistakes are doing very little or nothing.				"
17,Questions Are the Key to Success in Business and Life,Business,"
					Questions are the key to every advancement in life and in business. Ask the questions and the answers will provide the key.				"
18,Money Has a Cost,Business,"
					When I speak about the ""cost of money"" I am talking about just that. All money has a cost. Depending on how you use your money it will either make you more money or cost you money you could have made but failed to as you did not use it to maximize your return.				"
19,Even More Ways to Dramatically Reduce the Cost of Using Outside Experts,Business,"
					Who? Think. To start with, how about your suppliers? They know a great deal about your market and your competition. They can provide you with a wealth of information and advice. They know sources, they may know what works and what has failed.				"
,topic,category,content
0,Dramatically Reduce the Cost of Using Outside Experts,Business,"
					Your goal must be to reduce and control your costs incurred in conjunction with the use of outside experts while maximizing your results. Remember, lawyers, accountants, consultants, etc., are like anyone else in every other profession.				"
1,9 More Tips to Significantly Improve Your Purchasing Profitability,Business,"
					When you hear this term your warning bells should go off. Ask the questions. Discounted from what? Discounted compared to what prices, over inflated starting prices?				"
2,7 Ways to Reduce Your Insurance Costs,Business,"
					Blindly staying with the same company year after year will rarely, if ever, result in the best coverage for the best rates. I suggest that you bring in 3 agents each year, or at least every two years, to review your insurance needs, recommend coverage, and provide costs.				"
3,7 More Ways to Dramatically Reduce the Cost of Using Outside Experts,Business,"
					I know that in some cases you are not able to verify the time spent on your behalf as it takes place out of the office. However, in many cases you will be able to track much of the time expended on your behalf and in some cases all of it. By having such a log, you will be able to accurately verify or dispute any bills you receive.				"
4,6 Ways to Significantly Reduce Worker's Compensation Costs,Business,"
					This is the time each year when your insurance carrier will verify payrolls and risk classifications. You must verify all figures to ensure proper payrolls within each risk classification within the period in question and to challenge any risk classifications that you think are wrong.				"
5,6 Ways to Improve Your Purchasing Activities,Business,"
					If you allow anyone who needs anything to purchase whatever they need, even if it is small quantities of office supplies, you have a serious problem. All purchases must be authorized and funneled through one central purchasing group or individual.				"
6,The Success Formula: DefyMediocrity,Business,"
					A common problem today is that employees want to be paid more to perform better; they have this backwards. By requesting more money to do a better job, they are admitting that they are not doing the job as well as they could or should be doing it right now.To defeat mediocrity,such an attitude needs to be changed.				"
7,The Simplicity of Dramatically Increasing the Bottom Line of Your Business,Business,"
					How to dramatically increase the profitability of your business without increasing sales. Learn how cost control and expense reduction can dramatically improve the bottom line of your company and the direction of your career.				"
8,How to Double Your Profits Without Increasing Your Sales,Business,"
					Recent studies analyzing the tax returns of over 1 million businesses have shown that the majority of companies in this country make a pretax profit, as a percentage of sales, of 5% or less. I am not just referring to small companies.				"
9,4 Ways to Dramatically Improve Your Purchasing,Business,"
					Competition is one of the keys that drive your ability to control and reduce your costs, therefore, you should have an open door policy for dealing with vendors. By this I do not mean that you should see every sales rep that comes knocking on your door.				"
10,Would You Like to Dramatically Increase Your Bottom Line?,Business,"
					Call them. Tell them you are happy with their current service but you must get better prices. If you are not bidding out jobs and purchases, as you should be, tell them you are going to have to start getting bids.				"
11,Reasons to Use the Injection Molding Technique,Business,"
					Primarily, injection molding is a manufacturing process. In this process, molten material is injected into a special mold. Usually, this technique is ideal if you want to fabricate plastic parts.				"
12,CNC Machining Services: Introduction and Benefits,Business,"
					If you are on this page, chances are that you are into CNC machining. Nowadays, there are a lot of service providers. So, choosing one based on your business needs may not be that easy.				"
13,Is Dustless Blasting Right For You?,Business,"
					Dustless blasting is a procedure that has gained a lot of popularity in the past few years. More companies are beginning to understand its benefits, especially when compared to sandblasting. But there are still many people who are not sure about how dustless blasting works and if it is worth the money.				"
14,How to Turn a Struggling Startup Into a Successful Business,Business,"
					When you go to the doctor, he or she will not prescribe a solution to your symptom without a diagnosis. Similarly with businesses--large, small, start-up, or established. To identify underlying issues, we must perform a diagnosis. First, what does struggling mean? The particular symptom could be insufficient sales, poor quality, inadequate staff, underfunding, and many other permutations. However, an important issue often overlooked is this: Does this business have the potential to be viable? Indeed, not because you decide to be in business means there is a market for the goods and services you offer! Did you do proper market research? Did you choose an activity that merely fits your talents and desires? How much planning did you do before you started?				"
15,Prevent Vital Business Data From Walking Out the Door,Business,"
					Data is no less than a diamond for business and thus can last forever. Organizations should be very attentive for their business data as it can be lost or misused easily. Dark data is a curse to business' productivity and therefore needs proper care.				"
16,5 Simple Steps to Make a Career Change,Business,"
					With a new school year, many people turn to also look for a new career or work opportunity. Is this the year that you finally decide to break with a dead-end job that's taking you nowhere or a boss who causes your blood pressure to rise? Are you done giving everything that you've got in the tank to a company that doesn't acknowledge your contribution?				"
17,5 Essential Questions to Ask About Your Business Competitors,Business,"
					Are you thinking of starting a new business or have you done it yet and wondered the crucial questions to ask about competition? America is a nation of entrepreneurs, and small businesses are the leading providers or work opportunities for people. We need great entrepreneurs to continue to propel the economy forward.				"
18,Why A Small Shop Is Better Than a Chain Store,Business,"
					A couple of weeks ago, I visited a small, independently owned pharmacy. I know that's quickly becoming a rarity, but I'm glad I did. I've been to the chain store pharmacies, and I have to tell you that I often leave feeling like less of a person than a dollar sign.				"
19,How To Close Your Business,Business,"
					We often talk about in business starting or creating a company, but there's another side to that coin. It's not something entrepreneurs often think about, but many times there comes the point where you want to close your business. Perhaps you had a revenue amount that you wanted to achieve before you cashed out and started on another project of interest, or maybe you've been doing it for years, and it's time to get the business off your hands since no one in your family is interested in taking it over.				"
,topic,category,content
0,Corporate Welfare Destroys Jobs Long-Term,Business,"
					General Motors' notice to shutter several plants reminds us that corporate welfare does not produce long-term sustainable businesses. It's a band-aid and a colossal waste of taxpayers' funds. Government could apply those funds to help retrain workers, assist them to find new jobs, and minimize loss of income during the transition to their new situations.				"
1,Why I Would Never Look for Venture Capital Start-Up Funding,Business,"
					Not too long ago, a friend of mine told me about a young entrepreneur who was spending a lot of time looking for venture capital and start-up money for an app he had developed. I suggested that the entrepreneur should forget the financing and use his own money or borrow that of his friends or family. In the businesses I've created, I've always bootstrapped it, and my suggestion, if you're an entrepreneur, is that you think about doing the same thing.				"
2,DIY Upholstery Cleaning Made Easy,Business,"
					Taking care of all the upholstery at home all on your own can seem like quite the daunting task. The modern home sports quite a few furniture pieces, most of which can be spoiled or damaged very easily. This is doubly true for people who share their apartments with flatmates, have small children at home or keep pets. Upholstery tends to be very absorbent in regards to dust, dirt and spills, which can lead to dust build-up and allergies or, to plain and simple, damage to the tissues. And even if you do rely on professional assistance for your upholstery cleaning needs, it is important to know how to tackle situations as soon as they arise! Below you can find a few simple tips and tricks about taking care of your furniture that will make your cleaning sessions a lot easier!				"
3,Inclusion Is Your Path to Impact,Business,"
					I attended an event a few weeks ago that was chock-full of inclusion. Not in that reflexive, annoying, politically correct way. In that 'honoring everyone and celebrating what diversity offers' way.				"
4,Everything to Do With Data Is Data Science,Business,"
					The most important part is Data Science's application, all kinds of applications. Yes, you read it right, all kinds of applications, for example machine learning.				"
5,What Are The Secrets Of Affiliate Marketing?,Business,"
					What are the secrets of the top affiliate marketing 'guru's'? Or, is the secret to make yourself a guru so people will buy your products?! Top affiliate marketers have 'cracked' the code and know exactly which strategies get them the best results for their efforts.				"
6,The Four Factors That Control Your Managerial Effectiveness,Business,"
					Being an effective manager in a business corporation is not simply a matter of learning a few techniques or a process of ""learning the ropes"" in a new job. Rather, managerial effectiveness is controlled by four factors that must be taken account of in order for managers to be able to do their job properly.				"
7,Top 10 Business Podcasts,Business,"
					If you are a business owner or entrepreneur then you have to check out these business podcasts. It's time to take your business to the next level!				"
8,Why Are General Cleaning Services Important for an Office?,Business,"
					We all know that it is important to maintain the cleanliness of an office. A clean office creates a good impression on your visitors, whether they are your vendors, clients, etc. A neat and well-maintained office provides a hygienic environment for your employees. However, irrespective of the size of the office, maintaining cleanliness can be a daunting task. Fortunately, there are professional companies that offer general cleaning services for the upkeep of the office.				"
9,Voucher Codes - Will They Really Save You Some Money?,Business,"
					What are voucher codes? The voucher codes or promotional codes are the alphanumeric strings that internet stores give to the consumer to encourage their website purchases and are generally linked with the promotional marketing tactic. However, vouchers have switched quite well for internet use, and also have increased in identity and availability due to social media.				"
10,Why Packaging Labels Should Be Clear,Business,"
					It is an age when consumers are the most demanding. When purchasing a product, any customer has a specific set of requirements, which the buyer needs to meet. The requirements of the consumer are based on the kind of product which is being purchased and of course the purpose of use. Thus, it is important that retailers and manufacturers offer complete transparency, especially in case of food products.				"
11,"Artificial Intelligence Is a Must, Not a Need",Business,"
					WHAT DOES ARTIFICIAL INTELLIGENCE MEAN? Artificial Intelligence refers to the vicinity of science and engineering focusing on developing the machines as intelligent as the humans. They are created to be fitted into place on behaviors that human regard as intelligent i.e. simulation of human behaviors which they consider as intelligent via the use of machines.				"
12,A Way Out Available for Real and Automated Decisions: Artificial Intelligence,Business,"
					WHAT DOES ARTIFICIAL INTELLIGENCE MEAN? Artificial intelligence refers to the vicinity of computer science whereby the artificial human beings, i.e. the computers (machines) with the help of the designed computer program or the software programs imitate the way the human beings design, sketch and solve the complex problems. These systems have the capability of learning their own.				"
13,The Future of the New Wave in the IT Industry: Data Science a Fad or an Everlasting Field?,Business,"
					THE JOB OF A DATA SCIENTIST INVOLVES A LOT OF SCOPE - Being a data analyst in the 21st century remains to be the most trending and the most desired job. Since the supply of data professionals is less than the supply, hence, it signifies the scope and the future in the field of data scientist. The tremendous demand by the business firms is evident in the fact that choosing data science as a career option involves growth and development leading to reach greater heights.				"
14,Mylar Applications,Business,"
					>What is Mylar? Or what does Mylar mean? The basic info for Mylar is that is a thin polyester film manufactured by DuPont Teijin Films. According to the Encyclopedia Britannica, strong synthetic fibers of polyethylene terephthalate are stretched and used to produce Mylar. 				"
15,An Old-School Thank You Is Still a Brilliant Move,Business,"
					Want to know one of the best ways to get someone's attention? Send them a thank you--in the mail. My team and I are always saying ""thank you"" in our business.				"
16,You Can No Longer Ignore Data Analytics,Business,"
					What do you mean by Data Analytics? Data Analytics refers to the process of collecting, organizing, interpreting and extracting the useful insights from the raw facts and figures in the huge amounts of data generated by a business on a daily basis. The main responsibility of the data analyst is to translate the burgeoning data into useful perceptions and then into valuable information, assisting the organizations to make smart decisions based on data instead of relying on instincts.				"
17,Data Science: The Most Popular Course of the 21st Century,Business,"
					DATA SCIENTISTS AND THE DATA-DRIVEN WORLD - The world is flooded with a tremendous amount of data which is spawned on a daily basis in businesses. The rise of the internet and the introduction of social media platforms have led to an additional spike in the amount of data generated. It is necessary to extract useful insights from the data to add business value but these datasets alone cannot generate value.				"
18,The Future of Data Science,Business,"
					If you have a question in mind regarding the future of data science then you are definitely concerned with whether the techniques and tools such as Python, Hadoop or SAS will become outdated or whether investing in a data science course will be beneficial for your career in the long-run. But there is no need for worry. Businesses have only recently begun to realize the worth of their data and have just begun to make significant investment in these areas.				"
19,Get Data Science Training and Stand Out in the Crowd,Business,"
					What Is Data Science And Who Are Data Scientists? Data Science It refers to the use scientific tools, techniques and methodologies in order to gain useful insights from the volume of raw facts and figures streaming into an organization's warehouse on a daily basis. Data Science is all about generating business value out of this raw information by mining it.				"
,topic,category,content
0,What You Need to Know About Business Analytics Training,Business,"
					WHAT IS BUSINESS ANALYTICS? Business analytics refers to a practice of repetitive, systematic evaluation of an organization's data, with emphasis on statistical techniques and tools associated with analytics such as SAS, R, Python, Hadoop etc. Business analytics has become the lifeblood of every organization.				"
1,Analytics Training: A Stunning Opportunity for Growth in Career Prospects,Business,"
					THE IMPORTANCE OF ANALYSIS Big Data Analytics is not just a passing trend, it's here to stay. Its upward graph is partly because it plays an essential role in decision making for businesses. Data analysis helps organizations to design more appropriate, strategic decisions for the future.				"
2,Data Analytics Training Courses: Everything You Need to Know,Business,"
					Industry watchers report that data analysis is trending as one of the most popular and profitable professions taken up by people who work in the field of collection, management and updating of data, and analysis of data that can be used to enhance the business's top-line and bottom-line. This is a profession where you have to take a lot of chances because the solution or prediction that you suggest may not be the best solution economically or in other aspects, with respect to the company. This is a risky prospect that might or might not work out in your favor,...				"
3,8 Ways to Show Your Boss You're Ready for That Leadership Role,Business,"
					According to a report published on Deloitte Insights, 86% of companies interviewed in a survey say that developing new leaders is an urgent or important need. This means that the majority of organizations would prefer to groom a number of their employees who have the potential to handle higher positions than to hire externally. Taking up leadership training courses is a great way to boost your confidence and gain the additional skills and knowledge you need to be an effective leader.				"
4,Four Stages of Business Growth,Business,"
					There are four stages of growth a business organization might experience. These stages include initiation, growth, expansion, and maturity.				"
5,Decisions to Be Made for Analytics Training,Business,"
					Ways in which you can identify the kind of analytics training you need - Many people inquire about ways in which they can further the knowledge that they have in analytics. This is an industry that is still in its infancy and there are many developments that are bound to occur in the future. It is therefore important to choose the right kind of analytics training that will get you ahead and keep you current.				"
6,How To Select An Efficient Warehousing Service For Your Company,Business,"
					As a customer, you have the full right to know whether the warehouse service you have chosen for your business requirements is ideal for you or not? This article throws light on the factors that determine whether a particular service provider possesses the worthy warehousing standards or not.				"
7,Want To Cut Down Shipping Costs? Here Are The Ways,Business,"
					The biggest burden that most manufacturing businesses feel post the production process is the higher shipping cost. This article attempts to address that concern of businesses by enumerating some of the key ways to tame the costs of shipping and increase their profit margins.				"
8,4 Ways You Can Optimize Your Logistics and Distribution,Business,"
					In this world of competition, businesses are running with the prime goal of reducing their costs just to save up enough as profits. While logistics and delivery services are a key part of every business that outruns their expected expenses every time, this article here will help them with some measures to optimize their logistics and distribution functions and save up costs.				"
9,10 Things for Choosing the Best Company When Purchasing Products & Services,Business,"
					When purchasing a product and service, who do you turn to for advice? Before the advent of the Internet, it was colleagues, friends, neighbours and family. Now, it's the online reviews. Don't be fooled by over smiling salespersons or make presumptions by reading only one review. Read on for the 10 Things to look for while choosing a company or service provider.				"
10,"Pigments, Dyes & Inks",Business,"
					Pigments and dyes are both coloring materials but each of them have distinct characteristics and lend colors to the substrate differently. Dyes can be used as a solution as they hold on to the substrate whether it is textiles, wood, hair or food.				"
