,topic,category,content
2,Careers Avenues in Leatherwork,Arts-and-Entertainment,"
					Leatherwork, as a field of human endeavour, provides several job opportunities to the masses in the country. Each of the careers it offers generates a lot of income for the individual. Also, they are very lucrative and enterprising.				"
3,How To Care and Clean Leather and Its Products,Arts-and-Entertainment,"
					Leather has to be cared for to prolong their use. They must be cleaned regularly to free them of substances that can slow down their performance when used for the production of articles. Every type of leather has a special way of caring for it.				"
4,8 Oz To Boot,Arts-and-Entertainment,"
					Of course, it is not about the boots, it is about the player! But football cleats can give you the confidence and assurance that your feet are ready to tackle that ball for the first time and the relationship between the foot and ball just gets better with a right, authentic pair of football cleats.				"
5,Reasons for Decorating and Finishing Leather Items,Arts-and-Entertainment,"
					Decoration is the means or process through which the appearance of an artwork is enhanced or made more attractive. Decoration of articles and works in leatherwork has several benefits or importance both to producers, customers and the product itself. Finishing is the treatment given to products to change, improve or develop their appearance or behavioral characteristics. This treatment improves the hand and makes the products very attractive. It is the final methods and processes of preparing the leather for use, of polishing, buffing or otherwise after the completion of the leather artifact. Some of the reasons for decorating and finishing leather items are discussed in this article.				"
6,Preparatory Processes Before Tanning,Arts-and-Entertainment,"
					All the tanning processes go through these basic processes. They are important because they enhance and improve the transformation of skins and hides into leather. The preparatory processes include slaughtering of the animal, soaking, fleshing/ defleshing, dehairing, bating and pickling.				"
7,How To Produce Ten Different Lacing Styles,Arts-and-Entertainment,"
					There are several lacing or thonging styles which though form part of the construction of the article, also improve the aesthetic appeal of the article. Some of these thonging styles are discussed in this article.				"
8,The Forming Techniques in Leatherwork: Gluing and Stitching,Arts-and-Entertainment,"
					These processes ensure the permanent joining or securing of the various parts of the intended article together. Usually, small pins are used by some leather craft men to initially secure the pieces together as a final check before the actual stitching or gluing is carried out. Other leather craft men oversew the edges of the pieces temporarily together with cotton as a checker to test the general outlook of the article. The temporary sewing is very important because any corrections can be easily made before the actual and permanent stitching is done.				"
9,Socio-Economic Reasons for Studying Leatherwork,Arts-and-Entertainment,"
					Leatherwork is an aspect of visual arts that concerns itself with the production of items and articles with leather as the principal material. It involves the various processes of preparing the skins (outer coverings of small animals) and hides (outer coverings of large animals) into leather and using appropriate tools and materials as well as techniques to produce leather articles. Leatherwork is therefore not limited to only the preparation of the outer coverings of animals into leather, but also, the production of articles using the leather obtained.				"
10,A Beginner's Guide on How To Draw,Arts-and-Entertainment,"
					These are the basics on the art of how to draw for beginners. This includes people of all ages from 7 to 70 who love to draw but lack the confidence to start. The following will guide you to express yourself and fire up your creative imagination!				"
11,Fundamentals in Basketmaking,Arts-and-Entertainment,"
					A useful introduction to the fundamentals of basketmaking with links to video and other informational sites. What is basketmaking? What materials can be used? What's involved in the process?				"
12,How to Prepare for Model Casting,Arts-and-Entertainment,"
					Have you been called up by a model agency for a casting call? So sit tight, and read our guide carefully for you to ace your casting.				"
13,Ensuring Safety for Your Kids While Playing on a Trampoline,Arts-and-Entertainment,"
					During winter or rainy season, you can pack away the trampoline and store it somewhere dry. The mat should also not have holes in it. If the mat is worn out, replace it with a good quality mat of the same size.				"
14,What Makes Natural Leather The Best Choice,Arts-and-Entertainment,"
					Natural leather has several features that make it far more different from synthetic leather. These characteristics have to be known by leather craftsmen and students to help develop their taste and sharpen their judgment concerning 'fake' and real leather products. Some of the characteristics of natural leather are vividly described in this article. The aim of the paper is not to discourage leather craftsmen and producers from using artificial leather, but to accentuate the unique abilities of natural leather.				"
15,Finishing Techniques in Leatherwork,Arts-and-Entertainment,"
					Finishing is concerned with the improvement of the hand and appearance of a product so as to enhance its general outlook and maximize its marketability potentials. It is essential that Leatherwork articles are finished in any of the accepted finishing techniques to heighten their design and aesthetic qualities. There are various appropriate techniques through which leather products can be finished. Some of these techniques are burnishing, waxing, polishing, spraying, texturing, patenting. using conditioners, soaps, and cleaners.				"
16,How To Differentiate Between Natural and Synthetic Leathers,Arts-and-Entertainment,"
					Natural and synthetic leather share strong similarities in many respects. Therefore, it is important that we know their unique characteristics to make it easier to distinguish amongst them. Also, the prices of high-quality synthetic leather items are somewhat similar to those of natural leather. Owing to this, one may even be mistaken synthetic leather as natural leather. This article unveils the unique features of both natural and synthetic leathers while highlighting their strengths and limitations. This will assist leather craftsmen and clients who will be adequately informed about the types of leather to choose for the production of a particular article.				"
17,How To Fix Different Kinds of Fasteners on Leather Products,Arts-and-Entertainment,"
					Fasteners are devices in metal, leather or fabric used for closing or locking and opening leather articles. They include buckle, press-studs, zips, velcros, toggle and loop, drawstring etc.				"
18,The Different Ways of Dyeing Leather,Arts-and-Entertainment,"
					Dyeing is one of the major processes in the decoration of leather items. It is the process of permanently changing the color of leather by the use of a liquid colorant. The core fibers of the leather which are porous in nature absorbs and permanently holds the dye solution. The whole skin can be dyed before it is cut for the production of leather articles or parts of an already produced item can equally be dyed. However, when a whole leather is dyed, there is an even penetration of the dye.				"
19,"How To Design and Produce Functional Items in Leather: Briefcase, Belt and Leather Suspended Chair",Arts-and-Entertainment,"
					One of the interesting aspect in the field of Leatherwork is creatively manipulating the leather material to come out with aesthetically pleasing and functional products that can be used in playing various roles in our everyday life. This includes enhancing our personal outlook through the use of items for personal grooming like belts, briefcases for storage purposes and chairs for seating. The steps in producing these functional items have been discussed in this article.				"
,topic,category,content
0,"How To Decorate Leather Using Tooling, Marbling, Dabbing, Printing, Painting and Patchwork",Arts-and-Entertainment,"
					Increasing the aesthetic qualities of an item to be produced is one of the powerful means through which manufacturers win greater market share for their products. The leather craftsman must know these decorative techniques so that s/he can utilize them in improving the attractiveness of his/her products. This article gives a core description of tooling, dyeing, marbling, dabbing, painting and patchwork.				"
1,Enhancing The Aesthetic Outlook of Leather Items,Arts-and-Entertainment,"
					There are various ways of heightening the aesthetic appeal of items produced with leather. Some of these include printing, carving or incision, embossing, weaving, in-laying, on-laying, thonging, stamping and scorching. These decorative processes have been discussed in this article.				"
2,Classification of The Uses of Leather,Arts-and-Entertainment,"
					Leather has various uses in almost all the undertakings and activities of individuals, societies and the nation as a whole. Its immense use cannot be exaggerated. However, for purposes of easy identification and study, the uses of leather have been classified or grouped into seven namely, Clothing and body items, War and Defense, Education, Chieftaincy and culture, Containers for storage and services, Sports and entertainment and Industry.				"
3,Why Preliminary Designing Is Important in Leatherwork,Arts-and-Entertainment,"
					Preliminary design refers to the designs that are made prior to the production of the real product in Leatherwork. They are usually in the form of sketches carried out on paper. Preliminary designing is of immense importance in the field of Leatherwork production.				"
4,Ways of Joining Pieces of Leather for Production,Arts-and-Entertainment,"
					Pieces of leather are skillfully joined to produce leather items. The ways are varied and they are dependent on the particular leather item to be produced. Therefore, the Leatherwork designer must equip himself/herself with knowledge on how each of them is carried out. Some of the joinery techniques are described in this article.				"
5,The Rudiments in Thonging Leather,Arts-and-Entertainment,"
					Thonging is a decorative way of securing or joining the ends of the pieces of the article together. A thong is a long strip of thin leather that is cut and used for thronging. The width of the thong varies depending on the size of the article to be produced. However, the common size is 1/8 inches while the size is further reduced to 1/10 inches if the article is very small. Leather to be used for thonging must be strong but thin. Usually, the type of leather used for the production of the article is used for the thonging provided it is thin. However, if a different colour effect is to be achieved, the leather craft man can dye the thongs. To create a continuous thong, the leather is marked in a continuous formation using a compass or any circular device.				"
6,The Four Steps in Producing Leather Items,Arts-and-Entertainment,"
					Several items can be produced with leather. Some of these items include belts, purse/wallet, caps/hats, folders, pencil case, key cases and holders etc. However, there are some processes that when followed meticulously can help the leather craft man to produce functional and aesthetically pleasing articles. These processes include making a template, laying out, cutting and assembling.				"
7,"The Effects in The Use of Leather Materials, Tools and Materials on The Health of The Individual",Arts-and-Entertainment,"
					Leather as a material, as well as the tools, materials, and techniques used for its production, can pose serious health problems to the individual. The leather craftsman should endeavor to avoid the effects of these health hazards. Some of the effects that the tools, materials, and techniques in leatherwork can have on the individual are discussed in this article.				"
8,Terminologies Used in The Field of Leatherwork,Arts-and-Entertainment,"
					There are various terminologies in leatherwork. The leather artist must understand these terms. He must perfectly know their meanings so that he can be a chief or exponent in the field. Some of these terms in leatherwork are discussed.				"
9,Kinds and Importance of Tanning in Leather,Arts-and-Entertainment,"
					Tanning is the process of preparing or processing skins/ hides into leather using tannic acid. The raw collagen fibres of the pelt are transformed into a stable material that will not rot. The principal difference between raw hides and tanned hides is that raw hides dry out to form a hard, inflexible material that when re-wetted (or wetted back) putrefies, while tanned material dries out to a flexible form that does not become putrid when wetted back. The tanning process significantly improves the natural qualities of the leather such as its dimensional stability, abrasion resistance, chemical and heat resistance, its resistance to repeated cycles of wetting and drying.				"
10,The Uniqueness and Production Processes of Synthetic Leather,Arts-and-Entertainment,"
					The synthetic or Artificial leather is a fabric or finish intended to substitute for leather. There are considerable diversities in the preparation of synthetic leather. The commonest technique is the use of calico. These are the processes through which the fabric is transformed into leather:				"
11,Creating Adventure,Arts-and-Entertainment,"
					Working together with a fellow artist to create a work beyond the reach of each of the artists. Exciting and scaring and a huge adventure. Only possible in mutual surrender.				"
12,Scary Assignment,Arts-and-Entertainment,"
					Why would you give an assignment to an artist? Should you be scared to do so?				"
13,How to Take Your Fashion Modeling Career to the Next Level,Arts-and-Entertainment,"
					Truth is, fashion modeling is a truly competitive career, and the international stage poses a great deal of mental and physical challenge for which a fashion model has to go through an ordeal to prepare for. Check out this space for more details.				"
14,How to Become a Successful Female Fashion Model,Arts-and-Entertainment,"
					Being a female model in fashion is intensely demanding and stressful for anyone, especially so for a female, because of the competition. Stay tuned for more details.				"
15,Definition and Characteristics of Signs and Symbols,Arts-and-Entertainment,"
					A sign is any written or drawn representation that expresses or indicates the existence or meaning of that particular thought. On the other hand, a symbol is a representation of an abstracted idea with a sign, shape, colour etc. because of convention, association or resemblance. Signs and symbols are synonymous terms that express the same meaning. Symbolism is the ideas behind the symbols used for the production of the work. They are the suggestions through imagery of something that is invisible or intangible. This representation of the material object is not simply for its own interest or beauty, but as standing for an abstract idea.				"
16,Relevant Tips For Package Designing and Construction,Arts-and-Entertainment,"
					Products must be packaged in a well-designed and constructed packages to attract clients. A wide range of tools, materials and techniques can be used in the designing and production of packages. Some of these materials include cardboard, metal, glass, plastic, fabric, straw, polythene, Styrofoam, etc. The choice of any of these materials for the building of a package is dependent on some factors.				"
17,Terra Jole,Arts-and-Entertainment,"
					Do you know who Terra Jole is? Perhaps you have heard the name or seen her on one of her television shows. While she may not be a household name quite yet, there is a chance that more and more people will know who she is in the coming months. 				"
18,Care Tips For Your Acrylic Displays,Arts-and-Entertainment,"
					Acrylic is among the most popular materials used for display cabinets and display cases. You will also find acrylic display stands and acrylic display shelves that are suitable for your business to present products in an impressive way that attracts the customers. The good looks of the material are probably its best-selling point, it is a hard plastic that looks like glass and apart from the clear look, you can also find the plastic in several other colors so you can select what works best for your business.				"
19,All About Blanket Molds,Arts-and-Entertainment,"
					Learn the types and methods of making blanket molds. Life casting is an exciting but challenging art that requires both care and practice to perfect the skill.				"
,topic,category,content
0,Questions To Ask When Hiring Film Production Companies,Arts-and-Entertainment,"
					Are you in need of talents as well as help from experts for a film production project you are working on? If so, you won't need to be combing the streets inviting prospects to audition. In fact, there are so many matters you will need to focus your time and energy aside from prospecting talents.				"
1,"Build Corporate Community With A ""Battle Of The Bands"" Extravaganza",Arts-and-Entertainment,"
					Having a ""Battle of the Bands"" event is easy and a lot of fun but is not for every corporate business due to the cost. What it will do--if properly planned and carried out--is give all in attendance an evening of excitement and fun the likes of which most of them have never experienced and one they will always remember.				"
2,Model Agency: A Beginner's Guide,Arts-and-Entertainment,"
					A model agency is a crucial place for a model's development and success in the fashion industry. This article will break down the different segments of how an agency operates and give you a clearer picture of their work.				"
3,Choose a Sophisticated Affair With a Hen Party Life Drawing Class,Arts-and-Entertainment,"
					The question has been 'popped' and you have been asked to marry the love of your life! Finally the years you have spent planning the wedding of your dreams in your mind is now going to come to fruition. The search for that perfect dress starts and you look at all the different venues you can choose to hold your celebration.				"
4,Popular Adult Costume Ideas,Arts-and-Entertainment,"
					Who says that Halloween is a holiday that is interesting just for the kids and teens? Adults can have fun too and that's why I present a short list of Halloween costume ideas for adults.				"
5,Rooftop Venues Provide Prime Viewing Areas for Events,Arts-and-Entertainment,"
					Since the first multi-story building was constructed, people have been climbing to the tops of roofs for a better view of happenings below. Now, rooftops make perfect venues for watching special events in comfort and style.				"
6,Beauty and Abomination,Arts-and-Entertainment,"
					Life exists of contradicting experiences. Which things do we want to see and which things do we rather forget? Is this possible without losing importance in life?				"
7,How to Find Wall Art That Compliments the Room It Is in,Arts-and-Entertainment,"
					Above anything else in a room - art brings all the tangible components including furniture, fabrics and finishes together - but that is only where it begins. Through being prepared and enlightened, you should be well on your way to choosing art that will not only tie your space together... but it will make you feel that you belong to a place that is positively reflective of you.				"
8,How To Find an Acting Agent,Arts-and-Entertainment,"
					If you are an actor and you are desperately in need of a role in a film or even a part in a commercial that will bring your acting career on the right track, then you need an agent and/or a manager. Everyone knows how tough it can be to start an acting career especially if you have no connections or relationships in this field. But if you have a passion for acting and have the necessary skills of becoming a star, there is no stopping you from becoming one. You just have to be determined and need an agent or a manager that will represent you.				"
9,Tips To Improve Your Book Reading Hobby,Arts-and-Entertainment,"
					If you love burying yourself in books for hours, then you know how boredom, distraction and restlessness can ruin an otherwise good read. To be the best in reading, you must be ready and come up with ways of ensuring that you remain hooked to the reading to get the most from your hobby. With so many books available and tools such as e-readers that allow you to read your favorite book from your mobile device, you only need to make a few improvements to ensure that you get the most out of every book reading session.				"
10,The Need for Secondary Molds,Arts-and-Entertainment,"
					Making secondary molds can seem a waste of time at first glance. However, there are instances when secondary molds turn out very useful and time saving.				"
11,5 Things Every Model Must Know About Modeling Jobs,Arts-and-Entertainment,"
					Every model who has gone through modeling jobs knows the high demands of the job. Model knows that getting professional results requires a deal of preparation, time and energy.				"
12,4 Things to Consider to Be a Fashion Model,Arts-and-Entertainment,"
					In terms of modeling, fashion modeling ranks up to be the toughest type of modeling and can't be successfully achieved without certain key considerations and knowledge of the industry. Here, we list out some important considerations to make.				"
13,Geri Jewell,Arts-and-Entertainment,"
					Maybe you know the name. Maybe the face rings a bell. It's Geri Jewell and she has a story to tell!				"
14,Shading Techniques in Art,Arts-and-Entertainment,"
					Shading is an artistic technique that ensures that drawn objects achieve a three-dimensional, solid effect on surfaces. An artist needs to appropriately select a shading technique that suits the item that has been drawn.				"
15,Artist's Portfolio: Its Quintessential Roles and Relevance,Arts-and-Entertainment,"
					An artist portfolio shows the creative works of an artist. It is a blueprint of the identity of the artist and thus speaks for him. It is an evidence of his skills and knowledge in the field of art. There are two forms of portfolios that artists can create which are basically the softcopy portfolio and the hardcopy portfolio.				"
16,Schedule In Advance,Arts-and-Entertainment,"
					It's tough producing content.  I know - I do it for myself and my clients on a constant basis.				"
17,Tips on Finding the Best Children's Birthday Party Decorations Online,Arts-and-Entertainment,"
					Buying party decorations online should be a quick and easy task, but if you want the best quality products based on your chosen theme, then you will want to make sure you purchase from a company that can be trusted, a company that will ensure you get your order within the shortest space of time. There are so many great children's birthday party ideas, which means that focusing on a theme for your party is the first step. When you focus on a particular theme, whether it be the Minions, a Disney Princess or Frozen, you can plan the rest of the party a bit easier, focusing on that one theme and basing everything else around it.				"
18,Hobby Or Profession?,Arts-and-Entertainment,"
					What is the consequence of your choice to be a professional artist? And how can you explain your work to people that are no professional artist?				"
19,Each Material Has Its Own Character,Arts-and-Entertainment,"
					What input does the chosen material have in a sculpture? How can you use the material as an element of importance? Do you want to master one material or will you rather work with many different ones?				"
,topic,category,content
0,7 Reasons Why Kevin Hart Is So Successful,Arts-and-Entertainment,"
					Kevin Hart is no doubt one of the biggest names in the entertainment industry today. On the surface, you'd attribute this to his wit, his energetic and funny stage performances, as well as his unique style of comedy; well, you're not wrong but there are definitely other factors that led to his successful career. Here's what we believe to be the 7 reasons why Kevin Hart is so successful. Kevin Hart's Success - He Quit His Job! Kevin Hart started out as a shoe salesman and was on the verge of making a significant career promotion when he was offered an opportunity to work with Nike. He however turned this off down and opted for his true passion - comedy. Kevin Hart took a leap and the rest is history. Making the most of Social Media - Kevin Hart's success can also be attributed to his presence on social media. He regularly uploads content vis-a-vis his daily activities thereby keeping his many followers entertained and inspired. Yes, Kevin Hart (on Ellen's show) admitted to inspiring others through his social media account to be the best they can be.				"
1,Influence of Industrialism on Arts,Arts-and-Entertainment,"
					How industrialism and technology has changed arts in our lives. A new and thought provoking positive insight into the subject!				"
2,Modeling Precautions for Teenagers,Arts-and-Entertainment,"
					Vibrant and beautiful teenage years are perhaps the best times to look into a career of Modeling. But these years are also characterized by inexperience and a being a vulnerable target for exploitation.				"
