,topic,category,content
0,"Melbourne vs Brisbane was supposed to be a battle of contenders, but only one team looked like premiership material",sport," Sport Melbourne reaffirm their status as premiership favourites with 64-point belting of Brisbane Melbourne have rediscovered their mojo in a 64-point hammering of Brisbane that has re-established the reigning premiers as this year's AFL flag favourites. The Demons triumphed 16.21 (117) to 7.11 (53) at the MCG on Thursday night, snapping a three-game losing streak and displacing the Lions at the top of the ladder in the process. Steven May had mixed results on return from his club-imposed suspension when he blunted Brisbane spearhead Joe Daniher but made a few costly errors, especially with ball in hand. Just about everything else went the Demons' way as they laid the victory platform with a destructive six-goals-to-one second term, having trailed at quarter-time for just the second time this season. Melbourne won contested possession in a landslide (170-133) — a repeat of last year's qualifying final dominance over the Lions — and got on top of their opponents at stoppages (35-21). Clayton Oliver (35 disposals, 12 clearances), Christian Petracca (31, eight) and Jack Viney (34, eight) gave the Demons control in the midfield, where young ruckman Luke Jackson stepped up in place of injured skipper Max Gawn. James Harmes put the clamps on Lachie Neale, restricting the Brisbane ball-magnet to eight disposals during the middle two quarters, and Jake Lever starred in defence with 15 intercepts. Bayley Fritsch kicked three goals and four Demons — Toby Bedford, James Jordon, Kysaiah Pickett and Harmes — booted two each. The Lions had no clear individual winners in their heaviest loss of the season after three previous defeats by a combined 29 points. Hugh McCluggage, Daniel Rich, Harris Andrews and ruckman Oscar McInerney fought against the tide, while Mitch Robinson and Eric Hipwood finished with two goals each. Andrews (shoulder) and Rich (shin) required treatment on injuries but played out the match, while Jarryd Lyons (ribs) was eventually substituted out after being crunched in a second-quarter marking contest with Fritsch. The result extended the Lions' barren run at the MCG, where they last won in 2014 and have now lost 10 consecutive matches. May was back for his first appearance since round 11, when he suffered concussion, and looked shaky early but worked his way into the game. He put teammate Angus Brayshaw under pressure with a handpass that led to Brisbane's first goal and gave up another when he infringed on Daniher in a marking contest. It was the only major Daniher (1.3) kicked from his nine disposals. May's turnover by foot in the second term led to a Robinson goal, which ended a run of five straight for Melbourne. It was only a slight blip for the home side, who were firmly in control by half-time. AAP We acknowledge Aboriginal and Torres Strait Islander peoples as the First Australians and Traditional Custodians of the lands where we live, learn, and work. This service may include material from Agence France-Presse (AFP), APTN, Reuters, AAP, CNN and the BBC World Service which is copyright and cannot be reproduced. AEST = Australian Eastern Standard Time which is 10 hours ahead of GMT (Greenwich Mean Time)"
1,Team USA coach dives to save swimmer who passed out at world championships,sport,"  Photographer captures dramatic underwater rescue of unconscious swimmer Anita Alvarez An underwater photographer has captured the dramatic rescue of Team USA swimmer Anita Alvarez, who fainted during her routine. Alvarez, 25, was performing in the artistic swimming solo free final at the 2022 FINA World Aquatics Championships in Budapest. At the end of her swim on Wednesday (local time) she became unconscious and sank to the bottom of the pool. Head coach Andrea Fuentes dived in, fully clothed, to rescue Alvarez. ""It was a good scare,"" Fuentes told Spanish sports newspaper Macra. ""I had to dive because the lifeguards didn't do it. I was scared because I could see she wasn't breathing."" The underwater rescue was captured by AFP photographer Oli Scarff. Fuentes brought Alvarez to the surface, where another swimmer helped her take Alvarez to the edge of the pool. Alvarez was lifted out of the water and onto a stretcher to receive medical attention. In a statement, Fuentes said Alvarez had a medical emergency but was OK. ""The doctors checked all vitals and everything is normal: heart rate, oxygen, sugar levels, blood pressure, etc … all is okay,"" Fuentes said. ""We sometimes forget that this happens in other high-endurance sports. ""We all have seen images where some athletes don't make it to the finish line and others help them to get there. ""Our sport is no different than others, just in a pool, we push through limits and sometimes we find them. ""Anita feels good now and the doctors also say she is okay. Tomorrow she will rest all day and will decide with the doctor if she can swim free team finals or not. Thank you for all of your well wishes for Anita."" This is not the first time Alvarez has had a medical emergency in the pool. She briefly lost consciousness at the end of a routine during an Olympic qualification event in Barcelona in June 2021. It was Fuentes again who dived in to rescue her. Alvarez came seventh on Wednesday with a score of 87.6333. The women's solo free was won by Japan's Yukiko Inui, who scored 95.3667. We acknowledge Aboriginal and Torres Strait Islander peoples as the First Australians and Traditional Custodians of the lands where we live, learn, and work. This service may include material from Agence France-Presse (AFP), APTN, Reuters, AAP, CNN and the BBC World Service which is copyright and cannot be reproduced. AEST = Australian Eastern Standard Time which is 10 hours ahead of GMT (Greenwich Mean Time)"
2,Best of five on the line when New South Wales meet Queensland in the women's State of Origin,sport," Sport History is on the line when New South Wales meet Queensland in the women's State of Origin clash In the final year of one-off women's Origin matches, and at two wins each for New South Wales and Queensland after four meetings, there's even more on the line than usual when the rivals meet in Canberra on Friday night. With the series expanding to two matches next year, a new era will begin for women's rugby league – but before that, old scores must be settled. Both sides have two wins each since 2018, and each win has come on home soil, so on the frozen tundra of Canberra Stadium, the closest thing to neutral ground in rugby league, they will fight for the right to say they're the best of this era. The game is a decider of sorts, five years in the making. For their part, the Blues are also hell-bent on snapping their two-game losing streak. ""It annoys me (when I think about it). I hate losing, so it hasn't been great. But we played in Queensland the last two years, I'm happy this is a bit closer to home soil,"" said New South Wales prop Millie Boyle. ""Everyone gets hungrier through each year you don't have that success. We know what it's like to win, but now we know what it's like to lose as well."" The Blues enter the match as favourites, due in part to the presence of Boyle and fellow NRLW Dally M winner Emma Tonegato at fullback. While Queensland boast quality in the backline, especially with custodian Tamika Upton and dangerous five-eighth Tarry Aiken, the arctic Canberra conditions should play into the Blues' power and yardage game with Boyle, Tonegato and star prop Simaima Taufa leading the charge. Want more Origin news and analysis? Sign up for our State of Origin newsletter In such conditions, the kicking game will be crucial – the Maroons will once again look to Ali Brigginshaw, as fine a playmaker as the women's game has ever seen, to lead the charge while New South Wales will trust debutant halfback Rachael Pearson to run the show. Pearson, who enjoyed a brilliant debut NRLW season with the Dragons, has the biggest boot in the game and the Hay local will be looking to showcase it early and often at Canberra Stadium. ABC Sport Daily is your daily sports conversation. We dive into the biggest story of the day and get you up to speed with everything else that’s making headlines. She'll need to overcome any debutant jitters, but after appearing in St George Illawarra's run to the NRLW grand final Pearson believes she has the big game experience to get the job done. ""It was an emotional moment, when I found out I was debuting. I was excited and proud, getting the call from Kylie and hearing her say 'I want you to be my New South Wales halfback', what else can you say but 'I'd love to',"" Pearson said. ""Coming off the back of that NRLW season, it's been hectic and crazy but in a good way. I thought I was a good chance off the season I had, but getting the call was still so exciting. ""Just coming into the sheds and seeing 'Pearson' on the back of the jersey, I had tears in my eyes. It probably won't hit me all the way until I run out in Canberra. ""Sowie (Dragons coach Jamie Soward) said to me he can't wait for the switch to flick in my mind when I realise I'm the player who's supposed to be here. But I'm not a boastful person, I just want to take this opportunity and run with it."" We acknowledge Aboriginal and Torres Strait Islander peoples as the First Australians and Traditional Custodians of the lands where we live, learn, and work. This service may include material from Agence France-Presse (AFP), APTN, Reuters, AAP, CNN and the BBC World Service which is copyright and cannot be reproduced. AEST = Australian Eastern Standard Time which is 10 hours ahead of GMT (Greenwich Mean Time)"
3,analysis: The science of silliness: How psychology won the Socceroos a World Cup spot,sport,"  How Socceroos goalkeeper Andrew Redmayne used psychology to secure Australia's spot at the 2022 World Cup In last week's 2022 World Cup qualifying play-off between the Socceroos and Peru, there were two different games being played. The first began at the opening whistle and lasted for 119 minutes: a tense, physical battle between two uncertain sides that ultimately ended 0-0. The second game started a minute later. Because that's when Australia's head coach Graham Arnold made an unexpected (and risky) substitution, bringing off veteran goalkeeper and captain Mat Ryan for 33-year-old Andrew Redmayne. The initial reaction from Socceroos fans was one of disbelief. Ryan, who plays for Real Sociedad in Spain's La Liga, was a veteran of two World Cups and one of the team's most consistent and dependable players throughout Australia's 1,008-day-long qualifying campaign. Redmayne, on the other hand, had just two appearances for Australia to his name, and was even struggling to maintain his starting spot with Sydney FC in Australia's A-League Men. But Australian fans weren't the only ones who were baffled by the switch. Peru's players were, too. And that, according to Socceroos goalkeeper coach John Crawley — one of the only people 'in' on the plan — was the entire point. ""We always knew we had Redmayne up our sleeve,"" Crawley told the ABC. ""We planned for that. We did a couple of sessions throughout the window where we did some specific stuff on penalties. But we didn't need to tell anyone [in the team] as long as we knew the plan ourselves. ""I think you just have to do something different to disrupt the penalty-taker's routine. ""They'd played against Maty [Ryan] for the whole game and knew what he was about, so when they saw Redmayne coming on, they maybe thought, 'who's this guy?' ""Even just that bit of doubt can make a difference."" Redmayne's substitution was just the start of the psychological game that began to unfold after the final whistle of extra-time blew. As the nerve-biting penalty shoot-out got underway, there were other, subtler strategies the bearded shot-stopper performed to give his team the edge. The first was handing the ball to each of his team-mates; a tactic that was popularised by England at the 2018 World Cup and carried on by a number of goalkeepers at club level, including Liverpool's Alisson. According to Geir Jordet, a professor of sports psychology at the Norwegian School of Sports Sciences who wrote a tweet thread breaking down Redmayne's tactics, these gestures were important in fortifying the psychology of Australia's penalty-takers. However, it was what Redmayne did after each hand-off that was most interesting. ""In a penalty shoot-out, you want to make events as predictable and safe as possible for your team-mates,"" Jordet said. ""The way Redmayne helped his team-mates was spot-on: first, by handing them the ball between every shot, giving them a familiar way to start their pre-shot routine [and] a friendly word of support or encouragement. That beats getting the ball from the opponent or having to go get it yourself. ""But what I have not seen before is what he did after handing off the ball. ""He looks up at the opponent goalkeeper and saw that he was maybe trying to get into the penalty-taker's head, so [Redmayne] basically takes on the role as a bodyguard, where he lets [Gallese] know to back down and step away. He puts himself in the middle between the penalty-taker and the goalkeeper like a barrier. ""I've not seen this in a penalty shoot-out before, so this was maybe the biggest innovation for me: how he took that role of a bodyguard. That's quite unique."" Another piece of psychological warfare was barely captured on camera, but arguably had one of the biggest impacts. After Redmayne noticed one of Gallese's water-bottles had notes on Australia's penalty-takers wrapped around it — containing details on who they were and which way they would likely shoot — the Socceroos keeper picked it up and threw the bottle over the advertising boards. For Jorbet, this act didn't just deny Gallese crucial information; it also acted as an intimidation tactic, a violation of the Peruvian's property and his space. ""It's disruptive on a few levels,"" he said. ""Of course, it takes away information that he probably relied on. We don't know the extent to which he had memorised these things anyway, but it was on the bottle for a reason. ""But then there's the added aspect of it being a very hostile act. It's intimidating. It's not friendly in any way; it's leaving the goalkeeper feeling very unprotected, very attacked in this very indirect kind of way [with] someone stealing your stuff. ""You can imagine coming home and someone has been in your place and stolen things. People who've been robbed talk about how it's not just that they lost a computer or whatever, but that some stranger was in my home. So to instil that in this situation is quite extraordinary. Socceroos substitute goalkeeper Andrew Redmayne danced his way into national folklore this morning – and the internet went a wild emotional rollercoaster ride with him. ""This may be stepping over the line and taking it too far, though. I wouldn't be comfortable telling my team that [stealing] is something you should do. But if a player decides to do it on their own, that's a different thing. ""And there's the other intimidation tactic where [Redmayne] was invited to hand the ball over to one of the opponents, and then just let it go and kicked it away. It's a clear demonstration of gamesmanship: 'I don't respect you.' It's a clear, explicit mind-game."" Crawley admitted that he had prepared a similar water-bottle with notes on Peru's penalty-takers, but that Redmayne was confident enough that he wouldn't need them. ""We discussed it together probably two weeks out from the Peru game,"" Crawley said. ""And I said, 'mate, in the event that we lose our bottle — it gets thrown into the crowd or something — we've still got our signals. ""And, as it turned out, when I gave Andrew the bottle right before [the shoot-out], he said, 'mate, don't worry about the bottle. We've done the signals before with success. You hold the bottle.' ""So he's gone in there without the bottle and we just did our signals. But I actually didn't realise he took advantage of Gallese's notes being there and that he's then thrown his bottle [away]. ""But again, it's whatever it takes. We certainly had a Plan A and a Plan B, but I think Redders may have taken that to another level. And thank goodness he did."" And then, of course, there's the iconic ""Wiggles"" dance. While it looked silly and unorthodox, Jordet said there was a clear rationale behind Redmayne's flailing limbs and jittery style. ""A lot of goalkeepers do things on the line to try and distract; to try to disturb,"" he said. ""What Redmayne did was follow that principle that it needs to be unpredictable, it needs to be a little erratic, it needs to have some variation. ""Because if all you do on the line is go from left to right, from right to left, it doesn't have any impact; it's very easy for the taker to block out. So it needs to be different. ""I've watched thousands of penalty shoot-out shots over the years, and this definitely ranks in the top five with respect to unpredictability in his behaviour, which I love. ""It takes me back to football history: Liverpool in the Champions League with Dudek back in 2005 and Grobbelaar in 1984 and '85. This one fits nicely with them because it's so weird, it's so strange. And what could be more impactful than that?"" However, while it may have worked for Redmayne this time, such unusual goalkeeping tactics are still so rare in professional football that there is only a small amount of evidence to suggest it's more effective at stopping penalties than any other method. The key, Jorbet says, is the overall distraction — the psychology of the moment. ""There is research on when the goalkeepers are trying to do something to distract the shooter — no matter what it is — and that history directly reduces the chance of the shooter scoring by about 10 per cent. ""Research that I've done also looked at whether goalkeepers were able to take so much time that the penalty taker had to stand there and wait. I looked at every single penalty shot in the World Cup, the European Championships, and the Champions League and the difference there, with the shooter having to wait [for the goalkeeper] versus the shooter not waiting, was more than 20 per cent. ""So there are different ways a goalkeeper can be disruptive and there is some research to suggest it works. ""But it's always difficult to go from documenting what has happened to predicting what will happen. The point is that these are not absolute discoveries; these are trends based on history that might indicate something about probabilities going forward."" For Crawley, who Redmayne credits as introducing the idea to him when they worked together at Sydney FC, the same principle of unpredictability — as well as bravery to do something different — is what made the difference against Peru. ""Whether it's a Wiggles dance, or you turn your back on the player, or you say something to them, or you move to one side of the goal; whatever it takes, you're disrupting that routine,"" Crawley said. ""If you're a player and you're stepping up to practice a penalty, you put the ball down, you walk back, you turn around, you will always see a goalkeeper in the middle of the goal. That's routine for hundreds and hundreds of practice takes. ""So what would happen if you saw a dancing Wiggle there? Automatically, you start to win the psychological game. Andrew understands this and he's willing to make a fool of himself to get that edge. From A-League journeymen to first-generation migrants to young players moving abroad, the Socceroos' ""Aussie DNA"" is more than just mongrel and mateship. ""It's all about disrupting the routine. I don't think Redders really has a great save ratio with penalties, but we all know what he can do and what he can bring. It comes down to that intangible thing in the moment."" And that intangible thing, for Jordet, is why goalkeeping is the most 'human' position in football: so much of a goalkeeper's job happens off the ball and away from cameras. Their power lies largely within the invisible, but very real, dynamics they create between themselves and others on the field. ""This is such a personal type of strategy,"" he said. ""It's something where you have to use yourself more than other parts of the game where you can just do your job. ""There's something very human about this that transcends the game itself, in a way. You have to be able to put yourself out there in a moment like this, do something that others might not. ""These are the intangible human parts of football that are so fascinating. It's something that's very hard to measure; it's something that's hard to quantify. And that's exactly what is so wonderful about it."" We acknowledge Aboriginal and Torres Strait Islander peoples as the First Australians and Traditional Custodians of the lands where we live, learn, and work. This service may include material from Agence France-Presse (AFP), APTN, Reuters, AAP, CNN and the BBC World Service which is copyright and cannot be reproduced. AEST = Australian Eastern Standard Time which is 10 hours ahead of GMT (Greenwich Mean Time)"
