,topic,category,content
52,Unusual crash sets up Verstappen win in F1 final lap showdown,sport," Sport Daniel Ricciardo 11th as Max Verstappen wins F1 Canadian Grand Prix Max Verstappen has extended his lead in the Formula 1 drivers' championship with a flawless performance in Canada. Australian Daniel Ricciardo finished 11th in his McLaren which did not show the same competitiveness as it did during qualifying. Verstappen survived a 16-lap sprint to the finish after a safety car was called when Yuki Tsunoda crashed his car coming out of the pit lane. Ferrari's Carlos Sainz finished second with Lewis Hamilton third in his Mercedes. A safety car on lap 49 of 70 when Tsunoda crashed coming out of the pits set up the exciting finish. Sainz was leading Verstappen, but the eventual race winner had made an extra stop and had fresher tyres. The safety car allowed Sainz to pit for new tyres, dropping him behind Verstappen but giving him the chance to hunt down the Dutchman for his first career F1 win. Despite having DRS (drag reduction system) down the straights, Sainz was never able to make the move on his rival, with his maiden win still elusive. Verstappen said the straight-line speed of his car was a major difference in those final laps, handing him his sixth victory of the season. ""I think overall they (Sainz) were very quick in the race, so it would have been really tough for me to close that gap to the end, even on fresher tyres,"" he said. ""It was really exciting at the end I was giving it everything I had. ""The last few laps were a lot of fun."" Verstappen's victory is the sixth consecutive race win for the Red Bull team. Ricciardo was unable to convert his ninth-place starting position into a points-finish during a tough race for McLaren. Despite looking competitive during the rain-affected qualifying, both McLaren cars struggled for pace in dry conditions. Ricciardo was in 10th late in the race but was overtaken by Aston Martin's Lance Stroll with five laps to go. McLaren teammate Lando Norris had a horror race in Canada, finishing 15th. We acknowledge Aboriginal and Torres Strait Islander peoples as the First Australians and Traditional Custodians of the lands where we live, learn, and work. This service may include material from Agence France-Presse (AFP), APTN, Reuters, AAP, CNN and the BBC World Service which is copyright and cannot be reproduced. AEST = Australian Eastern Standard Time which is 10 hours ahead of GMT (Greenwich Mean Time)"
53,analysis: AFL Round-Up: Top-eight chaos as season sits perfectly poised for the run home,sport," Sport AFL Round-Up: Top-eight chaos as 2022 season sits perfectly poised for the run home It was a week of upsets and top-eight movement, setting the table for the home stretch of an enthralling season. Welcome to the Round-Up, where we digest the week that was. Of all of the three bye weeks, this one felt the most bye week-ish. The big dogs at the top of the ladder had a week off, so attentions were turned a little lower down. Luckily the goings on down there — and by that we mean from about fourth to 12th — is pretty compelling. In fact we've got one of the craziest finals races in recent memory brewing here. The big movers this week were Richmond, whose win over Carlton both went some way to re-establishing the old order and brought the Tigers back into flag consideration. Such is the evenness of this season across the board, Richmond's experience on the biggest stage and in the biggest games will become an asset. The same could be said for Geelong, who have once again quietly been sucked in by the gravitational pull of the top four. We've said all year there is likely to be one vacant spot in the top four and any number of teams capable of taking it. Right now, the smart money would be on one of Geelong or Richmond making it their own by the end of the season. Perhaps that is overreacting to one round, but it's hard to get too hyped about Sydney or St Kilda after their massively disappointing showings this weekend. Both were smacked by teams well below them on the ladder, mustering little fight and showing little resolve once their attacking instincts were headed off. The Swans in particular have been wildly unpredictable this year, their best just about untouchable and their worst barely worth registering. Collingwood, Gold Coast and the Western Bulldogs are lurking just outside that top eight now. Sporadic brilliance might not be enough to cut it in the race for the eight this year. We normally try not to get too ahead of ourselves in the Round-Up, but it's hard not to look at next week and not get excited. It's as if these three bye weeks were all just to set us up for round 15, when the 2022 season moves into its glorious home stretch with everything still up for grabs. Check out these fixtures: It's probably good that Richmond publicly told Shai Bolton off for his showboating, but internally I hope they were far less critical. He is a special player whose flair and showmanship should be protected at all costs. West Coast produced their best performance of the year this week, and Geelong one of their more timid. In a weird win-win, the Eagles would have been happy with their intent and performance and the Cats simply happy to get out of there with the points. We put a line through Port Adelaide last week here. Just when I thought I was out, they pull me back in. As long as there is a mathematical chance, any team with those key-position weapons can't be completely discounted. It was hard to know where to look during the Giants' and Bulldogs' 80s throwback game, but it was very easy to know where not to look. Cody Weightman's elbow. Returning to play after that might go some way to killing off some of the chatter around the young gun and ""the way he goes about it"". Good for Essendon. It would have been pretty easy to shut up shop in the third quarter after St Kilda basically erased the deficit in about five minutes, but to find the willingness to go again shows there is still something about this team. The Dons can really underline the point with a win over West Coast next week. Wil Powell's injury was the sort of one that can rattle teammates so thoroughly they struggle to see out the game. The Suns couldn't afford that and did well to finish the job. But holy cannoli, poor Wil Powell. Here we take stock of who is leading the race for the season's individual awards. A slow week in the Rising Star race with many of the frontrunners sitting out, but Nic Martin gave a timely reminder of his credentials. We've still got Nick Daicos in front for now, but it's going to be genuinely exciting to see which of the chief contenders — Daicos, Martin, Jai Newcombe and Sam De Koning — run away with this thing. Sam Draper can take home mark of the week honours with this solid entry. Not nearly enough to trouble Cam Zuurhar's lead though. Slim pickings on the goal front his week too, so we'll chuck it to Jack Billings for this one from the same game. Ed Langdon's grip on the GOTY title remains. We acknowledge Aboriginal and Torres Strait Islander peoples as the First Australians and Traditional Custodians of the lands where we live, learn, and work. This service may include material from Agence France-Presse (AFP), APTN, Reuters, AAP, CNN and the BBC World Service which is copyright and cannot be reproduced. AEST = Australian Eastern Standard Time which is 10 hours ahead of GMT (Greenwich Mean Time)"
54,Giants advance to Super Netball preliminary final with win over Magpies,sport," Sport Giants advance to Super Netball preliminary final with win over Collingwood Magpies The Giants remain in the hunt for successive Super Netball grand final appearances after a strong second-half effort set up a 55-48 home elimination final win over Collingwood in Sydney. Trailing by three points at half-time and two inside the last two minutes of the third quarter on Sunday, the Giants hit three successive two-point shots to lead 43-39 at the final change. Collingwood got the deficit down to two, but goal shooter Jo Harten made five successive shots to swell the Giants buffer to seven. England stalwart Harten, who shot 40 from 44 including four of six Super Shots, was rock solid as was wing attack Maddie Hay. The Giants missed more shots than the Magpies but the home team hit six of nine Super Shots, while Collingwood netted just one of three. ""I think there's still so much to brush up on, we were a bit wasteful of our centre pass tonight, little errors, communication breakdowns really frustrated me, but it's really easily fixed,"" Harten said. The Giants, who lost last year's grand final to cross-town rivals NSW Swifts, now face a preliminary final next Saturday away to minor premiers Melbourne Vixens, who lost Saturday's major semi-final to West Coast Fever. ""They (Vixens) have threats all over the courts. I'm not going to pick a threat, they are a team I greatly admire,"" Giants coach Julie Fitzgerald said. The Giants, notched a 12th straight Super Netball win over Collingwood, who have lost all three of their elimination finals. Magpies coach Nicole Richardson was proud of her team's effort but was frustrated by some of the officiating in the second half, particularly four offensive contact calls against Collingwood in the circle. ""I was told the intensity of the game lifted in the second half so the umpiring had to change,"" Richardson said. ""I was super frustrated because what was allowed in the first half compared to the second was very different. ""In terms of where our year has been, they fought hard and I'm super excited and can't wait see what this group can do next year."" In a tight first quarter in the first finals match played at Sydney's Ken Rosewall Arena, neither team led by more than three with the Giants up 13-11 at the first change. The Magpies outscored the home team 17-12 in the second quarter to lead 28-25 at half-time. ""I thought we looked a little bit nervous in the second quarter, we were just a little bit tentative in everything we did trying to keep the ball. We didn't give it when we could,"" Fitzgerald said. AAP We acknowledge Aboriginal and Torres Strait Islander peoples as the First Australians and Traditional Custodians of the lands where we live, learn, and work. This service may include material from Agence France-Presse (AFP), APTN, Reuters, AAP, CNN and the BBC World Service which is copyright and cannot be reproduced. AEST = Australian Eastern Standard Time which is 10 hours ahead of GMT (Greenwich Mean Time)"
55,Blues make seven changes to State of Origin squad for Game II,sport," Sport New South Wales make seven changes for second State of Origin game in Perth New South Wales coach Brad Fittler has made seven changes to his squad for next Sunday's must-win State of Origin II in Perth. Matt Burton, Angus Crichton, Clint Gutherson, Jordan McLean, Victor Radley, Siosifa Talakai and Jake Trbojevic all come in to the 22-man squad. Burton, McLean, Radley, Talakai, Joseph Suaalii and Nicho Hynes are in line for possible debuts. Fittler will not confirm his 17 until Monday morning, immediately after which the squad will travel to Perth. Reagan Campbell-Gillard, Tariq Sims, Jacob Saifiti, Tyson Frizzell, Kotoni Staggs and Jack Wighton have all been omitted Raiders star Wighton was forced out of Game II due to COVID protocols, having been the Blues' stand-out in Game I. Canterbury's Burton is in contention to play left centre in place of Staggs but there is no place for fellow Bulldog Josh Addo-Carr, who has scored five tries in the three games since being snubbed for Origin I. Api Koroisau will likely come off the bench to assist Rabbitohs hooker Damien Cook, who was oddly quiet in the Game I defeat after being a non-playing squad member for Game I. Fittler resisted the urge to parachute in returning South Sydney star Latrell Mitchell, who is yet to play in the NRL since suffering a hamstring tear in April and then testing positive for COVID. The Blues must win game two at Perth Stadium on June 26 in order to keep the series alive after losing game one in Sydney, 16-10. Maroons coach Billy Slater is set to name his squad on Monday morning. Blues squad: James Tedesco (captain), Matt Burton, Nathan Cleary, Damien Cook, Angus Crichton, Stephen Crichton, Clint Gutherson, Payne Haas, Nicho Hynes, Apisai Koroisau, Jarome Luai, Liam Martin, Jordan McLean , Cameron Murray, Junior Paulo, Victor Radley, Joseph Suaalii, Siosifa Talakai, Brian To'o, Jake Trbojevic, Daniel Tupou, Isaah Yeo. We acknowledge Aboriginal and Torres Strait Islander peoples as the First Australians and Traditional Custodians of the lands where we live, learn, and work. This service may include material from Agence France-Presse (AFP), APTN, Reuters, AAP, CNN and the BBC World Service which is copyright and cannot be reproduced. AEST = Australian Eastern Standard Time which is 10 hours ahead of GMT (Greenwich Mean Time)"
56,'Not just a game': Every week the Daly River Buffaloes travel eight hours for footy. This weekend they played on home soil,sport,"  Daly River Buffaloes' only home game lifts community spirits with art and footy festival In the vast outback of the Northern Territory, the tyranny of distance takes on a new meaning — but when it comes to footy, nowhere is too far. It was a twist of fate, and a last-minute call that saw the Daly River Buffaloes rise to the challenge of the Big Rivers Football league — a major step up for the local footy team. ""One of the other senior sides in the Big Rivers Football League in Katherine pulled out,"" the team's president John Bonson said. ""We got a phone call basically saying if you're interested, can you get sponsors, can you commit every weekend and possibly be in the competition for the next 10 years? ""We just jumped at the chance."" It's been no easy feat to get from the tiny remote community of Nauiyu, set on the banks of the Daly River, to Katherine. Every weekend the team hustles onto a bus at the crack of dawn for the eight-hour round trip, navigating twisting roads, flat tyres, and wild buffaloes big enough to stop a car in its tracks. But on Saturday, the team played its one and only fixture on home soil. And hundreds of people came to watch. ""This isn't just a game. This is like a grand final,"" Mr Bonson said. The goals flowed in a blistering contest, with the Buffaloes keeping up the pressure as they took on the Katherine Camels. Spectators came from hundreds of kilometres away and screamed their support from the sideline. It was the first time the community had welcomed visitors in big numbers since the start of the pandemic, and emotions were high. ""We were locked down for nearly two and a half years and it was scary,"" community leader Dr Miriam-Rose Ungunmerr Baumann AM said. ""When I heard the boys were having a home game I spoke to the art centre and I said 'Hey, why don't we combine with the boys?' The idea sparked the community's inaugural Art and Footy day, and for Dr Ungunmerr Baumann watching her team for the first time was galvanising. She said she hoped the weekend's event would be the first of many. ""You could almost feel everybody's heartbeat going with the excitement, whether it was a goal or a behind they still cheered them on … and I'll tell you, they can scream,"" Dr Ungunmerr Baumann said. Growing the home game into a mainstay on the NT calendar was a sentiment shared by Labor member for Daly, Dheran Young. ""Something I've always pictured is this [event] to be even bigger and better than the Tiwi Islands Grand Final,"" he said. ""I don't want to speak too soon but Daly River is only two hours from Darwin."" In round two of the Big Rivers Football League, the Buffaloes lost by two points to the Katherine Camels in a close contest. But this week they were looking for the win. ""We got skill, we got speed … some really formidable footballers, but it's more than just football,"" Mr Bonson said. ""Football and sport in the community is a great vehicle, it's not just about the game and it's not just about reaching the summit. It's the journey along the way. ""Around here since we got into the league the energy and spirit has just lifted so much … it far outweighs any negatives."" After a tough game, that saw the Katherine Camels maintain the upper hand right through to the last quarter, the Katherine team secured a victory, winning 16 goals to 10. We acknowledge Aboriginal and Torres Strait Islander peoples as the First Australians and Traditional Custodians of the lands where we live, learn, and work. This service may include material from Agence France-Presse (AFP), APTN, Reuters, AAP, CNN and the BBC World Service which is copyright and cannot be reproduced. AEST = Australian Eastern Standard Time which is 10 hours ahead of GMT (Greenwich Mean Time)"
57,Ricciardo starts ninth as rain creates a wild starting grid in Canada,sport," Sport Daniel Ricciardo starts ninth in F1 Canadian Grand Prix Daniel Ricciardo has another great opportunity to score points after a rain-affected qualifying led to a surprise grid for Monday's Formula 1 Canadian Grand Prix. Ricciardo was able to qualify ninth in tough conditions, ahead of teammate Lando Norris, who failed to make the top 10 due to mechanical issues. Red Bull's Max Verstappen took pole while Alpine driver Fernando Alonso shocked many by qualifying second. It is the first time the Spaniard, who won the world championship in 2005 and 2006, has qualified on the front row in 10 years. Ricciardo is coming off a solid eighth-place finish last time out, just his second top-10 finish this season. The Australian has looked solid in his McLaren around the Montreal track and is hoping to climb up the order during the race. ""We really hit the ground running in both dry and wet conditions and we've been on the pace, showing some good signs,"" he said. ""There's maybe a few cars out of position as well, and you never know how that could sway the race."" Red Bull's Sergio Perez missed out on the top 10 after crashing in the second qualifying run, while a grid-place penalty for a new engine has Ferrari's Charles Leclerc starting 19th. We acknowledge Aboriginal and Torres Strait Islander peoples as the First Australians and Traditional Custodians of the lands where we live, learn, and work. This service may include material from Agence France-Presse (AFP), APTN, Reuters, AAP, CNN and the BBC World Service which is copyright and cannot be reproduced. AEST = Australian Eastern Standard Time which is 10 hours ahead of GMT (Greenwich Mean Time)"
58,Gruesome injury to Powell mars crucial Suns win over Crows,sport," Sport Gold Coast Suns beat Adelaide by 43 points as gruesome injury to Wil Powell mars crucial win Gold Coast have overcome the loss of Wil Powell to a horrific leg injury, beating Adelaide by 43 points in a boost for their AFL finals hopes. The Suns triumphed 18.8 (116) to 10.13 (73) at Carrara Stadium on Sunday to move within one win of the top eight. But celebrations were tempered after Powell was dragged down in an attempted tackle by Adelaide's Ned McHenry during the third quarter and immediately grabbed at his lower right leg. McHenry called for medical assistance and broadcast vision showed what appeared to be a break above Powell's right ankle, with his foot at an awkward angle. Play was held up for more than five minutes while medical staff attended to Powell on the field before he was driven away on a medi-cab. The vision was so gruesome that the television broadcaster opted not to show a replay. ""Wil's such a good clubman and brings such good energy to our footy club and we love him,"" Suns co-captain Jarrod Witts told Fox Footy. ""Hopefully it's not too bad but it didn't look too good. ""We probably lulled there for a bit after the injury but we were able to get it back on our terms."" Gold Coast led by 29 points when Powell went down. They also lost Connor Budarick to a hamstring injury, while Adelaide's Riley Thilthorpe was substituted out with an ankle injury soon after the restart. Goals to Taylor Walker and substitute Lachlan Murphy helped Adelaide close to within 20 points by three-quarter time. But the Suns held off their opponents and kicked away with eight goals in the final term to post a third consecutive win, their fifth in six games. Mabior Chol, Izak Rankine, Ben Ainsworth and Levi Casboult kicked three goals each as Gold Coast compiled a triple-figure score for a third straight outing. Rankine also had two goal assists and 10 score involvements in an unselfish display. Matt Rowell (19 disposals, seven clearances), Noah Anderson (27, five) and Touk Miller (24, three) fought hard for the Suns in the middle. Adelaide's Rory Laird (42 disposals, five clearances), Matt Crouch (31, seven) and Sam Berry (25, 12) all tried to lift the visitors over the line and Darcy Fogarty kicked two goals. After trailing by six points at quarter-time, the Suns took control with a six-goal second term. Chol kicked two quick goals to spark the run and two for Holman at the start of the third quarter extended the home side's dominance. At that stage they had kicked eight of nine goals. The Powell and Budarick injuries threatened to derail the Suns but they resisted the Crows' attempts at a fightback, dominating the final term. We acknowledge Aboriginal and Torres Strait Islander peoples as the First Australians and Traditional Custodians of the lands where we live, learn, and work. This service may include material from Agence France-Presse (AFP), APTN, Reuters, AAP, CNN and the BBC World Service which is copyright and cannot be reproduced. AEST = Australian Eastern Standard Time which is 10 hours ahead of GMT (Greenwich Mean Time)"
