,topic,category,content
0,Prime Minister to visit Paris to 'reset' Australia's relationship with France,politics,"  Prime Minister Anthony Albanese to visit Paris to 'reset' Australia's relationship with France Prime Minister Anthony Albanese has confirmed he will visit French President Emmanuel Macron in Paris next week to formally ""reset"" diplomatic relations, which were flung into the freezer after the Morrison government scrapped a massive deal to build 12 submarines. In an interview on the ABC's 7.30, Mr Albanese said he was invited to France by Mr Macron and expected to receive a warm welcome. ""We do need to reset. We've already had very constructive discussions,"" the Prime Minister added. Earlier this month, the new Labor government announced it had agreed to pay French shipbuilder Naval Group $835 million in compensation for the scraped deal. In total, $3.4 billion was spent on the program, a figure Mr Albanese labelled an ""extraordinary waste"" of taxpayer money. ""France, of course, is central to power in Europe, but it's also a key power in the Pacific, in our own region as well,"" Mr Albanese told Leigh Sales. ""It's just one of the reasons why this needs to be a relationship that's nurtured, not damaged. ""What we can offer is a relationship between our respective leaders that won't be leaked in order to make an opportunistic headline in the newspaper, one of respect and honesty in the way that we deal with each other."" The submarine deal with France came at a time when Mr Macron was talking up the country's future as an ""Indo-Pacific power"" fully committed to the region. On a visit to Sydney in 2018, the President said the submarines were just the ""very beginning"" of a closer relationship with Australia that would be developed for ""the coming 50 years"". France is considered a key partner in efforts to limit China's expanding power and influence in the Pacific. Mr Albanese will be in Europe next week for a larger-than-normal NATO summit, where the Russian invasion of Ukraine will be the main item on the agenda. The Ukrainian ambassador in Canberra, Vasyl Myroshnychenko, is hopeful the Prime Minister might use the trip to offer more military assistance to his war-torn country. ""We need more heavy weaponry,"" Mr Myroshnychenko said, adding he hoped Australia would send more Bushmasters, a Bendigo-built troop carrier. ""We've got 40 Bushmasters … it would be great to get another 20,"" he said. ""I think it's coming that we'll get a young [Ukrainian] boy called Bushmaster. ""I think it's coming because Bushmaster is probably the most recognisable brand name of Australia in Ukraine right now, because if you mention Australia the next thing you hear is 'Bushmasters'."" Mr Albanese has also been invited to visit Ukrainian President Volodymyr Zelenskyy in Kyiv. However, as is usually the case for trips near conflict zones, he declined to confirm whether he was taking up the offer. ""We're getting national security advice on that,"" Mr Albanese said. ""We don't want to cause a circumstance whereby there's risk to Australian personnel by undertaking such a visit. ""We'll take that advice and we'll act accordingly."" Even though much of the discussion at NATO is going to be about Russia's invasion, some defence and intelligence experts are urging the Prime Minister to use his trip to remind allies of China's growing aims for our region. ""They're trying to push us around and coerce us in our region of immediate strategic concern,"" Paul Dibb, a highly regarded analyst, said. Mr Dibb had an extensive career in Australian intelligence and defence, and was the primary author of the 1987 Defence White Paper. ""Our Prime Minister, our Foreign Minister and our Defence Minister need to keep at the centre of their minds, deeply etched in, their first priority is the defence of this country and making sure that our immediate region is not dominated by an aggressive expansionist power,"" he said. ""That has to be their first priority and it must not be eroded by being excited, if I may so, about Europe and NATO."" Faced with a number of international and domestic challenges, the new government has also inherited a budget that is on track to be more than a trillion dollars in debt in a few years' time. With inflation and interest rates rising, the Prime Minister has said some things he would like to do in the government's first budget in October will have to wait. ""We're going to have to really put the brakes on some of the spending which is there,"" Mr Albanese said. ""I've made it very clear there are a range of things we would like to do that we won't be able to do in our first budget. ""We will also be going through, line by line, looking for the waste."" A number of economists predict the government will have to start a difficult conversation about how the nation pays for the services Australians have come to expect. ""I expect the October budget will be simply about delivering on the promises they took to the election,"" Danielle Wood from the Grattan Institute said. ""I think by the time we get to next May, those fiscal challenges are going to be really starting to bite."" Labor's election commitment was to not raise taxes or have new ones — except on multinationals — though, in the longer term, broader reform may be required. ""I think tax has to be on the agenda,"" Ms Wood said. ""That may just be making the case for changes that the government might take to the next election."" Watch the interview on 7.30 tonight on ABC TV and ABC iview. We acknowledge Aboriginal and Torres Strait Islander peoples as the First Australians and Traditional Custodians of the lands where we live, learn, and work. This service may include material from Agence France-Presse (AFP), APTN, Reuters, AAP, CNN and the BBC World Service which is copyright and cannot be reproduced. AEST = Australian Eastern Standard Time which is 10 hours ahead of GMT (Greenwich Mean Time)"
1,"WA's lowest paid workers just got a pay rise, but it's well behind Perth's inflation rate",politics,"  WA workers on minimum wage to get 5.2 per cent pay rise to help with cost of living The minimum wage in Western Australia will increase by 5.25 per cent, giving the state's lowest paid workers an extra $40.90 per week, following a decision by the WA Industrial Relations Commission. The increase is lower than what Unions WA and the WA Council of Social Services [WACOSS] had been seeking and is below Perth's inflation rate of 7.6 per cent. However, it is slightly ahead of last week's federal Fair Work Commission decision to raise the national minimum wage by 5.2 per cent. Chief commissioner Stephen Kenner said while the state's economy was strong, some low income households were finding it difficult to make ends meet given the rate of inflation. ""This has had a significant impact on the cost of living for the low paid,"" he said. ""A substantial body of data was before the commission in relation to low income households and the difficulties they have in meeting rising living costs in terms of rents, food and energy costs and rising fuel prices."" Commissioner Kenner noted that since last year's decision, health and border restrictions in WA had eased and there was record low unemployment. The hourly minimum wage will be lifted to $21.38 from July, a 5.2 per cent increase, after the cost of living increased dramatically. He said the IRC was mindful of increased costs to employers, including changes to compulsory superannuation contributions. There was a risk that businesses would pass on rising costs to consumers. The minimum wage will rise to $819.90 per week, up from $779, while other award wage workers will get rises of 4.65 per cent. The rise has been welcomed by unions and WACOSS, with UnionsWA secretary Owen Whittle calling on all employers to increase wages. ""This needs to be the first step to ensure that all workers get a significant pay rise,"" he said. ""We know the cost of living in WA has been the highest in the country and that's why we needed to see a minimum wage increase that was larger than the federal minimum wage increase."" WACOSS chief executive Louise Giolitto said it would make a huge difference to families. ""We know that West Australian families are really struggling at the moment,"" she said. With everything from mortgage rates to grocery prices and energy bills going up, more Australians are under financial pressure. We want to hear how it's impacting you. ""This will go some way of helping them keep the roofs over their heads, the lights on and three meals on the table. ""We know in Western Australia we've got an inflation rate of 7.6 per cent, so to some extent it's gone back slightly in real wages. ""But we're pleased it's at least kept pace and slightly better than the federal wage case."" She said the community services sector had seen increases of 20-30 per cent in people seeking income support. But the Chamber of Commerce said this was not the time to increase labour costs to this degree. It said the decision ""further increases"" the gap between the state and federal minimum wage and would ""pile on"" higher costs for sole traders and partnerships at a time of surging costs of materials and labour. WA businesses would be further disadvantaged when compared to the majority of businesses covered by the national system, the chamber said in a statement. We acknowledge Aboriginal and Torres Strait Islander peoples as the First Australians and Traditional Custodians of the lands where we live, learn, and work. This service may include material from Agence France-Presse (AFP), APTN, Reuters, AAP, CNN and the BBC World Service which is copyright and cannot be reproduced. AEST = Australian Eastern Standard Time which is 10 hours ahead of GMT (Greenwich Mean Time)"
2,Bureaucrats said plum US job would be handled internally one day before Barilaro quit politics,politics,"  Changing rules for recruitment of new trade commissioners discussed days before John Barilaro quit politics In the days before John Barilaro announced his plans to leave politics, emails show bureaucrats discussing changing the rules for the recruitment of new trade commissioners, then deciding the plum US role would be handled ""as an internal matter"". The former NSW deputy premier was named last week as the state's new senior trade and investment commissioner (STIC) to the Americas, to be based in New York, a job which comes with a salary package topping $500,000. Documents obtained through parliament show there was a previous round of recruitment, in which two candidates were rated very highly, yet the role was readvertised in December. Emails in those documents reveal that in early September, Investment NSW had identified a preferred candidate and a draft contract was being prepared, with a target for them to start in October. But on September 21, Investment NSW's general counsel wrote to the director of people and culture, saying an issue had been raised about the employment of several STIC roles under the government sector employment act. Dominic Perrottet says once complete, he will make the investigation into the $500,000 appointment public. ""We are now asked to consider whether there are alternative methods that STICs could be employed,"" he wrote. ""Specifically, we have been asked whether there is an option for ministerial appointments."" Ten days later on October 1 — the same day Gladys Berejiklian announced she would step down as premier — the chief of staff to Investment NSW CEO Amy Brown sent another email to several colleagues. ""FYl — Amy will speak with Marianne [Broadbent from the recruitment firm], but needless to say, there are no more STICs whose appointment Investment will be involved with now — so shortlisting/panels etc are no longer needed."" Two days later, Ms Brown emailed Dr Broadbent. ""I appreciate that you'll keep this confidential, but we've now had confirmed instructions to commence the preparation of legislation to convert the global senior trade & investment commissioners to statutory officers (ie ministerial appointments),"" she said. ""The Agent General for London and STIC for Tokyo will be transitioned across to the new arrangements. This means that the recruitment process for the STIC positions in Singapore, India/Middle East and China will need to be ceased, and all candidates informed that we're not going any further with the process. ""We will be handling the STIC New York position as an internal matter."" Mr Barilaro announced his intention to leave politics the next day. The ABC sent detailed questions to both Investment NSW and Trade Minister Stuart Ayres's office asking why the department had been asked to convert the roles to ministerial appointments, and by who. ""Senior trade and investment commissioner roles are not statutory roles, they are public service roles established under the Government Sector Employment Act and regulations and they are employed by Investment NSW,"" an Investment NSW spokesperson said in a statement. A NSW Government spokesperson said in a statement the Department of Premier and Cabinet would review the recruitment process. ""It is not appropriate to make further comment on the matter at this time,"" the statement read. ""The review will be made public as soon as it is received."" Mr Barilaro referred the ABC back to Investment NSW. The ABC has also sent questions to the office of Treasurer Matt Kean, as well as the former premier Gladys Berejiklian. On Wednesday, a motion was passed in the upper house calling on the government to delay the appointment until a parliamentary inquiry into the appointment reports back in a few weeks' time. Greens MLC Cate Faehrmann, who chairs the committee which will be inquiring into Mr Barilaro's appointment, said there were serious questions to be answered. ""This looks like there was an intervention from the top to deal with a political problem. And that was John Barilaro,"" she said. ""What we need to know now, though, is who within the current government knew what — what did the Premier know and what did the Treasurer know?"" That committee will meet tonight to decide on terms of reference and hearings, but could call witnesses as early as next week. On Thursday, Premier Dominic Perrottet announced he had asked the secretary of the Department of Premier and Cabinet to conduct a review. ""He will provide that report to me, I will review it and make it public,"" he said. During question time, Mr Perrottet said it was not required that the six STIC roles be approved by cabinet, but two had gone to cabinet in error. ""It's not necessary or appropriate for such appointments to be approved by cabinet, given the positions are senior executive positions appointed by the CEO following a merit recruitment process,"" he said. ""Cabinet approval would have raised risks in terms of the actual or perceived non-compliance with the merit principle in the GSE Act 2013. ""Having regard to these factors, the advice we've received, Mr Speaker, is that the cabinet could not intervene in that process."" We acknowledge Aboriginal and Torres Strait Islander peoples as the First Australians and Traditional Custodians of the lands where we live, learn, and work. This service may include material from Agence France-Presse (AFP), APTN, Reuters, AAP, CNN and the BBC World Service which is copyright and cannot be reproduced. AEST = Australian Eastern Standard Time which is 10 hours ahead of GMT (Greenwich Mean Time)"
3,'Not satisfactory': SA government investigates how a patient was left to wait on ED floor,politics,"  The South Australian government says an investigation is underway after a photo emerged of a patient laying on the waiting room floor of an emergency department. The photo, posted on social media, shows a person on the hospital floor with a white blanket covering them during a reported five-hour wait. Premier Peter Malinauskas said the fact someone felt the best place for them was to lay on the floor was ""not satisfactory"". ""And it's important that, while we acknowledge failures in the system, we don't confuse that with the extraordinary effort that is being undertaken on a daily, hourly basis from nurses, doctors, orderlies, cleaners in the hospital system who have been working back-to-back-to-back-to-back,"" he said. ""So, we acknowledge their efforts, but also acknowledge that what happened wasn't acceptable and that's why there's an investigation into that particular case."" On Wednesday, the doctors' union sounded the alarm of what it said was serious safety problems in the overstretched emergency departments at the state's two biggest hospitals. The hospital overcrowding problem has been brewing for years under successive Labor and Liberal governments. But SA Liberal leader David Speirs said the government made health ""a massive issue"" leading up to the March state election and urged them to ""get on with what you promised"". ""They've now been in office for three months and things have been worse than ever,"" he said. Opposition health spokeswoman Ashton Hurn said the government was focused on ending ramping at the expense of issues inside the hospital, and a system-wide review was needed. ""Our health system is under enormous pressure and it's just getting worse as we're plunging into the depths of winter,"" she said. But Mr Malinauskas said his government was moving at ""warp speed"" to try and improve the situation it inherited. ""This time last year in South Australia our hospital system was under the pump with record ramping and there was zero flu and zero COVID and now we've got both all at the same time,"" he said. ""Now we've put hundreds of extra beds into the system in the space of 10 weeks, which has been working flat-chat we're recruiting more staff than ever before. ""But naturally you get to a point where there's only so much you can do before the long-term investments that we're making come into effect."" ""And we're moving at warp speed to try and achieve that in the context of health service delivery, but the system is under massive strain around the nation at the moment and South Australia is no exception unfortunately."" See our full coverage of coronavirus We acknowledge Aboriginal and Torres Strait Islander peoples as the First Australians and Traditional Custodians of the lands where we live, learn, and work. This service may include material from Agence France-Presse (AFP), APTN, Reuters, AAP, CNN and the BBC World Service which is copyright and cannot be reproduced. AEST = Australian Eastern Standard Time which is 10 hours ahead of GMT (Greenwich Mean Time)"
4,Andrews government facing frontbench exodus ahead of November election,politics,"  Health Minister Martin Foley among high-profile Victorian Labor ministers to retire before November election Victorian Premier Daniel Andrews is set to lose decades of experience from his frontbench, with the mass resignation of four of his most senior government ministers just months from the November election. Health Minister Martin Foley, Deputy Premier James Merlino, Sport Minister Martin Pakula and Police Minister Lisa Neville are expected to stand down from their portfolios as early as Friday. They are set to join Planning and Housing Minister Richard Wynne, who announced last year he would not recontest his seat at the next election, with some in Labor also expecting him to stand down from his portfolio on Friday. It gives the Premier the opportunity to refresh his frontbench ahead of the November polls. The ministers will remain in parliament until the November election, but a cabinet reshuffle is expected in the coming days, with Speaker Colin Brooks, Sonya Kilkenny and Lizzie Blandthorn already put forward as possible replacements. The group joins the long list of ministers who have left the ministry since the last election, including Jill Hennessy, Jenny Mikakos, Gavin Jennings, Adem Somyurek, Marlene Kairouz, Luke Donnellan and Robin Scott. As Health Minister, Mr Foley oversaw some of the biggest decisions regarding Victoria's COVID-19 pandemic response, and was a frequent fixture at the daily press conference updates. His expected retirement comes as Victoria's healthcare system remains under severe strain, with critical staff shortages, ambulance ramping and triple-0 call delays plaguing the state's hospitals. Once touted as a future leader, James Merlino stood in as Acting Premier last year while Premier Daniel Andrews recovered from a serious back injury. We acknowledge Aboriginal and Torres Strait Islander peoples as the First Australians and Traditional Custodians of the lands where we live, learn, and work. This service may include material from Agence France-Presse (AFP), APTN, Reuters, AAP, CNN and the BBC World Service which is copyright and cannot be reproduced. AEST = Australian Eastern Standard Time which is 10 hours ahead of GMT (Greenwich Mean Time)"
5,'There is a better way': NSW Labor Leader makes election promises in budget reply speech ,politics,"  NSW Labor Leader Chris Minns uses budget reply to accuse government of 'spin', promises pre-schools, toll relief NSW Opposition Leader Chris Minns has criticised the state government for being all ""spin"" in his budget reply speech delivered in parliament today. Mr Minns used the speech to start outlining policies which Labor will take to the state election in March, as an alternative to the Coalition government. ""After 12 years of Liberal and National government, after four Liberal premiers and four Liberal treasurers,"" Mr Minns said. ""This Premier and this Treasurer have a press release for almost everything, but a plan for almost nothing."" He promised that a Labor government would build 100 pre-schools on existing primary school sites within its first term of office and stated that all new primary schools should be built with a pre-school. Mr Minns said the plan would help deliver the government's proposed universal pre-kindergarten a year quicker than the current timeline of 2030. ""I think we've already waited long enough,"" Mr Minns said. ""All this will help deliver universal pre-school for four-year-old children well before 2030."" The Opposition has also committed to spending more on toll relief for commuters than the government. In the state budget, the government allocated $520 million over two years to a toll rebate scheme where commuters would get up to $750 shaved off their annual toll bill once they spend $375. There's plenty of health spending and some big reforms for first home buyers — this is how NSW Treasurer Matt Kean's first budget will affect you. Labor said it would keep that rebate scheme and add a further $130 million by using the government revenue earned from the Sydney Harbour Bridge and Tunnel tolls. But it doesn't have a policy as to how the toll relief would be delivered. Mr Minns has also ruled out privatising both pieces of infrastructure, as the government will have to make a decision about the tunnel because the contract expires in August after three years of tolling since it opened. ""The government has refused to reveal what they will do with this critical piece of transport infrastructure,"" Mr Minns said. ""A NSW Labor government will keep Sydney Harbour Bridge and the Sydney Harbour Tunnel in government hands."" The Opposition Leader also used to his speech to announce that he would set targets for government contracts, to ensure more go to local industries. A Labor government would also abolish the controversial Transport Asset Holding Entity, which was set up to run the state's rail profits and under legislation has to turn a profit. ""We will deliver a sound plan, similar to the model previously managed,"" Mr Minns said. ""Where rail operators owned the assets they operated."" The Treasurer Matt Kean has criticised the budget reply speech for having no vision. ""It wasn't a small target strategy, it was a small minded strategy,"" Mr Kean said. ""There were no policies for women, no policies for the environment, no policies for climate change, no policies for health, no policies for transport and no policies for housing."" Mr Minns said more policy announcements would be made in the lead up the election, but declared ""there is a better way"" to run New South Wales. ""Together we can change the way this works,"" Mr Minns said. ""Only if we turn the page on this government, and begin anew, with a government with a real and credible plan."" We acknowledge Aboriginal and Torres Strait Islander peoples as the First Australians and Traditional Custodians of the lands where we live, learn, and work. This service may include material from Agence France-Presse (AFP), APTN, Reuters, AAP, CNN and the BBC World Service which is copyright and cannot be reproduced. AEST = Australian Eastern Standard Time which is 10 hours ahead of GMT (Greenwich Mean Time)"
