,topic,category,content
59,Robodebt-linked DFAT boss set to lose job in bureaucratic shake-up,politics,"  Bureaucratic shake-up likely to see Jan Adams replace Kathryn Campbell as Foreign Affairs and Trade boss Bureaucrats in Canberra are expecting a shake-up of top jobs, with the head of the Department of Foreign Affairs and Trade (DFAT) expected to be replaced due to her role in the robodebt scandal. Prime Minister Anthony Albanese is expected to appoint several new secretaries to run key government departments in the coming days. Australia's ambassador to Japan, Jan Adams, is the leading candidate to become the nation's top diplomat as the next secretary of DFAT. The head of the Defence Department, Greg Moriarty, had been tipped to take on the role, but it is understood Defence Minister Richard Marles would prefer him to stay in his current role. The current secretary of DFAT, Kathryn Campbell, has only been in the job for a year, having been appointed by the former Coalition government in July 2021. But Labor was unimpressed with her appointment at the time, given she oversaw the rollout of the controversial robodebt program as the secretary of the Department of Social Services. Foreign Affairs Minister Penny Wong has previously indicated she would prefer DFAT to be led by someone with a diplomatic background. A shift to lead a smaller department has been mooted as an alternative role for Ms Campbell. Prior to being stationed in Tokyo, Ms Adams served as Australia's ambassador to China and she has an extensive background in trade and international environmental policy. She recently accompanied Senator Wong at a meeting of the Quad in Japan, just days after the Albanese government was elected to power. The pair worked closely together when Labor was last in power. Senator Wong was the climate change minister and Ms Adam was Australia's ambassador for climate change as the then-Rudd government pushed for a more ambitious approach to global emissions reductions at the Copenhagen Climate Summit in 2009. Mr Albanese is also expected to announce new heads of the Department of Finance and the Department of Health, with the incumbents, Rosemary Huxtable and Brendan Murphy, retiring. Recruitment for someone to lead the newly formed super department covering climate change, energy, the environment and water has also been underway. The new appointments are expected to be confirmed in a cabinet meeting on Tuesday. Mr Albanese has already appointed Glyn Davis, the former vice-chancellor of University of Melbourne, to head the Department of Prime Minister and Cabinet. We acknowledge Aboriginal and Torres Strait Islander peoples as the First Australians and Traditional Custodians of the lands where we live, learn, and work. This service may include material from Agence France-Presse (AFP), APTN, Reuters, AAP, CNN and the BBC World Service which is copyright and cannot be reproduced. AEST = Australian Eastern Standard Time which is 10 hours ahead of GMT (Greenwich Mean Time)"
60,'It feels good': Remote football team plays first game in two years with COVID travel restrictions lifted at last,politics,"  On a red dirt field with only sparse patches of green, the Bidyadanga Emus have pulled on their footy boots at the team's home ground for the first time in two seasons. Access restrictions into remote Aboriginal communities, imposed at the start of the pandemic to limit the spread of COVID-19, were lifted last week. The easing of the travel ban means sport and cultural activities can return to normal in communities because visitors can now enter for non-essential reasons — and one of those is football. At a smoking ceremony marking the start of play, elder Angelina Nanudie was excited to celebrate the return of football to Karajarri country at Bidyadanga, around a two-hour drive south of Broome. ""I'm welcoming the Cable Beach mob to play in my country,"" she said. ""What we're doing is getting the scent of the grass so that people can have that smell and be safe. ""This is our first home game after the COVID … it feels good."" In the Kimberley — a region where Australian rules football is often likened to religion — the ability to host home games again has breathed life back into communities that have been largely closed off to the world. Women's coach Michael Martin said the return of home games brought the whole community together after a long period of uncertainty. ""Football is always number one on the calendar,"" he said. ""It's just given people a chance to forget about all that [COVID-19] and come down and support their team and have fun. ""It's also an opportunity for men and women now to represent their communities."" The restrictions, which were imposed by the state government, had required visitors to secure police approvals to enter more than 200 communities between the Goldfields and the Kimberley. While state-level restrictions have eased, individual communities can still choose to apply their own restrictions about who can enter and why. Mick Albert from the Cable Beach Greenbacks said his side was happy to make the last-minute trip from Broome, as teams in the West Kimberley Football League reverted to pre-pandemic fixtures. ""We had to scramble now the community has opened up during the week,"" he said. ""We were still unsure if we were coming down to play. ""We had to check who had cars and who had spots available and do RAT tests as well."" Community nurse Latham Rogers took it upon himself to pick up elders from around the community and bring them to the oval to ensure they didn't miss the big match. It's something he's done for eight years, but he says Saturday's game held particular significance. ""We're making sure we are looking after the oldies in the community, bringing them down and letting them be part of the atmosphere, watching the young people play sport,"" he says. ""Often the oldies wouldn't have the opportunity to come down to watch the games and would stay at home."" Mr Rogers prepared plates of fresh healthy food and served tea and coffee to elders throughout the game. ""Whether it's a barbecue, sandwiches, fresh fruit, baking, we provide all of that here,"" he said. ""That's just part of our goodwill to the community. ""It's also an opportunity to talk to our older community about making sure their vaccinations are up to date, whether they've had COVID, so it's a bit of a health talk as well."" Elder Joseph Munroe, who once played for the Bidyadanga men's side, enjoyed a sandwich as he watched the game from a fold-out chair under the shade of a tree. ""It [the team] is … the heart and soul for years, always will be, always was,"" he said. ""It's a nice feeling watching them play … really proud."" Mr Munroe was pleased to be back cheering from the sidelines on home soil after so many away games he couldn't attend during the pandemic. ""It was really hard for us not to travel to Broome, staying here in Bidyi, I was waiting until this COVID-19 went away to watch them play here on their home ground and in Broome,"" he said. ABC Kimberley will deliver a wrap of the week's news, stories and photos every Tuesday. Sign up to stay connected. See our full coverage of coronavirus We acknowledge Aboriginal and Torres Strait Islander peoples as the First Australians and Traditional Custodians of the lands where we live, learn, and work. This service may include material from Agence France-Presse (AFP), APTN, Reuters, AAP, CNN and the BBC World Service which is copyright and cannot be reproduced. AEST = Australian Eastern Standard Time which is 10 hours ahead of GMT (Greenwich Mean Time)"
61,"'I am deeply concerned': Attorney-General, minister react to 'horrific' findings of ABC's child protection investigation",politics,"  Attorney-General, minister 'deeply concerned' by 'horrific' findings of ABC's child protection investigation Federal Attorney-General Mark Dreyfus and Social Services Minister Amanda Rishworth say they are ""extremely concerned"" by the findings of a nationwide ABC investigation that revealed children were being raped and neglected in government care. Mr Dreyfus and Ms Rishworth said they had contacted the National Children's Commissioner to see what action could be taken to protect children in care. More than 700 people came forward as part of the investigation into child protection, revealing some children were at risk of more harm in care than before. More than 200 of those were current and former child protection workers with intimate knowledge about how the system operates. Some alleged departmental misconduct and manipulation of statistics about children in care. National Children's Commissioner Anne Hollonds has also reacted to the investigation, saying the system was ""really struggling"" with its purpose to protect children and ""desperately needs reform"". ""Really, this system, many, many people would argue that it’s broken and really needs urgent attention,"" she said. ""It's shocking how commonly one hears these stories. ""These are the most vulnerable children in this country and they've been removed from their families for their own safety and then unfortunately we find that they have been abused or harmed in various ways within the system that was meant to be protecting them. ""And, again, this is a sign that this system desperately needs reform."" More than 700 people from around the country have come forward with concerns about Australia's failing child protection system. These are their shocking claims. She has called for national leadership on the issue. ""We need to have national leadership for child wellbeing in order for children to be a national policy priority,"" Ms Hollonds said. ""When it comes to specific child protection departments and systems, there needs to be very clear accountabilities that they have for ensuring the wellbeing of the children that are in their care."" Mr Dreyfus said he had heard the commissioner's concerns. ""I am deeply concerned by the horrific cases uncovered around the country of abuse of children in care,"" he said. ""I have contacted the National Children’s Commissioner and will be talking with her about her concerns and what action we can all take to protect children in care."" Ms Rishworth said families deserved to have access to ""well-integrated"" services. ""The matters raised about the abuse of children in care are extremely concerning,"" she said. ""I will join the Attorney-General and National Children's Commissioner in a meeting to ensure all children in care are safe and protected."" The Assistant Minister for Indigenous Affairs, senator Malarndirri McCarthy, said she ""sadly"" had not been surprised by the revelations. ""I think that's the biggest disappointment here, that this isn't new,"" she said. ""There are families across this country who have known this for a very long time. There is more that has to be done."" She said in her new role she would investigate what could be done to protect Indigenous children. In a statement, peak Indigenous body SNAICC said it was clear the system did not protect children, and instead ""it causes further harm"". ""Governments know what the solutions are to keep children safe. But there seems to be no real will to implement them,"" it said. Tasmania's Women and Disability Services Minister Jo Palmer said the stories were heartbreaking. ""All of us felt our stomachs just sink, when we hear some of the stories that have come out of that [ABC] investigation,"" she said. ""They're uncomfortable stories they break our hearts and we know that more work has to be done in this space. ""We have failed children. Our premier has come out and said that we know that that has happened in the past, and now we've got to move forward and make sure where we did fail in the past we won't fail in the future. If you have been in the system, cared for someone who has, or work in child protection, we want to hear about your experience. ""This has to be a whole-of-community effort to find these solutions, all levels of government, all parts of our community."" New South Wales Minister for Women's Safety, Natalie Ward, said it was ""dreadful to hear these stories"". ""My heart goes out to those families,"" she said. ""We will always address these issues absolutely head-on and I welcome a very thorough investigation into those allegations. ""It is important that the police do their job and that those victim-survivors are well supported in their journey."" Asked what his newly-elected government was planning to do, Prime Minister Anthony Albanese said his ministers had been sworn in less than two weeks ago. ""We will deal with the range of issues we're confronting,"" he said. ""One of the things that we find, frankly, is that we inherit a trillion dollars in debt, we inherit crises in a range of areas because of neglect — in some cases wilful neglect, in other cases just incompetence."" Ms Hollonds was a child protection worker in the 1980s. She said while efforts had been made since then to try to address the needs of Indigenous children and families, the progress had been too slow. ""It's quite shocking to me to find, 40 years later, that relatively little has changed,"" she said. ""[The child protection] system is really overwhelmed because the other systems are desperately in need of reform, and by this I mean the early intervention systems. ""Struggling families, families in poverty, kids living with disadvantage — I hear from them directly that they're unable to get the help they need when they need it, and things just escalate and become worse."" Ms Hollonds said her office had gone through child welfare reports published over the past 10 years and found many of the 2,500 recommendations made over the decade kept recurring, pointing to the lack of implementation. ""What was remarkable about those recommendations is how often they are repeated across different reports, which really underscores the strength of the findings,"" she said. ""We've got this weight of evidence that's sitting there, the problem is it's not being implemented. ""We need to investigate what are the barriers to implementing the evidence."" 1800 Respect, National counselling helpline: 1800 737 732 Bravehearts, counselling and support for survivors of child sexual abuse: 1800 272 831 Child Wise, counselling provider: 1800 991 099 Lifeline, 24-hour crisis support and suicide prevention: 13 11 14 Care Leavers Australia Network: 1800 008 774 PartnerSPEAK, peer support for non-offending partners: (03) 9018 7872 Find support services in your state or territory. We acknowledge Aboriginal and Torres Strait Islander peoples as the First Australians and Traditional Custodians of the lands where we live, learn, and work. This service may include material from Agence France-Presse (AFP), APTN, Reuters, AAP, CNN and the BBC World Service which is copyright and cannot be reproduced. AEST = Australian Eastern Standard Time which is 10 hours ahead of GMT (Greenwich Mean Time)"
62,'It's failing the community of South Australia': Union calls for policing model overhaul,politics,"  Police staffing shortages reach boiling point as union calls for recruitment system review South Australia's police union is calling for an overhaul of the state's policing model, amid growing concerns about a lack of staff to respond to crime. Police Association of South Australia president Mark Carroll said there is not enough staff for the district policing model to work effectively. ""For more than 12 months now we have been telling commissioner Grant Stevens that his district policing model is failing,"" he told ABC Radio Adelaide. ""It's failing front line officers and investigators and it's failing the community of South Australia."" Mr Carroll said the model breaks officers into two groups, with one group responsible for responding to calls for assistance and the other larger group tasked with tracking down offenders, targeting crime spots and trying to reduce crime. ""It's very labour intensive ... we just don't have enough people on the ground to do that and we never have had,"" he said. He said officers are ""burnt out"" and want the teams to be combined. ""They are all uniform officers they should not be split up,"" Mr Carroll said. ""This is what members of the ground with decades of experience are telling us."" Police Commissioner Grant Stevens said the district policing model had not been properly tested yet as its second stage was implemented four days before the emergency declaration for COVID-19 came into action in March 2020. The declaration resulted in hundreds of police officers being deployed from their regular roles to COVID-related duties. Commissioner Stevens said it was not an appropriate time for the model to be quashed. ""I will be the first one to put my hand up if we believe the model doesn't work once it's been properly tested,"" he said. ""For it to be properly assessed and for anyone to suggest that it's failed first requires for it to be properly implemented and to do that we need people. ""We are getting to the point where we don't have police officers on COVID roles anymore but we are still impacted by COVID. ""We are struggling like every other police force in Australia to recruit sufficient people to keep up with attrition."" The union has also called for the state's police recruiting system to be reviewed. Mr Carroll said SA Police needed to recruit 90 officers, with another 120 regularly off-duty due to COVID. ""We find it a staggering indictment on SAPOL's recruiting systems that in a state of a million and a half people, we can't get 90 people to fill the recruit courses,"" he said. Commissioner Stevens said SA Police was doing what it could to try and recruit more people to fill positions. ""That's just a harsh reality that we are all dealing with,"" he said. ""We are struggling to maintain numbers and we are looking at the reasons for that."" Delegates from the union are planning to meet on Wednesday to further discuss the matter. Shadow Police Minister Tim Whetstone said the police shortages coincided with an ""enormous jump"" in crime, with more than 5,100 extra crimes committed during April. ""We are seeing crime rates jump in South Australia, but Labor isn't boosting SAPOL's resources to match that concerning trend,"" he said. Mr Whetstone said the government had cut $23.6 million from the budget to retain more than 168 protective security officers (PSOs) past next year. ""We see a double whammy with less security officers, less police officers, and now [with the lost] … opportunity with three cancelled cadet intakes, we are going to see a critical shortage of police on our streets,"" he said. But Police Minister Joe Szakacs said the PSO recruitment was a temporary boost provided during the pandemic. ""What this government is undertaking is a much more forward-looking body of work regarding police resourcing,"" he said. ""A premier's task force is being convened. This is an election commitment we are delivering that will be hearing from police and experts regarding resourcing — not just for this term of government, but for the next two, three and four years. ""The protective service officers is an option that we are looking at."" ""We will have recommendations out of the premier's task force well and truly before those contracts are up."" We acknowledge Aboriginal and Torres Strait Islander peoples as the First Australians and Traditional Custodians of the lands where we live, learn, and work. This service may include material from Agence France-Presse (AFP), APTN, Reuters, AAP, CNN and the BBC World Service which is copyright and cannot be reproduced. AEST = Australian Eastern Standard Time which is 10 hours ahead of GMT (Greenwich Mean Time)"
63,'Perrottet's captain's pick': Barilaro's US job at centre of parliamentary inquiry,politics,"  NSW upper house inquiry to probe John Barilaro's appointment as trade commissioner to US The appointment of former NSW deputy premier John Barilaro as the state's trade commissioner to the US will be investigated by a parliamentary inquiry. His new job as trade commissioner was announced on Friday and is among six trade posts around the world tasked with spruiking the state's investment opportunities and local businesses. Premier Dominic Perrottet said Mr Barilaro's appointment was the result of a ""rigorous talent search"" by a global recruitment firm. Mr Barilaro, who resigned late last year just days after former premier Gladys Berejiklian, played a role in setting up the international trade initiative Global NSW. Opposition Leader Chris Minns said an upper house inquiry would now look into the decision, which he has described as a ""$400,000-a-year job for a friend"". ""This represents everything that's wrong with the NSW Liberals and Nationals after 11 years in government,"" he said on Twitter. ""This is Dominic Perrottet's captain's pick and he will be held accountable."" Penny Sharpe, Labor's leader in the upper house, said the inquiry would leave no stone unturned. ""This stinks to high heaven,"" Ms Sharpe said. ""It just doesn't make any sense that the Premier would decide that John Barilaro is the best person in the whole of NSW to go to New York and represent us on our behalf."" Treasurer Matt Kean today defended the decision-making process regarding the appointment. ""John Barilaro was a trade minister and he appears qualified to be a trade commissioner,"" he said. ""I've been informed that this has gone through the proper process and that's how decisions should be taken."" In accepting his appointment, Mr Barilaro — who recently settled his defamation case against Google — said he would continue to build on what had already been achieved. ""I'm looking forward to supporting NSW companies to export and expand to the United States,"" he said. ""Including the many fintech, cyber security, space, health and food and beverage companies. Mr Barilaro, a former Monaro MP, resigned last year, saying public life had ""taken a toll"". We acknowledge Aboriginal and Torres Strait Islander peoples as the First Australians and Traditional Custodians of the lands where we live, learn, and work. This service may include material from Agence France-Presse (AFP), APTN, Reuters, AAP, CNN and the BBC World Service which is copyright and cannot be reproduced. AEST = Australian Eastern Standard Time which is 10 hours ahead of GMT (Greenwich Mean Time)"
